id,is_root,parent_id,author,body,score,score_hidden,created_utc,collected_utc
cvxiwer,1,t3_3of83h,joecity856,Get a 165 and you can go to wherever you'd like besides Penn ,1,0,1444692942,1444716498
cvx3uhk,1,t3_3ognso,joecity856,Hillary avoids questions. Bernie looks really old and disheveled. And people ask who is Lincoln Chafee ,4,0,1444670606,1444716498
cvx3qiu,1,t3_3ogkll,joecity856,Because some people want 0 abortions and others want abortions all the way until half way out of the womb. There are many lines in the middle ,-1,0,1444670441,1444716498
cvx1maf,0,t1_cvx15j7,joecity856,"This map http://www.270towin.com/

Plus PA (that's only gray to make it look close) then NH now that their fairly popular governor Maggie Hassan is running for senate ",1,0,1444667223,1444716498
cvwwj4s,1,t3_3odaai,joecity856,Dead last my class at a TT just passed. Do barbri very seriously,1,0,1444658417,1444716498
cvwtqe8,1,t3_3oerzs,joecity856,Statistically you are under 30 and your vote is already determined ,-1,0,1444651133,1444716498
cvwf0oa,0,t1_cvwekpk,joecity856,I did classic mix up ,6,0,1444610929,1444716498
cvwe6bl,1,t3_3oe367,joecity856,By a landslide. He would easily have 250 votes as Hilary does now then he gets Ohio Florida South Carolina Virginia ,9,0,1444609344,1444716498
cvwe571,1,t3_3odisr,joecity856,She needs unions to win the election its fine ,2,0,1444609284,1444716498
cvw9cg4,1,t3_3od8n7,joecity856,Because Hillary already has 250 ec votes,-2,0,1444600706,1444716498
