id,is_root,parent_id,author,body,score,score_hidden,created_utc,collected_utc
cvuxcot,0,t1_cvuxa1r,321done,Living in a city. Sometimes the divide between poor and upper class is a few blocks ,15,0,1444497570,1444721659
cvuvdud,1,t3_3o80vy,321done,what about self defense guns?,14,0,1444493916,1444721659
cvuvcj7,0,t1_cvuspmr,321done,The worst school shooting in history used two hand guns,77,0,1444493849,1444721659
cvusk9p,0,t1_cvuplb8,321done,Why don't you try to explain the issues to him instead of mock him?,1,0,1444488074,1444721659
cvqe62y,0,t1_cvqcpi9,321done,"Jesus, you're acting like he would have ultimate power. He still has a congress to go through",4,0,1444157732,1444721659
cvqdpxk,0,t1_cvqdjkw,321done,that's my point,2,0,1444157073,1444721659
cvqd1pe,0,t1_cvqcq34,321done,I thought that was widely known,1,0,1444156094,1444721659
cvqd0a4,0,t1_cvqcn2z,321done,"thanks, definitely meant highest. ",2,0,1444156037,1444721659
cvqbu1w,1,t3_3npcgp,321done,and this is with one of the highest corporate tax policies in the world. Imagine if we taxed corporations even more? ,5,0,1444154343,1444721659
cvqbphk,0,t1_cvq9moj,321done,"[I'm sure you heard of Carmen Segarra?](http://www.npr.org/2014/09/26/351520037/former-fed-bank-examiner-says-secret-tapes-show-fed-leniency)

",15,0,1444154162,1444721659
