id,is_root,parent_id,author,body,score,score_hidden,created_utc,collected_utc
cvttsb2,0,t1_cvsmlgt,JollyGreenDragon,"The US had no moral reason to be conducting war in China's back yard to begin with. Tensions increased,  but the US couldn't really appeal to the UN or anything about that one. ",1,0,1444407525,1444731822
cvsfa3x,0,t1_ctjq700,JollyGreenDragon,"There are some pretty good keto meal replacement recipes on the Soylent website, actually (at least a year ago they were there).

You can get to $4-6/day for 3 meals a day pretty easily if you can buy some things in larger volume.",1,0,1444309885,1444731822
cvsdv5j,0,t1_cvrfz8i,JollyGreenDragon,This looks so damn good. Thanks for the heads up!,1,0,1444306592,1444731822
cvqwv9f,1,t3_3nqdhb,JollyGreenDragon,No.,2,0,1444188423,1444731822
cvqw4w2,0,t1_cvo0qb6,JollyGreenDragon,Maybe if they do the Democratic party will tear itself apart? :D,2,0,1444187072,1444731822
cvqw2n4,0,t1_cvp10d6,JollyGreenDragon,Volunteer moderators.,2,0,1444186956,1444731822
cvqvkh7,0,t1_cvqult9,JollyGreenDragon,"As a US Citizen, 'dipshit' is the first thing comes to mind.",5,0,1444186034,1444731822
cvp3xu6,1,t3_3nillv,JollyGreenDragon,"What do you mean, 'you people?'",1,0,1444066407,1444731822
cvp3uog,0,t1_cvoqmtg,JollyGreenDragon,Is joke?,5,0,1444066273,1444731822
cvmuo4f,0,t1_cvmoul1,JollyGreenDragon,So he's trying to make the UK like the US?,10,0,1443890212,1444731822
