id,is_root,parent_id,author,body,score,score_hidden,created_utc,collected_utc
cvxqfvu,1,t3_3oi613,Kacen,Colonialism/Imperialism is shit.,1,0,1444704777,1444729677
cvxdam9,0,t1_cvx9upz,Kacen,Gay marriage is retarded. If you want gays to be tolerated stop making unreasonable requests.,4,0,1444684120,1444729677
cvxd1bb,1,t3_3oh9uy,Kacen,This is disgusting.,7,0,1444683745,1444729677
cvvk8im,1,t3_3o8tzo,Kacen,Salazar wasn't a Fascist.,0,0,1444541114,1444729677
cvulez6,1,t3_3o13si,Kacen,did u no that thinking european countries should stay majority ethnic european constitutes white supremacy and gassing 6 trillion jews?,3,0,1444460039,1444729677
cvule0r,0,t1_cvt9j3a,Kacen,"Neo-cons are just liberals with teeth. Generally they're smarter in some ways (more pragmatic and don't appeal to ""SJW""-like identity politics, such as the tolerating the intolerant bullshit as long as it's an ""oppressed minority""), but on the other hand they generally cause more harm with their militant actions than the dictators they sought to overthrow.",1,0,1444459928,1444729677
cvulcps,1,t3_3o01uq,Kacen,Joe's havin' a cerebral type of high watching Sam heh. :) (funny reference),3,0,1444459784,1444729677
cvopffw,0,t1_cvomij0,Kacen,Source?,1,0,1444029056,1444729677
cvjk208,1,t3_3mz09u,Kacen,Better question: Why the fuck would you want to eat at McDonalds?,-4,0,1443637059,1444729677
cvhlbjp,1,t3_3mqbuo,Kacen,You do realize emotionally they're going to be diametrically opposed right?,1,0,1443489937,1444729677
