id,is_root,parent_id,author,body,score,score_hidden,created_utc,collected_utc
cvxu5t7,0,t1_cvxis7z,rynomachine,I definitely did those in the wrong order.,2,0,1444711663,1444718532
cvx4qco,0,t1_cvx4lxs,rynomachine,"Yeah, as a Texan, I was embarrassed",1,0,1444671894,1444718532
cvx49bg,0,t1_cvwojbf,rynomachine,Perry also wanted it gone. ,1,0,1444671209,1444718532
cvwkibb,0,t1_cvw87vn,rynomachine,"Slider

Can decrease friction on his body, giving him the ability to slide long distances, effectively skiing wherever he goes. Also allows him to break grips with ease.",5,0,1444620742,1444718532
cvugss9,0,t1_cvub0jj,rynomachine,Really? That's when I decided to quit. ,4,0,1444446904,1444718532
cvttl7t,0,t1_cvtt4bu,rynomachine,This is exactly why this subreddit is good.,1,0,1444407232,1444718532
cvtt0vr,1,t3_3o0np0,rynomachine,I could be in favor of it. I would definitely want a 'no opinion' option though.,1,0,1444406365,1444718532
cvtsyz9,0,t1_cvtqtpy,rynomachine,"I misread your previous post, thinking you were talking about a scholarship to Harvard, my bad.",1,0,1444406284,1444718532
cvtqk7z,0,t1_cvsoi49,rynomachine,"Yeah, but getting that scholarship is more personal achievement than part if their childhood.",2,0,1444402639,1444718532
cvszp08,0,t1_cvsriuc,rynomachine,"Nitrogen gas is inert, so only something highly reactive would have a chance at reacting with it. ",1,0,1444340891,1444718532
