id,is_root,parent_id,author,body,score,score_hidden,created_utc,collected_utc
cvxcyle,1,t3_3ogidl,sarais,It's like the end of a teen sitcom.,1,0,1444683637,1444730733
cvxcsny,0,t1_cvx4kc5,sarais,I remember someone asking whether this was a school for special crocodiles.,4,0,1444683412,1444730733
cvwxo5w,0,t1_cvwkwti,sarais,Ricky Smiley,1,0,1444660634,1444730733
cvuxdlz,1,t3_3o7an2,sarais,Blair Witch Project. ,0,0,1444497614,1444730733
cvu6rlm,0,t1_cvtnytl,sarais,That hurts my heart...I just don't get how someone could do that. I just don't.,1,0,1444427287,1444730733
cvu3utc,1,t3_3o3rcw,sarais,Well that's just too adorable for words. Except these words.,1,0,1444422574,1444730733
cvu2ped,0,t1_cvtyi75,sarais,I miss Blade,52,0,1444420849,1444730733
cvu1g99,0,t1_cvtzdci,sarais,"Oh cool, thanks!",1,0,1444418949,1444730733
cvtyzqq,0,t1_cvtkn20,sarais,Not NA i don't think.,1,0,1444415270,1444730733
cvtyyz6,0,t1_cvtl7f8,sarais,"What does  a observer do, look for cheats/bugs?",1,0,1444415238,1444730733
