id,is_root,parent_id,author,body,score,score_hidden,created_utc,collected_utc
cvxyb05,1,t3_3oiil1,Plastastic,I can't stand that artist's pictures.,1,1,1444725289,1444727752
cvxy33n,0,t1_cvxrn06,Plastastic,"Hey, that was in the video!",1,1,1444724334,1444727752
cvxx0qx,0,t1_cvx9v1w,Plastastic,">""Brogressive"" is the same as saying ""This person is essentially liberal but disagrees with me on 1 or 2 things."" 

Yeah, that's not true.",1,0,1444720090,1444727752
cvxx01s,0,t1_cvxfq9x,Plastastic,How am I full of shit?,0,0,1444720017,1444727752
cvxe8sf,0,t1_cvxcprv,Plastastic,Don't think that word means what you think it does.,-2,0,1444685526,1444727752
cvxb40z,0,t1_cvxav64,Plastastic,"Jesus Christ, not this shit again...

Downvote me all you want, Circlebroke is not a bullying subreddit.",-5,0,1444681053,1444727752
cvx9wcg,0,t1_cvx9kve,Plastastic,"I do, trust me. Now please put a cap on that superiority complex and join the rest of the adults.",-4,0,1444679324,1444727752
cvx99rm,0,t1_cvx7bux,Plastastic,"Quit projecting, please.",0,0,1444678433,1444727752
cvx8vk1,0,t1_cvx7bkt,Plastastic,"I'm aware of that, yes. Saddam using US-bought chemical weapons against defenseless civilians kind of put a damper on the whole thing, though.",1,0,1444677868,1444727752
cvx7038,0,t1_cvx6ut6,Plastastic,"No, after he used it against the Kurds. Did you even read my post?",1,0,1444675154,1444727752
