id,is_root,parent_id,author,body,score,score_hidden,created_utc,collected_utc
cvxpc8y,0,t1_cvwcsq6,glennw56401,Some states  (including mine) already have a training requirement. I have no objection to that. ,1,1,1444703028,1444723036
cvwlrgz,0,t1_cvwb9bn,glennw56401,"No, I didn't say I knew them. I said I knew OF them. There's a difference. ",5,0,1444623274,1444723036
cvwb0o6,0,t1_cvw7az2,glennw56401,I didn't say that. ,3,0,1444603539,1444723036
cvw60zm,0,t1_cvvv86q,glennw56401,"You are wrong. The militia comprises all citizens. Regulated, in 1787, meant trained and disciplined. ",2,0,1444595381,1444723036
cvw5bid,0,t1_cvvy3tx,glennw56401,">Being inside the womb is safe.

Really? I know of several million aborted babies who would disagree. ",3,0,1444594358,1444723036
cvpwl8q,1,t3_3nmdgr,glennw56401,"She's beautiful. I had a husky named Rayna. Sadly, we list her in a house fire three years ago this coming February. Sigh. :-(",1,0,1444121049,1444723036
cvptw55,1,t3_3nnbxq,glennw56401,I agree. Don't carry a knife for self defense. Carry a gun. ,1,0,1444110828,1444723036
cvhl79c,1,t3_3mpsuo,glennw56401,"I would suggest the North Shore.  But, beware, no woman can do MOA in just 4 hours. ",1,0,1443489744,1444723036
cvgq1p8,1,t3_3mnvey,glennw56401,"Before asking how they can, perhaps we should ask if they should.",10,0,1443432598,1444723036
cvfzu3r,0,t1_cvft65w,glennw56401,"I don't get out west very much, but I've been up and down the I-35 corridor and back and forth on I-20 and I've never seen one. But there's a lot more to Texas than that. I'm sure I just missed them. ",1,0,1443377718,1444723036
