id,is_root,parent_id,author,body,score,score_hidden,created_utc,collected_utc
cvq43nf,1,t3_3nnyqr,Sir_Green_Britches,"But Grandma, they have Predator drones...",1,0,1444142647,1444722945
cvp0ibo,0,t1_cvmitds,Sir_Green_Britches,I just started in with this. Some of the representative postures have been helping me recover from some ugly shoulder injuries. Definitely changed my life for the better.,2,0,1444061173,1444722945
cvoztpx,0,t1_cvomqbk,Sir_Green_Britches,Every single thread.,5,0,1444059846,1444722945
cvkszyr,1,t3_3n3zqc,Sir_Green_Britches,Smells of troll.,1,0,1443725697,1444722945
cvkswhk,0,t1_cvksap7,Sir_Green_Britches,"I see what you mean. Maybe not so visible at night, but not exactly designed to be hidden.",3,0,1443725559,1444722945
cvkpzjb,0,t1_cvic5l9,Sir_Green_Britches,"The juvenile part means she gets at least one pass. In my city, they sent kids into the richer areas to boost cars. If they are 13, the judges give them another chance. And then again. And then again. And then again.",1,0,1443721300,1444722945
cvkpvp6,0,t1_cvk5g0u,Sir_Green_Britches,Are the body cams quite noticeable? ,3,0,1443721145,1444722945
cvkpu6a,0,t1_cviw1oa,Sir_Green_Britches,"""They'll never notice that broken tail light. Or the expired tag. Or my dilated pupils"".",2,0,1443721084,1444722945
cvjdt6o,1,t3_3mvbam,Sir_Green_Britches,"""Try"" meth. Next she'll be an enthusiast. ",1,0,1443628169,1444722945
cvhamxn,0,t1_cvh6g65,Sir_Green_Britches,"If the US is trying to remain in its role as hegemonic power, it would be doing this ""game"" to China. 

The EU is not a threat to the United States, and the Baltic nations + Poland have a real justified fear of their neighbor to the East. This means there are voices within the EU that oppose Russia. 

China is the real game. As fun as your theory is, it assumes far too much relevance for Europe. Europe can't tie her shoes without have a call for a resolution on the possibility of a vote to reach for the shoelaces. ",3,0,1443472464,1444722945
