id,is_root,parent_id,author,body,score,score_hidden,created_utc,collected_utc
cvuvzkt,0,t1_cvuvw66,garstasio,Yep.,6,0,1444495049,1444726504
cvuuu0j,0,t1_cvuu30f,garstasio,Clearly you don't know a lot of doctors.,63,0,1444492882,1444726504
cvtxpst,1,t3_3o3wqq,garstasio,"Isn't he in the middle of an affair, too? I think it's Carly Fiorna's sister.",1,0,1444413378,1444726504
cvtcjjs,0,t1_cvsw5rz,garstasio,I'll have a glass of what this guy's having-- Tea Party tears with a splash of Sanders on the rocks.,2,0,1444362542,1444726504
cvtcgeh,0,t1_cvsw5ik,garstasio,Now you're just insulting circuses and clowns.,5,0,1444362373,1444726504
cvrhl3d,1,t3_3nmrmq,garstasio,"If you had it to do over would you have gotten the 28f2 or 35f1.4, or done anything else differently? I have the 28 and 55 with plans to get the 16-35 next, or a high quality wide prime if one comes out, followed by the Batis 85, G 90, or maybe 70-200 (or maybe 70-300 if that comes out).",1,0,1444239128,1444726504
cvqyejj,0,t1_cvqvvvf,garstasio,"He did call Marco Rubio a clown, so I am counting two truths so far.",16,0,1444191714,1444726504
cvq612l,1,t3_3nogeb,garstasio,"G-Dub convinced the American public that he is a Texas man, despite his and his brother's deep northeast elite roots. Unfortunately for Jeb, he convinced the American public that he is, in fact, a Florida Man.",2,0,1444145764,1444726504
cvppe8b,0,t1_cvplyob,garstasio,Makes me wonder what AssCrackBanditHunter said. He's usually so pleasant and thoughtful.,11,0,1444100869,1444726504
cviwaut,1,t3_3mx3z9,garstasio,What in the fucking fuck did I just read.,3,0,1443582433,1444726504
