id,is_root,parent_id,author,body,score,score_hidden,created_utc,collected_utc
cvsowyt,1,t3_3nyewj,LearnProgramming7,Probably should have been drilling,1,0,1444325151,1444727566
cvsfhq4,1,t3_3nxkfj,LearnProgramming7,"Worst confession bear I've ever seen. Seriously, this is not a confession at all. Literally everyone does this. ",1,0,1444310323,1444727566
cvqx8wm,0,t1_cvqw8x4,LearnProgramming7,Im not the OP lol,1,0,1444189186,1444727566
cvqw3nq,0,t1_cvpq2f2,LearnProgramming7,"Im in crystal 2 using this base, so its definitely there",1,0,1444187008,1444727566
cvjhhxw,1,t3_3myj73,LearnProgramming7,"Very unnecessary, and ultimately confusing",1,0,1443633444,1444727566
cviw6zz,1,t3_3muxhv,LearnProgramming7,Tiny rick ruined that episode. The subplot was much funnier,-5,0,1443582232,1444727566
cvf8qnf,0,t1_cveuilz,LearnProgramming7,"Seriously?  A religious house for the religion the attack was the result of isn't offensive. The towers went down over radical islam. Building an Islamic shrine doesn't seem appropriate to me. I know reddit will down vote this, but it just needs to be said.

May be worth mentioning  I live 5 blocks from the WTC",-5,0,1443307918,1444727566
cvetrw9,0,t1_cveqnq4,LearnProgramming7,Jets fan still talk about the butt fumble like it was yesterday,1,0,1443279636,1444727566
cvciw13,1,t3_3m43aw,LearnProgramming7,It was decided this morning. Geno is our back up,2,0,1443102098,1444727566
cvc557h,1,t3_3m3lqb,LearnProgramming7,This is not always true,2,0,1443061989,1444727566
