id,is_root,parent_id,author,body,score,score_hidden,created_utc,collected_utc
cvxq65r,1,t3_3oj8wu,muddypaws,No Boobies?,1,0,1444704330,1444729747
cvwjifg,1,t3_3oemea,muddypaws,It worked perfectly for me on a roku 2 with 11mb download. ,2,0,1444618964,1444729747
cvvxcrb,1,t3_3obzxp,muddypaws,I call it Extra Medium.,25,0,1444581951,1444729747
cvuhoqi,1,t3_3o3n4d,muddypaws,Anything before conception is too young.,1,0,1444449005,1444729747
cvu9jyg,0,t1_cvtzirf,muddypaws,I hope you are wrong with all due respect.,1,0,1444432219,1444729747
cvrqs2l,0,t1_cvrhto9,muddypaws,The enemy of my enemy is my enemy's enemy. FTFY.,2,0,1444252405,1444729747
cvmzulc,1,t3_3nc237,muddypaws,Neo Tree,2,0,1443898968,1444729747
cvk2003,1,t3_3n1kbz,muddypaws,I use a silnylon pack cover and a trash bag liner. Having wet gear is a pain and could be dangerous.,9,0,1443664986,1444729747
cvjzs4g,1,t3_3n1fur,muddypaws,Reach out to Charter.,1,0,1443661167,1444729747
cvjzh14,0,t1_cvjsos0,muddypaws,Cam was born and raised in Atlanta.,9,0,1443660655,1444729747
