id,is_root,parent_id,author,body,score,score_hidden,created_utc,collected_utc
cvwxdpk,0,t1_cvwhp7r,caramelfrap,"Our calc 1 teacher required a textbook, but snuck all the poor college kids (everyone) a torrented pdf under the table. No one really ratted him out on it",1,0,1444660099,1444718710
cvwdqaf,0,t1_cvwbzpc,caramelfrap,"Only problem is that that's 40k without benefits for one year. And the 1 trillion being spent is meant to be a one time thing, not something that's redone every year or so. ",3,0,1444608475,1444718710
cvvw68n,0,t1_cvvqkx9,caramelfrap,Or has sold her soul to Fox news and publishing companies for lots and lots of money. Actually not a bad deal,4,0,1444579833,1444718710
cvvid2b,0,t1_cvvb16q,caramelfrap,"Its ok, CVS every few weeks or so will discount them to fifty cents so I guess that offsets the 1.25",2,0,1444536896,1444718710
cvuyl8h,0,t1_cvuy7am,caramelfrap,What? How do you evaluate how bright someone is? Kanye is a production genius and a great artist. Just because he doesn't fit your definition of what it means to be smart doesn't mean he's dumb. ,1,0,1444499769,1444718710
cvuu7gm,0,t1_cvuqr13,caramelfrap,"genuine question: I always saw the email thing as a matter of incompetence, how is it corruption?",6,0,1444491601,1444718710
cvsq8f4,0,t1_cvsog5y,caramelfrap,fixed!,1,0,1444327076,1444718710
cvsmg6l,0,t1_cvslt6o,caramelfrap,"Personally, I'm more concerned that their inaccurate missiles might kill some innocent moose. Moose havent done anything wrong",7,0,1444321551,1444718710
cvsh7gf,0,t1_cvroyuz,caramelfrap,"""I feel icky"" 

So should your conscience ",1,0,1444313501,1444718710
cvs8nem,0,t1_cvrombk,caramelfrap,"it was uh... auto correct. Yeah, definitely was auto correct. please don't take away my english privileges",2,0,1444286220,1444718710
