id,is_root,parent_id,author,body,score,score_hidden,created_utc,collected_utc
cvxqcp4,0,t1_cvwiox8,Gintoh,So are you against men masturbating at all since said men are using their hand as a replacement for a woman?,1,1,1444704634,1444716410
cvxbl5c,0,t1_cvwsiek,Gintoh,"It's actually $10.38 http://money.cnn.com/2015/05/14/pf/minimum-wage-countries-australia/

From may 14 2015 so it's fairly recent.",1,0,1444681716,1444716410
cvucqci,1,t3_3o1cyx,Gintoh,No? How has someone not done this yet?,1,0,1444438326,1444716410
cvs5fbe,0,t1_cvrrni7,Gintoh,"This has been studied and there are constant racial gaps within the same schools https://www.youtube.com/watch?v=aGx17P_O2LI

When looking at any given school , Asians did better than white kids, and white kids did better than Latinos and African Americans. They controlled for income, parental education, and other factors. They found that achievement was heavily correlated with pressure from parents/authority figures to get good grades etc.

I would still say it's because of poverty since certain attitudes and behaviors learned while in poverty do to lack of education etc. can be passed through generations.
",3,0,1444277588,1444716410
cvs3zby,1,t3_3nuyrs,Gintoh,Farm supports,-1,0,1444274243,1444716410
cvrema2,0,t1_cvrei9r,Gintoh,I don't see how stagflation could account for dot com and the 2008 crises.,-4,0,1444234825,1444716410
cvrelpp,0,t1_cvreik6,Gintoh,"Savings and loans, dot com, and the 2008 crises",-1,0,1444234802,1444716410
cvqyu3w,1,t3_3nlp1e,Gintoh,"""budding left-wing parties like Socialist Alternative""

lol",1,0,1444192708,1444716410
cvqo1y3,0,t1_cvq7vpc,Gintoh,"No, he's right, every dictionary definition of socialism is in accordance with what Bart_the _cat said http://dictionary.reference.com/browse/socialism

It's just been overused by right wingers to the point where it has lost all meaning.

Social security/welfare/ etc. isn't socialist since it has nothing to do with weather the means of production are publicly owned (either by the workers or the state)",1,0,1444172912,1444716410
cvpv48z,0,t1_cvpuxrm,Gintoh,Nothing except that it's no longer an IM injection so it won't work quite as well,1,0,1444114915,1444716410
