id,is_root,parent_id,author,body,score,score_hidden,created_utc,collected_utc
cvclj81,1,t3_3m569d,stanleytape,"Chinatown Express has great inexpensive soup and dumplings.
A Litteri has really good moderately priced italian sandwiches.

 ",5,0,1443106560,1444731332
cvbhi95,1,t3_3m258w,stanleytape,"[This](http://www.washingtonpost.com/gog/search/%23/dates_20150928,group_All%20Events.html) is a decent place to start, you can also check on the individual venues listed on the right if they are not in that link.",2,0,1443025422,1444731332
cvbdz9e,0,t1_cvbc3a0,stanleytape,That seems a great solution.,1,0,1443020185,1444731332
cvb2yog,0,t1_cvb2mlz,stanleytape,"This is not anti-cat, and I am not anti-cat. I live with two cats. I love cats.

This is pro-responsible pet ownership.  Cats are pets, and we are tasked with their well being. They can cause damage to wildlife and have shorter lives when allowed to roam outdoors.  

It is that simple, and it is pro-cat.",2,0,1442986462,1444731332
cvazfs3,0,t1_cvazats,stanleytape,I understand and I fully expect you will claw at me for no apparent reason at some point in time. ,0,0,1442978068,1444731332
cvaz90t,0,t1_cvaz170,stanleytape,I am sorry you lost your cats. It is never easy to lose a pet.,0,0,1442977704,1444731332
cvaz8i6,0,t1_cvaywu5,stanleytape,I am sorry you are offended feral cat. Would you like to come inside for some canned food and I will make it up to you?,1,0,1442977675,1444731332
cvaz74u,0,t1_cvayv38,stanleytape,"I think I am probably too old to be a hipster, but thanks anyhow.",0,0,1442977599,1444731332
cvav88l,0,t1_cvasxd6,stanleytape,"No prius here. I own several vehicles, including a one with chevy 454 in it, and I am not dumb enough to lay it down through turn on a public street or drive like a self centered idiot in general.

Enjoy your high insurance premiums and anti-social behavior. I am sure everyone in your neighborhood thinks you are the coolest. ",7,0,1442970462,1444731332
cvas4d8,0,t1_cvas2bx,stanleytape,The battle against ignorance is eternal. I am sorry I made you grumpy.,1,0,1442964823,1444731332
