id,is_root,parent_id,author,body,score,score_hidden,created_utc,collected_utc
cvs41u4,0,t1_cvquk76,themooster32,"Haha, I would not think Estonia would be the country to meet the obligation with countries like France. Anyway, I meant to say that the UK uses a large amount of it's defense budget to spy on it's civilians. GCHQ, I believe it is called. I must, however, retract this statement as it was baseless.",1,0,1444274373,1444720057
cvqtw6d,0,t1_cvqrzrq,themooster32,"It saddens me to know that the UK meets it spy on everyone and Estonia? What? Why do they meet it, afraid of Russia?",1,0,1444183052,1444720057
cvqtuc4,0,t1_cvqdq4c,themooster32,"Good, I wish more of Europe was grateful to Russia and the United States. WWI, in which Europe was fighting and Germany became too strong, Russia help smash Germany. If Germany never had to worry about a Eastern Front, I pretty sure they would have taken Paris. WWII was the United States and again, our buddy Russia.",0,0,1444182961,1444720057
cvqtqtj,0,t1_cvqkw6p,themooster32,"Haha, I found this quite funny.",1,0,1444182796,1444720057
cvqtogc,0,t1_cvq40js,themooster32,"Wait, sorry, but China is the biggest player at the moment in Africa as they are investing heavily in it, probably so that in 100 years they can have powerful, large allies which are not falling apart. If China had support of multiple African countries, they could form a scary coalition. Anyway, what position do we have in China except being garrisoned near or in countries like Egypt? ",1,0,1444182683,1444720057
cvqsu6z,0,t1_cvqr1de,themooster32,"*man turns around* ""What you say to my girl, bro?"" *shit ensues*",1,0,1444181204,1444720057
cvqss5o,1,t3_3noysy,themooster32,"I have been told that by everyone, I have ever told about this. They just look at you like ""why are you looking at me like that?"" I guess people do not know what Peripheral vision is.",1,0,1444181106,1444720057
cvn11n0,0,t1_cvn0kx5,themooster32,He still plays and does well.,1,0,1443901062,1444720057
cvn116n,0,t1_cvn0oog,themooster32,omg xD this is fucked,1,0,1443901042,1444720057
cvn10x9,0,t1_cvn0pg4,themooster32,Lol that is fucked mate,0,0,1443901030,1444720057
