id,is_root,parent_id,author,body,score,score_hidden,created_utc,collected_utc
cvxvwfw,1,t3_3oiju5,revanyo,Im not sure if the TV could make those sounds though,1,1,1444716336,1444716644
cvxvsvn,1,t3_3ojfa1,revanyo,Not really,1,1,1444716038,1444716644
cvxtqr7,1,t3_3oj7if,revanyo,She is the leader. So therefore all she needs to do run out the clock and when presented with a tough question she can punt on it and chose to fight at a later question. It is much harder for those behind her.,1,1,1444710747,1444716644
cvxkh6w,0,t1_cvxkc2z,revanyo,"I have also heard that the RNC has a problem with not letting their nominees be themselves in the elections.Example, would be Romney. They tried to show him  as this perfect candidate that get Moderates, Libertarians, Independents, Establishment but in the end just made him look fake. What do you think of that?",1,1,1444695524,1444716644
cvx6jqk,0,t1_cvwkybv,revanyo,"Booooom, logic!",0,0,1444674501,1444716644
cvx6h0x,0,t1_cvwtudd,revanyo,One day you will learn that there is more to life than labels and classifications. One day...,1,0,1444674390,1444716644
cvx6d1u,1,t3_3ohau9,revanyo,"No response it the best way to go about it. You may be thinking that because the post contradicts with your opinion that it needs to be squashed before it can do any damage, and that in no way can you opinion be anything less than pristine. 

However, the truth is that your opinion is in no way better no worse than your mothers. It is just a valid, no more and no less. The post does raise some questions and due to the fact that you have to come here to get a comeback shows that neither view is right or wrong, but equally valid. ",0,0,1444674233,1444716644
cvx4lrp,0,t1_cvw426b,revanyo,Not sure why someone downvoted you for that. ,1,0,1444671718,1444716644
cvx2rmj,0,t1_cvx1ihp,revanyo,Only a sith deals in absolutes.,1,0,1444668995,1444716644
cvx2nje,0,t1_cvv1nzs,revanyo,"You mean how liberals scream for freedom when it comes to marijuana, but want government intervention when it comes to health care?",0,0,1444668822,1444716644
