id,is_root,parent_id,author,body,score,score_hidden,created_utc,collected_utc
cvx9z2q,0,t1_cvx10c1,chamaelleon,"And does the rest of us the favor of ridding the world of two more idiots. Glad they didn't kill anyone else on their way out. Good riddance. 
",0,0,1444679437,1444719797
cvsgyj0,1,t3_3nxwl1,chamaelleon,"More than 87 percent of americans are scientifically illiterate, so how would most of us even know if our politicians had the understanding that most of the people lack?",1,0,1444313077,1444719797
cvrk3tq,0,t1_cvr3e27,chamaelleon,"It didn't even occur to you to call it an EvangElk?
You're slipping, bro.",7,0,1444242755,1444719797
cvrk2p1,0,t1_cvqxlma,chamaelleon,"Yep, thanks for the help there. A lot of us try to keep up with it too, but there's more assholes than decent people in any state, it seems. 
",1,0,1444242710,1444719797
cvq7dir,1,t3_3np5wy,chamaelleon,"Not true. This is a falsified statistic aimed at shifting public opinion in the direction of gun control. 

Inalienable rights CANNOT be licensed to the bearer of said rights. PERIOD!",5,0,1444147839,1444719797
cvpvysr,1,t3_3nnpbk,chamaelleon,"No one can favor the fucking TPP, because no one has fucking seen it. Fuck off with the propaganda nonsense. No one's buying it. ",2,0,1444118245,1444719797
cvpu29u,1,t3_3nkp3d,chamaelleon,"Good, fuck your regulations. ",1,0,1444111338,1444719797
cvpu260,1,t3_3nncrv,chamaelleon,"No, fuck you Apple",-3,0,1444111328,1444719797
cvnj1q7,1,t3_3nc6vf,chamaelleon,"We don't
",1,0,1443937066,1444719797
cvnimpa,1,t3_3ndb54,chamaelleon,"Yeah, this sounds about as believable as the rest of the story. ",2,0,1443935891,1444719797
