id,is_root,parent_id,author,body,score,score_hidden,created_utc,collected_utc
cvxdjqd,0,t1_cvxd2n1,I_Hate_Nerds,Yeah it's not like he won a Nobel Prize in economics or anything. ,4,0,1444684488,1444724262
cvxcatn,0,t1_cvxbzbv,I_Hate_Nerds,"Wut?

Sanders is literally considering Krugman for a cabinet position...

> Prompted by host Jake Tapper, Sanders went on to praise Paul Krugman, the New York Times columnist and Nobel Prize-winning economist. Krugman is a vocal opponent of tax cuts for the rich, and he has warned readers for years about the dangers of income inequality. ""Krugman does a great job,"" Sanders said.

http://www.dailykos.com/story/2015/07/05/1399317/-Bernie-gives-another-hint-Paul-Krugman-in-a-Sanders-Administration#",4,0,1444682718,1444724262
cvxancw,0,t1_cvxa92l,I_Hate_Nerds,"Did you miss the part where Ben Carson is a climate change denier and literally thinks the Earth is 6,000 years old? 

You attempt to point out reddit's hypocrisy about wanting more scientists or engineers in office while mocking Ben Carson when Ben Carson is a climate denying Creationist for fucks sake. ",0,0,1444680401,1444724262
cvx9ue0,0,t1_cvx8hr5,I_Hate_Nerds,"> Bernie Sanders economics beliefs are insane when looking at them from the viewpoint of someone who is educated in economics

Completely untrue. Show me any credible source that says otherwise. ",1,0,1444679244,1444724262
cvx9q4d,1,t3_3ohdmd,I_Hate_Nerds,"Is this really a serious question? 

Ben Carson is a climate change denier and literally thinks the Earth is 6,000 years old. 

Your average racist uncle is more scientifically literate than Ben Carson. 



",9,0,1444679074,1444724262
cvsql16,0,t1_cvsq1ih,I_Hate_Nerds,"You know what's even more common than having herpes? 

Not having herpes. ",-4,0,1444327612,1444724262
cvsnezh,1,t3_3nznsf,I_Hate_Nerds,Sounds like an obvious correlation/causation issue. ,1,0,1444322999,1444724262
cvsl6fg,0,t1_cvsfgfb,I_Hate_Nerds,Because all attractive women obviously unattainable for the average reddit neckbeard automatically have STDs. ,23,0,1444319703,1444724262
cvrr94e,0,t1_cvrgjbt,I_Hate_Nerds,Cole really goes off the rails some times. ,47,0,1444253132,1444724262
cvri5v3,0,t1_cvrdvdx,I_Hate_Nerds,Gee maybe a spoiler tag there bud?,1,0,1444239942,1444724262
