id,is_root,parent_id,author,body,score,score_hidden,created_utc,collected_utc
cvx9bvz,0,t1_cvx98fs,WadeWilsonforPope,So.... dont mix the dark side with drinking or other NSAIDs? ,1,1,1444678517,1444731284
cvx73fp,0,t1_cvx5v5h,WadeWilsonforPope,"The day I broke and couldnt do it anymore is getting home and getting a pretty thorough yelling at for the the socks I had purchased. 

",117,0,1444675290,1444731284
cvx0nn6,1,t3_3oggut,WadeWilsonforPope,"When I would sit in the driveway in my car before going inside. 

The stress was killing me. ",2129,0,1444665689,1444731284
cvx0m8m,1,t3_3ogbzd,WadeWilsonforPope,"Learning to ride a bike was a lot like how I lost my virginity. 

My Dad had a firm grip on my shoulders. 

*Am I doing these dad jokes right?*",66,0,1444665625,1444731284
cvwxpcu,1,t3_3obu65,WadeWilsonforPope,"I got food poisoning so bad I shit through every pair of boxers I owned and ended up sleeping in my own vomit/shit in the bathtub. 

",2,0,1444660695,1444731284
cvwxfpb,1,t3_3oe99u,WadeWilsonforPope,"Everyone is taking the wrongish approach. 

a SM will wreck thousands of people in this scenario but... Why not trap his ass in a canyon and pelt him with boulders? ",1,1,1444660202,1444731284
cvwx2vs,0,t1_cvwwyx5,WadeWilsonforPope,Even then his skin all by itself can stop small arms fire... ,1,1,1444659525,1444731284
cvwx0r2,1,t3_3ofk9n,WadeWilsonforPope,"Learning to ride a bike was a lot like losing my virginity. 

My Father had a firm grip on my shoulders. ",1,0,1444659413,1444731284
cvwx033,1,t3_3ofk9n,WadeWilsonforPope,"Whats the hardest part about breaking up with a Japanese girl?

Sometimes you have to drop the bomb twice before she gets it. 

",1,0,1444659376,1444731284
cvwwwkp,0,t1_cvw9h41,WadeWilsonforPope,"Except weight, youll lose a lot of weight. ",7,0,1444659184,1444731284
