id,is_root,parent_id,author,body,score,score_hidden,created_utc,collected_utc
cvxjltv,1,t3_3ohp1f,Arkene,"1. A gamer is someone who considers gaming to be their primary pastime, games competitively, or games professionally. 
  
2. Yep",1,0,1444694097,1444727022
cvxjgxu,0,t1_cvxgbld,Arkene,No. Telling someone their content is uncredible and shite is not harassing.,10,0,1444693883,1444727022
cvx677j,0,t1_cvwepze,Arkene,humour is an alien concept to your average sjw. ,1,0,1444674003,1444727022
cvwojbz,0,t1_cvwjhk4,Arkene,The words definition hasn't changed just because authoritarians have tried.to make it an insult. ,1,0,1444630435,1444727022
cvwc9ph,0,t1_cvvnotv,Arkene,An amazing marketing team and a group of celebrities.,1,0,1444605728,1444727022
cvwc8s7,0,t1_cvvp6s7,Arkene,Who think they are minorities and that its perfectly fine to exclude people because they happen to be straight and white?,0,0,1444605683,1444727022
cvwc841,0,t1_cvvppi4,Arkene,"While i agree to an extent. The hardest part will be the coding to handle it. Once thats done, you then need to have people to monitor it and maintain the servers. With all that in place...how the frig do you need 4100 people? ",0,0,1444605650,1444727022
cvwbz5a,0,t1_cvw2kph,Arkene,I cant even remember why i stopped using yahoo...I don't think there was a particularly big reason for it...,1,0,1444605197,1444727022
cvwbspb,0,t1_cvwasxt,Arkene,"What is it about free speech, free will and liberty you find so egregious?",12,0,1444604880,1444727022
cvwbgws,0,t1_cvw8i7s,Arkene,in a really bossy way?,2,0,1444604301,1444727022
