id,is_root,parent_id,author,body,score,score_hidden,created_utc,collected_utc
cvxkr7i,0,t1_cvxjxxe,koleye,"That one is bad too, but had a far lower body count.",2,0,1444695970,1444729823
cvx6ysg,0,t1_cvx6heh,koleye,They've posted a number of my contest entries before I've posted them to the main sub. I don't usually rush to post to the main sub. ,7,0,1444675101,1444729823
cvx542t,0,t1_cvx48av,koleye,I like my humor how I like my boxes: black. ,19,0,1444672436,1444729823
cvwzmni,0,t1_cvwxx20,koleye,"Thanks, and welcome! ",12,0,1444664025,1444729823
cvwziht,0,t1_cvwxvt6,koleye,My dream job would be to make propaganda materials for the government. NSA/CIA/FBI/KFC please contact me. ,561,0,1444663831,1444729823
cvwtrsq,1,t3_3ofxey,koleye,This is easily the darkest comic I've made. I felt bad making it.,774,0,1444651264,1444729823
cvvfaib,1,t3_3o3cev,koleye,I wanted that Falcon so badly as a kid.,1,0,1444530983,1444729823
cvu7n2c,1,t3_3o4kti,koleye,It still pisses me off that he's wearing his RotJ costume on Hoth.,3,0,1444428790,1444729823
cvspiy0,0,t1_cvsonwy,koleye,I have a dream that one day the Internet will hate as many people as Hitler. ,26,0,1444326046,1444729823
cvri332,1,t3_3nv2kc,koleye,Congratulations /u/zimonitrome!,8,0,1444239832,1444729823
