id,is_root,parent_id,author,body,score,score_hidden,created_utc,collected_utc
cvw9bh7,1,t3_3obi7b,thebedshow,If they laugh at my sarcastic remarks.,3,0,1444600661,1444726980
cvumewn,1,t3_3o5mjg,thebedshow,wtf is this shit? 13 year olds upvoting?,-19,0,1444464383,1444726980
cvukc7n,0,t1_cvufa4y,thebedshow,"Yeah drinking during ACL, must be a severe problem!",12,0,1444456111,1444726980
cvukbg7,1,t3_3o64oj,thebedshow,Getting arrested for a PI downtown is dumb,2,0,1444456041,1444726980
cvuka8q,1,t3_3o66yt,thebedshow,public intoxication at ACL? the police must really have wanted to arrest him,28,0,1444455929,1444726980
cvujwco,0,t1_cvu0gj1,thebedshow,Which is mostly true at least in Texas.,0,0,1444454722,1444726980
cvuj8kk,0,t1_cvu1njy,thebedshow,"I just got my password, easy to email ronandfez@aol.com to get yours.",2,0,1444452897,1444726980
cvue0lc,1,t3_3o1n5a,thebedshow,People live in Antarctica year round. Everything this guy says is retarded. Literally 2 seconds of googling and I find lots of videos of the earth from space. ,1,0,1444440898,1444726980
cvu3yct,0,t1_cvtduvx,thebedshow,"It is obvious to anyone who watches it, that is not good acting.",1,0,1444422729,1444726980
cvstgfa,0,t1_cvsltix,thebedshow,You do realize that people outside voice actor unions can still do voice overs right? Lots of times small studios have devs and other people do voice overs.,8,0,1444331772,1444726980
