id,is_root,parent_id,author,body,score,score_hidden,created_utc,collected_utc
cvxirw2,0,t1_cvx9yrq,chitwin,How could someone who was just appointed this week side with anything that was previously going on with supreme court ,1,1,1444692737,1444716310
cvxhzm9,0,t1_cvx69cs,chitwin,And we are. ,2,0,1444691465,1444716310
cvxhy85,0,t1_cvx4ro9,chitwin,Yes the big mean USA wanting to prosecute a traitor for treason. Or at least some sort of spying charge. ,0,0,1444691402,1444716310
cvxhqgb,0,t1_cvxh1lx,chitwin,Whenever there's a comment removed it usually cause someone complained to mods. ,0,0,1444691049,1444716310
cvxfvxf,0,t1_cvx9s7f,chitwin,I think Ron Paul supporters from 2012 would like a word with you. ,0,0,1444688091,1444716310
cvxfuhy,0,t1_cvwwp4u,chitwin,That's cute you complained he hurt your feelings. I would say that the party that controlled all of Congress and the White House probably deserve credit for their large ddeficit,0,0,1444688030,1444716310
cvxffxe,1,t3_3ogrj7,chitwin,Love everything but the skinny jeans. ,0,0,1444687386,1444716310
cvxe2zv,0,t1_cvxay4x,chitwin,Hmmm wonder why his reebok stuff has Brooks. You would figure UFC signed him at least partly cause the punk name will draw PPV  buys. ,0,0,1444685282,1444716310
cvxe04y,0,t1_cvxd07v,chitwin,Sorry on a phone only Internet access. If you couldn't figure there was supposed to be a N to make it and that's kind of poor reading skills on your part. But like I have asked twice now since you made the claim against me  please show me 1 comment I have made where I call liberals horrible names. As you put it. Not 1 specific liberal but where I am speaking about them as a group. Been here 4 plus years should not be that hard sport. ,-3,0,1444685158,1444716310
cvxcim7,0,t1_cvx78n1,chitwin,So you just down one me you won't even try a d show where I talk about liberals the way conservatives are talked about on reddit ? Expect nothing less ,-3,0,1444683026,1444716310
