id,is_root,parent_id,author,body,score,score_hidden,created_utc,collected_utc
cve9r92,1,t3_3mclxq,JDUE,Just sit back and enjoy the tears when it gets crushed in the first referendum. ,-4,0,1443221331,1444732092
cvdjze7,1,t3_3mb5l8,JDUE,Red Peak promoters are so obnoxious they are going to encourage people to vote *against* it out of spite. ,1,0,1443169356,1444732092
cvdj7wh,0,t1_cvdclqo,JDUE,"Try Farmers if you don't like the youth-targeted designs that Hallensteins and other similar stores stock, they have plenty of ""normal"" jeans there. ",1,0,1443166119,1444732092
cusus08,1,t3_3jw23m,JDUE,For life. ,-3,0,1441576641,1444732092
cusul3n,0,t1_cusqxbc,JDUE,"Assimilate to what exactly? White culture because they are the majority? 

America is a multiracial nation and whites will be a minority in thirty years. When Hispanics are the largest racial group in the United States will you start calling for immigrants from Europe/Asia to assimilate into Hispanic culture? ",0,0,1441576253,1444732092
cusu9o9,0,t1_custwqc,JDUE,"Your national legislature is controlled by creationists and climate change deniers. You aren't as bad as the Middle East but you are still bad and have taken quite a fall from the days of the founding fathers, who were mostly deists who understood logic and reason. ",-5,0,1441575617,1444732092
custpw3,0,t1_custf44,JDUE,"The $26 million was the cost of the consultation process and referendum, not actually changing the flag. It's already spent even if NZ votes to keep the current flag. ",21,0,1441574529,1444732092
custou0,0,t1_cuska9r,JDUE,It's also true for the United States. ,-42,0,1441574473,1444732092
cu1g8vl,0,t1_cu1efav,JDUE,There's still one Woolworths at a mall in Tauranga that wasn't changed over since there was already a Countdown in the same mall. ,6,0,1439463712,1444732092
cth9h5e,0,t1_cth8dym,JDUE,"True, but it's not like /r/newzealand ever misses an opportunity for Maori bashing. ",-7,0,1437959750,1444732092
