id,is_root,parent_id,author,body,score,score_hidden,created_utc,collected_utc
cvxs9p7,0,t1_cvx6a1s,LDM123,The dad joke thread is spilling over.,2,0,1444707834,1444719461
cvx2nb5,1,t3_3oerzs,LDM123,"As the years have gone by, I'm starting to see that it's much more practical to just spend money on rallies and speeches than tv  ads. The message goes further.",1,0,1444668812,1444719461
cvx24r1,1,t3_3oft3n,LDM123,"When I wake up and my hair is a mess, makes me want to punch a wall.",2,0,1444668007,1444719461
cvx23sd,1,t3_3oeqvu,LDM123,"I had a friend who had some unhealthy crush on me. I was dating somebody else at this point, so you can see why this was an issue. The girl I was friends with would constantly do and say things that she couldn't respect the fact that I was in a relationship, she attacked it by falsely asserting that I really liked her, instead. She also kept whining about how I was dating somebody else, and how much it hurt her. Time and time again, I tried to smooth things over, by helping her feel better and being the nicest friend I could be. Eventually she told me that it 'seemed obvious I didn't wanna told to her' so she depressingly said goodbye, to which I replied with a swift, simple 'Goodbye' ",2,0,1444667965,1444719461
cvwfuaf,1,t3_3obx5g,LDM123,To Kill A Mockingbird.,1,0,1444612459,1444719461
cvvup5r,0,t1_cvvtw34,LDM123,"The Brady Bunch is a show where an unmarried man with 3 sons marries an unmarried woman with 3 daughters. The eldest daughter is named Martia, and she's basically the self-conceited, golden daughter of the family, while Jan is the middle child who complains that she never gets any attention, in one episode she yells at her mom ""It's always about Martia! Martia, Martia, Martia!""  
They Parody this in one parody movie, where the dad becomes President of the United States, and during a meeting about a NASA mission to Mars, she yells 'Martians! Martians! Martians!""

Edit: I made a mistake. I stand by it.",6,0,1444576946,1444719461
cvuxui1,0,t1_cvuv9gq,LDM123,Leetle Leetle Leetle lee. ,1,0,1444498426,1444719461
cvuv66i,0,t1_cvuknxs,LDM123,>Leetle,1,0,1444493516,1444719461
cvugwls,0,t1_cvugt1v,LDM123,I have all As in advanced classes.,1,0,1444447146,1444719461
cvuglap,1,t3_3o4j5g,LDM123,"""Let's be real goddamned clear, ain't no motherfucker is safe!""",3,0,1444446431,1444719461
