id,is_root,parent_id,author,body,score,score_hidden,created_utc,collected_utc
cvxulc6,0,t1_cvx3tli,Malik_Killian,Non-profit CEO?,1,0,1444712691,1444726276
cvxubcf,1,t3_3ogs5w,Malik_Killian,Jeez.  Run it through the spokes people or [someone will take your wheel just to be a dick](https://www.youtube.com/watch?v=Fc_a0pbeuqU).,1,0,1444712014,1444726276
cvxu7rq,0,t1_cvx5lnj,Malik_Killian,Man chokes and pounds his boss to a satisfying climax.,1,0,1444711786,1444726276
cvxtqjr,1,t3_3oi7ib,Malik_Killian,I kind of feel better knowing that the pranker probably ate it the hardest of them all.,1,0,1444710735,1444726276
cvxtfg4,1,t3_3ojcu5,Malik_Killian,I was gonna say I can't wait for *Cheap Thrills* but holy shit that was 2 years ago!,1,0,1444710091,1444726276
cvxsczx,1,t3_3oj7hz,Malik_Killian,"Before you comment please watch the video.

Having watched the video I have to say this is probably the most racially charged arrest I have seen in recent years.  If the councilman was white the officer would've told him at least 30 times to step back, not 15.  And the officer definitely would've wrestled with a white councilman for at least 2 more minutes before tasering him.

**/s**",1,0,1444707995,1444726276
cvxqie3,0,t1_cvxpfvp,Malik_Killian,"Might as well be ""Pat Yourself on the Back for Making a Symbolic Gesture Day"".  They're still one of the most impoverished ethnic groups in America and to this day we continue to keep them down under the guise of ""looking after their best interests"".",5,0,1444704884,1444726276
cvxhisd,0,t1_cvxhba2,Malik_Killian,"I know it's stupid but it makes me smile every time, as do most posts in this sub.  /r/funny has nothing on us.",1,0,1444690703,1444726276
cvxgyxg,1,t3_3ohapn,Malik_Killian,"> October is National Domestic Violence Awareness month. Wear your favorite shade of purple!

[Confirmed, this is the official color](http://nnedv.org/getinvolved/dvam.html).  I was skeptical at first.",3,0,1444689809,1444726276
cvxg9qe,0,t1_cvxetoj,Malik_Killian,I also like that it isn't 100% random (maybe like 99%).,1,1,1444688689,1444726276
