id,is_root,parent_id,author,body,score,score_hidden,created_utc,collected_utc
cvxft5b,1,t3_3og6j1,anarchism4thewin,Nedstemt for misvisende overskrift.,-1,0,1444687972,1444719773
cvxex2v,0,t1_cvx56j9,anarchism4thewin,"Why do you think ""mainstream European sources"" are more biased than fucking fox news?",8,0,1444686580,1444719773
cvxe12w,1,t3_3oh9mq,anarchism4thewin,">I Danmark peger pilen bl.a. på Venstre. Danmarks (engang) liberale parti har med deres evige »det skal kunne betale sig at arbejde!« bevidst sat de lavestlønnede arbejdere op imod dem på overførsler. Det er underordnet, at ingen af dem lever i luksus.

Begge gupper lever i overdådig luksus, i en historisk eller global sammenligning.

>Jo mindre den danske arbejder stiller sig skulder ved skulder med underbetalte og udnyttede tekstilarbejdere i Pakistan og slagteriarbejdere i Polen, desto mere sikkert er det, at fem T-shirts fortsat kan købes for 100 kroner i Bilka sammen med kyllingen til 29 kroner (inklusive 12 procent saltlage), hvilket så betyder, at de gamle produktionsjob inden for tekstil og fødevareforarbejdning aldrig kommer tilbage til de danske arbejdere.

Hvorfor skulle danske arbejdere være specielt interesseret i tekstilarbejde og slagteriarbejde frem for alt muligt andet arbejde?

Arbejderne er også forbrugere, og har derfor en interesse i at kunne købe billige varer. Hvis varer kan produceres billigere i udlandet, og de så kan arbejde inden for andet, muligvis højere betalende arbejde, er det i deres interesse.

>Der er så ironisk, at de danske arbejdere, der burde være solidariske med deres polske og pakistanske co-workers, i stedet er blevet overbevist om, at de skal pege fingre ad deres globale proletarbrødre med den ene hånd (opfordret af bl.a. Dansk Folkeparti), mens de med den anden stikker hånden ned i lommen og køber deres T-shirts og kyllinger, og cementerer deres egne jobtab.

>Var det ikke så trist, var det nærmest morsomt.

Det eneste der er morsomt, er Joachim Nielsens mangel på økonomisk forståelse.",-6,0,1444685197,1444719773
cvw11n0,0,t1_cvvqenh,anarchism4thewin,"Der er skam også gode posts på /b/, /pol/ og /r9k/.",3,0,1444587950,1444719773
cvvmw40,0,t1_cvvhkkx,anarchism4thewin,"No, the reason saving in China is so high is exactly the lack of social benefits.

And yes, even for the so called poor in the developed world not saving is a choice. The developed world's poor are not living in any kind of existential minimum, they choose to spend all of their income in order to achieve a higher standard of living.",-1,0,1444550040,1444719773
cvv8qmy,0,t1_cvv8ocg,anarchism4thewin,"What are you trying to imply? 

Anyway, i'm guessing that you do not understand the difference between income and wealth.",-1,0,1444518589,1444719773
cvv81gt,0,t1_cvupbi4,anarchism4thewin,"The economic ignorance in this statement. Damn.

What subsidies for business is there in the TTP by the way?",0,0,1444517263,1444719773
cvv7req,0,t1_cvv78bi,anarchism4thewin,Do you understand the difference between wealth and income?,-1,0,1444516740,1444719773
cvv6vvx,0,t1_cvv6npe,anarchism4thewin,What do you base that claim on?,10,0,1444515123,1444719773
cvv650v,0,t1_cvv2hc1,anarchism4thewin,Are you serious?,-2,0,1444513741,1444719773
