id,is_root,parent_id,author,body,score,score_hidden,created_utc,collected_utc
cvx08cs,1,t3_3od3t9,patron_vectras,"I can recommend the book *Andean Tragedy* for the entire history of the War of the Pacific.

Fascinating addition to any pre-World War perspective or investigation of the operations of South American militaries and governments. Thousands of men being forced to march ludicrous distances between water, often in commands formulated by blatantly inexperienced officers; foolish attacks; civilian dissent; nationalization; attrition; guerrilla warfare; heroic feats which precede ungodly slaughter - making you question the nature of heroics and heroes.",3,0,1444665011,1444731088
cvwy1tg,0,t1_cvwnxrb,patron_vectras,"I couldn't get my shoulder under my 08 civic, even if I did prop it on a curb.",1,0,1444661317,1444731088
cvwwky6,0,t1_cvwuq1x,patron_vectras,"And she said it was negative.

Was that from the research on humans I think she mentioned, or on mice?",1,0,1444658521,1444731088
cvww2b2,0,t1_cvwi819,patron_vectras,Apologizing to the NSA wont stop them wiping your mind. You knew the rules when you signed up.,3,0,1444657426,1444731088
cvvtl5i,1,t3_3o9a1s,patron_vectras,"It might be on old-games.com",1,0,1444574612,1444731088
cvv8k5j,0,t1_cvv8a0m,patron_vectras,I think the writers of the Constitution would consider what goes on in DC blatant corruption and criminal in some way. Maybe not through the First Amendment.,1,0,1444518249,1444731088
cvurrto,0,t1_cvuqqha,patron_vectras,We disagree.,1,0,1444486121,1444731088
cvurquy,0,t1_cvuqlyo,patron_vectras,Then I don't see how any part of what you said is a solution.,1,0,1444486055,1444731088
cvuqnha,0,t1_cvuihxi,patron_vectras,"Do you think Africa being dependent is an inherent thing?

Do you think there is some black hivemind that drives them to breed instead of a lack of incentives and a lack of education?",1,0,1444483064,1444731088
cvuqk95,0,t1_cvuir48,patron_vectras,"Its a way around the ban. If I have 10,000 to give and you had 0, but the limit is 5,000 - there are ways to submit the 5,000 in your name.",1,0,1444482778,1444731088
