id,is_root,parent_id,author,body,score,score_hidden,created_utc,collected_utc
cv2zoeg,1,t3_3l3k8s,shrillskril,not very,-2,0,1442363933,1444728108
cv05pzc,0,t1_cv04qpr,shrillskril,"True. most states in Europe, Asia, Africa, and Oceania also make possessing marijuana illegal, have a drinking age of 18, do not allow for overseas taxation of citizens, have abolished the death penalty and make gay marriage illegal",3,0,1442164107,1444728108
cv03all,0,t1_cuzz26w,shrillskril,Pretty much every country in the Americas..,10,0,1442159939,1444728108
cucc84u,0,t1_cucc499,shrillskril,"I already have, that holdin on with freddie gibbs is🔥",1,0,1440290794,1444728108
cuaduqk,1,t3_3ht2f1,shrillskril,Intoxicated by Martin Solveig,1,0,1440136261,1444728108
ctf9zw0,1,t3_3e392u,shrillskril,Seriously any song from this [Giraffage mix pls](https://soundcloud.com/giraffage/giraffage-mix-4-diplo-and-friends-free-download) ,3,0,1437788144,1444728108
comvajg,0,t1_comv5tb,shrillskril,He already has. You might have known him as one half of The Cataracts ,5,0,1424068989,1444728108
ciajbmq,0,t1_ciag72s,shrillskril,u da real mvp,3,0,1403075170,1444728108
ciajbha,0,t1_ciaiwde,shrillskril,ganz is amazing. I enjoy his ghetto symphony flip,2,0,1403075154,1444728108
c8t4u37,0,t1_c8t2ksf,shrillskril,Ah ah ah ah eh eh eh eh eh ,13,0,1362936760,1444728108
