id,is_root,parent_id,author,body,score,score_hidden,created_utc,collected_utc
cvxmllq,1,t3_3oi210,Imsortofabigdeal,Strop's upper body is impressive. Wow. He is HUGE,3,0,1444698803,1444727658
cvx1bc7,1,t3_3ogqrn,Imsortofabigdeal,"Seek guidance from medical professionals, and the institutions where you live that are in place to help you become sober. With their help, your honesty to yourself, and the thoughts and prayers you've asked for, you can do this. You have to believe in yourself, and you have to seek the right assistance. But have no doubts that you are capable.",12,0,1444666750,1444727658
cvwv7y0,0,t1_cvwpgj0,Imsortofabigdeal,"And athleticism. If you're giving up size and hops, not much you can do on defense. ",4,0,1444655460,1444727658
cvwv7j9,0,t1_cvwnnau,Imsortofabigdeal,almost looks like McBob if you squint... ,5,0,1444655431,1444727658
cvwhm0c,1,t3_3odwe9,Imsortofabigdeal,Yay Tulo. Knew he'd get off the schnide,6,0,1444615566,1444727658
cvvgljj,1,t3_3oa2de,Imsortofabigdeal,Yedlin for Fallon D'Floor,2,0,1444533507,1444727658
cvva8hm,0,t1_cvva6q4,Imsortofabigdeal,"I mean his windup and velocity are back. He's rusty, not injured. And that's amazing.",1,0,1444521367,1444727658
cvva62s,1,t3_3o9acp,Imsortofabigdeal,"They're right, it's absolutely silly that Wainwright is back looking like this in less than 6 months. What a beast. But fuck the Cards, obviously",10,0,1444521238,1444727658
cvu9ngf,1,t3_3o4rnw,Imsortofabigdeal,Costly. Ouch.,3,0,1444432394,1444727658
cvu9frs,0,t1_cvu9cvg,Imsortofabigdeal,Fucking RCN...,2,0,1444432005,1444727658
