id,is_root,parent_id,author,body,score,score_hidden,created_utc,collected_utc
cvty1ao,1,t3_3o3i77,Pronell,I want to get prints of Duluth in this era to hang on my wall. My house was built in 1900. This is a great one.,3,0,1444413857,1444729284
cvtor8f,0,t1_cvtnnkz,Pronell,"Holy crap, kids today are kinky.",26,0,1444399641,1444729284
cvsfu01,0,t1_cvsfav4,Pronell,"Oh, I dunno. I kinda like Quakers.",2,0,1444310992,1444729284
cvrbyyd,0,t1_cvrbsc1,Pronell,So the game considers a weapon as a kind of minion and its durability is its health. It's just immune to most 'kinds' of damage. ,11,0,1444230847,1444729284
cvr77t9,0,t1_cvr2him,Pronell,Not that you would.,3,0,1444222135,1444729284
cvm3um2,1,t3_3n9gag,Pronell,"Tailored, nipped, tucked, altered...

I don't even necessarily disagree, I just cringe at the statement.",3,0,1443818943,1444729284
cvj9ndm,0,t1_cvj6b92,Pronell,I think you're getting a bit dramatic.,-5,0,1443621658,1444729284
cvaj0s4,1,t3_3lw4dl,Pronell,I'm afraid your daughter may have ingested large quantities of LSD.,9,0,1442950446,1444729284
cv4umny,0,t1_cv4u9jx,Pronell,Oops.,1,0,1442508732,1444729284
cv4qd8z,0,t1_cv4pzo7,Pronell,"The brain surgeon on stage is also an evolution-denying young earth creationist.

I don't really put any stock in his medical knowledge.",55,0,1442502180,1444729284
