id,is_root,parent_id,author,body,score,score_hidden,created_utc,collected_utc
cvrok98,0,t1_cvrof86,Umsakis,This explains everything :(,24,0,1444249178,1444728170
cvro67x,0,t1_cvrn4d9,Umsakis,"Are you a Danish transport planner?

Do you hate the commuters on Jagtvej? We're not all going INTO the city, you know, some of us are going around! Why are all the lights always red? Why?!",71,0,1444248615,1444728170
cvpx5g8,1,t3_3noj6o,Umsakis,"> smutvej

Nåda.

> genvej

Uha!

> hvis de havde boet i Danmark i 12 år, havde bestået folkeskolens afgangsprøve og ikke havde begået alvorlig kriminalitet.

Øh. Sikke da en kort lille genvej, man skal bare bo her i 12 år, gennemføre folkeskolen, og være en lovlydig borger :P",22,0,1444123667,1444728170
cvn3ark,0,t1_cvn2b8s,Umsakis,That's how we weed the less intelligent kids out of the gene pool.,73,0,1443905079,1444728170
cvkqisy,1,t3_3n4kmp,Umsakis,"Gad vide hvor meget erfaren og kvalificeret arbejdskraft vi kommer til at miste på dette her. Det er vel de færreste mennesker som bare lige kan flytte hele deres liv fra København til Viborg, med mand/kone og børn og hele udstyret.

Møder imellem de forskellige institutioner bliver nok også besværliggjort, og så mister vi vel også en del stordriftsfordele ved at sprede store dele af administrationen ud over hele landet - skal Statens IT (som er blevet lagt sammen af alle de forskellige institutioners egne IT-virksomheder i løbet af de sidste 10 år) f.eks. patruljere rundt i bil hver gang der er en embedsmand, som er kommet til at hive netstikket ud på sin computer?",3,0,1443722082,1444728170
cvk9zun,1,t3_3n03ok,Umsakis,Den kan jo næsten kun være genial eller forfærdelig. Det er svært at forestille sig noget midt imellem.,2,0,1443683563,1444728170
cvjr9oo,0,t1_cvjo8qy,Umsakis,"Er du sarkastisk? Det kan være svært at vide på tekst :)

Aino Olsen har åbenbart en meget begrænset definition af ordet ""hul"". Nogen ville måske endda kalde det en håbløst idiotisk og ukorrekt definition.",3,0,1443647216,1444728170
cvjjovz,1,t3_3mzcaa,Umsakis,"""Amateur nonsense""? Harsh.",4,0,1443636547,1444728170
cvemijm,1,t3_3mellf,Umsakis,"Cool building. Looks Indian, yet not really. Too bad it hasn't been maintained better.",3,0,1443253137,1444728170
cvb6boh,0,t1_cvb5w08,Umsakis,"The same Danish intelligence that has made several arrests over the past 10 years of people smuggling weapons across the bridge from Sweden, building bombs in apartments, and being generally terroristy.

But hey, you wanna make up threats to scare yourself, don't let me stop you.",49,0,1442999870,1444728170
