id,is_root,parent_id,author,body,score,score_hidden,created_utc,collected_utc
cvtpttw,1,t3_3o2jo9,WeimarRepublic,[And then there's this guy](https://www.youtube.com/watch?v=36lSzUMBJnc),5,0,1444401473,1444719701
cvtpok7,1,t3_3o30o9,WeimarRepublic,I feel suddenly relevant,206,0,1444401232,1444719701
cvmt2gb,1,t3_3nc6vf,WeimarRepublic,"Like anything else, Reddit will glamorize the things they like and ignore the things they don't

For example, in many European countries an abortion cannot be obtained after 12 weeks unless it would save the mother's life. In some European countries, abortion is completely illegal.

Meanwhile, when Republicans try to limit abortions in the US to only within the first 20 weeks, we're up in arms about how they're evil woman-haters.  No appeal to Europe in these circumstances",64,0,1443887332,1444719701
cvazrem,0,t1_cvaux69,WeimarRepublic,"> [Wtf I've got duds for nipples...](https://www.youtube.com/watch?v=mkAqK4YW474)
",1,0,1442978722,1444719701
cv9iljz,1,t3_3lsdv8,WeimarRepublic,"I use radiation to treat cancer, so I'm going to have to go with wizard on this one",3,0,1442873589,1444719701
cv34v6e,0,t1_cv2ts3f,WeimarRepublic,You mean [nobody told you?](http://funnyjunk.com/channel/animemanga/It+s+not+the+breast+on+the+outside/XilTLKv),3,0,1442373315,1444719701
cuyj3gz,1,t3_3km0y0,WeimarRepublic,"Sorry for the potato quality, it was the only clip of the scene I could find on youtube",3,0,1442017677,1444719701
cul4ly4,1,t3_3izivc,WeimarRepublic,"If you were a lucky poor kid, your ripoff gameboy actually could play [more than one game](http://cloud2.todocoleccion.net/videojuegos-y-consolas/tc/2013/02/08/35754008.jpg)",22,0,1440969348,1444719701
cubip8v,1,t3_3hwzhy,WeimarRepublic,I don't like the implication that Q95 isn't a legitimate rock station,-2,0,1440218727,1444719701
cu8v9ys,0,t1_cu8ogr2,WeimarRepublic,And then you realize it's only 11 inches!  The horror,5,0,1440026393,1444719701
