id,is_root,parent_id,author,body,score,score_hidden,created_utc,collected_utc
cvxsdnn,1,t3_3oigna,SocotraBrewingCo,83rd percentile in the country.,2,0,1444708027,1444729978
cvwl3nz,0,t1_cvwkseg,SocotraBrewingCo,I would rather have no friends than shitty friends.,39,0,1444621861,1444729978
cvpmjiu,1,t3_3nmwy9,SocotraBrewingCo,What does your buddy normally play as White?,1,0,1444096124,1444729978
cvgqdfw,1,t3_3moedg,SocotraBrewingCo,"Downloaded.  Any recommendations for paper?  I've never made brochures before, but I want to help.",1,0,1443434181,1444729978
cvf32ud,1,t3_3kjhbe,SocotraBrewingCo,I highly recommend watching this at half speed.,1,0,1443297147,1444729978
cvf1h52,1,t3_3mfpqh,SocotraBrewingCo,"I sincerely hope that it was the original director(s) who uploaded this.  I remember seeing this at the Hump festival a few years ago, and that shit is supposed to be on total lockdown.",1,0,1443294133,1444729978
cvc8eam,0,t1_cvc7awm,SocotraBrewingCo,"You had the same idea as I did, but on a [different square](#s ""Qb6"").  It's interesting to see the difference between the two positions in lines where White doesn't take.",1,0,1443068170,1444729978
cvc72rs,0,t1_cvc5sl1,SocotraBrewingCo,"Black is winning.

[Hint: ](#s ""You don't have to move the Bishop"")",1,0,1443065461,1444729978
cva6ecm,0,t1_cva65jl,SocotraBrewingCo,"Seriously, when the fuck is the USA going to realize this?  The world is not binary; you can have a little bit of both pies if you really want to.",2,0,1442931185,1444729978
cv9hh94,1,t3_3lupnk,SocotraBrewingCo,"> Do not post content such as memes, jokes, videos or images that don't offer useful chess insight. Consider posting such content to our sister subreddit, /r/AnarchyChess.",0,0,1442871765,1444729978
