id,is_root,parent_id,author,body,score,score_hidden,created_utc,collected_utc
cvxsohe,0,t1_cvxso72,GhostofTeddyRosevelt,Did he?,1,0,1444708586,1444729827
cvxsjkl,1,t3_3ojhob,GhostofTeddyRosevelt,"will Bernie be the interview guest or on the panel? Since he's listed first, I'm guessing the interview guest?",1,0,1444708329,1444729827
cvxsix4,0,t1_cvxscet,GhostofTeddyRosevelt,"I wouldn't say Talib shit on Bernie. Santorum hardly did either, in fact I would say he was rather civil on his appearance. Basically he just did boogieman with the word socialist, but about the party in general and not about Bernie specifically. ",1,0,1444708294,1444729827
cvxsc1e,1,t3_3oji0s,GhostofTeddyRosevelt,"He is the Juan. 

I'll see myself out. ",2,0,1444707949,1444729827
cvxs060,0,t1_cvxrwwq,GhostofTeddyRosevelt,"Her as a US representative and her as a DNC vice chair are two separate entities. It's kind of like having a job + a volunteer position (I assume only the chair, if anyone, gets paid). 

It's kinda like how Bernie's senate office is separate from his presidential office. ",2,0,1444707385,1444729827
cvxrtj1,1,t3_3ojcxs,GhostofTeddyRosevelt,"No for the love of god don't do that unless you are a *constituent*. If you aren't a constituent, then send a message on facebook or twitter. 

The more we clog up her email, the harder is it for her to get back to her *constituents*. ",1,0,1444707074,1444729827
cvxrqzx,0,t1_cvxrguf,GhostofTeddyRosevelt,But does he have the black and hispanic youth vote?,3,0,1444706954,1444729827
cvx8pd3,0,t1_cvx85jr,GhostofTeddyRosevelt,inter-party caucuses might be a timesink. ,8,0,1444677619,1444729827
cvx8mjc,0,t1_cvx85dk,GhostofTeddyRosevelt,"Political endorsements are the cart before the horse. Certainly these could help him, but to the public at large he still has a problem because 1) He's largely unknown vs someone who is largely known, and 2) Clinton already has a good headstart with both demographics. ",38,0,1444677504,1444729827
cvx5m0w,1,t3_3oh8k8,GhostofTeddyRosevelt,debate is on Tuesday. ,1,0,1444673154,1444729827
