id,is_root,parent_id,author,body,score,score_hidden,created_utc,collected_utc
cvxy1kx,0,t1_cvxipbu,amnes1ac,Hush it's been nice so far! There's hope for the end of the month!^But^probably^not:(,1,0,1444724164,1444724223
cvxy0l0,0,t1_cvxcxdo,amnes1ac,Umm... that's fucking awesome.,1,0,1444724047,1444724223
cvw89zf,0,t1_cvw7x35,amnes1ac,And pretty much everyday...,13,0,1444598953,1444724223
cvvt1c9,0,t1_cvvsi42,amnes1ac,Mine used to vote NDP. It's my parents that vote conservative.,10,0,1444573311,1444724223
cvum7e6,0,t1_cvuj9lm,amnes1ac,Fucking magical every time.,2,0,1444463426,1444724223
cvulmle,1,t3_3o5l23,amnes1ac,Punk as fuck.,1,0,1444460922,1444724223
cvukq8b,0,t1_cvua1lr,amnes1ac,I think it is more here too.,1,0,1444457412,1444724223
cvukhsa,0,t1_cvuib2i,amnes1ac,Me too! 3 am? No problem! 11 am? Hmm maybe I'll skip the first set... But I just bought PVR at the end of the US open so we'll see how this changes my watching habits.,2,0,1444456620,1444724223
cvui934,0,t1_cvuhoin,amnes1ac,PVR my friend.,1,0,1444450368,1444724223
cvugw4u,1,t3_3o53ka,amnes1ac,Jon's impressions were pretty fucking terrible to be honest.,2,0,1444447115,1444724223
