id,is_root,parent_id,author,body,score,score_hidden,created_utc,collected_utc
cvxhnx5,0,t1_cvxhfbh,Pksoze,"She told me, she said it was the best 12 seconds of her day.
",2,0,1444690934,1444730260
cvxawis,1,t3_3oh49t,Pksoze,The shocking thing...the 80's Bears...who are known as the ultimate sackmasters only did it twice.,-1,0,1444680758,1444730260
cvx998l,1,t3_3oh97y,Pksoze,If true this is sad...I hope he can live a normal life.,2,0,1444678412,1444730260
cvx0i11,0,t1_cvwz93p,Pksoze,http://www.nbc.com/saturday-night-live/video/jay-feely-story/n11998,1,0,1444665440,1444730260
cvwv3vc,0,t1_cvwl8d5,Pksoze,The Jay Feely game...a loss so bad they made an SNL skit about it.,5,0,1444655170,1444730260
cvwlo9x,0,t1_cvwlgcg,Pksoze,Indeed also fuck Chase Utley!,4,0,1444623076,1444730260
cvwln00,1,t3_3oes2x,Pksoze,I forgot how it felt to win games like this. It feels good,4,0,1444622996,1444730260
cvwjy0g,1,t3_3oe1cr,Pksoze,It wouldn't be too much to get a break right guys.,1,0,1444619744,1444730260
cvwjr31,1,t3_3oe1cr,Pksoze,Time to redeem yourselves for the cowgirls game.,1,0,1444619398,1444730260
cvw7aww,0,t1_cvw77t7,Pksoze,This is cbs so yeah.,1,0,1444597365,1444730260
