id,is_root,parent_id,author,body,score,score_hidden,created_utc,collected_utc
cvxe92l,0,t1_cvx9vfj,R_V_Z,"Remember that we're operating under the concept of an omnipotent being. Whose to say said being couldn't have created the universe with light ""mid-travel""? There is no argument to be had when an appeal to omnipotence exists. It's pointless, and no matter how much you tell them about the reasons their invisible dragon in the garage can't exist they will invent new reasons why it does.",1,0,1444685539,1444720565
cvtzup0,0,t1_cvtezd4,R_V_Z,"Control wins with mill, one card at a time.",2,0,1444416556,1444720565
cvswkzt,0,t1_cvsuzne,R_V_Z,That's a strange way to spell Rupert Murdoch...,626,0,1444336255,1444720565
cvssn7r,0,t1_cvsshkb,R_V_Z,"Misread and just saw ""run 3 basics"". Oops.",3,0,1444330559,1444720565
cvsrzvk,0,t1_cvsm5bz,R_V_Z,I do that anyway...,1,0,1444329615,1444720565
cvsqc4b,0,t1_cvsnuhq,R_V_Z,Need more than that. Young liberals need to understand that congressional elections matter as they impact confirmations (in addition to a multitude of non-SCOTUS related matters).,32,0,1444327232,1444720565
cvs6gs2,1,t3_3nxjw6,R_V_Z,Justin should have Sphinxed before Declare Attackers for enough to hopefully draw into Path or Swords. Pretty sure that was his only out.,3,0,1444279994,1444720565
cvs5ems,1,t3_3nx9mq,R_V_Z,Kiki-Jiki + Resto Angel or Conscripts,1,0,1444277541,1444720565
cvrk8dg,0,t1_cvrbh2g,R_V_Z,So Goblin Electromancer is an epic flavor fail?,14,0,1444242936,1444720565
cvrdqrs,0,t1_cvr5uep,R_V_Z,"Personhood Amendment and whatever the GOP figure of the week decides to call the ""Heterosexual Marriage Only Amendment"" says otherwise.",6,0,1444233522,1444720565
