id,is_root,parent_id,author,body,score,score_hidden,created_utc,collected_utc
cvxvudc,0,t1_cvqtw71,Iamabioticgod,Vyvanse ,1,0,1444716161,1444723151
cvxue68,0,t1_cvxhwj9,Iamabioticgod,"> Reassortment

Will Samaritan and The Machine merge?",1,0,1444712196,1444723151
cvxr5o7,0,t1_cvxr3at,Iamabioticgod,"That would be considered a ""Dick-move"" in Bird culture

Honestly, though, its not a big deal. Have you tried browsing by new and just ignoring them?",2,0,1444705927,1444723151
cvxqtd1,0,t1_cvxp6nk,Iamabioticgod,"Given that you made an account dedicated to being the unofficial policeman this sub, there must have been some related event that set you over the edge. What was it?",3,0,1444705378,1444723151
cvxq4s9,0,t1_cvxphp3,Iamabioticgod,Fake flowers? What a bunch of cheapskates,2,0,1444704271,1444723151
cvxq1fx,0,t1_cvx2cal,Iamabioticgod,"Morty, you gotta let thise burps out man its good for you; you dont wanna keep those in Morty, gotta let em out often Morty; its healthy Morty.",1,0,1444704118,1444723151
cvxp72u,0,t1_cvxojv5,Iamabioticgod,I think you just recognize their names more often than someone who is obscure ,4,0,1444702825,1444723151
cvxp2re,0,t1_cvxowa3,Iamabioticgod,"""ECR giveaways are an important but volatile part of the community."" - Abraham Lincoln

I agree with Linoln ",4,0,1444702638,1444723151
cvxoua0,1,t3_3oj5bk,Iamabioticgod,Done. When are the results gonna be posted? I wanna read peoples end comments.,2,0,1444702263,1444723151
cvxnqc3,0,t1_cvxchmd,Iamabioticgod,"It not really painful, just incredibly annoying and uncomfortable ",1,0,1444700515,1444723151
