id,is_root,parent_id,author,body,score,score_hidden,created_utc,collected_utc
cvvj7gu,0,t1_cvsw54r,stinky_toecutter,White Plains,1,0,1444538655,1444725677
cvviv5r,1,t3_3o7s0y,stinky_toecutter,Pruning only. ,1,0,1444537917,1444725677
cvtaccx,0,t1_cvssdur,stinky_toecutter,Please list one. ,2,0,1444358669,1444725677
cvrhr5k,0,t1_cvragm3,stinky_toecutter,"LPT: If need to take a dump, go to toilet. ",1,0,1444239364,1444725677
cvlp5z4,0,t1_cvliaxl,stinky_toecutter,What is SJW?,1,0,1443796984,1444725677
cvl796j,0,t1_cvkckrw,stinky_toecutter,I would not say massive. ,1,0,1443748420,1444725677
cvk3ldq,0,t1_cvjyi9x,stinky_toecutter,Don't forget beautiful blonde girls. ,1,0,1443667797,1444725677
cvk3io3,0,t1_cvjrph7,stinky_toecutter,TIL this post is a repost whore. ,1,0,1443667665,1444725677
cvjzug6,0,t1_cvjz4gy,stinky_toecutter,They are not cheap. ,1,0,1443661278,1444725677
cvjzqv6,1,t3_3mzq0u,stinky_toecutter,"If this program is bad, why don't they kill it? ",1,0,1443661108,1444725677
