id,is_root,parent_id,author,body,score,score_hidden,created_utc,collected_utc
cvxmtg2,0,t1_cvxmhus,craig80,"Your avoiding the question.   You said a 1 day old infant is not a person.   That's absurd because than you would be able to perform post birth abortions...ie murder.  Do you believe,  as you seem to be implying,  that should be all owed. ",1,1,1444699138,1444717596
cvxmhu7,0,t1_cvxldm0,craig80,Still time for another,1,0,1444698640,1444717596
cvxlgsb,0,t1_cvxkv0k,craig80,"It's not.  One is a person of the human variety.  Everything else is not.

Edit: you didn't answer the question.   Should you be able to murder a 1 day old infant. ",1,1,1444697065,1444717596
cvxkijp,0,t1_cvxjb0q,craig80,Not at all.  A person is legally different than an animal.   Intelligence has nothing to do with it.  Do you believe that you have a right to kill a 1 day old infant?   Because that is your argument. ,1,0,1444695582,1444717596
cvxiskf,0,t1_cvxa6eq,craig80,"Personhood isn't way past birth.  That's crazy.  A person has a right not to be killed.  That includes day 1.  

Scotus has set the standard at viability,  22 weeks.   This seems perfectly reasonable.   If a person can survive outside of the womb, than they have a right to that life.",2,0,1444692768,1444717596
cvxik0z,0,t1_cvx19yq,craig80,"I'm all for more sex education.   I, like most conservatives I assume, think that conversation should take place at home.  Not all of it, but certainly, most of it.",1,0,1444692388,1444717596
cvxif4j,1,t3_3ogkll,craig80,It sounds like you understand it perfectly. ,1,0,1444692174,1444717596
cvw1ac9,1,t3_3oan0r,craig80,I see lots of people here using 20 plus grams to bake.  That is way to much.  I use 6g and get high as fuck with just a few pieces ,1,0,1444588326,1444717596
cvuv2te,1,t3_3o7w5d,craig80,"This is a terrifying headline, if true.",1,0,1444493338,1444717596
cvupujp,0,t1_cvuju50,craig80,They have fielded two moderate presidential candidates in a row.  Most tea party members lost on the last midterm.  ,7,0,1444480412,1444717596
