id,is_root,parent_id,author,body,score,score_hidden,created_utc,collected_utc
cvxo5hn,0,t1_cvxgy58,nanowerx,"The Fall wasn't a proper Gorillaz album, it was just fanservice that Damon made on his iPad while touring for his solo stuff.",2,0,1444701163,1444726948
cvxo33n,0,t1_cvxnxzj,nanowerx,"Even better. Love Del, was hoping for his return.",9,0,1444701061,1444726948
cvxi83c,0,t1_cvxd6zj,nanowerx,"Damn, BK bringing the diversity.",1,0,1444691850,1444726948
cvxcx8r,0,t1_cvxct1l,nanowerx,Devices can have different uses for different situations. I personally would rather have my phone sitting upright if docked.,2,0,1444683585,1444726948
cvxcjey,0,t1_cvwygqx,nanowerx,Actually more of a dark Forest Green shit.,3,0,1444683057,1444726948
cvxbbff,0,t1_cvx1q8f,nanowerx,They literally had an article like that about the Cowboys that posted after we beat them. Had me shaking my head.,4,0,1444681334,1444726948
cvxb7od,0,t1_cvx08tc,nanowerx,"Julio wasn't 100% Sunday and he probably only made his injury worse. He will probably make a showing, but I seriously doubt we get a full game out of Julio Thursday after a short week.",3,0,1444681188,1444726948
cvxamgi,0,t1_cvwtpp3,nanowerx,"The only thing the 550 has over the 640 is slightly better front camera with a flash and the AMOLED screen. The 640 smokes the 550 on everything else, including price",2,0,1444680366,1444726948
cvx8xez,0,t1_cvx6qn0,nanowerx,If you are going to be using the phone as a mouse then you can connect it wirelessly.,2,0,1444677946,1444726948
cvx2nyo,1,t3_3ogs5p,nanowerx,"If they price this right then they might have a sale out of me. This looks way better than the 950, has similar specs, and comes with the dock. I haven't heard good stuff about Acers support though :-/",31,0,1444668841,1444726948
