id,is_root,parent_id,author,body,score,score_hidden,created_utc,collected_utc
cvxua82,0,t1_cvxlyh6,insane_contin,I'd say DK would be above Metroid.,1,0,1444711940,1444728460
cvxtld8,0,t1_cvxsnfo,insane_contin,"I used to be the overnight manager at a McDs, gave cops and plow drivers free coffee.",4,0,1444710427,1444728460
cvxpdgy,1,t3_3oitrr,insane_contin,"If a Flood outbreak begins in earnest, humanity is screwed. The Swords of Sanghelios doesn't have enough ships, and then you have to deal with the religious fanatics that think the Flood are holy and they should be infected. ",2,0,1444703077,1444728460
cvxonea,0,t1_cvxk79h,insane_contin,"I hate everyone comparing movie villains to Kingpin. Kingpin has the benefit of having a couple hours dedicated to his character, even if through the eyes of his underlings.  ",7,0,1444701955,1444728460
cvxo5pe,0,t1_cvxlpm4,insane_contin,Get me a horse or a very large dog!,2,0,1444701173,1444728460
cvxo50g,0,t1_cvxlj8a,insane_contin,"No, Banner is the good cop, Thor is the bad cop, and Hulk is the psycho cop.",11,0,1444701142,1444728460
cvxgs5b,0,t1_cvxfg3n,insane_contin,High-functioning alcoholism or autism?,3,0,1444689508,1444728460
cvxfbzw,0,t1_cvx6ib6,insane_contin,"Listen, I think we should be friends. I'm a sandsexual vore addict. Now, I'm not saying I'm going to eat you, what with your soft, bread goodness and delicious cheese and meat insides, but I will eat you.",0,0,1444687219,1444728460
cvxf848,0,t1_cvx64bb,insane_contin,"Jerry. Please, we need to know. You can't just abandon us Jerry.",3,0,1444687053,1444728460
cvxewjl,0,t1_cvxch1g,insane_contin,I could read that.,16,0,1444686558,1444728460
