id,is_root,parent_id,author,body,score,score_hidden,created_utc,collected_utc
cvxqfrj,0,t1_cvxpvkx,Turbo_Tacos,"Right?  ""Saving the world one #hashtag at a time""",2,0,1444704771,1444720293
cvvy7oo,0,t1_cvvoe19,Turbo_Tacos,Actually no - the Sandy Hook monster murdered his mother and stole her guns from her safe.  ,4,0,1444583474,1444720293
cvqr6oi,1,t3_3nrena,Turbo_Tacos,"First was Return of the Jedi in 83' 
Last was The Hunger Games Mocking Jay.",1,0,1444178365,1444720293
cvqojxi,0,t1_cvqn8qt,Turbo_Tacos,"I think his point remains that there was no compromise, just another slice of the pie taken.",3,0,1444173789,1444720293
cvqgsm3,0,t1_cvqc22t,Turbo_Tacos,"The bureau of justice did a study which shows a 71% recidivism rate for violent offenders.  Care to comment on that?

 http://www.cbsnews.com/news/once-a-criminal-always-a-criminal/",1,0,1444161563,1444720293
cvqawu5,0,t1_cvqa8b1,Turbo_Tacos,"If someone has a proven history of violence, why in your opinion should they be free?",1,0,1444153011,1444720293
cvq5noi,0,t1_cvq5gxz,Turbo_Tacos,Recidivism for violent offenders is a major problem in my opinion.  ,3,0,1444145176,1444720293
cvpp8tf,0,t1_cvovibh,Turbo_Tacos,"It's the left's ""Death Panels""",2,0,1444100622,1444720293
cvnsoak,0,t1_cvnqidf,Turbo_Tacos,And you are clearly making threats.  ,3,0,1443970493,1444720293
cvn1li0,0,t1_cvmz97d,Turbo_Tacos,"No.  I'm saying that in the argument you are making (going door to door) people would resist before it started en masse or once word got out that it was happening they would start.  Regardless, it isn't going to happen.",1,0,1443902032,1444720293
