id,is_root,parent_id,author,body,score,score_hidden,created_utc,collected_utc
cvxvh7h,1,t3_3ofe0h,GunsOfZapata,"A lot of the ""Anarchist"" teens I've met don't know how to transition to the intellectual side of Anarchism when they leave the hell-hole of public education.

They're drawn in by the free expression and hatred of authority but a lot sadly don't explore the incredible nuances of Anarchism.

20 years later they look at it like it was a phase and chastise other people because they were the one's who were too intellectually weak to explore the complexity of the Anarchism ideology.",1,0,1444715086,1444716510
cvxvfzv,0,t1_cvxvbfg,GunsOfZapata,nope,1,1,1444714988,1444716510
cvxuvc0,0,t1_cvxusyw,GunsOfZapata,There were ABSOLUTELY mass attacks on Jews throughout the early 1900s,1,1,1444713402,1444716510
cvxunn7,0,t1_cvxukzf,GunsOfZapata,"Nope, it was because of the same populism that was killing thousands of Jews throughout Europe at the time as well.",1,1,1444712854,1444716510
cvxuj5z,0,t1_cvxuhga,GunsOfZapata,"This is why I fucking hate you people.

You have your heads so far up your ass that anyone who questions if Israel might be contributing to the radicalization of Palestinians, that MUST mean I want dead Jew babies!

Military occupation and airstrikes WILL cause the radicalization of more and more Palestinians.

Don't like that? Well it's fucking truth so deal with it and stick it up your ass.",1,1,1444712542,1444716510
cvxu261,0,t1_cvxtnsr,GunsOfZapata,"Did you just link me to a staged video from a pro-Israel youtube channel?

Is this literally what pro-Israelis consider evidence?

Let's read some of the great, enlightened comments on that video:

""palestinians are even worse waste like gypsies. I've seen their behavior in Paris - dirty motherfuckers""

""Ask yourself what Muslims give to this world""

It sounds like YOU'RE the one's who are raised to hate Palestinians.

You don't view people as humans, you view them as waste.",1,1,1444711434,1444716510
cvxtfoz,0,t1_cvxt0t5,GunsOfZapata,"Are pro-Israelis ever capable of critical thought or do they just think Palestinian teenagers woke up one day and thought ""IMMA STAB A JEW BECAUSE ISLAM!""

",-19,0,1444710105,1444716510
cvxoliq,0,t1_cvxemkl,GunsOfZapata,"*clicks news link*

""Oh hey capitalism was overthrown and the proletariat are in charge!""

*closes browser*

*plays Battlefield*",10,0,1444701875,1444716510
cvxo0ok,1,t3_3oguy5,GunsOfZapata,"Stop arming rebels.

Use the money to build refugee shelters.",-1,0,1444700960,1444716510
cvxnglb,1,t3_3ofnqi,GunsOfZapata,"In what universe is North Korea even remotely left wing?

They declared themselves a monarchy, which is a right wing ideology.",2,0,1444700105,1444716510
