id,is_root,parent_id,author,body,score,score_hidden,created_utc,collected_utc
cuyufzt,0,t1_cuyn96q,cdub4200,About to fall in the same situation in 9 days. ,1,0,1442049643,1444732142
cuxmp42,1,t3_3ki1yp,cdub4200,"Deez Nuts. Not only is it clever enough, but still slutty. And you can repeat that line the whole night. ",0,0,1441948346,1444732142
cuxmkqb,1,t3_3khx7k,cdub4200,"The Village
I might as well assume the role of poor Noah and act retarded. That's okay, dressing up as a red monster helps with my pick up game. ",1,0,1441948022,1444732142
cuxmims,1,t3_3khxyj,cdub4200,"I can't see how this will be good.
",-2,0,1441947871,1444732142
cut03gz,1,t3_3jvmx4,cdub4200,I'm not a fan of Clinton. Trump leading only reassures that we are living in a Simulation. ,2,0,1441587808,1444732142
cus2uzx,0,t1_cus1d4s,cdub4200,We don't call for the penalty of death on gays. We just shame them. ,0,0,1441504005,1444732142
cul3fzp,0,t1_cul2vvc,cdub4200,How do you  change it?,4,0,1440967238,1444732142
cukk4ys,1,t3_3iwppm,cdub4200,X1 uppercut Tyson ,1,0,1440920194,1444732142
cuabq24,0,t1_cua5hqu,cdub4200,Can you still get added ram or storage or is it only the models they have in stock?,1,0,1440130770,1444732142
cu97awj,1,t3_3hock3,cdub4200,How do you part your hair like that? I can't get it to one side? its always split in two over my forehead like Prince Charming,2,0,1440049423,1444732142
