id,is_root,parent_id,author,body,score,score_hidden,created_utc,collected_utc
cvub5n4,1,t3_3o5ji4,admrlwlvrnlitblt,"Harry Love. The guy who drew Yogi Bear, and others for Hanna-Barbera",3,0,1444435233,1444727014
cvebxen,1,t3_3me0rl,admrlwlvrnlitblt,"I have AT&T, GF has cricket. Seems to have similar coverage to mine (pretty good) just everything is much much slower. 4G, sending texts, etc.",1,0,1443225557,1444727014
cv7ci33,0,t1_cv777c4,admrlwlvrnlitblt,"There is just always circles there. If you ask, people will let you join. Then ask for the hookup",2,0,1442702807,1444727014
cv741vu,0,t1_cv73ug5,admrlwlvrnlitblt,"Yeah they do. I was just implying that some freshman might not have been ""enlightened"" yet",2,0,1442686638,1444727014
cv740hu,0,t1_cv73ppt,admrlwlvrnlitblt,"2 words. 
Porter 
Meadows",3,0,1442686565,1444727014
cv73lz4,0,t1_cv72jae,admrlwlvrnlitblt,EVERYWHERE,2,0,1442685809,1444727014
cv725mm,0,t1_cv6ogtr,admrlwlvrnlitblt,"Not everyone smokes weed.


Yet.",4,0,1442683126,1444727014
cv6cdxy,0,t1_cv6830p,admrlwlvrnlitblt,Got it on the link. Would post answered here but don't know how to spoiler on mobile.,2,0,1442613299,1444727014
cv693f2,1,t3_3lgny5,admrlwlvrnlitblt,Look up Virmin Supreme. That.,1,0,1442607763,1444727014
cum6a6b,0,t1_cum3e8d,admrlwlvrnlitblt,"Just got a job at a coffee shop, did not know that! No wonder the Italian couple that came in turned their noses up at my espresso. Thanks, I will not make shit espresso any more! ",22,0,1441050199,1444727014
