id,is_root,parent_id,author,body,score,score_hidden,created_utc,collected_utc
cvwb33j,0,t1_cvvxo3h,Gnashtaru,Just wait!  Beth really brings it!,1,0,1444603650,1444728758
cvuhkdj,1,t3_3o5ch5,Gnashtaru,"It's so obvious someone is going to photoshop some dude behind her...   We were all thinking it I'm just saying it!

Anyway, nice post though.",-4,0,1444448722,1444728758
cvuhene,1,t3_3o3d10,Gnashtaru,So anyone here know if the clear part is living cells or just a water storage thing or what?  I'm super curious.  Googling now.,3,0,1444448337,1444728758
cvuhe5v,0,t1_cvudtx5,Gnashtaru,"So, good?  I guess?",1,0,1444448305,1444728758
cvucpf6,0,t1_cvub1xh,Gnashtaru,"LOL ok.

It really is a cake.  I dunno how else to prove it to you.",1,0,1444438274,1444728758
cvub1y6,0,t1_cvub0be,Gnashtaru,Yea I think they are boobs.  Probably a bachelor party cake or something.,1,0,1444435030,1444728758
cvuaytf,0,t1_cvuanha,Gnashtaru,"LOL!  Dude I'm not screwing with you.  Seriously.  here I'll link just the cake if I can...

[Cake](http://static1.squarespace.com/static/52ab3377e4b0ade834b9c66c/5432f311e4b08b6ea43c67f8/55c02d14e4b092dcc828c24a/1438659791255/20150624_184929.jpg)",1,0,1444434862,1444728758
cvuajds,0,t1_cvu88zc,Gnashtaru,Why do you say that?  ,1,0,1444434057,1444728758
cvuahzs,0,t1_cvu94l7,Gnashtaru,There really is a dick cake.  Right side partway down.  They are all over it.  You have to kinda look close.  LOL,3,0,1444433981,1444728758
cvtmsfo,0,t1_cvta5s0,Gnashtaru,They are remaking it!?  I'm both excited and terrified.  Gods I hope they don't fuck it up.,1,0,1444395821,1444728758
