id,is_root,parent_id,author,body,score,score_hidden,created_utc,collected_utc
cvxr5z4,0,t1_cvugrzt,Badgerisbest,And that's why. If test taking is difficult for someone it's way longer than 2 weeks. ,1,0,1444705941,1444719257
cvxr4d8,1,t3_3o5ssx,Badgerisbest,Read the view of every firm carefully that you apply too. Best advice is to go to a smaller shop with a high net worth book or a very honest advisor who is looking to groom successors/valuable support staff rather than churn and burn people. ,1,0,1444705869,1444719257
cvxr13w,0,t1_cvuffek,Badgerisbest,It's a little early for that specific exam.,1,0,1444705726,1444719257
cvxqt7x,0,t1_cvxo75j,Badgerisbest,"Your post was incredibly vague  ""Chicago Trading"" could mean 100 different job positions of varying quality. 

So he's an intro analyst. ",-1,0,1444705372,1444719257
cvxnda2,0,t1_cvxikkx,Badgerisbest,"I bought a Brandon Marshall jersey at a discount after he was traded at a discount. 

No ragrats. Just tears. ",4,0,1444699971,1444719257
cvxmxdk,0,t1_cvxmsds,Badgerisbest,"Yes, and then I remember follow up articles that went something like ""50-60 people pardoned, 50,000 still in jail with no expectations of parole or hearing..."" ",1,0,1444699307,1444719257
cvxmiq9,0,t1_cvxklfp,Badgerisbest,Learned from Jack Bauer. ,5,0,1444698680,1444719257
cvxmi6m,1,t3_3ohzz7,Badgerisbest,Twitch campaigns for Rand?,4,0,1444698656,1444719257
cvxl2e6,0,t1_cvx696u,Badgerisbest,"Rauner is my hero right now. I'm hoping to meet him when he comes to an event I'm helping people organize, even if just to shake his hand and say thanks. 

Fuck Mike Madigan. He's so good at being corrupt he's figured out how to bake his own law company right into the political system. ",1,1,1444696444,1444719257
cvxkznc,0,t1_cvx3bgn,Badgerisbest,Get everyone to support that indie scene. So important that we keep having new shoegaze bands come into the fold. We all love  this kind of this obscure sub-genera and we have to make sure that industry and bands know  that we are around. We are all hoping for a big growth and explosion again like you're seeing in Estonia.,2,0,1444696329,1444719257
