id,is_root,parent_id,author,body,score,score_hidden,created_utc,collected_utc
cvxozdn,1,t3_3oj3qw,BookwormSkates,they came out like months ago.  Do a search on sneakernews or something for undefeated bape superstars,1,0,1444702490,1444717001
cvxmrt3,1,t3_3oiyf1,BookwormSkates,like,1,0,1444699069,1444717001
cvxbe05,0,t1_cvx9pgv,BookwormSkates,Must have been stolen pics. ,1,0,1444681438,1444717001
cvx452j,0,t1_cvwwtre,BookwormSkates,"to be fair, having worked retail a long time, I usually try to get a second opinion if I really need something.  Retail is weird, and sometimes asking a different person can get you the item you need.",19,0,1444671038,1444717001
cvx3ytw,0,t1_cvwx77e,BookwormSkates,yeah but that still doesn't mean a computer can't out-drive a human.,1,0,1444670783,1444717001
cvx3pqs,0,t1_cvx3nak,BookwormSkates,"damn, this is an awesome shot but I don't know how good it would look scaled or cropped to banner size.",1,1,1444670410,1444717001
cvx2vi3,0,t1_cvwxh67,BookwormSkates,"likewise, hating downward is called ""being independent.""",2,0,1444669157,1444717001
cvx28h0,0,t1_cvwsiqb,BookwormSkates,"> (I was unaware of the fact there were portions of the journey I could stand in the middle of the ocean with no land in sight)

That's crazy!  How far off shore?",1,0,1444668172,1444717001
cvx26qg,0,t1_cvwx7jv,BookwormSkates,better shoes than the hospital bill.,3,0,1444668093,1444717001
cvx201g,0,t1_cvx1uye,BookwormSkates,"I actually thought B&W, the red would be more visible.",3,0,1444667810,1444717001
