id,is_root,parent_id,author,body,score,score_hidden,created_utc,collected_utc
cvveqls,1,t3_3o9occ,Ghoti76,Why she mad? It would be a lot more suspect if he lasted a long time. Bitch should be lucky the nigga ain't cheat on her.,42,0,1444529924,1444725592
cvvej2k,1,t3_3oa77a,Ghoti76,Is this Gangland? lol,1,0,1444529531,1444725592
cvumf8o,0,t1_cvumeal,Ghoti76,Same. Gained so much respect for the character.,5,0,1444464425,1444725592
cvuk6sn,0,t1_cvujzts,Ghoti76,That's not the only thing he beat,1,0,1444455621,1444725592
cvsnmgu,1,t3_3nzpjj,Ghoti76,Do you go to UCSD?,1,0,1444323306,1444725592
cvsa4j7,1,t3_3nxxrd,Ghoti76,Obnoxiously clapping before the song is over,2,0,1444291865,1444725592
cvp60si,1,t3_3n244r,Ghoti76,"Not a parent, but I would hate to put my mom through that. That's a horrible thing to just leave people to deal with.",1,0,1444069524,1444725592
cvo1ayx,1,t3_3nfe7l,Ghoti76,What the fuck Norm,10,0,1443984367,1444725592
cvh5mjr,0,t1_cvgiqq3,Ghoti76,"Well, ya learn something new every day ! Thank you, that's pretty interesting ",1,0,1443465392,1444725592
cvh5l0s,0,t1_cvgfaol,Ghoti76,Example?,0,0,1443465330,1444725592
