id,is_root,parent_id,author,body,score,score_hidden,created_utc,collected_utc
cvxwnqo,0,t1_cvxjeve,playfulpenis,"Trump is a tough-talking, deal-making LION and a patriot industrialist. America needs that right now. He'll cut to the bone on things, increase efficiency and get things built. He's also strong on law and order. Without these things America turns into a dump. And Trump has nothing to gain if the US turns into a 3rd world dump.",1,1,1444718805,1444729292
cvxsecy,0,t1_cvxruwv,playfulpenis,"It's a tough world out there, champ. Mommy government can't and won't protect you everywhere. Everyone should protect themselves and their own.",1,1,1444708063,1444729292
cvxrvnw,0,t1_cvx7vyz,playfulpenis,We need more of that German ingenuity and industriousness.,3,0,1444707178,1444729292
cvxrh12,0,t1_cvxr7kn,playfulpenis,"People can craft things. People can craft guns, bombs or use SUVs to ram into a rally at 60 mph. Enough with this mommy-state shit. America is meant to be free not necessarily safe. Pussies will cry of course.",1,1,1444706459,1444729292
cvxr7f9,1,t3_3oh6ed,playfulpenis,They're building an army..,2,0,1444706002,1444729292
cvxcad6,0,t1_cvxc24t,playfulpenis,"With their kind of perfectionist, purely ideological thinking they're going to hand the WH to Democrats again for another 8 years, possibly forever. Stubborn fools. This is a very critical election for this country. This country needs a strong, pragmatic patriot. ",3,0,1444682700,1444729292
cvwsinj,0,t1_cvwshhi,playfulpenis,How so?,0,0,1444646469,1444729292
cvws94q,0,t1_cvwq887,playfulpenis,Trump gains nothing if the US turns into a 3rd world dump. ,0,0,1444645280,1444729292
cvws4mi,0,t1_cvwpsl1,playfulpenis,How so? You make it sound like scientific fact.,5,0,1444644716,1444729292
cvws39n,0,t1_cvwqthc,playfulpenis,"Same with bombs, poison, katanas and SUVs.",12,0,1444644543,1444729292
