id,is_root,parent_id,author,body,score,score_hidden,created_utc,collected_utc
cvxsqjd,1,t3_3ofxxd,Cap3127,Utley is only gonna be practicing golf after today.,1,0,1444708694,1444726006
cvxsph1,1,t3_3ojjtd,Cap3127,TAKE THAT UTLEY!  Only ball you will be practicing will be golf.,8,0,1444708638,1444726006
cvxopik,0,t1_cvxono6,Cap3127,"I dunno, you look skinny enough on gunnit live to pass for normal.  I never had a clue.",1,0,1444702047,1444726006
cvxoluh,0,t1_cvxnsot,Cap3127,Jesus you were fat.  Did you turn all that goat fat into cheese or something?,1,0,1444701890,1444726006
cvxlp3e,0,t1_cvxlgrk,Cap3127,"Its the same thing, according to /r/GrC",1,0,1444697423,1444726006
cvxkmaw,0,t1_cvwpaiu,Cap3127,"Did your beard get caught in it, too?",2,0,1444695746,1444726006
cvxk7pc,0,t1_cvxjz63,Cap3127,You do a lot of good work.  Ask SAF if they will consult you for research :P,5,0,1444695108,1444726006
cvxjo8q,0,t1_cvww7ye,Cap3127,"Great work there, Freeman.   ",6,0,1444694212,1444726006
cvxaucq,0,t1_cvxamcs,Cap3127,"Problem is, Roberts is a wild card.  They don't know how he will vote.  They'd rather not take it and have the option later, than let a ruling lets AWBs stands",2,0,1444680672,1444726006
cvx0qhg,0,t1_cvwv6r5,Cap3127,I don't think they will hear it.  They've avoided 2A cases wherever possible.,10,0,1444665813,1444726006
