id,is_root,parent_id,author,body,score,score_hidden,created_utc,collected_utc
cvxbeen,1,t3_3oguvx,toby224,We continue to arm ISIS. But the western media call's them Syrian Rebels. ,2,0,1444681454,1444730825
cvxb9nm,0,t1_cvxb2lb,toby224,Thanks. ,1,0,1444681264,1444730825
cvxaejs,1,t3_3ohld0,toby224,Next man up. We'll have an opportunity to see some of the backups. I hope they shine.,1,0,1444680045,1444730825
cvx7log,0,t1_cvx2kc5,toby224,I heard all the gun show hoopla so I thought I would go check one out. Maybe I won't have to put my name on a registration list. Went to a gun show in Indiana and they wouldn't even sell a gun to me because I lived in Chicago. That was before the CCW ban was lifted. People hear a lie and keep repeating the lie. ,1,0,1444676022,1444730825
cvx6p2t,1,t3_3od3z9,toby224,I like Charles. He is a very good running back. But the guy has some thin legs for a running back. I'm not surprised he has torn up his knees a few times. The first time I saw him play I thought he would do better at WR. I just don't think he can't take the pounding long term for a RB.,2,0,1444674717,1444730825
cvx6jly,0,t1_cvwyve1,toby224,So now is the time to bet on the Bears.,4,0,1444674495,1444730825
cvwyshx,0,t1_cvw6q2r,toby224,Good for you! Don't let people's ignorance anger you. Your inner peace is too precious to give away on account of a fool.,1,0,1444662619,1444730825
cvwyfh9,0,t1_cvwyaml,toby224,It is pretty stupid. The computers heavily weight home field advantage. ,22,0,1444661989,1444730825
cvwx25v,0,t1_cvvm8vu,toby224,"As a young black child from poverty raised by a single mom. He knows poverty and struggle, and he knows how to accomplish success. ",1,0,1444659488,1444730825
cvww9ug,0,t1_cvw5oqk,toby224,He's got speed too. They should go deep to him and wilson at least twice per game. Just to keep the defense honest. ,1,0,1444657872,1444730825
