id,is_root,parent_id,author,body,score,score_hidden,created_utc,collected_utc
cvtsp42,1,t3_3o1bm7,pattonc,"Wish it would bail me out. I lose all the games I'm supposed to and lose the games I'm not. 

TLDR: All I do is lose.",1,0,1444405878,1444731040
cvrhpaw,0,t1_cvrhnwp,pattonc,And I picked ManU,1,0,1444239294,1444731040
cvrh2rp,0,t1_cvrgm1h,pattonc,"Same here, but is that true for everyone?",1,0,1444238404,1444731040
cvrg0ro,1,t3_3nuub4,pattonc,So what are they? Care to share?,1,0,1444236879,1444731040
cvrg0d1,0,t1_cvrfwfd,pattonc,But what are your teams default tactics? Are they the same for everyone?,1,0,1444236861,1444731040
cvrfl2c,0,t1_cvrbl4j,pattonc,"Thanks for taking the time to explain. It's always great to hear a variety of perspectives from successful players. I really like this version's less arcade-like-feel, but it's frustrating to experience loss after loss.",1,0,1444236233,1444731040
cvrbgyz,0,t1_cvrbdsk,pattonc,"Thanks again, I really appreciate it. ",1,0,1444230062,1444731040
cvrb2el,0,t1_cvr2nfr,pattonc,Can you elaborate?,2,0,1444229424,1444731040
cvrb1l2,0,t1_cvraglw,pattonc,Thanks for replying. What key player instructions do you like?,1,0,1444229387,1444731040
cvr2afr,1,t3_3nsuoa,pattonc,"Thanks for that. After spending all night losing, it was good to laugh and smile.",2,0,1444203414,1444731040
