id,is_root,parent_id,author,body,score,score_hidden,created_utc,collected_utc
cvxoznk,0,t1_cvxov7g,object_on_my_desk,Add mustard and it's not like ours would be that different.,1,0,1444702503,1444729918
cvxo414,0,t1_cvxnrfe,object_on_my_desk,What's NY-style? I didn't think you guys even had a particular way to make them.,24,0,1444701100,1444729918
cvxj5c3,0,t1_cvxj2lo,object_on_my_desk,Northside of Chicago.,3,0,1444693359,1444729918
cvwvx4x,0,t1_cvwvvh3,object_on_my_desk,"He had the ball in his glove, took a step, transferred the ball to his throwing hand, and then attempted to tag out the runner with the ball in the throwing hand.  That's not fielding the ball.",4,0,1444657106,1444729918
cvwvt7v,0,t1_cvwv9be,object_on_my_desk,">  batted ball or a fielder in the act of fielding a batted ball 

Why do so many people seem to gloss over this part?",11,0,1444656860,1444729918
cvwve3q,0,t1_cvwunie,object_on_my_desk,"He's a hell of a ballplayer.  One of the best in the league, obviously.  That's why he's going to get it. ",1,0,1444655880,1444729918
cvwlwk9,0,t1_cvw6gih,object_on_my_desk,I have a strong feeling this person received very little from the educational system. ,2,0,1444623588,1444729918
cvwlvz5,0,t1_cvwf8un,object_on_my_desk,You must be one of those criminals.,4,0,1444623552,1444729918
cvwlmz1,0,t1_cvwl93o,object_on_my_desk,Wasn't even expecting nsfw ,77,0,1444622995,1444729918
cvwkufp,0,t1_cvwh8kx,object_on_my_desk,Yeah I'm pretty indifferent.  It's just how it works.  Protecting your teammates and such.,1,0,1444621372,1444729918
