id,is_root,parent_id,author,body,score,score_hidden,created_utc,collected_utc
cvluy7i,0,t1_cvlup4e,sellington,"Stay at home dads are becoming more common. Plus, with the cost of child care it is often cheaper to have one parent stay at home. ",2,0,1443805369,1444731782
cvluhl5,0,t1_cvltpf6,sellington,More families living off one income is not necessarily bad. That could easily account for the decline. ,0,0,1443804692,1444731782
cuu37mm,0,t1_cuu0hok,sellington,Europe didn't help cause the Latin America refugee crisis. ,-5,0,1441683560,1444731782
cutzlyw,1,t3_3k1fmb,sellington,"Shot with a panasonic GH4, in 4k video mode. Lens: Panasonic 14-140mm at 140mm. f5.6. Cropped the 4k image into a 1080p frame and keyframed a bit to keep the moon in position.",1,0,1441676512,1444731782
cuty6kg,0,t1_cutxwaf,sellington,I think you are right. I find it interesting that the responsibility of the US isn't discussed more. Every /r/news story on the topic just talk about what is happening Europe and how Middle East countries aren't doing their part. Why is their no discussion the the US not doing its part?,7,0,1441673778,1444731782
cu5y3kc,0,t1_cu5hl8v,sellington,"The problem is also starting in several other countries in Latin America, like Peru",1,0,1439825413,1444731782
ctgqrhi,1,t3_3eo0zf,sellington,Apple will fix it and the new parts will have a warranty. They will also be legit parts. I forget the price,3,0,1437926056,1444731782
csz8rf2,0,t1_csz7xxn,sellington,It's not ok to make fun of someone for being poor but it is ok to make fun of someone for being a fan of Kid Rock,8,0,1436575249,1444731782
csuvu6c,1,t3_3cf1yu,sellington,Original: http://imgur.com/16Xye58,2,0,1436271597,1444731782
csizwwu,0,t1_csix4fm,sellington,Yes,2,0,1435286187,1444731782
