id,is_root,parent_id,author,body,score,score_hidden,created_utc,collected_utc
cvv4ktv,0,t1_cvv3hl7,PrimesteFericera,Fair enough.,1,0,1444510798,1444725477
cvtxza4,1,t3_3o45tk,PrimesteFericera,"I've never been a daily makeup wearer, and I haven't noticed any negative (or positive for that matter) attention because of it. If it makes you really uncomfortable to go bare faced, just do some simple mascara and a long lasting lip color. That's what I do to freshen myself up if I really feel like crap, yet it doesn't make me look like an entirely different person.",0,0,1444413773,1444725477
cvtxr5r,0,t1_cvtpc9a,PrimesteFericera,"What if they've never had the opportunity? Their views on sex might be exactly the same as yours, despite their experience level.

I can understand why you see it as a negative other than that though.",4,0,1444413435,1444725477
cvtxntb,1,t3_3o3572,PrimesteFericera,"Yes, very. I like being on the dominant side, and I think that would be easier and more fun with a virgin. There'd be a bit of a thrill in teaching him all I know and what not.",5,0,1444413297,1444725477
cvtvxnu,0,t1_cvt3qw9,PrimesteFericera,I'd take either. My porn finding skills are really bad.,1,0,1444410751,1444725477
cvrssxe,1,t3_3nqknw,PrimesteFericera,Jay or Silent Bob. Bonus points if you can find a friend to do it with you.,1,0,1444255562,1444725477
cvp2pz4,1,t3_3nkt85,PrimesteFericera,Shea Moisture Curl Enhancing Smoothie. Put in a little while the hair's damp for a leave in. I sometimes use it for regular conditioner and making deep condition treatments too.,1,0,1444064597,1444725477
cvh5w0d,1,t3_3mpjhd,PrimesteFericera,It looks great. I'm not sure why you'd want it thinner.,2,0,1443465775,1444725477
cveg8r2,0,t1_cvebzvk,PrimesteFericera,That sounds pretty fun! We might give it a go.,2,0,1443234637,1444725477
cveg807,0,t1_cveaxne,PrimesteFericera,"Very true. 

I still am not sure about the ethics of the requirement part, but for the love of jebus birth control other than the pill needs to be widely available. The pills are way too easy to mess up. I have the implant and it's awesome. Three years no worries! Woo!",3,0,1443234592,1444725477
