id,is_root,parent_id,author,body,score,score_hidden,created_utc,collected_utc
cvvmc5v,0,t1_cvv82xv,Oliver_the_chimp,Leave your job.,-1,0,1444547857,1444731302
cvugv4g,0,t1_cvtonwi,Oliver_the_chimp,My variation: Shampoo for my real friends and real poo for my sham friends.,3,0,1444447056,1444731302
cvs3jdv,0,t1_cvqzjc7,Oliver_the_chimp,Quickly weird it's... Oh nevermind,2,0,1444273444,1444731302
cvrk8w1,1,t3_3nueg4,Oliver_the_chimp,y do you ask?,3,0,1444242956,1444731302
cvrjync,0,t1_cvr17t2,Oliver_the_chimp,SMILF,1,0,1444242545,1444731302
cvpdbza,0,t1_cvp4pkr,Oliver_the_chimp,"Think of it like you're going to visit a therapist who can see everything you've ever done or thought. You are fully on the table, so you need to take it easy on yourself and allow yourself to disassociate a little. Try to listen, feel, learn and grow. Marvelous experience. Just not a good time to allow yourself to obsess on the dark stuff unless you're experienced and wanting to grow in that area.",1,0,1444080397,1444731302
cvo5nz0,1,t3_3ngyzf,Oliver_the_chimp,Yours will be the one with the dent on the door ;),9,0,1443990716,1444731302
cvm8xw5,0,t1_cvlpgaj,Oliver_the_chimp,You should really publish a book of these.,3,0,1443827962,1444731302
cvjwrey,0,t1_cvjs0mv,Oliver_the_chimp,Got it. 200 Million years ago the Mississippi ended in Illinois.,1,0,1443656067,1444731302
cvipoxx,1,t3_3mtux4,Oliver_the_chimp,"""Both parties are the same."" (USA) So edgy!",2,0,1443570609,1444731302
