id,is_root,parent_id,author,body,score,score_hidden,created_utc,collected_utc
cvx494p,0,t1_cvx02zt,brutalhonesty45,"Ignore the weight issue.  You do not need a reason to dump her.  As you said yourself, the spark is gone.  It does not need to be a black/white fully rational reason.  At your age, this stuff happens.  Just break it off, and be done with it.  ",3,0,1444671202,1444723970
cvx1hzw,1,t3_3ogj21,brutalhonesty45,"Never buy cell phone warranties, replacement plans, care plans, etc.  Almost all of them are rip-offs.  ",-2,0,1444667042,1444723970
cvx0p9v,0,t1_cvwzgre,brutalhonesty45,"Dell is phasing out equal logic in favor of compellent.  

edit: mye speling sucks.  ",6,0,1444665762,1444723970
cvwzunp,0,t1_cvwwbou,brutalhonesty45,"Which would be fine if it was awesome, but I do not trust Belkin to get anything right (except surge protectors).  The WRT1900AC was mediocre at best.  ",22,0,1444664394,1444723970
cvwzpcp,0,t1_cvwwsor,brutalhonesty45,"Because they do not want advice, they just want positive reassurance for their actions.  ",30,0,1444664149,1444723970
cvw6n2r,1,t3_3ocrjd,brutalhonesty45,Not me.  ,2,0,1444596309,1444723970
cvvujfz,1,t3_3oaq3n,brutalhonesty45,Little does Mom know hat Arkham is a demon!,1,0,1444576622,1444723970
cvu9wlz,0,t1_cvtp5zv,brutalhonesty45,"Really.  Using a Netscaler as a forwarding proxy to an actual content filter is not only hackneyed, but expensive.  ",0,0,1444432857,1444723970
cvtlo2q,0,t1_cvtffty,brutalhonesty45,Then put it in her husband's butt.  ,1,0,1444393131,1444723970
cvtllcz,1,t3_3o2opv,brutalhonesty45,Nothing wrong with you at all dude.  And embrace your preferences.  ,7,0,1444392929,1444723970
