id,is_root,parent_id,author,body,score,score_hidden,created_utc,collected_utc
cvo3r4q,0,t1_cvnvra1,Fritz_Ortman,The frickin' bean dude,16,0,1443987969,1444719841
cvmp23p,0,t1_cvmp0uu,Fritz_Ortman,That makes sense. ,2,0,1443877878,1444719841
cvmoymy,0,t1_cvmopra,Fritz_Ortman,So what then is the course of action for socialists and communists who want to violently overthrow the government?,-1,0,1443877587,1444719841
ctyjyi3,0,t1_ctyi5ux,Fritz_Ortman,The plural of vinyl is vinyl. ,2,0,1439250077,1444719841
cty3lni,0,t1_ctxorkb,Fritz_Ortman,"Plenty of Bands are still making pop punk. Joyce Manor, The Story So Far, Tigers Jaw, and Title Fight to name a few. ",4,0,1439224750,1444719841
ctf65bh,1,t3_3eg9lh,Fritz_Ortman,"Have a nice life - Earthmover

What an incredible track",1,0,1437780502,1444719841
ct3oabw,0,t1_ct3o7bl,Fritz_Ortman,"Depending on how you feel about the word faggot, I guess you can say it goes either way.  He says ""who's the faggot now?"" which definitely uses the word as an insult.",1,0,1436924798,1444719841
ct3nla2,0,t1_ct3in5t,Fritz_Ortman,Attila is a crap metal-core band whose singer uses homophobic slurs in songs,0,0,1436923617,1444719841
csum5y7,0,t1_csrs3wm,Fritz_Ortman,Wow I forgot about Pat. That really sucks that he was trying to sell those off. I remember when him and James got them and we're making videos about them. That's crazy. ,2,0,1436240791,1444719841
csu3xgn,0,t1_csu3nnj,Fritz_Ortman,*nonsense,1,0,1436209779,1444719841
