id,is_root,parent_id,author,body,score,score_hidden,created_utc,collected_utc
cvw92g2,1,t3_3o9asz,chipbod,"Saw them last year at a free concert in my universities union. Great show, me and a few of my buddies have been listening to them a ton the last year",1,0,1444600252,1444724912
cvugl5h,0,t1_cvubmbu,chipbod,Well im american and this is basically what my history teacher told us lol,2,0,1444446422,1444724912
cvu2dsl,0,t1_cvu232x,chipbod,This pretty much ends all arguments over who won the war for the allies ,0,0,1444420370,1444724912
cvu19ii,0,t1_cvu11cm,chipbod,Big fucking difference ,1,0,1444418662,1444724912
cvr0on0,0,t1_cvqzuoh,chipbod,Ordering the lockerbie bombing and protecting the perpetrator does kind of make you look insane. Dont think it help his geopolitical goals much. Just looks like a supporter of terror,2,0,1444197735,1444724912
cvqvywo,0,t1_cvqrbf5,chipbod,and protecting terrorists,9,0,1444186768,1444724912
cvqj966,1,t3_3nny24,chipbod,The house and the lakehouse,3,0,1444165119,1444724912
cvnyvd9,0,t1_cvnqixz,chipbod,At that point add the xb70 lol,5,0,1443980686,1444724912
cvn6fx5,0,t1_cvn5eqt,chipbod,"Lol, wtf is this vid trying to show? Its a normal bomb blowing an ammo depot. It would be big fuckin news if a nuke is used somewhere in the world. Not easy to cover that up.",19,0,1443910868,1444724912
cvkar7m,1,t3_3n2boh,chipbod,"Ehh, i just like the style snd cool designs. Also a great place to put pop tabs since our school has competitions for that.",6,0,1443686563,1444724912
