id,is_root,parent_id,author,body,score,score_hidden,created_utc,collected_utc
cvrdr40,0,t1_cvra4ss,King_Stannis,"Super Battle Droids, Droidekas, Count Dooku, Geonosians, and Jango Fett. ",92,0,1444233536,1444723890
cvrdq9w,0,t1_cvrabkb,King_Stannis,"From what I've played, it is random.",1,0,1444233502,1444723890
cvrd0t7,0,t1_cvqyae2,King_Stannis,and he is wrong. This is one time where an opinion is empirically false. ,4,0,1444232462,1444723890
cvqbv9z,0,t1_cvqb52f,King_Stannis,and you've designed how many games again? ,11,0,1444154395,1444723890
cvist4v,1,t3_3k4pwu,King_Stannis,Any interest in Dragon Age: Inquisition or Dying Light for Destiny? ,1,0,1443576179,1444723890
cvg4j6f,1,t3_3ml2je,King_Stannis,Any interest in Dragon Age: Inquisition? ,1,0,1443384553,1444723890
cvdyhxi,0,t1_cvdwhaw,King_Stannis,That was a midterm though. Democratic voters usually don't vote in non-presidential years. ,23,0,1443202402,1444723890
cvcw6tt,1,t3_3m74z0,King_Stannis,"I have a friend that went to a really good school for his MA in English Lit, and he has been working as my editor. It's a nice situation since we read different things and our friendship is at the level where we honesty reigns supreme. He demolishes my writing in order to build it up, and it has helped me immensely. ",2,0,1443122206,1444723890
cvbbhs5,1,t3_3lzkqi,King_Stannis,"This is especially bad for someone like me who liked BO3, but is still on the fence about buying it. ",1,0,1443016062,1444723890
cv9p9k7,0,t1_cv9meal,King_Stannis,"Ahh, sorry! ",1,0,1442884890,1444723890
