id,is_root,parent_id,author,body,score,score_hidden,created_utc,collected_utc
cvxb12m,1,t3_3ohfpn,wildlight,"Doesn't mean he's the front runner, it just means he's the best leader and other are following his example. If you want to be a compelling candidate for the Democratic nomination and attract voter instead of alienate them you need to make your platform look like Bernie's because he represents what engaged likely democratic voters want.",1,0,1444680938,1444729743
cvx9td4,1,t3_3ofusg,wildlight,Ehh you should probably be making the extra money anyways.,1,0,1444679203,1444729743
cvx8e0w,1,t3_3ohei2,wildlight,"""Hillary Clinton's struggling campaign taking lead from Sanders""",2,0,1444677167,1444729743
cvx2okn,0,t1_cvwh8br,wildlight,"Maybe to encourage people to vote, since this is a democracy and if people don't vote then the system doesn't work very well.",2,0,1444668867,1444729743
cvx2lx9,0,t1_cvwpfy5,wildlight,Which one are you talking about?,1,0,1444668752,1444729743
cvwo7k4,1,t3_3odbxm,wildlight,Your mom for the first of 2 million nights.,2,0,1444629448,1444729743
cvw4u2e,1,t3_3od6ds,wildlight,"Sanders is a capitalist and a social Democrat. His ideology is so far from communism or socialism, you should chill out and try to get a grasp of reality.",4,0,1444593648,1444729743
cvvnoma,0,t1_cvvlv3d,wildlight,Men commit suicide at a much higher rate then women.,4,0,1444553545,1444729743
cvvl3w6,0,t1_cvvh3iz,wildlight,Or anyone as dumb as the rebublican party ,-3,0,1444543619,1444729743
cvvkwcz,1,t3_3oa3jb,wildlight,Regulations should foster the growth of freelance enterprises develop into cooperatives.,3,0,1444542970,1444729743
