id,is_root,parent_id,author,body,score,score_hidden,created_utc,collected_utc
cvw2kzw,0,t1_cvw0bow,Haster,"Really? is it because it's not good enough or too good?

Like this thing; I would be hard pressed to actually identify anything really wrong with it but my brain just rejects it as *wrong*",2,0,1444590312,1444721447
cvw2hzq,0,t1_cvw1p02,Haster,"lol, yes, hair would go a long way I'm sure but there's something that just freaks me out about the skin.",4,0,1444590187,1444721447
cvw003u,1,t3_3ocexw,Haster,Well that's right smack in the middle of the uncanny valley.,3,0,1444586328,1444721447
cvv6f6r,1,t3_3nmguq,Haster,"Consultant here.

we have about a dozen clients that have no IT staff at all (well they might have a guy to kick the printer when it's not working)

On the high end I don't know exactly but must be in the several 100's at least.
",1,0,1444514263,1444721447
cvv69dv,0,t1_cvv0k0d,Haster,"Thanks! I'll check it out. 

Bit silly of me to have never checked for a patch really.",1,0,1444513962,1444721447
cvrvkrq,0,t1_cvrtmqd,Haster,Way to miss the point.,2,0,1444260276,1444721447
cvrpt21,0,t1_cvrmbjo,Haster,"Two have refused, how many would rather have kept it on but didn't.",14,0,1444250963,1444721447
cvrplsj,0,t1_cvrp18r,Haster,"There's a trend of terrorism being done by muslims, that doesn't mean we should act out against muslims.

By the same token even a trend of abuse in polygamous relationships shouldn't warrant a ban on it.

I think we absolutely banned polygamous relationships because of how the majority dislikes the idea.",5,0,1444250674,1444721447
cvp2fcw,0,t1_cvoucuj,Haster,Can you explain it to someone too slow to get it?,1,0,1444064160,1444721447
cvlyukt,0,t1_cvlslol,Haster,"Personal transfers require both people to not care that it's illegal. you're dramatically shrinking the size of the pool of potential sellers for lunatics/Criminals to buy from.

doesn't need to be a complete solution to help.

treat guns like cars (require license, registration, insurance)and that would be a good first step.",0,0,1443811214,1444721447
