id,is_root,parent_id,author,body,score,score_hidden,created_utc,collected_utc
cvu9co7,0,t1_cvu7vwn,sharules,Because he likes to use charts and graphs.,1,0,1444431846,1444727367
cvrvkjk,1,t3_3nvxtq,sharules,[Hear her real voice on Oprah.](https://www.youtube.com/watch?v=fT3QpVjMvCU),5,0,1444260266,1444727367
cvqm53f,1,t3_3nqzdu,sharules,He had the vapors that day.,1,0,1444169630,1444727367
cvp34hs,0,t1_cvoscgy,sharules,The DILT is hiding!,1,0,1444065200,1444727367
cvipr16,0,t1_cvinls4,sharules,Thank you.,1,0,1443570711,1444727367
cvipqrk,1,t3_3mvd84,sharules,Sad news for sure.,5,0,1443570699,1444727367
cvin672,1,t3_3mw4l2,sharules,Artist name? It's pretty awesome.,2,0,1443566256,1444727367
cvi0t4f,1,t3_3msapb,sharules,"I have a clothing company, maybe I'll steal and alter their altered Forever 21's design too. :)",0,0,1443532298,1444727367
cvex7hk,1,t3_3mgvbt,sharules,Does John Cena always wear Jorts?,1,0,1443286297,1444727367
cvewhux,1,t3_3mfc6p,sharules,When he humps himself..Hah!,0,0,1443284933,1444727367
