id,is_root,parent_id,author,body,score,score_hidden,created_utc,collected_utc
cvxmoxn,0,t1_cvxlffj,sparta1170,I miss McKay and O'Neil ,4,0,1444698948,1444728672
cvxlbwv,0,t1_cvxl1g4,sparta1170,"gotta go max speed, no slowing down, HRE final destination",1,0,1444696857,1444728672
cvxjbuw,0,t1_cvxj2u5,sparta1170,"I earned an acheivment in this run. I got the respected acheivment on oct 4th. So I definately was doing an ironman run. 

Edit: I earned it when Hungary was under a PU with me, my other Austrian Ironman mode does not have that",1,0,1444693660,1444728672
cvxifej,1,t3_3oikhe,sparta1170,"The best part was somehow getting Great Britain, France, and Spain on my side in a war against the Ottomans, poor Kebab was overwhelmed. ",1,0,1444692187,1444728672
cvxd167,1,t3_3odx0f,sparta1170,Wtf 2 blazes?,1,0,1444683739,1444728672
cvx3bu8,1,t3_3o8ni8,sparta1170,A good way to remember is February for fall and September for Spring.,1,0,1444669840,1444728672
cvve9tl,0,t1_cvv28iw,sparta1170,Did he receive the Bright Slap of Destiny? I don't think he really did.,4,0,1444529042,1444728672
cvufmqy,0,t1_cvudzzh,sparta1170,"This is good, isn't it?",2,0,1444444276,1444728672
cvub9jc,0,t1_cvuadbb,sparta1170,We need his Phantom,4,0,1444435440,1444728672
cvt2gp1,0,t1_cvsv5qn,sparta1170,Nanomachines son,2,0,1444345461,1444728672
