id,is_root,parent_id,author,body,score,score_hidden,created_utc,collected_utc
cvu803a,0,t1_cvu7uga,seycyrus,"Nah puppy. I'm not going to get drawn into a drawn out argument with an internet troll who lives in a fantasy land.

I knew you WOULDN'T answer it,",1,0,1444429421,1444722121
cvu7s1h,0,t1_cvu7n93,seycyrus,"Get outa here pup! You want to live in your little fantasy land, you go ahead.

You tell me. The laws are as written. What constitutes a threat?",3,0,1444429033,1444722121
cvu7moy,0,t1_cvu7kd0,seycyrus,You're not a threat.,4,0,1444428774,1444722121
cvu7j8a,0,t1_cvu3h3s,seycyrus,"The threat of having your ass kicked (or killed) is enough to warrant lethal force.
",5,0,1444428603,1444722121
cvu0y12,0,t1_cvtzieu,seycyrus,"Your fantasy world where 7 guys who jump 2 others are ""gentlemanly"" enough to stop putting the hurt down must be a crazy place.",9,0,1444418184,1444722121
cvtr8jm,0,t1_cvtr2b4,seycyrus,Cheetahs can jump like 15 feet in the air. I guess its not that far off.,0,0,1444403672,1444722121
cvtqwgb,0,t1_cvtqnvl,seycyrus,Don't think it scales linearly.,1,0,1444403151,1444722121
cvtp8m4,1,t3_3o34rs,seycyrus,"Dude can run 60 mph, but only jump 10ft?",1,0,1444400483,1444722121
cvpmq0z,1,t3_3nlqz3,seycyrus,This is just a commercial. Not worth the cost they charge at the fairs. Not by a long shot! ,2,0,1444096434,1444722121
cvmomme,0,t1_cvmmhi7,seycyrus,https://en.m.wikipedia.org/wiki/Tortoise#Use_of_the_terms_turtle.2C_tortoise_and_terrapin,1,0,1443876468,1444722121
