id,is_root,parent_id,author,body,score,score_hidden,created_utc,collected_utc
cvxdqp1,0,t1_cvxcnk0,FighterPoetThinker,Better then how I felt about us in the Big 12.,3,0,1444684771,1444717540
cvx5v54,0,t1_cvx5df0,FighterPoetThinker,I am okay with this.,23,0,1444673522,1444717540
cvx15re,0,t1_cvwzgew,FighterPoetThinker,"Ah, you're right. I stopped playing 4s multilayer pretty quick after launch so it was a while ago for me to remember all the playlists.",1,0,1444666506,1444717540
cvwz9aa,0,t1_cvwy96k,FighterPoetThinker,"We've never had a straight up ctf playlist, it's always been mixed in with objective.",0,0,1444663412,1444717540
cvw5mfb,0,t1_cvw5e7u,FighterPoetThinker,:') that's a beautiful sentence.,25,0,1444594791,1444717540
cvw5la9,1,t3_3od7li,FighterPoetThinker,"Doug Martin is love, Doug Martin is life.",37,0,1444594749,1444717540
cvvz54n,1,t3_3obunq,FighterPoetThinker,:'(,2,0,1444584979,1444717540
cvvf21y,0,t1_cvveu90,FighterPoetThinker,"Honestly, no clue. I've been playing the beta solo.",1,0,1444530539,1444717540
cvveq0m,0,t1_cvvedj5,FighterPoetThinker,"Pros: it's gorgeous, the gunplay is fine, the sound effects are top notch

Cons: it feels hallow. There's no classes and the walker assault is terribly unbalanced. I actually wish it was more like battlefield.",1,0,1444529893,1444717540
cvveoro,0,t1_cvvedli,FighterPoetThinker,Xbox,1,0,1444529826,1444717540
