id,is_root,parent_id,author,body,score,score_hidden,created_utc,collected_utc
cvihvm6,0,t1_cvigzrt,hzane,Why? Do you have any meaningful differences in mind?,3,0,1443558296,1444722193
cvid4w1,1,t3_3muuk9,hzane,This is a growing belief online that right wing propagandists are using to groom young people. Such is an early stage to political induction. The standard counter to your friends perspective is that nazis and fascists are still around. They still organize and soapbox. And without exception they support right wing ideals and politicians. Simply look up a nazi group and see which side of the spectrum they exist on.,-1,0,1443551669,1444722193
cvfbmmz,1,t3_3mhf19,hzane,"Depends on your client and your content. For example a corporate office application should target desktops. ""Mobile first"" is a popular idea. But designing for landscape and adapting for mobile is also reasonable. I dont think you are wasting time persay. And style is subjective. Design debates can get combative.",3,0,1443313633,1444722193
ct6snum,0,t1_ct6phuh,hzane,Lets not rule out the possibility this thread is full of 13 years old though....,2,0,1437155312,1444722193
ct6shno,0,t1_ct6pntz,hzane,"So wait youre saying you know for sure the god of Abraham doesnt exist (literary invention), or that you know for sure that our universe was not created by some entity that we do not understand?

Cause the latter seems pretty likely to me based on the pattern of reproduction observed in everything.

Personal note, i identify as an atheist though still...",1,0,1437155064,1444722193
cstklmf,0,t1_cstip6x,hzane,What liberal?,1,0,1436163036,1444722193
cssay9c,0,t1_cssacfh,hzane,This whole thing appears to this observer to be people want to be part of a cause. Redditors inner SJW coming out. With that in mind its kind of embarrassing this is being taken serious as an issue at all. But okay folks.,-1,0,1436046404,1444722193
css60b3,0,t1_css2zdz,hzane,"I have no degrees, work maybe 30 hours a week and pull in more than 6 figures a year (pretaxes). So, yay!",6,0,1436035858,1444722193
css5kp2,0,t1_csrytyx,hzane,Is this directed at redditors infantile enough to think Pao is an important issue? They should gtfo and be drama queens elsewhere.,1,0,1436034962,1444722193
css5hw4,0,t1_css2iq8,hzane,I know she fired a couple employees. There must be more to it. What are you so offended by..?,5,0,1436034800,1444722193
