id,is_root,parent_id,author,body,score,score_hidden,created_utc,collected_utc
cvwqumd,0,t1_cvvy9n9,AnokNomFaux,Lard.,0,0,1444638913,1444731434
cvwqto7,0,t1_cvvwrqb,AnokNomFaux,serious question.  I am a vegetarian.  Which products at Taco Bell do not have animal products in them?  Seven Layer Burrito and Plain Nachos?  (except cheese in the Nachos and the Seven Layer Burrito tastes funny.),1,0,1444638800,1444731434
cvwqs6y,0,t1_cvvrzuj,AnokNomFaux,fries back then were fried in lard.  Not vegetarian.,1,0,1444638615,1444731434
cvwpc48,1,t3_3oe68e,AnokNomFaux,"
""It's terrible, terrible, and it's mainly because of drugs, I'm afraid,"" said Michael McDaniel. ""We need to get rid of drugs and hopefully that will stop this stuff.""

SEE?  GUNS DON'T KILL LITTLE GIRLS, DRUGS KILL LITTLE GIRLS!  HIGH VELOCITY DRUG PELLETS!",1,0,1444633003,1444731434
cvwm48l,0,t1_cvwir8s,AnokNomFaux,"A few years ago, my neighbor tried to cut down the tree that shaded my house from the brutal Valley sun.  I stood out in the street in my nightgown screaming at them until they stopped.  DO NOT FUCK WITH MY SHADE.",8,0,1444624064,1444731434
cvwlzuk,0,t1_cvwlirc,AnokNomFaux,"Isn't that where the woman's body was in the water tower and went undiscovered until someone said ""Hey, the water has been tasting funny lately....""",13,0,1444623786,1444731434
cvrmojs,1,t3_3nv5pq,AnokNomFaux,VCA is good.  I have also used Laurel on Santa Monica.,0,0,1444246498,1444731434
cvho8xr,0,t1_cvhg3b9,AnokNomFaux,Don't call it Cali.,1,0,1443494581,1444731434
cvho2tq,0,t1_cvhe2o2,AnokNomFaux,ricin is natural,3,0,1443494312,1444731434
cvghjrx,1,t3_3mmm8n,AnokNomFaux,What is the name of the daycare facility?,1,0,1443407616,1444731434
