id,is_root,parent_id,author,body,score,score_hidden,created_utc,collected_utc
cvxlgyo,1,t3_3ogwt8,RecallRethuglicans,Even if you did stab someone doesn't mean they have to be mean,-2,0,1444697073,1444717063
cvxlayt,0,t1_cvxjnbq,RecallRethuglicans,Because it's another example of Israel's occupation The Palestinian people,-24,0,1444696819,1444717063
cvx76mm,0,t1_cvx6um1,RecallRethuglicans,The occupation.,-26,0,1444675416,1444717063
cvx6rme,0,t1_cvx0qyr,RecallRethuglicans,Is it wrong?,0,0,1444674819,1444717063
cvwrzjv,0,t1_cvss2v0,RecallRethuglicans,There's no evidence these are related or even acts of terror. It's more like civil disobedience to me.,0,0,1444644069,1444717063
cvwk1i8,0,t1_cvwfiv3,RecallRethuglicans,That's called getting what's best for your family.,1,0,1444619915,1444717063
cvwjd6f,0,t1_cvwevdu,RecallRethuglicans,"Probably one of those racist ""voter ID"" idiots",2,0,1444618705,1444717063
cvwj8sy,0,t1_cvvwher,RecallRethuglicans,That's why it can't just be free. We need to be **paying** students for school.,0,0,1444618488,1444717063
cvw87bh,0,t1_cvvv2ve,RecallRethuglicans,You don't need investment. We need a worldwide ban on fossil fuels. We need to be able to go to the small mining towns in West Virginia and tell them that no more husbands or sons will be harmed working in those nasty mines.,0,0,1444598832,1444717063
cvw36y1,0,t1_cvw0ho9,RecallRethuglicans,"Someone doesn't understand the multiplier effect. As they come and bring their families, they will spend the benefits and that will make the economy grow. Better for them to have the money than middle-class Germans.",-14,0,1444591223,1444717063
