id,is_root,parent_id,author,body,score,score_hidden,created_utc,collected_utc
cvxbrr3,0,t1_cvwtyam,superfudging,100% to hinder the price savings and velocity of people cutting the cord of cable. 300gb will be done in like 10 days of streaming HD and even faster with 4k. Even with SD its pretty easy to go over the limit with gaming included. ,1,0,1444681977,1444732290
cvx87uc,0,t1_cvx82xj,superfudging,DING DING DING... Why invite a claim it might be the moral thing to do but your going to screw yourself. Your company is very likely to drop you after two claims and 100% your going to pay for it over the life your insurance at the very least. ,11,0,1444676916,1444732290
cvx7owc,1,t3_3og414,superfudging,I used to be a promoter. My standard contract was venue guarantee (overhead) was the first to be paid out. Roughly $500. Then after that the door was split by draw count or if the bands wanted it an even split. Then there sometimes was a bar split but the band essentially was a sellout before we even started negotiating. ,3,0,1444676150,1444732290
cvwh6jh,1,t3_3obyxx,superfudging,The legislator needs the ability to be flexible in times of turmoil or great positive change. Earmarks hinder that which is why ultra left and ultra eight love them. It forces the center into paralysis ,1,0,1444614797,1444732290
cvu8c3x,1,t3_3o40d2,superfudging,My guess is he is cheating on you actually,2,0,1444430016,1444732290
cvu4esy,1,t3_3o4wav,superfudging,Graduates in my 30s I think it actually helped me. I now have a narrative of how I overcame mistakes and stuck it through and made it happen. Your the rarity to go back and actually graduate,1,0,1444423512,1444732290
cvtubr0,0,t1_cvttx05,superfudging,http://www.consumerreports.org/cro/car-insurance/credit-scores-affect-auto-insurance-rates/index.htm?loginMethod=auto,1,0,1444408337,1444732290
cvtcinv,1,t3_3nztgn,superfudging,My friend who is a food scientist basically does labeling concerns. E.g no nuts etc... Basically the science has to meld with the marketing. He also said its a giant pigeon whole and went and got his masters,1,0,1444362492,1444732290
cvt1347,1,t3_3o07hb,superfudging,"You could also be running into your credit rating affecting it. Have you checked that lately? 
",1,0,1444343127,1444732290
cvqau31,1,t3_3npzs3,superfudging,First of al have you looked at your own company? Obviously do not tell your direct supervisor but do ask for career advancement.,1,0,1444152904,1444732290
