id,is_root,parent_id,author,body,score,score_hidden,created_utc,collected_utc
cvxwu53,0,t1_cvxsu8e,wheelsofconfusion666,That's not how it works.,0,0,1444719427,1444730080
cvxwmm8,1,t3_3ohxcy,wheelsofconfusion666,Join the club,2,0,1444718699,1444730080
cvxc3m9,1,t3_3nt0n5,wheelsofconfusion666,Bout a month late with this.,1,0,1444682432,1444730080
cvwtuv2,1,t3_3oeqkx,wheelsofconfusion666,"As cool and useful as new technology can be, its hard to see its purpose for being created as nothing more than dispensing devices for advertisements. Why does everything in this world just have to have a goddamn dollar sign stamped on it.",0,0,1444651551,1444730080
cvw7q6y,0,t1_cvw3hae,wheelsofconfusion666,"Ok, I'll just stay ignorant. I just don't care enough to read a book on the subject. Good day, ya fruitcake.",1,0,1444598056,1444730080
cvvztc7,0,t1_cvvqyqe,wheelsofconfusion666,...or one built on oil fields.,1,0,1444586035,1444730080
cvvzrw6,0,t1_cvvvpwe,wheelsofconfusion666,"What book do u suggest I read. Is there a book that says that he didn't own slaves? Better yet, save me a trip to the bookstore and just enlighten me yourself.",0,0,1444585970,1444730080
cvvzk8d,0,t1_cvvs6wb,wheelsofconfusion666,OK. How does that reconcile the fact that hr bought the slaves in the first place? He bought human beings and called them his property. Not good. Not good.,0,0,1444585633,1444730080
cvvkilg,1,t3_3o9u32,wheelsofconfusion666,The the scandal is that he actually has a penis.,-1,0,1444541857,1444730080
cvvhgua,1,t3_3o9phn,wheelsofconfusion666,"Well, Thomas Jefferson was a piece of shit slave owner. I don't care if people look at him as a founding father. How much could he have been into freedom liberty and pursuit of happiness and all that happy ass shit if he owned human beings as slaves?",-18,0,1444535198,1444730080
