id,is_root,parent_id,author,body,score,score_hidden,created_utc,collected_utc
cvxa3b4,1,t3_3oh49y,dyggur,People are probably more comfortable criticizing their own country or culture.,3,0,1444679602,1444721596
cvx551x,0,t1_cvx2vbt,dyggur,hann er virkilega fær,7,0,1444672475,1444721596
cvwwbyj,1,t3_3ofji4,dyggur,so /r/shitpost ?,-2,0,1444658000,1444721596
cvwjbuw,0,t1_cvwimjq,dyggur,"Já hvernig læt ég, ætlaði nú ekki að gera mig að fífli á alþjóðavettvangi.",4,0,1444618639,1444721596
cvw8dqm,0,t1_cvvvem7,dyggur,You forgot a question mark.,1,0,1444599119,1444721596
cvw8bxv,0,t1_cvvv43g,dyggur,You just did dipshit.,1,0,1444599039,1444721596
cvvuxg6,0,t1_cvvuu36,dyggur,Do I look like I give a fuck?,-4,0,1444577424,1444721596
cvvtpgz,1,t3_3oay8f,dyggur,OK! We get it..technology spies on us. ,1,0,1444574896,1444721596
cvvteh1,0,t1_cvvt4fh,dyggur,Þannig að bandaríkin voru stofnuð af indjánum.,6,0,1444574170,1444721596
cvuchqv,1,t3_3o5zsu,dyggur,Mikið væri nú gaman ef fróðir menn um þetta málefni myndu rökræða um þetta akkurat hérna á /r/Iceland. ,1,0,1444437852,1444721596
