id,is_root,parent_id,author,body,score,score_hidden,created_utc,collected_utc
cvxtlb3,0,t1_cvxr1s9,qmechan,"We never will, as long as Hamas stays in power. It's against their charter for them to enter into peace talks.",1,1,1444710424,1444726784
cvxsjkx,0,t1_cvxiefk,qmechan,Source for that?,1,0,1444708330,1444726784
cvxsfl4,1,t3_3oj335,qmechan,"Ever hear of the Thuggee cult? Don't just take my word for it, but check out [their Wikipedia page](https://en.wikipedia.org/wiki/Thuggee) to see a pretty awful cult of people. ",1,1,1444708125,1444726784
cvxgm8x,1,t3_3oi8ja,qmechan,"That's right everyone, if you were Jewish in Hitlers Germany, they just asked if you were a Zionist and if you said no, they let you go.",3,0,1444689247,1444726784
cvx5lyx,1,t3_3od8iv,qmechan,Did we need him for something.,3,0,1444673152,1444726784
cvx5gkc,1,t3_3of3j5,qmechan,"Hopefully yes, and probably Iraq.",1,0,1444672935,1444726784
cvw4tm6,1,t3_3od4y4,qmechan,Chosen may not mean what you think it means.,1,0,1444593631,1444726784
cvu1fwt,1,t3_3n1orz,qmechan,WHAT THE HELL JUST HAPPENED!?,1,0,1444418934,1444726784
cvty7qu,0,t1_cvty5u6,qmechan,"That's a possibility, to be sure.",1,0,1444414123,1444726784
cvtxohj,0,t1_cvtcovh,qmechan,"> and I am immune to the anti-Semite label as I am Jewish myself.

That part is funny.",5,0,1444413326,1444726784
