id,is_root,parent_id,author,body,score,score_hidden,created_utc,collected_utc
cv5h61q,0,t1_cv55mic,DevonWeeks,">Okay, even if he called you dishonest, you've done nothing to support your honesty or bolster your point 

Yes, I did.  But, it was pointless.  Or, have you not checked the rest of this post?  Are you more concerned with having a ""high horse"" moment?  The first link I was asked for was the video she mentioned, and I posted that to another, much more polite poster.  Someone else linked it, too, further down the thread.  But, instead of reading it, OP just posted ""bullshit"" and posted a blog link saying it doesn't exist.  Do you understand what's happening here?  He said ""Source"", saw one, and rejected it without even clicking it, said bullshit, and posted an opinion piece as a counter.  That's precisely the behavior I predicted and is what I've come to expect from this sub and others, and yet you would like to sit their and pretend it's **me** that's wasting time?  Why should **anyone** indulge any of you with sources when you don't intend to actually look at them?  It's you who wastes my time by asking.  As I said, ""source"" has become a hyperpartisan word that doesn't mean anything any more other than that you are both too lazy to research a topic yourself and that you don't actually intend to change your mind no matter what you see.

And, as for the business record, you can read **OP's own source!**  Seriously, read it and pay close attention to **how** the writer arrives at the conclusion that Fiorina is lying.  He actually got numbers from one of Fiorina's PACs that showed precisely what she was claiming.  But, he chose, arbitrarily (admittedly at one point), to reject the metrics those numbers were based on and pick different dates and times and measurements.  So, Fiorina has one set of measurements she quotes, accurately so, and the fact checker says ""Mmmmm.... nah.  I want to use a different set of numbers you haven't referred to or ever got asked about or had a chance to respond to.  I'm going to use those numbers instead and say you're lying.""  

It amazes me to know end that all of you spout off without actually reading anything.",0,0,1442545596,1444727356
cv68qe5,0,t1_cv5h61q,,[deleted],1,0,1442607187,1444727356
cv6nm2r,0,t1_cv68qe5,DevonWeeks,">I was just looking for more to evaluate.

And you can't Google it?

Okay, we'll start with a good article describing why a lot of this information [is entirely subjective](http://theweek.com/articles/572482/carly-fiorina-really-bad-ceo).

Now, we'll look at a [positive analysis of her record.](http://fusion.net/story/198712/did-carly-fiorina-really-do-a-bad-job-as-ceo/).  

It's also important to note that Fiorina's predecessors and successors were notably less successful at managing the company than she was and that much of the criticism originates from Dell and HP's embedded legacy employees.  

Just for good measure, [here is another fair and objective analysis with commentary from various parties involved with Fiorina during her tenure at HP.  Be sure and read all three pages.](http://news.investors.com/technology/082715-768408-assessing-fiorinas-time-as-hp-chief.htm?ven=djcp&src=aurlabo&p=2%20-#http%3a%2f%2fnews.investors.com%2fNewsAndAnalysis%2fArticle.aspx%3fid%3d768408%26ven%3ddjcp%26src%3daurlabo%26p%3d2).

This is what kills me.  You took all that time to type up your little critique of me... yet you couldn't at any point Google ""Fiorina CEO record""?  This is what makes the whole ""SOURCE!!!"" thing so ludicrous.  It gets down to selective laziness.  Personally, I feel like an OP should post their sources from the get go.  But, they don't.  Instead, they just say whatever they want while anyone disagreeing is pounced on for sources by people who can opine for paragraphs without ever searching the three little words that would find them all the information they could ask for.  It's among the most ridiculous things on the Internet, Reddit especially.",1,0,1442637177,1444727356
cv529hp,0,t1_cv51r1y,CrapNeck5000,He is certainly not the being the most friendly in the world but its hardly as bad as you make it out to be.  There is certainly room for discussion here. ,2,0,1442520086,1444727356
cv51ukv,0,t1_cv51ghk,ClockOfTheLongNow,"He already noted the Washington Post incorrect fact check, and then you tossed it out there anyway.  I get the frustration from him on that one, at least.",0,0,1442519479,1444727356
cv51zky,0,t1_cv51ukv,ZenerDiod,Did you actually click on any of the links? They were about her business record not the planned parenthood correction he claims to have happened without any sources.,2,0,1442519682,1444727356
cv50jr2,0,t1_cv500r5,FlyingFistsOfFury,"Would you please link to that video then?  Because I searched for it and could find no such thing.  The closest thing I could find was a video that claimed to be of someone at Planned Parenthood talking about keeping babies alive to harvest their brains.  I could find no video of such a procedure actually taking place, and Fiorina very clearly said she watched such a video.",3,0,1442517566,1444727356
cv531ye,0,t1_cv50jr2,littlebitsoffluff,"Is this the one? If so, this is an edited version I think:

https://www.youtube.com/watch?v=GWQuZMvcFA8",1,0,1442521291,1444727356
cv57sdq,0,t1_cv531ye,FlyingFistsOfFury,"That looks roughly like it, yeah.  ",1,0,1442528979,1444727356
cv58avt,1,t3_3lc48c,thatnameagain,">She can actually land a punch on Trump due to the social protection of being a women, notice how the audience clapped along when Trump made fun of Rand's looks 10 minutes earlier but thought her response was brilliant.

Donald Trump does not have a history of making men angry by making misandrist comments. Fiorina's response worked because it was a clear but subtle nod to all the other misogynist comments he's made in the spotlight. And being a woman, it's realistic to expect she has at least some insight into how those misogynist comments have been received by other women, which she wouldn't have if she were a man. Social protection had nothing to do with it.",1,0,1442529890,1444727356
cv59d7y,0,t1_cv58avt,ZenerDiod,"Fiorina doesn't seem to have a problem making fun of women's appearance.

http://talkingpointsmemo.com/livewire/barbara-boxer-carly-fiorina-hair-face",1,0,1442531835,1444727356
cv59mxx,0,t1_cv59d7y,thatnameagain,"The fact that she is a hypocrite doesn't mean she enjoyed ""social protection"" when making that comment. ",1,0,1442532343,1444727356
cv59tru,0,t1_cv59mxx,ZenerDiod,"She definitely did, if Rand had a similar response after he was made fun of do you think everyone would be calling him brilliant? People feel bad for women who get made fun of for their looks, and are willing to back them more then they would a man.",1,0,1442532692,1444727356
cv5fa9c,0,t1_cv59tru,thatnameagain,People feel that way because everyone is well aware that women face more pressure on average to tend to their physical appearance. If that is supposed to constitute a social protection then it's one based on rational understanding of an existing double standard. ,1,0,1442542206,1444727356
cv55iju,1,t3_3lc48c,,[deleted],-1,0,1442525130,1444727356
cv5ry7o,0,t1_cv55iju,chitwin,"She was on one of GW Bush's security councils. I think that gives her about as much foreign affairs experience as president Obama had when he was elected. Possibly more. 
",1,0,1442579634,1444727356
