id,is_root,parent_id,author,body,score,score_hidden,created_utc,collected_utc
cvk7wfo,0,t1_cvk7l6r,I_Love_Liberty,">You dont shrink a fire department because there are less fires. They have grown because technology has improved, they can lower the response times and put out fires before they spread or leave a building ruined.

Should we have a fire department on every block? In between every 2 buildings? You'd get faster response times, and fires could be put out very early on. Of course, you'd have to pay a lot more. At what point is it not worth it to have more fire departments? Who decides that, and what in the world makes you believe their primary motivation is to make sure taxpayers aren't spending more money on it than they want? What makes you think they'd get that right even if they wanted to?

>Some countries did nationalise food production 100 years ago. It did go very well, so its now kept private. That being said, the US subsidizes its farmers.

And how's that working out? Now everything corn-related is cheap and plentiful, and half of the people are obese and at risk for developing diabetes.

>I am not talking about regulation in healthcare, I am talking about replacing the current model with a nationally owned model.

And why do you believe a national model would work better than a market system with few/no regulations? Bonus points: don't point to the US as an example of such a system, because it's not. Double bonus points: don't point to anything that happened 100 years ago, because medicine was worse then in all aspects regardless of how it was paid for.

>Like I said, the free market works well for many goods and servies, but does a poor job with others.

Perhaps. Does government do a good enough job with the few places where the market doesn't do very well (very small number of things) to justify the government predictably putting its tentacles in the areas that the market does do well (nearly everything) and gumming them up? I doubt it. If government could possibly be restricted to areas where it actually does better than the market, maybe it wouldn't be a bad deal. But that's not how governments operate. They exist to expand.

>You could not have a privately run fire service

Why not?

>or national defense.

That is undoubtedly more difficult because there's an actual public goods problem there. Is it worth the public goods problem necessarily created by having a government? Maybe not.

>You compare the way healthcare is ran in different countries, and you see public is better than private.

Ya, except there are no reasonable comparisons to be made, because there are no real private systems in advanced countries.",1,0,1443677008,1444722981
cvk85st,0,t1_cvk7wfo,brinz1,"Yet somehow, despite it being a government ran organisation with little opposition for over a century, firefighting departments havent done that.

Obesity is an issue with people eating too much, subsidies were put in place to stop crashes in food production. It worked too well.


I am only talking about the government going into one thing (healthcare) that the market does not do well. I like the free market, I just see where it works and where it doesnt.


The reason why firefighting and street lighting are called public goods is that they only work when everyone has coverage. If one house on the street isnt covered by a fire fighting service, then a fire risks spreading to other houses. Or, in the case of street lighting, everyone benefits from its existence even if they want it or not. Or, sewage systems, where not only is not having it has a serious knock on effect and hazard to your neighbor but the up front installation costs are prohibitive for private investment.


There are are no private systems in advanced countries because they do not work. Failed systems do not stay around for very long, thats why state owned farms dont exist in advanced countries either.",1,0,1443677727,1444722981
cvlbxmw,0,t1_cvk85st,I_Love_Liberty,">Yet somehow, despite it being a government ran organisation with little opposition for over a century, firefighting departments havent done that.

They have consistently expanded their budgets and responsibilities over the years, as I mentioned, despite need for their services going down and despite there being perfectly good alternatives to their services (sprinklers) that would be far more common if firefighting were a market service. Instead we pay higher local taxes everywhere, because politicians and bureaucrats don't have the interests of the people as their highest priority.

>Obesity is an issue with people eating too much

Different foods affect how much food you want to eat, and corn happens to be one that makes you want to overeat. Whether the bureaucrats could have known when the programs started is not relevant. We know it today, but the subsidies won't be going away because that's not how government works. Instead, we'll get more government spending directed toward patching up problems caused by those programs. That's how government works.

>subsidies were put in place to stop crashes in food production.

And how do you know that? Were you there when the politicians implemented those programs, scanning their brains to make sure you had an accurate reading of their thoughts and motivations?

>I am only talking about the government going into one thing (healthcare) that the market does not do well.

Except your only examples of the free market not doing well in health care are the US system, which is about as far from a free market as you can get, and 100 years ago, when everything sucked in comparison to today because everyone was vastly poorer and technology was comparatively primitive.

>I like the free market, I just see where it works and where it doesnt.

No, you see where politicians have invited themselves to intrude into the market and concluded they must have 1) been smart enough to know they could actually make it better with their policies and 2) cared seriously about whether they were making it better, rather than following ideology or worse.

>The reason why firefighting and street lighting are called public goods is that they only work when everyone has coverage.

Firefighting isn't a very good example of a public good, because the externalities can easily be handled privately. Street lighting is only a public good on public streets. On private streets, the street owner can restrict who can be around to use the lights, so it's not a public good.

> If one house on the street isnt covered by a fire fighting service, then a fire risks spreading to other houses.

Which is well known and can easily be handled privately. See, if your house doesn't have fire protection, the values of the houses surrounding your house go down. That ends up making the value of your house go down. And it's quite possible for private agreements to be made which require all houses in some neighborhood to be protected. It's not a big problem today because we're rich enough to actually be able to afford decent fire protection.

>Or, sewage systems, where not only is not having it has a serious knock on effect and hazard to your neighbor but the up front installation costs are prohibitive for private investment.

If private investment can fund skyscrapers, I think it can fund sewage systems.

>There are are no private systems in advanced countries because they do not work.

How do you know they don't work?

>Failed systems do not stay around for very long,

So every system that doesn't exist is a failed system? In the year 1775, would you have concluded modern democracy was a failed system because it didn't exist?

In some markets, the incentives and conditions are such that the people who privately benefit the most from some policy have an easy time convincing other relevant people to go along with the system. It's easy enough for doctors and insurance companies and hospitals to convince well-meaning stooges that their industries should be heavily regulated, and it's quite obviously been hugely beneficial for the people currently succeeding in those industries to have them regulated. So it happens. In some industries it's harder to make that argument, and in others there aren't as many benefits to making it.

>thats why state owned farms dont exist in advanced countries either.

State owned farms don't exist because they don't benefit the people in charge of deciding whether there should be state owned farms enough to persuade them to make state owned farms exist. That's it.",1,0,1443756467,1444722981
cvlj45d,0,t1_cvlbxmw,brinz1,"http://www.economicsonline.co.uk/Market_failures/Price_stabilisation.html

Here is a brief lecture of Price Stablisation. Before the 1940s, it was common to go through periods of price booms and busts that caused famines. The look up Americas own Farming crisis in the 1920s.

Hell, [here](http://www.economicsonline.co.uk/Market_failures/Introduction_to_market_failures.html) is a list of all the times the price mechanism does not work

Your ideas on private firefighting still result in a private company enforcing a contractual requirement that everyone buys fire protection. How is that different from the government doing that.


>In the year 1775, would you have concluded modern democracy was a failed system because it didn't exist?


You are aware that the American Government is actually not that old a democracy. It was almost completely based off pre-existing governments in england, at the state level at least. 

The Private system of healthcare has failed, even now there are countries with zero government provisions from healthcare and it leaves most of the poorer sections of the population with zero coverage",1,0,1443782540,1444722981
cvn5ywp,0,t1_cvlj45d,I_Love_Liberty,">Here is a brief lecture of Price Stablisation. Before the 1940s, it was common to go through periods of price booms and busts that caused famines.

Given that your own link explains the serious downsides to governments attempting to set prices, I don't feel any need to point them out to you. The one I will mention is that they prevent entrepreneurs from coming up with innovative market mechanisms to take care of the problem.

>Carbon emissions

Pollution is fundamentally a dispute between the polluter and the person who doesn't want the polluter to be polluting. Governments have forcibly made themselves final arbiter of disputes. They have routinely sided with polluters since, oh, 1830. How could you expect the market to take care of pollution if government is in charge of enforcing property rights?

>Road congestion

Uh...roads are built and managed by governments. What does that have to do with a market failure? They're solely a government failure.

>Healthcare provision

This assumes the costs and benefits of health care can't be greatly privatized through freedom of association. Which they can be. The market works quite fine here.

>Unstable primary markets

No one said markets are perfect. The question is if the intervention is likely to make the world better overall. It isn't.

>Your ideas on private firefighting still result in a private company enforcing a contractual requirement that everyone buys fire protection.

No, it would be the other homeowners enforcing the contractual requirement.

>How is that different from the government doing that.

How is having homeowners decide the level of fire protection different from having government officials decide the level of fire protection?

>You are aware that the American Government is actually not that old a democracy. It was almost completely based off pre-existing governments in england, at the state level at least. 

Which of them elected the chief executive? Whatever you want to call it, the current American system of government didn't exist until 1789. Prior to that, if someone proposed the current American system of government to you, would you have called it a failure because it didn't exist?

>even now there are countries with zero government provisions from healthcare and it leaves most of the poorer sections of the population with zero coverage

Oh? Which are you referring to?",1,0,1443909974,1444722981
cvngbma,0,t1_cvn5ywp,brinz1,"most of the world doesnt have private insurance and now deals with this.

America is a good example. There is zero economic incentive to cover conditions that are chronic, long term and pre existing. The free market also has no issue  with letting people who cannot afford the prices die",1,0,1443930446,1444722981
cvnihq1,0,t1_cvngbma,I_Love_Liberty,">America is a good example.

Of what?

>There is zero economic incentive to cover conditions that are chronic, long term and pre existing.

You know chronic means long term, right? You're right, health insurance companies don't have an incentive to take on new individual customers with pre-existing conditions and pay for their health care. What those people are looking for, if their can't afford their health care, is charity, not a for-profit business.

>The free market also has no issue with letting people who cannot afford the prices die

Neither do you, unless you're currently out there donating 100% of your time and effort to stopping people from dying.",1,0,1443935527,1444722981
cvnim77,0,t1_cvnihq1,brinz1,"America is an example of a country whose poor are not able to afford healthcare and are left to suffer.

This is the difference between private and public systems. If you are too poor to afford the healthcare premiums, or you have a condition that makes your coverage non-profitable, the private system will leave you to die.

Most Western countries find such a concept as letting people die like this barbaric and primitive. The Public Healthcare system means you do not have to worry about the cost of a medicine when you are sick.",1,0,1443935853,1444722981
cvnv04y,0,t1_cvnim77,I_Love_Liberty,">America is an example of a country whose poor are not able to afford healthcare and are left to suffer.

America is also an example of a country where there are strict government controls on who can provide medical care, what medical equipment can be used, who can open a medical facility, who can offer health insurance, and so on. That raises the price drastically, and slows down innovation drastically, which means poor people have to rely on other people to pay for care that they could otherwise afford. The quality of care they would elect to pay for would probably have originally been lower than the mandated limit, but would have been at a price they could afford, and that quality would have increased rapidly beyond the minimum, had the market been allowed to operate.

>If you are too poor to afford the healthcare premiums, or you have a condition that makes your coverage non-profitable, the private system will leave you to die.

Like I explained to you earlier, every system, no matter how many resources it pours into health care, is going to have to make choices about who receives some of those resources and who doesn't. That is not in and of itself a criticism of any health care system. If you believe the free market will let more people die than you find acceptable, then make that case. Every system has to let some people die. There aren't enough resources in the world to change that.

>Most Western countries find such a concept as letting people die like this barbaric and primitive.

Most people don't understand that every system has to make choices like that because resources are limited.

>The Public Healthcare system means you do not have to worry about the cost of a medicine when you are sick.

Of course you do. You just lack any ability to do anything about it. If medicine is too expensive, rationing will occur.",1,0,1443974701,1444722981
cvnvaa0,0,t1_cvnv04y,brinz1,"actually, most countries do it very well, it is unheard of in the UK to die of something because you cannot afford the medication. People do not die due to a lack of dialyses, or from a disease that was diagnosed but medication was too expensive.

The NHS works so much better than medicare and medicare and the rest of America's medical system despite costing a fraction per capita. By America think-tanks own [evaluations ](http://www.economist.com/blogs/economist-explains/2014/06/economist-explains-16)

http://www.theguardian.com/news/datablog/2010/mar/22/us-healthcare-bill-rest-of-world-obama",1,0,1443975203,1444722981
cvnxtq4,0,t1_cvnvaa0,I_Love_Liberty,">People do not die due to a lack of dialyses, or from a disease that was diagnosed but medication was too expensive.

You're saying the NHS will pay any amount of money for any medication or any kind of procedure that might even conceivably keep the patient alive for another couple of minutes?

>The NHS works so much better than medicare and medicare and the rest of America's medical system despite costing a fraction per capita.

Why in the world would you think comparing the NHS to medicare or medicaid says anything at all about the free market?

Why are you still talking about the American health care system, when you're supposed to be providing me with examples of free market health care systems that have failed?",1,0,1443979085,1444722981
cvo3swf,0,t1_cvnxtq4,brinz1,"Fine,  a fully free market health care system the way you describe, does not and has never existed. Like the Fully communist system or anarcho-capitalist one.  You can look at every partial model and claim it wasnt free market enough, but in the end, none of them work.

NHS does budget, it takes predictions on health and future population and it effectively does that. The National Institute for Health and Care Excellence does a fairly good job making very difficult decisions. Like I said, it is unimaginable in england someone would have a treatable cancer or illness and would die from it without treatment. Unlike in the USA.",1,0,1443988041,1444722981
cvogeb1,0,t1_cvo3swf,I_Love_Liberty,">Fine, a fully free market health care system the way you describe, does not and has never existed.

I'd be fine with a market that's as free as, say, the electronics market is in the US. I'm certainly not going to accept a market that's likely in the top three most heavily regulated markets by a government that spends 4 trillion dollars annually.

>NHS does budget,

Ah, OK, so then costs do matter. Thank you for admitting that.

> The National Institute for Health and Care Excellence does a fairly good job making very difficult decisions.

That's fine that you think so. My point is that they do indeed need to make difficult decisions. The market does as well. Your criticism of the market was *not* that it makes those decisions worse than the NHS, but the very fact that it makes those decisions. I believe you called the very act of making those decisions ""barbaric and primitive"".

>Like I said, it is unimaginable in england someone would have a treatable cancer or illness and would die from it without treatment. 

Whether something is treatable or not is affected by the amount of money that will be thrown at it, and as you admit, the NHS must budget its money. Therefore, people will die, despite having diseases that could be treated if twice as much money were poured into that person's case, or 4 times as much money, or 100 times as much money. If the NHS were to spend that extra money on that one person, they'd have less to treat others, and so may end up with fewer people saved overall. So it's not unimaginable. It happens every day.",1,0,1444008634,1444722981
cvonn1f,0,t1_cvogeb1,brinz1,"The whole english system is designed around helping as many people and prolonging their lives as much as possible. Thats the primary goal and incentive of the NICHE. 

The american system is built around who can pay for what.
",1,0,1444023121,1444722981
cvonx4o,0,t1_cvonn1f,I_Love_Liberty,">The whole english system is designed around helping as many people and prolonging their lives as much as possible. Thats the primary goal and incentive of the NICHE. 

OK, and what is the evidence that it's actually more successful at achieving that goal than a free market based system would be? You don't seem to address that question.

>The american system is built around who can pay for what.

The american system is really based around funneling enormous amounts of money into the hands of established and therefore powerful interests. Anyway, do you understand that not every single health care system where receiving health care depends on your ability to pay for it is identical to the american system? Why are we still even talking about the american system, when we both agree it's terrible?",1,0,1444023931,1444722981
cvoo2t5,0,t1_cvonx4o,brinz1,"> OK, and what is the evidence that it's actually more successful at achieving that goal than a free market based system would be? 

Every time I bring up how much better National systems are you claim its because there are no free market systems out there.

A free market system, is built around who can pay for what. If someone can not afford treatment in the free market, they are left to die. This is particularly galling when many serious diseases will take away a persons ability to work and therefore afford treatment.

A health insurer will by directed by the free market to ensure its profit margins are as high as possible. As a result they will always move to avoid insuring those with such conditions who need it the most.


> The american system is really based around funneling enormous amounts of money into the hands of established and therefore powerful interests

This is what happens when you try to have a free market in an area such as healthcare, where demand is extremely inelastic and there are very high barriers to entry for competitors, leaving practical monopolies. ",1,0,1444024389,1444722981
cvp1fv8,0,t1_cvoo2t5,I_Love_Liberty,">Every time I bring up how much better National systems are you claim its because there are no free market systems out there.

You keep claiming it's better, and I keep asking what it's better than. You point to the american system, but virtually no one is holding the american system up as an example of a good system, so why bother making that comparison?

>A free market system, is built around who can pay for what.

Yes, it is.

>If someone can not afford treatment in the free market, they are left to die.

This is true. What you fail to understand is that intentions aren't results. It is perfectly possible for a system specifically intended to help as many people as possible to do worse than a system intended to treat those who can pay. Intentions are not results.

>This is particularly galling when many serious diseases will take away a persons ability to work and therefore afford treatment.

That's what insurance is for.

>As a result they will always move to avoid insuring those with such conditions who need it the most.

You're absolutely right. Insurance companies take on your future *unexpected* costs in exchange for upfront payment. It's unknown whether those costs will actually occur for any given individual, so the insurance company charges you less for premiums than you'd have to pay for those costs if they occurred and you didn't have insurance. If you're already suffering from some disease, then the insurance company knows they're definitely going to have to pay for it if they take you on. Their only viable option, in a free market, is to charge you even more than it would cost you to pay for that treatment on your own. It's just not a situation where insurance is a good solution. Insurance works when costs are unexpected. If you already have the disease, you're not looking for insurance. You're looking for charity.

>This is what happens when you try to have a free market in an area such as healthcare, where demand is extremely inelastic and there are very high barriers to entry for competitors, leaving practical monopolies. 

What are these ""high barriers to entry""?",1,0,1444062667,1444722981
cvp3tlc,0,t1_cvp1fv8,brinz1,"Medecine and healthcare have obviously high barriers to entry, drugs require years of investment and research. Hospitals require a lot of equipment, plus there isnt exactly loads of trained doctors, nurses and technicians who can be hired at a moments notice. These are called barriers to entry.

These cause a relative monoply. If you are sick, and a hospital gives you a bill to get better, you can not negotiate, there will not be many competing hospitals or medicines to try. You have the choice to pay or suffer.


Of course, there are very strict regulations as well on who can set up a hospital or sell medicine. No one wants to go back to the time of poorly regulated medicine. That is how you get frauds and people dying.


Now, as you as said, there will be a percentage of people who cannot afford their insurance or medicine. Its a guarantee people will not be able to afford it.

Also, there will be long conditions that insurance will refuse to cover. Before the ACA, this list for many firms was nearly a thousand lines long. A bad illness could guarantee you would never  be able to get affordable insurance again if it had long term effects. A  condition you were born with, would be a death sentence for poorer children or would  preclude them from insurance for life.

What you are left with is a portion of your society who are one bad fall or sickness from abject poverty. Now the free market sees no problem with people living like this, but most of the civilized world sees it as barbaric. Even you try to justify it with charity, but that does not work very well in the long term. Especially when it is such a buyers market for medicine.",1,0,1444066229,1444722981
