id,is_root,parent_id,author,body,score,score_hidden,created_utc,collected_utc
cuy8zih,0,t1_cuy8o7b,kingvitaman,"Ha. Did you realize I put the term ""Troofer"" in the title of this post? I am by no means a truther ( doubling down on the strawman I see), but I""ll still wait to see how you say I have a disregard for the facts by quoting Cheney who spoke about the connection between Iraq and 911 ( by speaking out on more than one occasion about the meeting between Atta and senior Iraqi intelligence officials in Prague) . If this is the point of contention, or if you don't think that Cheney said this, or that it is somehow taken out of context then I'd be interested in seeing what you have to say.  I don't believe in any conspiracy regarding that Bush brought down the towers, however I do believe the 911 was a catalyst and used as leverage in order to achieve goals unrelated to 911 ( invasion of Iraq).  ",0,0,1441999713,1444730134
cuy3rt7,1,t3_3kiyui,iliveintexas,"I don't subscribe to any of the ""9/11 Truther"" conspiracy, other than I do suspect the U.S. Government (either Clinton or Bush, Jr.) had several prior hints as to an attack but Bush chose to cover it up afterwards to not appear incompetent.

Of course, hindsight is always 20/20.

But, to be clear, I in no way believe that Bush ""let 9/11 happen."" That would be political suicide for the Republican Party.",2,0,1441991489,1444730134
cuyczx8,1,t3_3kiyui,RationalRattachist,"911 conspiracy theories don't make sense to me because of the Iraq war. If 911 was a conspiracy, Bush would have blamed it on Saddam Hussein, as well as Bin Laden. ",1,0,1442006199,1444730134
cuye52b,0,t1_cuyczx8,kingvitaman,They did partially blame it on Saddam. ,0,0,1442008163,1444730134
cuygtac,0,t1_cuye52b,RationalRattachist,They openly admitted that he wasn't responsible for 911. That was just a campaign of misinformation. If it was an actual conspiracy the Iraq war would have been justified solely on the basis that Saddam was responsible for 911.,2,0,1442013152,1444730134
cuynn3u,1,t3_3kiyui,DannyXopher,"I believe the official account. 

Did the U.S. ""let"" it happen? Not directly. I think the U.S. said ""If something happens, then so be it."" I do believe that the government knows an attack is a galvanizing event, so they have may have done less to prevent one. I don't think they were aware of the WTC details. 

Once you get into the controlled demo conspiracies, you go down a stupid rabbit hole. I have not seen one piece of remotely convincing evidence for this. Not to mention the fact that such a monumental government conspiracy could remain secret so long, especially in the Snowden era. ",1,0,1442027349,1444730134
cuxs55s,1,t3_3kiyui,SuffragetteCinci,"Possibly, but for me that is a rabbit hole not worth going down.",1,0,1441969086,1444730134
cuy52ie,1,t3_3kiyui,Synux,I have never seen a reasonable explanation for the collapse of WTC 7.,-1,0,1441993471,1444730138
