id,is_root,parent_id,author,body,score,score_hidden,created_utc,collected_utc
cv9cw9j,1,t3_3lty3f,takingitlikeachamp,"This question has some big assumptions attached.

Free Trade:

I think there is a difference between someone who says we should not have free trade, and someone who says they do not like current trade agreements. You phrase it as though Sanders is saying we should not trade with other countries. That is not his position. He appears to be sensitive to issues of human rights, currency manipulation, and the integrity of our trade partners. I don't necessarily see that as a bad thing. He did put legislation years back professing what he would want to see in trade agreements related to human rights, so he isn't just speaking platitudes about what it would take to get him to sign off.
  
http://www.ontheissues.org/2016/Bernie_Sanders_Free_Trade.htm
  
Nuclear Power:
   
I could not find anything specifically on Nuclear Power, other than some statements he made about subsidies for the Nuclear Power industry. It doesn't ""bother"" me, if he is against subsidies to the nuclear power industry. If we are talking about public research into nuclear power techniques, than I'm all for it. If we are talking about public support to public nuclear power plants, I'm for it. If we are talking about specific subsidies to private nuclear power plants, I'm not sure why we do that. This doesn't appear to be a major issue for him.
  
Anti-GMO:
  
I'm not well read enough on GMOs to know all the politics about the industry and its practices. The idea of GMO foods does not scare me. I know he was on a food labeling kick. It seems like a stupid campaign. However, this is not one of his platform issues. He isn't going around giving campaign speeches about GMOs. You have to dig pretty far into the issues to pull this out and ask whether I'd pause my support for him because of it.
  
Anti-gun:
  
Full stop. The only way you are ""anti-gun"", is if you do not want them to be legal. It's all in the phrasing. He wants gun control. That isn't anti-gun. It's anti-""do anything you want with any gun, anytime, anywhere"".
  
http://www.ontheissues.org/Bernie_Sanders.htm#Gun_Control
  
He has made statements that do not make me think he wants to make all guns illegal. The guy voted against the Brady bill because he thought states could determine laws around handgun waiting periods. That doesn't sound like he wants to ban all guns.",2,0,1442864726,1444726007
cv9hrrj,1,t3_3lty3f,MysticSnowman,"I used to support Bernie, but once I found out about these issues I stopped supporting him. I'm not really that pro-gun, but an assault weapon ban is stupid.",3,0,1442872239,1444726007
cv9jzeq,0,t1_cv9hrrj,I-HATE-REDDITORS,Have you found another candidate who you agree with more?,2,0,1442875933,1444726007
cv9lxi4,0,t1_cv9jzeq,MysticSnowman,"Not really. I liked him initially because he was interesting, authentic, and looked like he really cared about things. I'm not near as left-wing as he is on fiscal issues though. For example, I think we should give the minimum wage a modest raise to around $8.50, tie it to inflation, and expand the EITC to help lower income earners. I think a $15 federal minimum wage would be disastrous for lower-income employment. Certain economic issues and the issues mentioned previously led me to eventually stop supporting him.

I like Rand Paul but he seems to be pandering to the GOP voter base lately. I'll probably inevitably support Hillary.",0,0,1442879289,1444726007
cv98kq1,1,t3_3lty3f,Risk_Neutral,Can't be more anti-free trade than a 50 basis point transaction tax. ,0,0,1442858191,1444726007
cva267e,0,t1_cv98kq1,Kelsig,"Free enterprise, not free trade",1,0,1442920755,1444726007
cv9d7yx,0,t1_cv98kq1,scithion,How is that opposed to free trade?,2,0,1442865211,1444726007
cv9da49,0,t1_cv9d7yx,Risk_Neutral,How isn't it?,-1,0,1442865300,1444726007
cv9dc1n,0,t1_cv9da49,scithion,"I'm not saying it isn't, I'm just asking how it is.",3,0,1442865380,1444726007
cv9df1x,0,t1_cv9dc1n,Risk_Neutral,"It distorts trade as the policy itself affects the decision to trade. 

https://en.wikipedia.org/wiki/Free_trade",-1,0,1442865506,1444726007
cv9dtf7,0,t1_cv9df1x,scithion,">Free trade is a policy followed by some international markets in which countries' governments do not restrict imports from, or exports to, other countries. 

Is Sanders' tax applied along national lines?",4,0,1442866113,1444726007
cv9dxgt,0,t1_cv9dtf7,Risk_Neutral,Alright you're right. Though it does give you an idea of how ridiculous his tax proposals could be. ,-4,0,1442866284,1444726007
cv9dif4,0,t1_cv98kq1,kevinbaconjames,"free trade, not free trading. Two different issues.",7,0,1442865646,1444726007
cv9o7ub,1,t3_3lty3f,bluehands,"I think you have touched on a larger theme: how do you choose a candidate?

You shouldn't agree with completely with a candidate. If you do then he or she is almost certainly pandering to you.

Perhaps most importantly, I think he is focusing on the real issues. I think he should be pro-nuclear but income inequality is a much more important. GMO labelling is lame but healthcare for all is truly important.

I think one of the tragedies of our modern political system is that too many people will vote on their personal wedge issue, pro-life or pro-choice, and ignore the rest.",1,0,1442883178,1444726007
cv9svge,1,t3_3lty3f,warmwaterpenguin,No yes yes no.,1,0,1442890822,1444726011
cv9ud2n,1,t3_3lty3f,cornelius2008,"I'm huge on nuclear power,  think it could literally save and transform the world if embraced, so no candidate is really going to have my level of zeal for the adoption of the technology so him coming up short there is expected. 

Not committed to my candidate but he's in the running. ",1,0,1442893532,1444726011
cv9ud9j,1,t3_3lty3f,Loco970,I'm not fond of his stance on nuclear power or guns. Nuclear power (when safety prevails) is clearly a better option for the environment short term. And he only wants to take guns away from blacks because of 'black culture' ,1,0,1442893542,1444726011
cva0t5v,1,t3_3lty3f,skelly6,I'm old enough to know that no candidate will line up with my views 100%. Some issues matter more than others and Bernie is right about the stuff I care about the most.,1,0,1442914905,1444726011
cva2x7g,1,t3_3lty3f,Aristox,"NAFTA absolutely fucked Mexico, as well as a number of other southern american countries. Just wrecked their economies. And the US gov knew it was going to do that but went ahead with it anyway. The fact that he opposes it is absolutely something I like.

There's a big difference between free trade as a concept, and the oligopolistic machinations of big governments. Neither NAFTA nor TTIP actually support Free Trade. Just because North Korea calls itself Democratic doesn't mean it actually is. And just because the FT in NAFTA stands for Free Trade doesn't mean it isn't a propagandistic piece of bullshit. Those treaties *oppose* free trade by consolidating oligopolies.

I haven't seen anything which makes me think he's anti-gun. I'm very pro nuclear, although obviously renewables are preferable. But if he came out against nuclear it wouldnt come close to being a primary of even secondary issue for me.

GMO I couldn't care less about.",1,0,1442923225,1444726016
cvcqjzt,1,t3_3lty3f,adamwho,"Since this is about the 10th thread on this issue.

1. Labeling is an attempt to ban GM products, it is not to educate. Many anti-GMO activists state this explicitly. http://files.vkk.me/images/44218639cd7ad0c686050a38c3913bed2c7caf3a.png

2. The decades old scientific consensus is that there is no difference in health or safety between GM and non-GM crops. http://i.imgur.com/Dj0MLX1.jpg

3. 'Non-GMO' and 'USDA Organic' labels already exist. 

4. There is no compelling reason to mandate a 'life-style label'. Consider religious groups mandating all non-halal or non-kosher foods be labeled instead of the other way around.

5. Given there is no compelling scientific reason for a mandatory label, such laws run afoul (ironically) of free speech. This is the primary reason the law will be struck down in court. 

6. Labeling laws (as stated so far) would cause serious logistical issues, because it would require completely separate handling and storage of different varietals, a chain of custody would be required from farmer to processing plant. A state passing such a law would be in effect legislating across state boundaries and be struck down under the commerce clause. This is a secondary reason the law it will be struck down in court.

7. Adding to the expense of food with no compelling reason is dumb. You don't see anti-GMO activists trying to label mutagentic hybrids or pesticide use, why do you think that is? Hint, because organic producers use both. 

8. There is no well defined definition of what constitutes a GMO. Everything from artificial selection to transgentics are genetically modified in one sense and only activists seem to confuse Genetically Engineered with Genetically modified. This is another reason the law will be struck down in court. 

9. Most GM crops are animal feed or are processed to the point that there is nothing ""GM"" about the product. Maybe you can point to the ""GM"" part of a sugar molecule. How can such a thing be meaningfully labeled or enforced? This is another reason the law will be struck down in court.

***

Sanders panders to anti-science activists.",1,0,1443113939,1444726016
cv9hefp,1,t3_3lty3f,Nonsanguinity,"I really don't have a problem with any of these positions - at least they're not deal-breakers for me.  Sanders is the first politician I have ever heard that is talking about the issues that I care about - inequality, caring for the poor as a moral imperative - these are deeply reflected in my own values and it's incredible to see that reflected by even a single (US) politician.  And I agree with him as far as legalization, abolishing private prisons, regulations on speculative finance, equal pay, addressing blue on black violence, and marriage/family equality for lgbt.

I'm fine with his stance on free trade - I think free trade is predicated on outdated assumptions and its supporters focus too single mindedly on efficiencies that really only benefit a very small class of people. Finance and commerce have moved beyond the assumptions that validate free trade as unassailable. 

And I'm fine with a gun control stance - I don't really believe the 2nd Amendment confers an individual right to own firearms (yes, I know the current interpretation by SCOTUS does, I can recognize that and have a different desired outcome), so limit away.

For GMO, if manufacturers of bottled water can go out of their way to label their water as ""gluten free"" then it's probably not so onerous to label things as containing GMOs.  If people want it, and it's not harming anyone and there's relatively low costs associated with it, I don't have a problem with it.

For nuclear, I'm fine if we don't publicly fund it but not oppose private expansion, so long as we keep it tightly regulated.",1,0,1442871642,1444726019
cv9l0k3,1,t3_3lty3f,allmilhouse,He's no more anti-gun than any other democrat. ,1,0,1442877707,1444726019
cv9r6xs,0,t1_cv9l0k3,Shotgun_Sentinel,Many Blue dog democrats aren't anti-gun at all.,3,0,1442888021,1444726019
cv9n92y,1,t3_3lty3f,javi404,"What is his position on nuclear power? That is pretty much the only thing I care about. Pretty sure rural vermont has many 2nd amendment supporters and they vote for him there.

I also agree with him on TTIP if that is his position since only the rich wall street cxxk suckers benefit from it.",1,0,1442881577,1444726019
cv9ewqb,1,t3_3lty3f,Chubbybrownbear,"Sanders is not anti-GMO. He simply believes that GMO products should be labeled. I see nothing wrong with informing consumers what they're actually purchasing.

Free-trade works only when both sides are playing by the same rules. We can't fairly compete with countries that don't have the same labor and environmental laws as we do. This costs us jobs, increased unemployment, and increased dependency on social welfare programs. There is a reason to have conditions on free-trade, and Bernie Sanders shares this view. In theory feed creed is beneficial for all parties involved, and practice it has actually hurt us in many different areas more than it has helped. 

 ",2,0,1442867763,1444726019
cv9foxc,0,t1_cv9ewqb,dtiftw,"The groups pushing for GMO labeling are anti-science. If he's going to sign up with their goals, it's reasonable to consider why.",5,0,1442868943,1444726019
cv9itjy,0,t1_cv9foxc,,[removed],-1,0,1442873970,1444726019
cv9j92b,0,t1_cv9itjy,dtiftw,The Organic Consumers Association is one of the leaders. They willingly use Joseph Mercola when it suits them. That's anti-science.,0,0,1442874692,1444726019
cv9ks6u,0,t1_cv9foxc,Chubbybrownbear,"Russia, Australia, New Zealand, Hungary, France, Spain, U.K., Sweden, Italy, Denmark, China, and India all require GMO products to be labeled. The people that want them labeled are not anti-science fanatics. Labeling is not banning or preventing the use of these crops. If it was then I could understand your argument",0,0,1442877305,1444726019
cva51b9,0,t1_cv9ks6u,dtiftw,"They label GMOs for protectionist reasons, not scientific ones. 

Just because other politicians give in to something doesn't make it a good idea. ",2,0,1442928503,1444726019
cva6uoa,0,t1_cva51b9,Chubbybrownbear,"The reasons are numerous. Some want more regulation because they are worried that non-GMO crops could easily become extinct and the only way to grow certain foods would be to pay a corporation that own the patent on a particular seed in order to grow a specific crop.

Others are worried about the environmental impact of certain genetically engineered crops that have been designed to eliminate particular diseases that may play an important part in regional ecosystems.

The vast majority of the industrialized world believe regulating GMO crops is important and for valid scientific and financial reasons.",0,0,1442931994,1444726019
cva7bkb,0,t1_cva6uoa,dtiftw,"None of the reasons you just mentioned are unique to GMOs. 

It's this line of thinking that is why so much opposition is unfounded. It ignores the reality of all modern agriculture and instead chooses a convenient scapegoat. 

Your first point, for example. Non-GMOs are patented as well. If a nation was worried about that, singling out GMOs is a particularly dumb way to articulate their concern. It's like singling out Ford because you have a problem with the auto industry. It's misguided at best.",3,0,1442932782,1444726019
cv9954f,1,t3_3lty3f,prinzplagueorange,"Ahhh yes, those great objective ""scientists,"" the economists.  See [this article in the WSJ](http://www.wsj.com/articles/SB10001424052970203436904577148940410667970)  An excerpt:
""Many economists serve as consultants to companies, governments and other groups outside of their formal academic work. Critics both inside and outside the profession have argued those relationships—often lucrative and sometimes undisclosed—may have influenced economists' work, leading them first to miss signs of the impending crisis and then to recommend policy prescriptions that served their clients' interests, at the expense of the economy as a whole. [....]  George DeMartino, a University of Denver professor who headed the panel, has argued for the adoption of an even broader 'economists' oath' that would address questions like the ethics of advising dictators and the responsibility of economists to stand up for the poor. University of Illinois Prof. Deirdre McCloskey told the group that economists too often have acted like lawyers, standing up for a certain point of view regardless of the evidence."" ",-5,0,1442859065,1444726019
cv99m3x,0,t1_cv9954f,Lambchops_Legion,"Yes, [all those pesky expert economists who oppose free trade](http://www.igmchicago.org/igm-economic-experts-panel/poll-results?SurveyID=SV_0dfr9yjnDcLh17m)

The reason people hate economists is that they refuse to bow to normative statements such as ""the responsibility of economists to stand up for the poor.""",5,0,1442859783,1444726019
cv9b3hk,0,t1_cv99m3x,TheSonofLiberty,"If no one stands up for the poor, then you get Lenin, Mao, French Revolution, etc. Our society is slightly more protected from this via benefits or ""entitlements"" depending on your point of view.

I don't ""hate"" economists, but it is important to see that their solutions to economic problems (e.g. free trade) heavily benefit a certain class of individuals, while at best marginally benefiting the rest of the country (e.g. slightly lower prices on consumer goods), while possibly greatly impacting some sectors of the job market, leading to outsourcing, etc. ",2,0,1442862039,1444726019
cv9dnqd,0,t1_cv9b3hk,Lambchops_Legion,"> If no one stands up for the poor, then you get Lenin, Mao, French Revolution, etc.

Susan Strange, renowned political economist, argued in her book ""The Retreat of the State"" that in a new globalized world, you can't turn to history to predict future political economic events. We live in a world where cooperation between states is much more incentivized than ever before in history.

Also, I resent your implication that economists don't stand up for the poor because that means you have no fucking idea conclusions experts in the field have come up with, and are actively willing to dismiss all evidence that are contrarian to your priors.

>it is important to see that their solutions to economic problems (e.g. free trade) heavily benefit a certain class of individuals, while **at best marginally benefiting** the rest of the country (e.g. slightly lower prices on consumer goods), while possibly greatly impacting some sectors of the job market, leading to outsourcing, etc

No more like the benefit of lowered prices and higher wages outweights the **short term** negative of driven down wages for low-skilled workers, but that those wages are higher in the **long term**. But why believe positive analysis and the data when you can so arrogantly believe in your preconceived notions.",0,0,1442865873,1444726019
cv9ftcl,0,t1_cv9dnqd,TheSonofLiberty,">you can't turn to history to predict future political economic events.

Interesting argument.  I should read the book.  However, it seems pretty clear that Sanders is the 21st century (less-socialist) version of Eugene Debs.  And, indeed, I would argue that if our system basically stays the same in the 22nd century, we will have another Debs, Sanders, etc. 

>We live in a world where cooperation between states is much more incentivized than every before in history.

""Cooperation between states"" says absolutely nothing about the class aspects of each state that is supposed to be cooperating.  In fact, this should be more aptly named ""cooperation between the elites of states,"" meaning that it isn't the average American that is somehow cooperating with someone in China, it means that the average *capitalist* is cooperating with another Chinese capitalist.  At best, for the average American, cooperation means a consumer buys a T-shirt made by a Chinese guy making $2 an hour while the American company profits and the Chinese manufacturing company profits.  That is good cooperation for some people, but not for others.  How does having a globalized world somehow remove class agitations between a countries capitalist class and the labor class?

>economists don't stand up for the poor because that means you have no fucking idea conclusions experts in the field have come up with

Okay mate, you're right that I don't know every single conclusion by every single economics professor.  But in reality, those conclusions (I'll run with the premise that they are all beneficial toward the working class) have absolutely zero meaning if those policies are *never implemented*.  What I see in most Western countries (e.g. US, UK, Aus) are neoliberal economics that mostly benefit the elite classes while giving some marginal benefits (better benefits in UK and Aus compared to US) that help the ""pressure pot"" so to speak of class agitations.  But we must admit that in each of those countries capitalists wield enormous power in politics, education, media, etc. 

>are actively willing to dismiss all evidence that are contrarian to your priors.

Really? I don't believe we've had a discussion before.  How can you say this if we have not even discussed any papers in the first place?  You would be right if you said I was skeptical and my reasons for being skeptical lie in the phenomena that most wealth increases in the US go to a certain class of people that just happen to be the richest class.  And how does their wealth continue to grow if not for policies that politicians implement *that are recommended by economists* advising them?

>but that those wages are higher in the long term.

Higher for whom?  Upper middle class and the wealthy class? Sure.  Middle class and lower? I can't agree with that.  The argument against mine is that there have been increases in benefits, but certainly not wages, and it is arguable that these increased benefits are mostly going to certain sectors that can afford them (e.g. tech, Si Valley, etc.) and remain the same in other sectors (service sector).

> preconceived notions.

Please. My opinions are based on the realities that I have noticed throughout my life.  Just one [example](http://www.pewresearch.org/fact-tank/2014/10/09/for-most-workers-real-wages-have-barely-budged-for-decades/).  
",6,0,1442869135,1444726019
cv9bhsf,0,t1_cv9b3hk,ZenerDiod,Outsources hasn't been show to increase unemployment in the long term. ,1,0,1442862647,1444726019
cv9fzwy,0,t1_cv9bhsf,TheSonofLiberty,"You might be right, but a large portion of newly created jobs are [lower wage](http://www.jsonline.com/business/help-wanted-most-us-job-openings-are-for-low-skill-low-pay-workers-b99460445z1-298692631.html)). So, assuming that your assertion is correct, unemployment will not be increased, but the worker will be taking a massive pay cut if they go from the average manufactoring wage of ~$20 to ~$10 for a job at the mall, possibly even minimum wage.",4,0,1442869424,1444726019
cv99rms,0,t1_cv9954f,lollersauce914,"So how does that account for the fact that economists that are employed by institutions as varied as banks, universities, the public sector, non-profits, and other organizations all agree on free trade? Do they *all* face the same perverse incentive that biases them towards free trade (just like all those climate scientists are just ""libuhrul academics"")?",5,0,1442860016,1444726019
cv9c8kl,0,t1_cv99rms,AHSfav,Dont you dare try to say economics is on  par with climate science as a science.,-2,0,1442863746,1444726019
cv9fnv1,0,t1_cv9c8kl,Huey_McDuck,"They pointed out that economics is just as tainted as climate science when it comes to being corrupt.  As in, neither are. ",-2,0,1442868898,1444726019
cv9cfkh,0,t1_cv9c8kl,lollersauce914,"What I'm trying to say is that saying ""economists are in someone's pocket"" is about as viable as saying ""scientists are in someone's pocket.""

They are both huge academic disciplines with people from all over the place contributing to the consensus. There is no common incentive for economists to ""make up"" a consensus on free trade just as there is no common incentive for climate scientists to ""make up"" a consensus on climate change. I'm not saying the veracity of both disciplines is the same. 

I'm saying that it's stupid to assert, as the comment above does, that economists favor free trade because of the incentives they face from their positions. 

People have made that same argument about climate science: That scientists are all incentivized to support a consensus on climate change. I'm just saying his argument is equally stupid.",4,0,1442864034,1444726019
cv9cen1,0,t1_cv99rms,prinzplagueorange,"The problem is not that economists like trade.  Trade is consensual so you would expect that generally it is a good thing.  The problem is that many economists do not care much about economic inequality or about undermining international human rights law (which includes extensive protections for labor unions).  I think that they do this because as a group, they self-identify with rich people or at least with the wealthier section of first-world consumers.  The fact that the discipline is rife with (widely acknowledged) conflicts of interest to business groups and banks only exacerbates this tendency.  The comparison to climate science doesn't work: there the issue is whether human beings have in fact contributed to climate change.  More often than not, the left-wing objections to Econ 101 focus on values: will this trade policy undermine something that is of value that the economist does not regard as of value.  The OP is here suggesting that Economics is an apolitical science.  It clearly is not.  It is a discipline with fundamentally right-wing agenda (and that agenda is not grounded in ""science"" but in rather in the priorities of the researchers).  It is not surprising that a left-wing politician opposes those goals.",-1,0,1442863994,1444726019
