id,is_root,parent_id,author,body,score,score_hidden,created_utc,collected_utc
cvh4xbk,0,t1_cvh3dds,Weenercopter,">If you are saying I'm dead wrong, then where is all the extra money the US pays on healthcare going?

I should've worded my response differently.  I was only referring to your suggestions about lawyers.  (And it seems like I might've misread your comment.  Either way, that is an enlightening documentary.)

Yeah, US healthcare costs are wack-o, but greedy lawyers are only a small percentage of the problem, and, in fact, more often than not, actually help the average American who was harmed.  

>A private system of roads and highways would involve more lawsuits, paperwork, advertising, contracts, storefronts, etc. With public roads, you just build them and they may suck a little, but its not complicated.

I'm not so sure about this.  I'm admittedly not well-ready on the subject, but I did a little googling just now, and it seems like there are persuasive arguments that private toll roads are, overall, more efficient from an input/output perspective.  (Granted, they limit transportation because you gotta pay for them, and you disproportionately hurt the poor who have to pay just to get to work, so there are huge benefits to public roads as well.)",0,0,1443464369,1444722981
cvh5knu,0,t1_cvh4xbk,zeperf,"I'm sure a private road system could be higher quality and more efficient.  The problem is whether or not you want poorer people to use them.  We do want poorer people to have access to healthcare so hospitals are forced to treat everyone.

I'm not 100% in one camp or the other, I just think this is the most persuasive argument and it is the reason our healthcare is more expensive.  It has nothing to do with greed or even people getting rich, its just about the extra machinery of a private industry combined with the mandate and expense of a public good.  I do suspect OP is right however and its not just waste.  I'd have to see good data to come to a conclusion.",1,0,1443465315,1444722981
cvgxuuo,0,t1_cvgurnl,BrawnyJava,"Have you ever worked in government?  I have.  They're certainly not focused on providing the best service to the taxpayer.  

Have you ever heard of a private business that spends every nickel remaining in the budget at the end of the fiscal year?  The federal government does that.  

I don't know where this idea that government is efficient and not bureaucratic comes from.  ",7,0,1443453675,1444722981
cvgywjh,0,t1_cvgxuuo,brinz1,see the other reply for my comment,0,0,1443455319,1444722981
cvgzbox,0,t1_cvgywjh,BrawnyJava,"So, I guess your answer is:  No you've never worked in government and no you have no idea how bureaucratic, inefficient and wasteful it is.  Yet you want to pour more money and responsibility into a system that buys $990 toilet seats.  ",5,0,1443455962,1444722981
cvh4eg2,0,t1_cvgzbox,brinz1,"thats' the military. Which is its own massive problem. Mainly, heavy unions, nepotism among contractors, and most fiscal hawks are afraid to criticize it",0,0,1443463589,1444722981
cvh7czy,0,t1_cvh4eg2,BrawnyJava,"No, pretty much all federal contracting and procurement is the same.  Every department tries to spend every dollar in their budget at the end of the year, and they don't care what they buy or if they need it.  The goal is to just get rid of money.  Saving is an utterly foreign concept.

But more to my point:  We have a system we know to be inefficient and wasteful, and we also know it is impossible to reform.  Why in the world would we want to route all our healthcare dollars through this system?",6,0,1443467890,1444722981
cvh8cqp,0,t1_cvh7czy,brinz1,"Hospitals in other countries are ran with a level of autonomy. The hosipital manages itself. Success is set by such things as waiting times for treatment, waiting times in emergency rooms, mortality rates for serious illnesses and other things.",1,0,1443469257,1444722981
cvhcex0,0,t1_cvh8cqp,BrawnyJava,I'm not interested in other countries.  I'm interested in how you think the same congress that can't pass a budget is going to run a single payer healthcare system.  And how is a federal government that pays $990 for a toilet seat going to not break our economy trying to pay for it.  ,3,0,1443475093,1444722981
cvgy6mg,0,t1_cvgurnl,I_Love_Liberty,">In a public business, which does not have a profit margin demanded by investors, its main priority is treating as many people as possible.

Actually it's not. Its main priority is to grow its budget and the scope of its responsibilities.",6,0,1443454196,1444722981
cvgyvgm,0,t1_cvgy6mg,brinz1,"well, there is always the risk of unintentional incentives, which is what happened in the private sector. However, such a system does work out excellently in Europe and Canada and they have managed fine, suggestion that, while an issue in parts of the public sector, healthcare works fine",-4,0,1443455273,1444722981
cvgzhqu,0,t1_cvgyvgm,I_Love_Liberty,">well, there is always the risk of unintentional incentives

Yes, and we should take that risk very seriously, not just write it off like you're trying to do.

>which is what happened in the private sector.

What exactly are you referring to?

>However, such a system does work out excellently in Europe and Canada and they have managed fine

Managed fine compared to what?",3,0,1443456223,1444722981
cvh4co8,0,t1_cvgzhqu,brinz1,"Compared to private systems.  Even if you look at something as simple as money spent per capita on healthcare, the Single payer systems are much cheaper than private",1,0,1443463513,1444722981
cvh4gm5,0,t1_cvh4co8,I_Love_Liberty,Which private systems are you comparing them to?,2,0,1443463679,1444722981
cvh4kpj,0,t1_cvh4gm5,brinz1,"Americas

http://www.trbimg.com/img-53863db9/turbine/la-fi-mh-overuse-healthcare-20140528-001/900/900x506",2,0,1443463851,1444722981
cvh4uso,0,t1_cvh4kpj,I_Love_Liberty,"What about the health care system in the US makes you think it's private? The government controls the health care system to a greater degree than nearly every other industry. You need government permission to do pretty much anything health care related. If a public organization is micromanaging the industry to the degree that the US government micromanages the health care industry, how can you really claim it's privately run?",6,0,1443464267,1444722981
cvh5ai7,0,t1_cvh4uso,brinz1,"Well, whatever the system is, however you would define it it is doing much worse than countries with healthcare that is simply ran by the government.

Not only that, but if you go back to pre ACA, or the 2000s, or the 90s, when the medical system was less tightly managed by the government, insurers would pay for even less things than they do now and the american system was worse

No matter how you look at it, The single payer public healthcare system was better. No  private system can compete.",1,0,1443464899,1444722981
cvh5syl,0,t1_cvh5ai7,I_Love_Liberty,">Well, whatever the system is, however you would define it it is doing much worse than countries with healthcare that is simply ran by the government.

That's probably true for a lot of people. But virtually no one is holding the US system up as an example of what they want. Everyone agrees it's set up badly.

>Not only that, but if you go back to pre ACA, or the 2000s, or the 90s, when the medical system was less tightly managed by the government, insurers would pay for even less things than they do now and the american system was worse

Health insurance companies were heavily regulated decades before the 90s. Either way, the root of the problem with the US system is that it's incredible expensive, and that's due to regulations that have been steadily piling on over the last hundred years. The regulations that came with the ACA addressed some negative consequences of the previous regulations, but it's too soon to see the full extent of the negative consequences of the ACA.

>No matter how you look at it, The single payer public healthcare system was better. No private system can compete.

What private system has failed to compete?",2,0,1443465652,1444722981
cvh75om,0,t1_cvh5syl,brinz1,"The America healthcare system was worse before the regulation, the regulation was required as insurers would try their best to pay as little as possible. I dont know if you have ever tried to claim money from insurance, but they dont like giving you money back",0,0,1443467613,1444722981
cvhbjsc,0,t1_cvh75om,I_Love_Liberty,You're saying the highly regulated insurance companies were doing what they could within the bounds of the previous horrible system of regulations to make money? What a surprise. Get back to me when you find a health insurance system where you don't need government permission to operate.,2,0,1443473772,1444722981
cvhbn64,0,t1_cvhbjsc,brinz1,those regulations exist to to stop the sorts of insurers who would not pay out. Thats why governments are so strict on Insurers.,1,0,1443473909,1444722981
cvhcaya,0,t1_cvhbn64,I_Love_Liberty,"I'm not asking what reasoning you imagine is behind those regulations. If you're going to tell me that a private system has done worse than the public systems, I'm going to ask for you to provide me an example of an actual private system, not one where you need government permission to do just about anything.",1,0,1443474922,1444722981
cvhpzr1,0,t1_cvhcaya,brinz1,"if the system worked fine the regulations would not have been imposed in the first place,",1,0,1443497535,1444722981
cvhr504,0,t1_cvhpzr1,I_Love_Liberty,"What do you mean by 'worked fine'? No one said any system was perfect. There's not going to be any system, ever, where a critic can't come up with ways he thinks he can improve it, and politicians literally do that for a living. The question is whether politicians can actually make the system better. So far, all politicians have done is cause massive problems they conveniently get to use to justify further government involvement later on.",1,0,1443499777,1444722981
cvhsc06,0,t1_cvhr504,brinz1,"Look at the scams and frauds that were commonplace in insurace in the 1930s. hell look at the things that were considered insurance in the 1800s. Back then they had only an obligation to pay out, and acvtively avoided it. ",1,0,1443502472,1444722981
cvi47cz,0,t1_cvhsc06,I_Love_Liberty,I don't doubt there were problems. It was a young industry. Lots of mistakes are going to be made. Lots of bad business models are going to be tried out. It takes some time for entrepreneurs to figure out how to create lasting businesses.,1,0,1443538483,1444722981
cvidq47,0,t1_cvi47cz,brinz1,"the problem with that is there is no profit to be made with the poor and the very sick.

The free market will leave  some people unable to pay for the level of healthcare they need. Its an inherent part of the price mechanism",1,0,1443552528,1444722981
cvihgnf,0,t1_cvidq47,I_Love_Liberty,">the problem with that is there is no profit to be made with the poor and the very sick.

Plenty of very profitable businesses make their money by selling things to the poor. Why would health care be any different, except that government rules get in the way?

>The free market will leave some people unable to pay for the level of healthcare they need.

So will every system. Even if 100% of every person's efforts were dedicated to providing health care, some people would die of diseases that would be curable if only more research had been done into their disease rather than some other one. Some people would die because only the best surgeons in the world could successfully perform their needed operation, and all of those surgeons were off performing surgery on other patients that also needed them. The price mechanism is about allocating resources based on what the people participating in the market want the most. Government allocation of resources means some self-interested politicians and bureaucrats and their wealthy powerful friends get to decide where resources will be allocated. Even if they wanted with all of their hearts to allocate resources to the things that would benefit society most, they'd just be guessing about how best to achieve that with the resources they have available. The price mechanism does a far superior job. No one said it's perfect, and you're always welcome to dedicate whatever amount of your resources you want to helping the sick if that's what you want.",1,0,1443557720,1444722981
cvijvk3,0,t1_cvihgnf,brinz1,"yes, but that is a fraction of the number of people who would die due to a lack of of money to afford healthcare. As is the case in most parts of the world.

Phamaceutacals still make loads of money off Canada and Europe, only the customers have much more buying power than if it was an individual or a single insurance company. Its the equivlanet of a union giving its members a better deal  by collective bargaining.

As I mentioned before, the huge costs accrued by the American health service benefit the insurance companies far more than the medical R&D.",1,0,1443561076,1444722981
cvjbcvl,0,t1_cvijvk3,I_Love_Liberty,">yes, but that is a fraction of the number of people who would die due to a lack of of money to afford healthcare. As is the case in most parts of the world.

Of course, and in exchange we'd have no housing, no food, no clothes, no entertainment, and so on.

>Phamaceutacals still make loads of money off Canada and Europe, only the customers have much more buying power than if it was an individual or a single insurance company. Its the equivlanet of a union giving its members a better deal by collective bargaining.

Customers get lower prices than they would otherwise get, which means more pharmaceuticals would be developed if the government didn't mandate that bargaining. Customers themselves have no actual bargaining power, because they don't have the right to opt out of paying for the government to bargain that way and instead use that money to bid up prices so that more pharmaceuticals get produced.

>As I mentioned before, the huge costs accrued by the American health service benefit the insurance companies far more than the medical R&D.

Which is a result of the regulatory system cooked up by the US government.",1,0,1443624468,1444722981
cvjhe71,0,t1_cvjbcvl,brinz1,">Of course, and in exchange we'd have no housing, no food, no clothes, no entertainment, and so on.

An exaggeration if there every was one. Look at all the other countries with free healthcare and standards of living that equal or Surpass the US.


You think the government would try to use its bargaining power to increase prices? You do see whats wrong with what you are saying.

>Which is a result of the regulatory system cooked up by the US government.

Yes, because Health Insurances do not want to pay out, ever, the regulation is so tight because they are constantly trying to find ways to not pay out. As discussed earlier",1,0,1443633292,1444722981
cvjienx,0,t1_cvjhe71,I_Love_Liberty,">An exaggeration if there every was one.

I was referring to the hypothetical scenario in which all human efforts went toward treating medical problems. The point is that any efforts that go toward medical problems can't go toward other efforts. You believe politicians and bureaucrats and their cronies can and will do a better job allocating those efforts toward what people want than the market can. I don't believe they could do that if they wanted, and I don't believe doing that is their highest priority anyway.

>Look at all the other countries with free healthcare and standards of living that equal or Surpass the US.

What about it? I'm not holding up the US as an example of a health care system I want.

>You think the government would try to use its bargaining power to increase prices?

How did you pull that out of what I said?

>Yes, because Health Insurances do not want to pay out, ever,

Of course they do. If they don't pay out, ever, they don't have any customers. Why would I pay a health insurance company that never pays out?

>the regulation is so tight because they are constantly trying to find ways to not pay out. As discussed earlier

The regulation is tight because politicians thought they could make the situation better than it was. As I explained earlier, the fact that they did it in no way implies they were correct in their belief, and history shows clearly that their actions had serious negative consequences.",1,0,1443634734,1444722981
cvjj445,0,t1_cvjienx,brinz1,"Well then dont use silly hypotheticals


I am holding up dozens of countries where the system works just fine


You said the government would be up prices. Its clearly wrong. Also, medicine is not a luxury people Opt out of.

the reason the regulation is so self defeating is because people still believe the free market can work for healthcare when it clearly cant, never has, and never will. No free market has ever succeeded in giving people good healthcare coverage. 

Thats ok, there are dozens of services where the government has realized that the free market can not work and has made public services. Since when has anyone had to pay firefighter insurance? Or take out a private  subscription for Street lights?

The fact that Emergency Services and Vaccines are government funded shows that some parts of the healthcare system understand this",1,0,1443635728,1444722981
cvk57an,0,t1_cvjj445,I_Love_Liberty,">Well then dont use silly hypotheticals

Did you get the point?

>I am holding up dozens of countries where the system works just fine

Just fine compared to what?

>You said the government would be up prices. Its clearly wrong. Also, medicine is not a luxury people Opt out of.

I said government would negotiate for lower prices than the people otherwise would, resulting in less people creating pharmaceuticals.

>the reason the regulation is so self defeating is because people still believe the free market can work for healthcare when it clearly cant, never has, and never will.

The regulation fails because people believe the free market can work? How does that follow?

>No free market has ever succeeded in giving people good healthcare coverage.

What are you defining as 'good healthcare coverage', and is your statement vacuously true because there are no free markets in health care in wealthy, advanced parts of the world?

>Thats ok, there are dozens of services where the government has realized that the free market can not work and has made public services.

As I've explained repeatedly, the fact that the group of people with the ability to implement those programs thought implementing those programs was in their interests, whatever those might have been, in no way demonstrates, proves, or even suggests that those programs are good or necessary.

>Since when has anyone had to pay firefighter insurance? Or take out a private subscription for Street lights?

What point do you think you're proving?

>The fact that Emergency Services and Vaccines are government funded shows that some parts of the healthcare system understand this

It shows that the people with the ability to make the government do those things thought it was in their interests, whatever those might have been, to make the government do those things. That's it. The fact that you think you can actually draw conclusions about the usefulness of having government do those things from the mere fact that government does those things is illuminating.",1,0,1443670818,1444722981
cvk5pa6,0,t1_cvk57an,brinz1,"Ok, there are a few key points that we dont seem to have clear, causing the problems.

Hospitals are seen as important necessities, like Fire Fighting services. 
When you need one, you need one urgently, its not something one really says they dont need, but they can not plan when they will need it.

Good Healthcare, like a good firefighting service has 100% coverage. If you ignore a fire, it has a tendency to spread and hit many other houses. You wouldnt be ok with a percentage of households being completely ignored by firefighting services.

Firefighting was once privately insured, it didnt work very well, so it became a public service. Now you would be hardpressed to find a country with private firefighting.

If you compare countries with public healthcare to America, they all have equal or much better standards of living, even in healthcare.

There are no fully private healthcare countries that also have high standards of living. Its purely a theoretical Idea, like a prosperous communist society.

The fact that things such as Vaccinations and firefighting are ran by the government and they are ran well is proof itself. What more do you need on it?",1,0,1443671824,1444722981
cvk7349,0,t1_cvk5pa6,I_Love_Liberty,">When you need one, you need one urgently

Not true in the most cases, but what's your point? Hospitals are just a part of the health care system, and the rest is also exceedingly tightly regulated. There's no reason to believe the urgency of hospital patients has very much to do with the existence of regulations on hospitals.

>Good Healthcare, like a good firefighting service has 100% coverage. If you ignore a fire, it has a tendency to spread and hit many other houses. You wouldnt be ok with a percentage of households being completely ignored by firefighting services.

If you're buying a house and the neighbors don't have fire protection, insurance companies aren't going to want to cover your house, so you're probably going to pick a different place to live. That's not very hard for the market to solve, now that fire protection is extremely cheap compared to the past and everyone has home insurance. You can also install sprinklers in your house. Instead of letting the market take care of it, we have public fire departments that are still growing in size and budget despite the number of fires falling rapidly, so you've picked a pretty bad example. Fire departments, like all other bureaucracies, exist solely to expand.

>Firefighting was once privately insured, it didnt work very well, so it became a public service. Now you would be hardpressed to find a country with private firefighting.

Lots of things didn't work very well 100+ years ago by today's standards because people were poor and didn't have our advanced technology. If governments had nationalized food production 150 years ago you'd be telling me we used to have private food production but it didn't work very well so it became a public service. Meanwhile we'd have 25% of the population working in food production because bureaucracies resist shrinking with all of their power.

>If you compare countries with public healthcare to America, they all have equal or much better standards of living, even in healthcare.

Why are you bringing up a healthcare system you acknowledge to be extremely heavily regulated, when we're talking about the consequences of a healthcare system with low or non-existent levels of regulation?

>There are no fully private healthcare countries that also have high standards of living. Its purely a theoretical Idea, like a prosperous communist society.

Except we can point to real world examples of free markets working extremely well in other industries. Meanwhile every market that's extremely heavily regulated is stagnant and has tons of problems. Coincidence?

>The fact that things such as Vaccinations and firefighting are ran by the government and they are ran well is proof itself.

Are they run well? Why aren't fire departments shrinking as the number of fires shrinks? Why are they instead growing?",1,0,1443674934,1444722981
cvk7l6r,0,t1_cvk7349,brinz1,"You dont shrink a fire department because there are less fires. They have grown because technology has improved, they can lower the response times and put out fires before they spread or leave a building  ruined.

Some countries did nationalise food production 100 years ago. It did go very well, so its now kept private. That being said, the US subsidizes its farmers.

I am not talking about regulation in healthcare, I am talking about replacing the current model with a nationally owned model. 

Like I said, the free market works well for many goods and servies, but does a poor job with others. You could not have a privately run fire service, or national defense. You compare the way healthcare is ran in different countries, and you see public is better than private.",1,0,1443676192,1444722981
