id,is_root,parent_id,author,body,score,score_hidden,created_utc,collected_utc
cuv87no,0,t1_cuv7z9d,CompactedConscience,">It absolutely is their responsibility. Congress has a responsibility to craft laws that are Constitutional and the President has the responsibility to veto unconstitutional laws and to enforce the laws in a Constitutional manner.

Not in the way that the Supreme Court interprets the constitution. The Supreme Court gets the final word on what laws and presidential actions are constitutional. If congress or the president disagree, their opinion isn't co equal. That should be obvious to anyone who has taken high school government. 

>They refuse to enforce Federal laws on immigration. How is that not breaking the law? That is illegal.

There is actually no law saying police officers have to arrest and begin deporting immigrants. In fact, there is a tradition going back since before the country was founded of prosecutorial and police discretion in enforcing crimes. There is nothing that anyone would consider illegal happening here. 

>I wouldn't define liberty that way. Love has got little to do with it too. Couples are free to love one another regardless of marriage status. 

You wouldn't but virtually every legal scholar, federal justice, and over half of the supreme court justice would. Marriage is extremely important in giving people liberty to define how they arrange their personal relationships. This has been held consistently in cases for decades. 

>So then a refusal to issue multiple marriage licenses will be next on the docket I'm guessing. If marriage can't be defined as between 1 man and 1 woman, how is the definition that it has to be between 2 people going to hold up?

The court has often found that certain rights can be abrogated for a variety of reasons. The fact that multiple partner marriages are often exploitative would be enough to put a stop to that line of reasoning. ",4,0,1441769324,1444731396
cuv94y0,0,t1_cuv87no,TheNaBr,">The Supreme Court gets the final word on what laws and presidential actions are constitutional.

Actually, they don't.  The SCOTUS needs to wait for cases to come through the lower courts.  They can't rule on Presidential/Congressional actions.

>If congress or the president disagree, their opinion isn't co equal.

It is co-equal because the SCOTUS can't enforce their opinions.  

>There is actually no law saying police officers have to arrest and begin deporting immigrants. 

It says they are to be reported to ICE.

>There is nothing that anyone would consider illegal happening here.

Except for the millions of people that disagree with you there.  

>Marriage is extremely important in giving people liberty to define how they arrange their personal relationships.

How so?  I've heard the exact opposite from entire classes of people and an erosion of the practice for decades.  If less people are married does that mean the nation inherently has less liberty?

>The court has often found that certain rights can be abrogated for a variety of reasons. 

Such as 1 man and 1 woman.  But that didn't hold.

>The fact that multiple partner marriages are often exploitative would be enough to put a stop to that line of reasoning.

Often exploitative?  That'll never hold.  ""Those people love each other just as much as everyone else. "" ",3,0,1441771162,1444731396
cuvmnn2,0,t1_cuv94y0,Kinkonthebrain,"> The SCOTUS needs to wait for cases to come through the lower courts.

Under Article 3, Section 2 (Constitution), SCOTUS has was is called ""original jurisdiction"" in any case to which a state is a party (e.g. ""John Q. Public vs State of ______""). That term means that they do not have to wait for an appellate court to hear the case...they can be the first to do so.

""In all Cases affecting Ambassadors, other public Ministers and Consuls, and those in which a State shall be Party, the supreme Court shall have original Jurisdiction.""

> I've heard the exact opposite from entire classes of people and an erosion of the practice for decades.

In relation to marriage as a matter of ""liberty"" (or pursuit of happiness):

*""Meyer v. Nebraska, 262 U.S. 390 (1923) The right ""to marry, establish a home and bring up children"" is a central part of liberty protected by the Due Process Clause.""*

> Such as 1 man and 1 woman. But that didn't hold.

There was no ""right"" that was abrogated via findings regarding marriage (being 1 man, 1 woman). 1 man and 1 woman can *still* get married. Nothing was 'done away with' here in any of the recent SSC/marriage related cases. The only argument that some have against it is based on moral/religious grounds. And as the old adage goes, it's basically useless to attempt to 'legislate morality'. Since we don't live in a theocracy, any religious argument used to assert whether or not group is allowed to marry (1 man/1woman) and a different configuration does not (1 man/1man or 1woman/1woman) will fail. Historically, the SCOTUS rarely revisits such 'hot button' issues, especially after it's already ruled on the matter in a number of cases...and has always confirmed that 14th amendment equal protections are a 'thing'. 

Congress might well be able to fix this all pretty easily - by revising and passing DOMA to read out marriage as ""1 human being and another human being"". I leave it to you to decide how possible that might be. LOL",0,0,1441810506,1444731396
cuv9h01,0,t1_cuv94y0,CompactedConscience,">Actually, they don't. The SCOTUS needs to wait for cases to come through the lower courts. They can't rule on Presidential/Congressional actions.

This is factually inaccurate on a lot of counts. The supreme court does not always have to wait for cases to go through the lower courts. Jurisdiction is way more complicated than that. They don't have original jurisdiction in many cases, but they do in some. Even if they did have to wait on lower courts, that wouldn't do anything to respond to the claim that they get the last word. A supreme court decision is binding on the lower courts. Finally, the supreme court can very much [strike down executive actions](https://www.myheritage.org/news/unanimous-supreme-court-rules-against-the-obama-administrations-unconstitutional-power-grab/).

>It is co-equal because the SCOTUS can't enforce their opinions. 

That doesn't make it co-equal. The rule is that the executive has to enforce SCOTUS' rulings. The only counterexamples have been tyrannical lawlessness on the part of the executive. 

>It says they are to be reported to ICE

Cite either the relevant law or a reliable source to that effect. I really don't think the law says that, but I could be wrong.

>Except for the millions of people that disagree with you there. 

Luckily, those millions of people don't interpret laws because that would mean they are very bad at it. The law you think exists simply doesn't exist. There are 100s of years of precedent against you. 

>How so? I've heard the exact opposite from entire classes of people and an erosion of the practice for decades. If less people are married does that mean the nation inherently has less liberty?

This is self explanatory. If you had the freedom to marry who you love, is that more liberty or less liberty?  It isn't about the number of people married it is about having the ability to marry who you want. If I said you couldn't marry people of another race, you would have less liberty. I don't understand the confusion and this is another point that makes me think you are being intentionally obtuse. 

>Such as 1 man and 1 woman. But that didn't hold.

That isn't a reason. There is no actual harm being done to anyone. The exploitation that often accompanies polygamous marriage is. I honestly don't care that much whether this holds, I can't understand why anyone would be worked up about this issue either. If they love each other just as much as everyone else, why not let them get married? Unless you believe there is a bit of truth to the power dynamics of the relationship. 
",4,0,1441771845,1444731396
cuva136,0,t1_cuv9h01,TheNaBr,">he exploitation that often accompanies polygamous marriage is. I honestly don't care that much whether this holds, I can't understand why anyone would be worked up about this issue either. If they love each other just as much as everyone else, why not let them get married? Unless you believe there is a bit of truth to the power dynamics of the relationship.

I don't care if there are Polygamous marriages.  I'd at least want a law passed to create that situation though...instead of a Supreme Court decision establishing law across the land.  

I don't even think ""love"" comes into the equation when talking about rights.  It's a fluff piece that's best left for a John Lennon song.  ",2,0,1441773019,1444731396
cuva5i8,0,t1_cuva136,CompactedConscience,">Laws

Why? If something is unconstitutional, let the court get rid of it. But if polygamous marriages are exploitative then they are not likely to be unconstitutional. This is true for the same reason that you have free speech but can't yell fire in a crowded theater. The rights aren't protected to the extent that there is a harm in that sense.  

>I don't think love

Then you disagree with decades of jurisprudence that existed even before the case that struck down laws against interracial marriage. ",4,0,1441773280,1444731396
cuvacpe,0,t1_cuva5i8,TheNaBr,">Why? If something is unconstitutional, let the court get rid of it. 

Because the courts are creating the law and not the Legislative branch.  It undercuts the entire purpose of a Representative Democracy and it further serves the image that we are all ruled by elites that tell everyone else how to live and think.  

>But if polygamous marriages are exploitative then they are not likely to be unconstitutional. 

What's exploitativeness got to do with it?  That's not an inherent value to polygamous marriages.  In fact, in the 60s and 70s when people pushed for that sort of thing, they didn't need to get married to do it.  Marriage is a permissive right, it isn't an inherent right we're all born with.  That's what the famous story of Romeo and Juliet was all about.  

>This is true for the same reason that you have free speech but can't yell fire in a crowded theater.

You can yell fire in a theater, you'll just be liable if you get someone injured or killed.

>Then you disagree with decades of jurisprudence that existed even before the case that struck down laws against interracial marriage.

Yeah and I supported that interracial marriage law getting struck down, but now I'm seeing the current state of things and thinking maybe they got that wrong too.  At least in that case the 14th Amendment was *clearly* about race.  ",2,0,1441773723,1444731396
cuvah50,0,t1_cuvacpe,CompactedConscience,">Because the courts are creating the law and not the Legislative branch. It undercuts the entire purpose of a Representative Democracy and it further serves the image that we are all ruled by elites that tell everyone else how to live and think

I wonder if you read SCOTUS cases. Reasonable people can disagree on the exact reasoning, but there is clearly more to it than them creating law out of whole cloth. You can make an argument that convinces 5 of the 9 smartest judges in the US that there is a constitutional right to same sex marriage. All but one of the lower federal courts were convinced by this argument. The majority of legal scholars were convinced by this argument. The view that the constitution did not protect same sex marriage is both a minority argument and a minority argument among people educated on the topic. 

>exploitativeness

Because if a practice is harmful the courts can abridge it even if it would otherwise be protected. It isn't inherent, but it doesn't need to be for the argument to be compelling. I don't take my views on rights from fiction, but I get the impression that was tongue in cheek. 

>fire

In many states it is illegal to yell fire in a crowded theater. Like, that act is against the law. It isn't just a tort like you think.

>interracial

The relevant part of the due process clause doesn't mention race. It just says that no person shall be ""deprived of life, **liberty**, or property without due process of law"". Emphasis added. ",1,0,1441774007,1444731396
cuvapzx,0,t1_cuvah50,TheNaBr,">I wonder if you read SCOTUS cases.

Yes, I've read some.

>Reasonable people can disagree on the exact reasoning, but there is clearly more to it than them creating law out of whole cloth.

Effect is all the same.

>The view that the constitution did not protect same sex marriage is both a minority argument and a minority argument among people educated on the topic.

All depends on who you ask and who you get to sit in judgement.  [Going back to 2010 it was a majority position](http://www.gallup.com/poll/117328/marriage.aspx) by the population and laws upholding traditional marriage were even passed in California, only be be struck down by the courts.  

In my opinion, it's a manufactured consensus. But again, my position is that I don't care or mind if gays get married.  It's the way that its happening that is disturbing to me.

>The relevant part of the due process clause doesn't mention race. It just says that no person shall be ""deprived of life, liberty, or property without due process of law"". Emphasis added.

I know it doesn't mention race.  And I'd *probably* be okay with the textual reading of the Amendment....but when it came to a Textual reading for the Affordable Care Act, Intent ruled the day.   The justices choose what path they want to take to get the desired outcome they wanted from the start.  

The arguments don't even matter.",0,0,1441774580,1444731396
cuvavst,0,t1_cuvapzx,CompactedConscience,">effect is the same

The effect doesn't matter. If they are simply recognized a constitutional right then that is fine even if it has the same effect as policy. Most of them, most federal judges and most legal scholars think that is all they are doing.

The consensus of the public point that I made isn't really relevant to my overall argument. It was more of an aside. The consensus of constitutional experts is more important is striking. 

And yes, supreme court justices often evaluate different things when coming to a decision. These can include legislative intent, public policy, and a strict reading of statue or the constitution. That is how things have always been done since common law started in medieval England. 

",2,0,1441774976,1444731396
cuvb0mb,0,t1_cuvavst,TheNaBr,">If they are simply recognized a constitutional right then that is fine even if it has the same effect as policy.

At what point are they recognizing and at what point are they creating?  Roe V Wade is a perfect example...technically its about privacy rights.  Effectually it's about abortion.  I can agree with Privacy rights, but I don't get the leap to legal abortion.",0,0,1441775302,1444731396
cuvb796,0,t1_cuvb0mb,CompactedConscience,Roe v wade built on similar precedent. There were lots of cases that held that the privacy right of the 4th amendment extended to family and reproductive decisions. This is how laws banning contraceptives were struck down.,3,0,1441775782,1444731396
cuvb957,0,t1_cuvb796,TheNaBr,">There were lots of cases that held that the privacy right of the 4th amendment extended to family and reproductive decisions. 

Yeah, and then that got morphed into a doctor performed abortion right.  There's a leap there that just seems impossible to make, but it happened.",0,0,1441775915,1444731396
cuvbj8o,0,t1_cuvb957,CompactedConscience,"I don't see the leap. If your right to privacy implied family planning rights, and abortion services are important to family planning, then...",3,0,1441776674,1444731396
cuvfvda,0,t1_cuvb796,yankeesyes,"I guess we're not going to see the cite for ""illegal immigrants must be reported to ICE,"" are we?",2,0,1441793682,1444731396
cuvful9,0,t1_cuv87no,yankeesyes,">There is actually no law saying police officers have to arrest and begin deporting immigrants. In fact, there is a tradition going back since before the country was founded of prosecutorial and police discretion in enforcing crimes. There is nothing that anyone would consider illegal happening here.

Correct.  In fact under the 10th it is unconstitutional to require localities to enforce federal law.  Localities can enforce immigration law (or most other federal laws) if they like, but they aren't obliged to.

The number of times I've seen this falsehood online makes me suspicious that this false comparison is being pushed out as a talking point to misdirect on the Kim Davis case.",3,0,1441793585,1444731396
cuv6pb6,0,t1_cuv61ke,Trotskyist,">Didn't she refuse to issue any marriage certificates?

If she's not issuing any she's definitely not issuing any to gay/lesbian people. This is of particular importance in Kentucky, as you must get your marriage certificate in the county in which you reside.

>It's not absolute, Judges can err just like other people. See the Dred Scott case. She refused to comply knowing full well that there would likely be consequences.

You mean the one 4 years before the outbreak of the civil war?

>Not really. The three branches are co-equal. A President can have their own interpretation, Congress can have its own interpretation, and the Scotus can have their own interpretation.

On questions of constitutionality, the supreme court/judicial branch unquestionably has more authority than the other two branches. No matter how much Obama disagrees with the Citizens United ruling, it will remain the law of the land until [if] the Supreme Court overturns it. Bernie Sanders is campaigning on a *constitutional amendment* to overturn it, as that's the only legal way to get around a supreme court ruling without their compliance. The same is true for the Republican controlled legislature & Roe v. Wade

>I don't think many people see it that way. On both sides of the aisle.


How things are framed politically is distinct from how they exist legally.
>Maybe some are, some recognize the law was broken, but they see that a Christian gets jailed for it...if other Federal laws are broken, such as with Sanctuary cities, those laws are allowed to be broken without jailing. I think a lot of people see this event as a sign that the US Government has become incompatible and hostile to Christians.

Show me an example of someone disobeying a federal judge's ruling without there being any consequences.

>The Constitution doesn't say anything about issuing marriage licenses. The SCOTUS ruling struck down a definition of what marriage is in Kentucky law.

Sure, but the 14th amendment guarantees equal protection under the law, which the supreme court ruled applies to marriage

>The rules haven't been followed for a long time now.

Whether or not the status quo aligns with your personal views on constitutionality is irrelevant. 
 


",5,0,1441766585,1444731396
cuvlvu8,0,t1_cuv6pb6,Kinkonthebrain,"> This is of particular importance in Kentucky, as you must get your marriage certificate in the county in which you reside.

Early on, I used to think that too. It isn't the case. 

Source:
http://www.jeffersoncountyclerk.org/marriage-license-faq.asp

> ""Q: Where Are Marriage Licenses Issued?

> ""A: The parties may go to any county in Kentucky to get a marriage license as long as both are 18 years of age or older.""",1,0,1441809228,1444731396
cuv7qfl,0,t1_cuv6pb6,TheNaBr,">You mean the one 4 years before the outbreak of the civil war?

Yes.  Are you fearful that Gay Marriage licensing is on par with the Slavery divide?

>On questions of constitutionality, the supreme court/judicial branch unquestionably has more authority than the other two branches.

Not really.  Andrew Jackson famously disregarded the SCOTUS during the Trail of Tears event and FDR bullied the court to pass Social Security.

As to the other examples, yes, people tend to follow the SCOTUS rulings, but they typically find work-arounds to force the issue too.  

>How things are framed politically is distinct from how they exist legally.

And you're commenting on Political actions, not legal ones.

>Show me an example of someone disobeying a federal judge's ruling without there being any consequences.

Pretty specific request.  I pointed to the Sanctuary cities as an example already.  

>Sure, but the 14th amendment guarantees equal protection under the law, which the supreme court ruled applies to marriage

I know...but that isn't disobeying the Constitution, that's disobeying the SCOTUS opinion of the Constitution.  

>Whether or not the status quo aligns with your personal views on constitutionality is irrelevant.

Well then I'll just say your entire post is irrelevant.  Those are your personal views on Constitutionality.  They're irrelevant.",2,0,1441768431,1444731396
cuv8mmc,0,t1_cuv7qfl,Trotskyist,">Yes. Are you fearful that Gay Marriage licensing is on par with the Slavery divide?

Specifically gay marriage? No. But there's a much broader cultural divide emerging that's very worrying.

>Not really. Andrew Jackson famously disregarded the SCOTUS during the Trail of Tears event and FDR bullied the court to pass Social Security.

Yes, the Andrew Jackson affair was a low point for the rule of law in this country. The supreme court struck down a number of key new deal programs (which remained struck down, because supreme court rulings are absolute...). FDR tried to pack the court by colluding with congress, but ultimately failed.

>And you're commenting on Political actions, not legal ones.

No, I'm commenting on the legal framework of the united states that's been established by over 200 years of judicial precedent. There's a difference between arguing that gay marriage is immoral (a political argument), and advocating that a government official actively subvert the judicial branch.

>Pretty specific request. I pointed to the Sanctuary cities as an example already.

It's not really. No federal court has ruled on this 'sanctuary city' issue. You're comparing apples with oranges.

>I know...but that isn't disobeying the Constitution, that's disobeying the SCOTUS opinion of the Constitution.

SCOTUS' opinion of the Constitution is the *only* one that ultimately matters. That's their whole reason for existence. There's 200+ years of judicial precedent to back this up. Some body has to have the final say or we end up talking in circles as we are now. Honestly, it's this line of logic that scares me. Basically the takeaway from your argument is that the law (and thus the whole concept of the rule of law) is irrelevant.

>Well then I'll just say your entire post is irrelevant. Those are your personal views on Constitutionality. They're irrelevant.

I really haven't brought my views of constitutionality into this, actually. There're a number of supreme court rulings that I disagree with, and think are incorrect. That doesn't make them any less the law of the land.",6,0,1441770137,1444731396
cuv9qn6,0,t1_cuv8mmc,TheNaBr,">Specifically gay marriage? No. But there's a much broader cultural divide emerging that's very worrying.

There is...it's got little to do with gay marriage licenses though.

>FDR tried to pack the court by colluding with congress, but ultimately failed.

FDR ultimately won.  The Chief justice resigned to prevent the expansion of the court and FDR appointed a Justice that would rule the way he wanted him to on Social Security.

>No, I'm commenting on the legal framework of the united states that's been established by over 200 years of judicial precedent.

I took it as you commenting on the GOP presidential candidates.  Legally...nothing has occurred  to break from any legal framework.

>There's a difference between arguing that gay marriage is immoral (a political argument), and advocating that a government official actively subvert the judicial branch.

Advocating is political.  It's not legal.

> Basically the takeaway from your argument is that the law (and thus the whole concept of the rule of law) is irrelevant.

Not at all.  In fact, the only issue I have with the gay marriage ruling is that it is setting law outside of the Constitutional controls.  No law was passed in Kentucky or Nationally to allow gays to marry.  Instead, the SCOTUS set the law, just as they did with Roe V Wade.  You want to find the political body responsible for this mess, look no further than the SCOTUS.  They're not supposed to establish law, but that's exactly what they've been doing.  And *that* violates the Constitutional framework.

",1,0,1441772411,1444731396
cuvi5sp,0,t1_cuv9qn6,,"No law needed to have been passed if that one provision of the current law is unconstitutional to enforce. That part of the definition which requires a specific complement of sexes just stops being operative. 

We all will allow laws we think are unconstitutional to be struck down. You just have some doubts about how unconstitutional this one was. That's fine, but you do not have the moral or constitutional high ground you think you do. ",0,0,1441801535,1444731396
