id,is_root,parent_id,author,body,score,score_hidden,created_utc,collected_utc
cuvfyyl,1,t3_3k6avz,pleasure2kill,Not all Republican candidates defended her; I believe Kasich and Fiorina both said she should have obeyed the law or quit her job. ,25,0,1441794104,1444731380
cuvjzkn,0,t1_cuvfyyl,BUbears17,Jeb also said she needs to do her job I believe. ,3,0,1441805732,1444731380
cuvnwqh,0,t1_cuvjzkn,PoppyOncrack,"He said there should be a ""compromise"" so gays can get married, but Davis doesn't have to do her job.",2,0,1441812457,1444731380
cuvquux,0,t1_cuvnwqh,fracto73,"That is what the court said too. She didn't have to issue the licenses herself, just allow her willing clerks to do it. After she was jailed that happened, without her consent, and is the reason she was released. ",2,0,1441816939,1444731380
cuvqxrn,0,t1_cuvquux,PoppyOncrack,True.,1,0,1441817062,1444731380
cuvhq55,0,t1_cuvfyyl,mrmoustache8765,"Yeah OP is way off saying all but 2 support her. I'm pretty sure it was only like Santorum, Hukabee and Cruz who actively came out in support of her. And then there's Rand's weird libertarian ""government out of marriage"" argument that's kinda been misconstrued as him supporting her. But other than that I haven't seen much, Bush doesn't wanna touch this thing with a 20 foot stick.  ",14,0,1441800320,1444731380
cuvli48,0,t1_cuvhq55,Dynamaxion,">  Rand's weird libertarian ""government out of marriage"" argument 

It's ""weird"" to think that the government shouldn't be using a purportedly religiously loaded term in law? ",4,0,1441808579,1444731380
cuvqri6,0,t1_cuvli48,fracto73,"What do you suggest we use to replace the word ""judgement"" in our legal system?",1,0,1441816803,1444731380
cuvm2wn,0,t1_cuvli48,mrmoustache8765,"On a purely philosophical basis sure, the argument can be made that the government shouldn't get to decide the definition of marriage. But in the real world we need a legal status and a name for two people who love each other and will spend the rest of their lives together. Most people would agree that the name for this arrangement is marriage. ",2,0,1441809563,1444731380
cuvoakp,0,t1_cuvm2wn,yankeesyes,">But in the real world we need a legal status and a name for two people who love each other and will spend the rest of their lives together.

Not to be bitchy, but the government doesn't require that the marrying parties love each other or that they spend the rest of their lives together.  The government doesn't even require that they live together.",1,0,1441813041,1444731380
cuvotxf,0,t1_cuvoakp,mrmoustache8765,...and your point is?,-1,0,1441813850,1444731380
cuvmggp,0,t1_cuvm2wn,Dynamaxion,"Civil Union? For use in terms of law? Then you expand civil union privileges to encompass everything marriage currently allows. That way nobody can use the ""you can't define marriage!"" argument ever again. 

>two people who love each other and will spend the rest of their lives together.

That's not even the case, divorce and arranged marriages are both legal. ",8,0,1441810188,1444731380
cuvmobt,0,t1_cuvmggp,mrmoustache8765,The entire lgbt community would be up in arms if you changed it from marriage to civil union now that gays can be married. And why do you even care about the wording? It's a lot easier to just say gays can be married. ,0,0,1441810538,1444731380
cuvmt4m,0,t1_cuvmobt,Dynamaxion,"No, it's not ""easier"" because half the country believes that marriage shouldn't apply to homosexuals. 

>why do you even care about the wording?

It is a violation of the First Amendment for the government to institute religious language into law. 

>Now that gays can be married.

Obviously the Court came up with its own solution since they can't change existing language in laws. I'm talking about what should have been done a long time ago from a legislative perspective. ",-2,0,1441810753,1444731380
cuvnvbs,0,t1_cuvmt4m,PoppyOncrack,"Around 65% of Americans support Gay marriage, only about 25-30% Don't.",1,0,1441812398,1444731380
cuvnmkd,0,t1_cuvmt4m,Dennis_Langley,"> It is a violation of the First Amendment for the government to institute religious language into law.

That's not what the First Amendment says. ",3,0,1441812030,1444731380
cuvnrtl,0,t1_cuvnmkd,Dynamaxion,"What does it mean to say that Congress shall ""make no law respecting an establishment of religion""? To me, making a law based on a religious word respects, actually *creates*, an establishment of religion. ",-2,0,1441812252,1444731380
cuvod9v,0,t1_cuvnrtl,yankeesyes,"You're using a tortured reading of the Constitution.  If you were correct, there could be no federal holidays named Christmas or Easter.",1,0,1441813151,1444731380
cuvoilf,0,t1_cuvod9v,Dynamaxion,"There wouldn't be, if the government mandated that only Christians are allowed to take work off for Christmas and Easter. ",-1,0,1441813373,1444731380
cuvnwfu,0,t1_cuvnrtl,Dennis_Langley,"Using a word that happens to be religious is not the same as establishing a religion. Some state statute or local ordinance protecting a place of worship does not violate 1A simply because it uses the word ""worship."" ",3,0,1441812446,1444731380
cuvo9a1,0,t1_cuvnwfu,Dynamaxion,"It violates the First Amendment to use the *religious* meaning of the word to justify discriminating the law. As in, ""marriage is a religious term, and *since it is religious*, it should not be defined as allowing homosexual marriage."" That's the argument of the GOP is it not? That the law should be framed according to the word's *religious* meaning? That the government cannot define marriage, only religions can? 

How is that not an establishment of religion? 

My argument is that if a term is religious to the extent that the religious definition supersedes government authority to redefine it, then that word cannot be used in law per the First Amendment. ",0,0,1441812988,1444731380
cuvockq,0,t1_cuvo9a1,Dennis_Langley,"> ""marriage is a religious term, and since it is religious, it should not be defined as allowing homosexual marriage."" 

This is indeed a violation of 1A. But it is not a violation *because it uses religious language.* It is a violation because it amounts to codification of religious law. I'm making a relatively minor point, but one that I think is important to note. ",1,0,1441813123,1444731380
cuvojn1,0,t1_cuvockq,Dynamaxion,"So we can agree that using the religious meaning of a word as a basis for why the law must be a certain way violates the 1st Amendment. 

From what I understand that was the only argument the defense had in the gay marriage case, aside from alluring to ""tradition."" ",0,0,1441813416,1444731380
cuvom8w,0,t1_cuvojn1,Dennis_Langley,"No, because again, ""worship"" has a religious meaning but there can exist laws that protect places of worship or the right of people to engage in worship. ",1,0,1441813523,1444731380
cuvoqif,0,t1_cuvom8w,Dynamaxion,"But there *cannot* exist laws that protect the right of certain people, but not others, to engage in worship, or that mandate which forms of worship are and are not protected. That's basically what the government was doing with marriage. ",0,0,1441813706,1444731380
cuvouxa,0,t1_cuvoqif,Dennis_Langley,"> or that mandate which forms of worship are and are not protected.

Because **this** is a violation of 1A. Again, such a law would not be a violation *solely* because it contained the word ""worship,"" but because its effect would be to establish one particular religion. 

Your claim is that any law regarding ""marriage"" is unconstitutional because it contains the word ""marriage."" This is not an accurate interpretation of 1A. Such a law would be a violation of 1A **if and only if** it favored one religion's application of that word over another's. ",1,0,1441813893,1444731380
cuvpj6g,0,t1_cuvouxa,Dynamaxion,"> Such a law would be a violation of 1A if and only if it favored one religion's application of that word over another's.

Which ""marriage"" in the United States did for over 200 years. Yet the Court ruled it violated the Fourteenth Amendment, not the First, which was strange to me. ",0,0,1441814930,1444731380
cuvsbwi,0,t1_cuvpj6g,Dennis_Langley,"> Which ""marriage"" in the United States did for over 200 years. 

The effect did, because the law effectively established Christianity's definition of marriage. The word itself did not. ",1,0,1441819185,1444731380
cuvxpov,0,t1_cuvmggp,ChronaMewX,"Why don't Christians just refer to theirs as Holy Matrimony, which many already do? Why do they want monopoly over a word that predates them? It seems that this argument could just as easily be solved by religious people referring to theirs as something else instead of expecting the rest of the world to adapt to their whims",1,0,1441827412,1444731380
cuvnklj,0,t1_cuvli48,awa64,Marriage as a civil institution predates marriage as a religious rite.,5,0,1441811949,1444731380
cuvnp1s,0,t1_cuvnklj,Dynamaxion,"Not according to most of America... 

Also the entire concept of a separation between civil institutions and state religion is extremely modern. I'm not aware of a single truly secular government from the ancient world, even Rome invoked gods.  ",-3,0,1441812136,1444731380
cuvnxy2,0,t1_cuvnp1s,awa64,"> Not according to most of America...

Most Americans believe we spend over 25% of our federal budget on foreign aid, when the real number is under 1%.

Whether or not most Americans believe something shouldn't matter if that thing is demonstrably untrue. Delusions shouldn't trump facts just because those delusions are popular.

> Also the entire concept of a separation between civil institutions and state religion is extremely modern.

Yeah, but think about why they were ever conflated together in the first place. It wasn't due to divine authority—it was due to infrastructure. Churches were the only places in small communities that could be expected to keep records because priests were the only people you could expect to be literate. So you went to the Church to get married so they could make a note of it for census and tax purposes.",10,0,1441812509,1444731380
cuvik67,0,t1_cuvhq55,pleasure2kill,"Yeah true. Even Trump (who I doubt is even Christian) said he didn't think she was right to deny the licenses, and he's the frontrunner right now. ",3,0,1441802557,1444731380
cuvwmks,0,t1_cuvhq55,umbra_sword,">Rand's weird libertarian ""government out of marriage"" argument 

In his defense, that has always been his position.  ",2,0,1441825797,1444731380
cuvgs8a,1,t3_3k6avz,linkns86,">It would be fully within their power to deploy the National Guard to prevent the judge’s order from being carried out, subverting the entire judicial branch of government, and undermining the very constitution that they [at that point] will have sworn to uphold.

None of them have said anything close to that.  You might as well say that if the Justices didn't legalize same-sex marriage, Obama was just going to raid the Supreme Court. 
",11,0,1441797273,1444731380
cuvp1g0,0,t1_cuvgs8a,Weaselbane,"Let's see.... https://en.wikipedia.org/wiki/Little_Rock_Nine#National_Guard_blockade 
",-1,0,1441814166,1444731380
cuvp6ey,0,t1_cuvp1g0,linkns86,Wow.  Totally identical. ,3,0,1441814377,1444731380
cuvbldf,1,t3_3k6avz,Kronos9898,"I'm sorry but this is hyperbolic. While I agree that she is in contempt of court etc etc. The sky is not falling. How many on the left are screaming about this, but say nothing over the fact the Marijuana is legal in some states. These states are defying federal law, which supersedes state law. 

Secondly, she is making a conscientious objection, and will be disciplined accordingly. Again how is what she doing different than what the left does with sanctuary cities, certain forms of protest etc. They are acting on their conscious for what they believe it is right, and they are breaking the law. I fail to see the difference with what Kim Davis is doing, as stupid as it may be.

She is going to get the book thrown at her, and we will all keep moving right along. 

The law is not some beneficent thing, it is neutral and cold, just as capable of being right as it is wrong. 

For clarity, just to make sure I don't get lumped in with her idiocy, I do not support Kim Davis. She should be removed from her position and punished accordingly.",36,0,1441776880,1444731380
cuw1bs0,0,t1_cuvbldf,Blazicus,If this logic was true Alcohol would still be illegal. State legislatures have been doing this for 150 years.,0,0,1441832823,1444731380
cuvclf7,0,t1_cuvbldf,question_all_things,"> How many on the left are screaming about this, but say nothing over the fact the Marijuana is legal in some states.

The people have been for the legalization of marijuana for many years.  Most, if not all, politicians have tried it.  The vast majority of Americans have tried it and know it poses less risk that alcohol.

Finally they found a local way to change the laws the fed gov refuses to.

The fed knows they are wrong which is why theyve cut back on enforcement.",-9,0,1441779962,1444731380
cuvfoko,0,t1_cuvbldf,yankeesyes,"These false equivalences have been debunked again and again, but here's the TL;DR

1. Marijuana laws are federal laws.  Local authorities aren't obliged to enforce federal laws.
2. When someone on the left defies a court order, they are subject to jail and often are jailed.  Period.  ",5,0,1441792839,1444731380
cuvjxig,0,t1_cuvfoko,YankeeQuebec,">When someone on the left defies a court order, they are subject to jail and often are jailed. Period.

Yeah, no. There are countless examples of people on the left absolutely defying court orders, without any punishment.

[Here is an example](http://www.washingtontimes.com/news/2014/nov/20/federal-judge-considers-holding-dc-in-contempt-ove/) of a 100% Democrat city council, after numerous court cases, decided to not uphold the courts decision, took it back to court and lost, and still are defying the courts decision. If what you say is true that everyone gets subjected to jail for defying court orders, there would be 13 Democrats and extremely left leaning independents in jail right now.

[Here is another example](http://www.cbsnews.com/news/court-strikes-down-californias-concealed-weapons-rules/) where courts ruled against California, yet after a year [hundreds of people](http://www.guns.com/2015/04/24/orange-county-sheriff-relents-for-ccw-applicants-caught-in-peruta-quagmire/) are still being denied their rights in one county alone.

In both of these examples, the court has ruled numerous times against these places, and politicians are still defying these court rulings. In both of these examples, magnitudes more people are demonstratively being denied their rights, as enumerated in the supreme law of the  land, yet we are years and months after the fact with not one of these politicians being jailed. While only a month after a courts decision, somehow this politician is being jailed when there wasn't more than a handful of people involved.

I do not support bigots like this lady, but holy fuck, jailing someone, only a few weeks after a court decision, while allowing others to blatantly defy numerous court orders without even a slap on the wrist is nothing but political persecution.

If you could  point me to any example of a politician being jailed for defying a court order, I would honestly be surprised, but as you claim that politicians are often jailed for this exact reason, is so completely absurd that it's not even funny. If any other politicians were held to the same standards as this lady has, we'd have hundreds of politicians sitting in jail right now.",9,0,1441805620,1444731380
cuvkanj,0,t1_cuvjxig,yankeesyes,">Here is another example where courts ruled against California, yet after a year hundreds of people are still being denied their rights in one county alone.

No, it isn't.  From your article, a judge suspended the ruling and the sheriff stopped enforcing the looser standard for issuing permits.  She wasn't in contempt of court, in fact she responded to an NRA query by beginning to process the permits.  Voluntarily.

I don't have time right now to deconstruct the Washington Times article, but even the headline of the article though says that ""Federal judge considers..."" meaning the city counsel hasn't yet been subject to contempt charges as of the publishing of the article.    

So no one jailed, no one in contempt of court, bogus false equivalency.  Again.",2,0,1441806346,1444731380
cuvl8ew,0,t1_cuvkanj,YankeeQuebec,"The problem is the fact that these politicians have been given an extreme benefit of the doubt, and numerous times to comply with the laws and still haven't. In some of these cases they did apply for a stay of the ruling, and it was weeks, if not months of defying court orders before they got a stay, yet somehow this decision was upheld almost instantaneously, and this person was jailed so quick, while others who defy court rulings aren't.

I'm not defending the actions of this person, but it's extremely disingenuous to that people are often times jailed, when I don't know of one example where a politician has been jailed for defying a court order.

You can say all you want how it's not the same, and try to justify it with as much bias as you want, but it is. And, the quickness that this court ruling was enforced, and in such a way that has never been done before, while there are many more extreme examples of politicians defying court orders without question, really makes me question this whole situation.

To be quite honest, I don't know what court order she was defying. The ruling did not mandate marriage of gay or straight people, it only mandated that you have to treat couples equally with marriage. She wasn't issuing anyone licenses, while her reasons were bigoted, she was treating people equally, gay or straight. The only law she might have been violating is the state law of her having to issue marriage licenses, and as you pointed out with your marijuana example, states don't have enforce federal laws, it also goes the other way where state laws cannot be enforced by the federal government.

I'm sorry, to me this is nothing but political persecution. If were going down this route of jailing politicians who defy court orders, because after all we have to treat people equally, there are going to be a lot of politicians sitting in jail then, including the President, the current Democratic front runner, and the former AG who actually has been held in contempt (the same this lady was jailed for), yet the former AG did not spend one moment in jail after his actions literally killed people.",0,0,1441808103,1444731380
cuvljz9,0,t1_cuvl8ew,yankeesyes,">To be quite honest, I don't know what court order she was defying. The ruling did not mandate marriage of gay or straight people, it only mandated that you have to treat couples equally with marriage. She wasn't issuing anyone licenses, while her reasons were bigoted, she was treating people equally, gay or straight.

You're commenting on a case when you have no idea what it is about.  My recommendation is that you read popularly available news reports and learn about this case. ",-1,0,1441808668,1444731380
cuvmhc8,0,t1_cuvljz9,YankeeQuebec,">My recommendation is that you read popularly available news reports and learn about this case.

Unlike where you are getting your information, admittedly from populist and therefore biased sources, I am looking at this issue from both sides, and also through the actual court paperwork.

[Here is the filing that had her held in contempt.](http://www.aclu-ky.org/wp-content/uploads/2015/09/re.67.contempt.mot_.pdf) As you can see that she was treating people equally by not issuing anyone licenses, and the main argument to hold her in contempt was because of a state law. As you can see, this case is being held in US Court, which has very, very, very, very little power in enforcing state laws. The entire reason this person was jailed was through some extreme mental gymnastics to make a political statement by making example of her.

Our whole discussion is about how politicians are being apparently jailed left and right for being held in contempt, yet you're not addressing that issue, even after I've given you examples of politicians being held in contempt where people were killed, yet here we are where the deaths of people matter less than who can get fucking married. ",4,0,1441810230,1444731380
cuvn51n,0,t1_cuvmhc8,yankeesyes,"If you actually read the decision, as I did, all of these things are explained to you.  ",0,0,1441811272,1444731380
cuvl0d7,0,t1_cuvfoko,ISBUchild,">Marijuana laws are federal laws. Local authorities aren't obliged to enforce federal laws.

This is so, but isn't the principle the same for the purposes of public opinion?",5,0,1441807694,1444731380
cuvlmrz,0,t1_cuvl0d7,fracto73,"No. You have one government body fulfilling the letter of their obligations and another that isn't meeting their obligations. One government body is allowing people the freedom to make choices and the other government body is enforcing a particular view of Christianity on the citizens it has authority over.

This is not the same, legally or morally.",1,0,1441808800,1444731380
cuvmber,0,t1_cuvlmrz,ISBUchild,">This is not the same, legally or morally.

I mentioned public opinion on the federal-local divide, not the nature of the disobedience. I think the proportion of people who care about the difference between federal and local enforcement for this purpose is trivial.

> One government body is allowing people the freedom to make choices

The general public [does not perceive gay marriage as a personal freedom issue.](http://i.imgur.com/oKAp3CC.png) It's entirely subsumed by the culture war.",1,0,1441809952,1444731380
cuvmpsv,0,t1_cuvmber,fracto73,">I mentioned public opinion on the federal-local divide, not the nature of the disobedience.

And in the case of marijuana legalization there is no disobedience on the part of local government.

Your data on marriage as a question of freedom is from 2012. For this situation that is going to be inaccurate, there has been a significant shift since then. I would also be interested in seeing the document this is attached to, since there is not very much information to be had in that graphic.",1,0,1441810603,1444731380
cuvnlpk,0,t1_cuvmpsv,ISBUchild,">Your data on marriage as a question of freedom is from 2012. For this situation that is going to be inaccurate, there has been a significant shift since then.

It's not going to make a difference to the correlation. Not only would there need to be a change in marriage opinion larger than has actually occurred in three years (with several states moving from ~50% support to near 100%), but the pattern of that change would have had to suddenly reorganize itself, such that some states completely stopped seeing an increase, or even went backwards, which we know is not the case.

It's an insane question; Public opinion can shift fast generally, but the internal structure of public opinion usually doesn't, and never in just three years.",2,0,1441811994,1444731380
cuvoko7,0,t1_cuvnlpk,fracto73,">It's an insane question

I asked for your source, that is reasonable. 

If you want to mince words about what percentage would make it the ""general public"" or whether believing that it is a constitutional right is the same as a personal freedom issue, fine, but without the context of the survey you are referencing I am not going to put much faith in your graphic. From the polls I have seen I would say that the general public does support the concept of marriage as a constitutional right. ",1,0,1441813459,1444731380
cuvoz7y,0,t1_cuvoko7,ISBUchild,">I asked for your source, that is reasonable. 

Oh, sure.

Data Series | Source
---------------|----------
Personal Freedom Index | Mercatus Center
Support for Gay Marriage, 2012 | Gallup
Romney Vote Share | NYTimes Exit Polling Data

>From the polls I have seen I would say that the general public does support the concept of marriage as a constitutional right. 

I agree, but that's not the same as processing it as a personal freedom issue for the purposes of public opinion. As an analogy, suppose we polled people on:

- Favor/oppose constitutional amendment prohibiting abortion
- Importance of religion
- A general mix of other personal freedom issues (free speech issues, gun ownership, drugs, gambling, alcohol, prostitution, etc)

I would bet (in fact, let's bet, I have some data and can actually test this) that whether or not one believes in ""abortion as a right"" has nothing to do with their general support for greater personal freedom under law, and *everything* to do with whether they think Jesus died for their sins.",2,0,1441814071,1444731380
