id,is_root,parent_id,author,body,score,score_hidden,created_utc,collected_utc
cvhqksc,0,t1_cvhcy1v,Omen12,">  There are a lot of things the Republican GA has done that I completely disagree with, but their economic plans have had tangible positive impacts on our economy.

[Yeaaahhh, that is still up for debate.](http://www.newsobserver.com/opinion/opn-columns-blogs/opinion-shop/article10299056.html)",1,0,1443498628,1444722697
cvhi09g,0,t1_cvhcy1v,virnovus,"IIRC, North Carolina was hit hard by the collapse of the housing market, but rebounded fairly quickly due to the state's continued growth in other areas, particularly technology, ie the Research Triangle.  In any case, North Carolina's economic recovery tracked well with that of the rest of the country, and wasn't really an anomaly.",8,0,1443484542,1444722701
cvhd4hy,0,t1_cvh8s9g,LiveByTheFreePen,"This isn't all that illustrative, though. It's Kansas. It's an agricultural economy with a few speckles of industry here and there. Were people going to farm twice as hard once they cut taxes? 

There's more than policy that goes into economics. The way the red state/blue state split mirrors the rural/urban split really makes it difficult to prove whether the policies work. ",12,0,1443476205,1444722701
cvi3rcy,0,t1_cvhd4hy,ejohnse,"Just FYI, manufacturing makes up 15% of Kansas GDP, as opposed to 6.4% for primary agriculture.  Kansas is hardly speckled with manufacturing.  Manufacturing, wholesale trade, retail trade, finance/insurance, real estate, health care, and government employment all contribute more to Kansas GDP than primary agriculture.  ",5,0,1443537768,1444722701
cvh9jde,0,t1_cvh8s9g,WhiteyDude,"He also raised state sales tax too, right?  which of course hits people with lower incomes harder since they spend nearly everything they make. ",22,0,1443470898,1444722705
cvhb6fz,1,t3_3mqguc,cassander,Kansas has a budget deficit of a [couple percent](http://budget.ks.gov/cre.htm) of its budget.  The idea that there's some catastrophe is patently absurd.  ,8,0,1443473235,1444722705
cvh8rzz,1,t3_3mqguc,Perfect_Society,"The best way to view policies is over multiple years and Kansas in the first two years.   Its not looking awesome, but its not in the condition that California was in right before Arnold became Governor.  ",3,0,1443469833,1444722705
cvhgvbf,0,t1_cvh8rzz,punk___as,">its not in the condition that California was in right before Arnold became Governor. 

It's not being fucked over by Enron? 


",1,0,1443482563,1444722705
cvi5fxs,0,t1_cvhgvbf,Perfect_Society,How did Enron give the state of California all the debt it had and the then-deficits?,0,0,1443540434,1444722705
cvi9nnd,0,t1_cvi5fxs,punk___as,">How did Enron give the state of California all the debt it had and the then-deficits?

You mean when California semi-deregulated the power industry with a capped retail price and Enron (and others) deliberately cut power generation creating power outages that forced up the wholesale price of electricity?

So, the CA gov was stuck paying out the difference between the retail and inflated wholesale prices?

https://en.wikipedia.org/wiki/California_electricity_crisis

That was the immediate financial crisis at the time of the recall election, not ""all of the debt and then deficits"". But it's not like Arnold fixed the budget, that had to wait until Brown was elected. ",0,0,1443546696,1444722705
cvlr9ur,0,t1_cvi9nnd,Perfect_Society,"The deficits, while increased, didn't increase over the period materially over what the trend was. This is seen by the California debt history by year.   

[California didn't increase its debt materially in that time frame](http://www.usgovernmentspending.com/spending_chart_1990_2017CAk_16c2li111mcn_H0c).  So clearly while that cost them some money, it didn't put them in this spot.   Try again.",2,0,1443800064,1444722705
cvi8mbi,0,t1_cvi5fxs,Bassoon_Commie,[Would this help?](https://en.wikipedia.org/wiki/Enron#California.27s_deregulation_and_subsequent_energy_crisis),1,0,1443545181,1444722705
cvlrb38,0,t1_cvi8mbi,Perfect_Society,"It wouldn't. 

The deficits, while increased slightly, didn't increase over the period materially over what the trend was. This is seen by the California debt history by year.   

[California didn't increase its debt materially in that time frame](http://www.usgovernmentspending.com/spending_chart_1990_2017CAk_16c2li111mcn_H0c).  So clearly while that cost them some money, it didn't put them in this spot.   ",1,0,1443800111,1444722705
cvhoj2q,1,t3_3mqguc,hardman52,It's yet another failed Laffler Curve experiment. [Here's](http://www.nytimes.com/2015/08/09/magazine/the-kansas-experiment.html?_r=0) an on-the-ground report that explains it.,3,0,1443495030,1444722705
cvhj58f,1,t3_3mqguc,revanyo,I think the problem is that they tried to duplicate the growth that Texas and Florida have seen in the last few decades but this time in a few years,1,0,1443486458,1444722705
cvi43eq,1,t3_3mqguc,mt_weather,tl:dr it turns out corporate welfare and rigging elections is bad for the bottom line,1,0,1443538306,1444722705
cvhp7jl,1,t3_3mqguc,arthurpaliden,You cut taxes and Joe/Jane small business owner's net profit goes up and they have not had to alter their  business model. They then take that profit and buy income funds to further increase their wealth without the addend problems associated with growing their business.,1,0,1443496156,1444722705
cvhmeou,1,t3_3mqguc,Pharmtekbobby,They AREN'T working. You cut taxes to nothing and then expect revenue to flow in? How? It's like paying for everything on your credit card and thinking you've stopped spending money.,-1,0,1443491635,1444722705
cvhkm3l,1,t3_3mqguc,commenter1126,"An illegitimate state government got into power using rigged voting machines, and they've been looting the coffers ever since.",-4,0,1443488824,1444722709
cvhenry,1,t3_3mqguc,,[deleted],-1,0,1443478710,1444722713
cvheuus,0,t1_cvhenry,ABSOLUTELY__BASED,">2 Years Since Cutting Taxes on the Rich...

Why does no one ever mention the simultaneous tax cut for the middle and lower class?

The title alone shows what kind of hand that author is playing.",8,0,1443479036,1444722713
cvhezxn,0,t1_cvheuus,,[deleted],0,0,1443479272,1444722713
cvhf99a,0,t1_cvhezxn,ABSOLUTELY__BASED,"FTA

>In 2010, Republican Sam Brownback was elected governor of Kansas on the strength of a promise to slash taxes for the state's highest earners and eliminate them almost entirely for nearly 200,000 private businesses — a program he would later call a ""real live experiment"" in conservative government.

The first sentence is an outright lie by omission...",5,0,1443479710,1444722713
cvi90ok,1,t3_3mqguc,mrhymer,Yes - I can explain - Dick gets 8 blocks a day for he and Jane to build the state of Kansas fort of awesome but Jane uses 10 blocks a day because she is a know it all little bitch that will not listen to reason. The teacher and other kids are mad at Dick and Jane because they cannot do simple math and spend more bricks than they have but swear they are doing what is best for the class.,-1,0,1443545760,1444722713
