id,is_root,parent_id,author,body,score,score_hidden,created_utc,collected_utc
cv31xy0,0,t1_cv2xr78,pankpankpank,"Definitely. On the Department of State's website it lays out whole the process works from beginning to end throughout the links on this [page](http://www.state.gov/j/prm/ra/) 

These were the nine primary NGO's used last year: 

* Church World Service
* Episcopal Migration Ministries
* Ethiopian Community Development Council
* Hebrew Immigrant Aid Society
* International Rescue Committee
* Lutheran Immigration and Refugee Service
* United States Conference of Catholic Bishops
* U.S. Committee for Refugees and Immigrants
* World Relief

Contact info for all of those agencies can be found [here](http://www.state.gov/j/prm/releases/onepagers/228697.htm)",1,0,1442367894,1444728728
cv34ktu,0,t1_cv31xy0,Usaftergrad,Thank you very much,1,0,1442372755,1444728728
cv28ew5,0,t1_cv28bm7,ClockOfTheLongNow,"I wish the number was 100,000, not 10,000, but I otherwise agree except for one point:

> This poses absolutely no increase in the threat to our national security from foreign terrorists by bringing in these refugees. 

Considering the region, the instability, and the desire to radicalize these people, there is a *unique* security threat that isn't true of other refugees.  It shouldn't be a barrier to taking in as many as we can, but it needs to be considered.",2,0,1442318483,1444728728
cv28n97,0,t1_cv28ew5,pankpankpank,"It will be considered during the screening process. We technically have made the same risks by allowing hundreds of thousands of Muslims to immigrate to the United States in recent years.

Therefore, compared to the immigration numbers, and the fact that these people will all be heavily involved with NGO's for their foreseeable future...it's not that hard to screen and keep track of 10,000. 

They all have to go through security screenings, and agencies will keep tabs on those that think may pose a threat. But its really not that different than anything out of the ordinary.",2,0,1442319161,1444728728
cv28qga,0,t1_cv28bm7,jctennis123,I agree with this entire post except for the part about it posing absolutely no security risk. That's a bit of conjecture.,3,0,1442319405,1444728728
cv28utl,0,t1_cv28qga,pankpankpank,"Then we make these risks every year. By using the latest report I could find from Department of State, in FY 2013: 

we had

661 refugees from Afghanistan
2,578 refugees from Iran
19,488 refugees from Iraq

And that's only from 3 radicalized countries. And no one even batted an eye at that. 10,000 is an extremely small number of people. They will all be placed in resettlements, monitored and aided by NGOs who regularly report to the Government on their status, and are basically under observation. 

Maybe I shouldn't have said no security risk, but rather minimal ",8,0,1442319730,1444728728
cv2a65n,0,t1_cv28utl,jctennis123,"Very fair. You have convinced me, thanks for the data/numbers.",3,0,1442322906,1444728728
cv23t9q,1,t3_3l0as3,Axdek,Because we are not the battered women's shelter for the world. The main role of the U.S. Government should be concerned with taking care of the people already here. ,13,0,1442299644,1444728728
cv2n00e,0,t1_cv23t9q,ripcitybitch,"Doesn't mean we can't do both.

Weak argument.",1,0,1442343694,1444728728
cv2a3h8,0,t1_cv23t9q,radialmonster,Which country is?,2,0,1442322749,1444728728
cv26yab,0,t1_cv23t9q,houinator,"""Keep, ancient lands, your storied pomp!"" cries she

With silent lips. ""Give me your tired, your poor,

Your huddled masses yearning to breathe free,

The wretched refuse of your teeming shore.

Send these, the homeless, tempest-tost to me,

I lift my lamp beside the golden door!"" - Something Americans [used to](https://en.wikipedia.org/wiki/The_New_Colossus#Contents) believe in.",14,0,1442313282,1444728732
cv27yj4,0,t1_cv26yab,Axdek,Half of legal immigrants go on welfare. Most are low skilled workers. ,0,0,1442317069,1444728732
cv29jes,0,t1_cv27yj4,Dugen,"And you think that's bad for the rest of us, which just means you're bad at macroeconomics.  It's ok.  The nature of macroeconomics is counterintuitive to most people. ",1,0,1442321463,1444728732
cv2hj9z,0,t1_cv27yj4,uncannylizard,receiving welfare does not mean that you are bad for the economy. The number of people who don't understand basic economics on this site is astounding. ,2,0,1442335411,1444728732
cv29jsd,0,t1_cv27yj4,cmmgreene,I would really like to see a source on that. Not to mention most Americans refuse to work those low skilled labor jobs.  The average American won't pick fruits for cents on the bushel.,6,0,1442321489,1444728732
cv2azdm,0,t1_cv26yab,down42roads,When did we start basing foreign policy on poems on statues?,6,0,1442324531,1444728732
cv2gvrs,1,t3_3l0as3,thehollowman84,"Your cons are just one long logical fallacy.  

http://www.logicallyfallacious.com/index.php/logical-fallacies/94-false-dilemma

""We can't help refugees because homeless veterans need help!"" is not the reality of the world. Helping people is not a zero sum game.  It's not like the US isn't helping illegal aliens or homeless vets because they can't afford it.  ",2,0,1442334407,1444728732
cv2p9a5,0,t1_cv2gvrs,creativeusername55,If you noticed I did not say below was any part of an argument. I said it said these are reasons to why I am split which is why I was asking for arguments from both sides. Yes I understand logical fallacies. I never said we can not help refugees because homeless veterans need help. My concern is our government failed a majority of these veterans and a lot of them do in fact need saving. The pro arguments other than the fact that we should help people in need is that the Syrian refugees with proper integration will be an asset to the US economy and the US as a whole. My problem is that the people who need saving in their own country of the US can also be those lifelines. I am a firm believer of fixing one's own problems ( and I will add problems closet to homes for the sake of a claim that I ignored that the US had a part in the Syrian crisis) before trying to fix other problems/ further away problems. ,1,0,1442346972,1444728732
cv23kxv,1,t3_3l0as3,creativeusername55,I do not understand the down votes - I am trying to become better educated on this topic in regards to both sides and I expressed my reasons why I am split and confused. ,3,0,1442298818,1444728732
cv2bl7p,1,t3_3l0as3,molotoviphone,"Bobby Jindal, Marco Rubio, Bernie Sanders. 

All three of these presidential candidates were born to at least one parent who wasn't an American citizen . 

Bernie Sanders' father left Poland to work as a paint salesman in America. 

Many of Bernie Sanders' polish family members were victims of the holocaust. 

Jindal's parents migrated from India to the United States. Marco Rubio's parents are Cuban. 

I have a friend who was born in Saudi Arabia and migrated to America as a kid. I've been friends with him since the fourth grade. He'll be attending UC Berkeley in the fall, after graduating with honors ands 4.2 GPA. 

America is built on the backs of immigrants who want to forge a new life for their families. These aren't just poor refuges fleeing from Syria - they're oppressed and in danger. 

America is the greatest country in the world because it has always been a land of opportunity for immigrants. It needs to stay that way. ",0,0,1442325671,1444728732
cv2opn4,0,t1_cv2bl7p,creativeusername55,"I agree and understand that the US is made up of immigrants - my family is too. There is no doubt in my mind, especially with immigrants of the ww2 period, for example, that immigrants helped to make America greater in so many ways including Nobel prizes, advances, way of life etc. I am in no way saying that America should not accept immigrants, I think they should. I am saying that should America not step back and help those already here who need the help before admitting a possibly unstable refugee population that could contain potential threats to US itself. As it seems to be a consensus, there is a larger threat of terrorism/ riots/ problems with Syrian refugees compared to others. So should the US put the needs of its own first or the needs of others before its own. (Yes, I know the media perpetuates negativity, phobias etc; however, we also do not know when we are receiving a full 100% truth in this day and age. We live in a society where if we do not agree with the morally objective action of a Utopian society, we are automatically seen as terrible, hateful  and naive people - this I think is something that could be very dangerous.) If we looked at countries like families and a crisis happened - would you put others before your current family or put your own, current family, first?  (Please understand, I am trying to understand all sides and I do believe that helping people in need is most important especially when there is something that can be done to help them, but I believe we need to do it in the smartest possible way. ",1,0,1442346185,1444728732
cv32dy6,0,t1_cv2opn4,praxulus,"A disproportionate number of the Americans who need help are those who are most expensive to treat, such as the mentally ill, the drug addicted, and the elderly.

Many refugees need only peace and stability to flourish. For a large portion of those fleeing violence, a few month's worth of transitional housing and some English classes would transform them from destitute refugees into working or even middle class members of society.

We can accomplish a lot more good by directing our limited resources towards those who can make the best use of it. You make think I'm being callous toward our poor, but I think that's better than being callous toward an even greater number of Syrians.",1,0,1442368684,1444728732
cv28a6s,1,t3_3l0as3,Quetzalcoatls,I think taking in 10K is one of the literal dumbest ideas I have heard in months. How the hell are you even gonna screen these people anyway? Plus the war in Syria needs to be controlled anyway. Why not just carve out a zone in Syria to send them to? Much better plan over the long haul. These people can't leave Syria anyway they have to stay and be there to rebuild. ,1,0,1442318091,1444728732
cv28cuk,1,t3_3l0as3,Fr33zy159,"Cons: considering these people won't have even basic ID, and ISIS, Al Qaeda and friends have vowed to infiltrate these refugee groups, there is a massive risk of allowing in terrorists. ",-3,0,1442318309,1444728732
cv28j9s,0,t1_cv28cuk,pankpankpank,"That's what the Resettlement Support Center (RSC) is for,  taken literally from the Department of States admissions process from their [website](http://www.state.gov/j/prm/ra/admissions/index.htm)

>The RSCs collect biographic and other information from the applicants to prepare for the adjudication interview and for security screening. Enhanced security screening is a joint responsibility of the Department of State and the Department of Homeland Security and includes the participation of multiple U.S. Government security agencies.

>Officers from the Department of Homeland Security’s U.S. Citizenship and Immigration Services (USCIS) review all the information that the RSC has collected and also conduct an in-person interview with each refugee applicant before deciding whether to approve him or her for resettlement in the United States.

All of these refugees will be screened thoroughly, there is absolutely not a massive risk of allowing in terrorists. 

",5,0,1442318846,1444728732
cv28rgj,0,t1_cv28j9s,jctennis123,You keep saying this but you're totally incorrect. Why do you so strongly believe this?,-4,0,1442319482,1444728732
cv28vwv,0,t1_cv28rgj,pankpankpank,See my response to you below. We regularly take in much larger numbers of refugees from radicalized nations all over the world. None have turned out to be terrorists. That's a pretty good batting average,3,0,1442319815,1444728732
cv2a1yl,0,t1_cv28j9s,Fr33zy159,That makes me feel slightly better. We just need to make sure that we don't handle it like the EU has. Europe is now a ticking time bomb thanks to the way they handled that mess. ,1,0,1442322658,1444728732
cv2cpxz,1,t3_3l0as3,stDemigod,">We live in a world where countries like the **United States** have been committing severe human rights violations for a substantial amount of time, yet the world does not take aggressive action to rescue the people in work camps, political prisoners etc.

North Korea is Kindergarten compared to what the US does in other countries. The Syrian refugee crisis is a direct consequence of US politics. This is why the US should take in every single refugee from that region.",-5,0,1442327701,1444728732
cv2t5t3,0,t1_cv2cpxz,bookerevan,"Everyone is trying to get into the U.S.  Everyone is trying to get out of N. Korea.

Maybe you should try to get into N. Korea, It's probably easy and you can then make an informed judgement relative to human rights violations.

Good Luck to you, best wishes in N. Korea.",1,0,1442352694,1444728732
cv2tfm8,0,t1_cv2t5t3,stDemigod,"Hm, I see you make a difference between someone killing his own people and someone killing other people. Interesting. ",1,0,1442353123,1444728732
cv2tqkm,0,t1_cv2tfm8,bookerevan,"Hm, I'd bet if you were in charge the world would go to complete shit, but at least you'd feel good about yourself for doing nothing - clean conscience and all of that.",1,0,1442353612,1444728732
cv2fkwx,0,t1_cv2cpxz,_o7,"> North Korea is Kindergarten compared to what the US does in other countries. 

You actually believe that which is sad.",3,0,1442332345,1444728732
cv2h4r1,0,t1_cv2fkwx,stDemigod,"Tell me when was the last time North Korea killed up to 30 million people.

http://www.sott.net/article/273517-Study-US-regime-has-killed-20-30-million-people-since-World-War-Two

Exactly, in their entire history no nation has ever killed that many people aside from Nazi Germany and Colonial Britain.

You stand corrected and I accept your apology.",-2,0,1442334790,1444728732
cv2hfzv,0,t1_cv2h4r1,_o7,"Again, I stand by my previous comment.  You believe this and its sad.

Here is some light reading for you.

http://www.theguardian.com/world/2014/feb/17/torture-executions-rapes-north-korea-human-rights

http://www.nytimes.com/1999/08/20/world/korean-famine-toll-more-than-2-million.html

http://news.bbc.co.uk/2/hi/asia-pacific/433641.stm

Since ya know, its kindergarten and all.",2,0,1442335273,1444728732
cv2iu3z,0,t1_cv2hfzv,stDemigod,"Still kindergarten compared to 20 - 30 million deaths. If the worlds population could chose between a nation that killed about 5 million of its own people and a nation that has killed dozen of millions of peoples from other nations, I am pretty sure NK would be very much preferred.

Dont get me wrong, what NK is doing is absoultey atrocious and inhuman but numberwise its a joke compared to the US murder campaigns.

Mind you, the US is mainly killing innocent civilians. Far more than NK, ISIS or the entire world combined. And all in the name of doing good, fighting evil. If the US would stop fighting evil there would be a lot less evil in our world. Imagine what the US could do with the trillions they spent on killing other people. Education, social security, welfare programs, space exploration...

But the US has to kill other people instead. In 20 years the US reign over this planet will have cost more lives than the second world war. In 50 years more people will have been killed by the US than died in both world wars combined.

But North Korea will still only have killed a fraction of these numbers. And the better state in this regard. 30 000 000 > 5 000 000.

Some might call that a fact. Others find it sad that there are people who actually want to see less killing. ",-2,0,1442337400,1444728732
cv2jpjs,0,t1_cv2iu3z,_o7,You're not even worth the time it would take to explain how wrong you are.,2,0,1442338730,1444728732
cv2o4cs,0,t1_cv2jpjs,KaiBerlin,"I would love to see you argue your point. I find his argument quite compelling, I am inclined to agree that less dead people are better.",2,0,1442345333,1444728732
cv2ob2c,0,t1_cv2o4cs,_o7,"I agree that less dead people is better but hes not comparing apples to apples or even the same time frame.

His linked article says since World War 2 the US has killed that many people, yes, in wars (weather you agree with the wars is irrelevant).  Where as North Korea is causing famine and oppression on their own citizens.  If the USA was going around oppressing everyone and causing famine I could see the comparison but the bigger monster here is North Korea, not the USA as he proposes.  He is only basing his judgement on the amount of people killed, not how or why.  Intent matters.",2,0,1442345599,1444728736
