id,is_root,parent_id,author,body,score,score_hidden,created_utc,collected_utc
cuvnwry,0,t1_cuvncjl,WhiteyDude,"The right to marry has long been established as a basic human right in our court.  [Here's what they said about marriage in the latest ruling: ](https://en.wikipedia.org/wiki/Obergefell_v._Hodges)

> The Court listed four distinct reasons why the fundamental right to marry applies to same-sex couples.

> First, ""the right to personal choice regarding marriage is inherent in the concept of individual autonomy.""[67] 

>Second, ""**the right to marry is fundamental** because it supports a two-person union unlike any other in its importance to the committed individuals,"" a principle applying equally to same-sex couples.[68] 

> Third, **the fundamental right to marry** ""safeguards children and families and thus draws meaning from related rights of childrearing, procreation, and education""; as same-sex couples have children and families, they are deserving of this safeguard—though the right to marry in the United States has never been conditioned on procreation.[69] 

>Fourth, and lastly, ""marriage is a keystone of our social order,"" and ""[t]here is no difference between same- and opposite-sex couples with respect to this principle""; consequently, preventing same-sex couples from marrying puts them at odds with society, denies them countless benefits of marriage, and introduces instability into their relationships for no justifiable reason.[70]",3,0,1441812459,1444731384
cuvqyrn,0,t1_cuvnwry,rkrish7,"Well you certainly have made me look foolish. In reference to the actual opinion, Kennedy mentions the 4 principles you discuss beginning on page 13. 

i think, however Justice Kennedy is a bit off base when he says this:

>The right of same-sex couples to marry that is part of
the liberty promised by the Fourteenth Amendment is
derived, too, from that Amendment’s guarantee of the
equal protection of the laws.

While equal protection clause of the 14th amendment says this:

>All persons born or naturalized in the United States, and subject to the jurisdiction thereof, are citizens of the United States and of the state wherein they reside. No state shall make or enforce any law which shall abridge the privileges or immunities of citizens of the United States; nor shall any state deprive any person of life, liberty, or property, without due process of law; nor deny to any person within its jurisdiction the equal protection of the laws.

It doesn't mention marriage as a right, only for every citizen to have equal protection of the laws. 

So in my opinion, I agree with the court's ruling, but I think the justification was a little to emotionally driven rather than logic driven. 

It's obvious, however, that the ruling was on marriage being a fundamental right, and only partially on equal protection, not entirely founded on the 14th amendment, like I had said previously. ",3,0,1441817105,1444731384
cuvrni1,0,t1_cuvqyrn,WhiteyDude,"> I  think, however Justice Kennedy is a bit off 

I think his opinion carries a bit more weight... 

> It's obvious, however, that the ruling was on marriage being a fundamental right, and only partially on equal protection, not entirely founded on the 14th amendment, like I had said previously.

Well OK then, I'm glad we had this conversation.  Have a great hump day. 
",1,0,1441818145,1444731384
cuvrs8l,0,t1_cuvrni1,rkrish7,"Obviously his opinion carries more weight, I was simply stating my disagreement with how he justified his opinion. ",1,0,1441818350,1444731384
cuvo7u8,0,t1_cuvk6qq,Kinkonthebrain,"I would have to do some research but not issuing to all couples, as a way to avoid issuing to a (now) constitutionally protected 'class' would still be a *form* of discrimination. It's the legal equivalent of the 'take your ball and go home' defense - simply because you don't approve of the way a new 'player' is playing...even though they are doing so via valid/legal 'rules of the game'. 

Here is a sports metaphor: A pitcher in baseball stops pitching to *any* player at all...simply because wants the ""right"" to *avoid* pitching to African-American players. If his assertion is something like ""I will pitch to batters...but only if they are white"", I tend to think that pitcher is gonna run into problems. ",3,0,1441812927,1444731384
cuvof3h,0,t1_cuvo7u8,rkrish7,"Would it though? Regardless of intention, she is treating all people equally. She is breaking the law, but I don't find what she did discriminatory. Stupid? Absolutely, but not discrimination. ",1,0,1441813227,1444731384
cuvpn1q,0,t1_cuvof3h,Kinkonthebrain,"> Regardless of intention, she is treating all people equally.

The *clear* intention was not to issue to same-sex couples. VERY clearly. Heck...by her own *admission*, that's clear. Not providing a legally-mandated service to *all*, as a way to avoid giving to a particular class is still discriminatory. Avoiding 14th amendment equal protections for one legal 'class' has meant that heterosexual couples seeking marriage licenses have *their* 14th amendment equal protections violated *as well*. 

Here's another example (not perfect, just an example):

A state-funded university has a law professor, who draw his salary from the state. That university offers a class to *all* students. Some of those who sign up are homosexual. The profession (paid by the state) decides that he doesn't want to teach to them specifically. So, he simply decides not to teach to *anyone* until those students stop signing up for his class.

That'd be okay too - right? Avoiding providing a service to everyone as a way to avoid doing so for *ONE* class of 'student' would still be discriminatory (at least in this citizen's opinion). I've not done research yet on whether my assertion is backed up by any case/constitutional history.",2,0,1441815095,1444731384
cuvql3j,0,t1_cuvpn1q,rkrish7,">Avoiding 14th amendment equal protections for one legal 'class' has meant that heterosexual couples seeking marriage licenses have their 14th amendment equal protections violated as well.

Here's where I disagree. By definition, her actions are not discriminatory because she is treating heterosexual couples and homosexual couples in the exact same manner. Her intentions are discriminatory, but her actions are not. 

Again, I don't think her actions were morally justifiable, but by definition, I don't think that they can be called discriminatory, whereas her intentions most certainly are. I think that distinction is key, and I definitely would be interested to see if there are any cases similar to this one where discriminatory intentions are enough to prosecute someone who committed an action similar to Kim Davis'. 

For the record, I am mostly playing devil's advocate. I do have a big problem with the stand she took and the support she got from major republican candidates. I am, however, also on the fence as to whether this constitutes civil disobedience or not. I'm leaning toward no, but I could certainly see the side of the argument where her actions could be considered as such. ",1,0,1441816532,1444731384
cuvgmqe,1,t3_3k6avz,The_seph_i_am,"> Currently, all but two Republican candidates (Carly Fiorina and Chris Christie) have come out in support of Ms. Davis’ actions. 

False Kasich has said from the beginning he didn't agree with her actions

And  there are others who disagree with her actions as well.

http://www.miamiherald.com/news/nation-world/national/article34397109.html
",3,0,1441796738,1444731384
cuvl87q,1,t3_3k6avz,Kinkonthebrain,"For those who need or would like it, here is the *specific* law that Ms. Davis broke to land her in the slammer:

https://www.law.cornell.edu/uscode/text/18/401

@@@@@@@@@@@@@@@@@@@@@@@@@@@@


Also, it's my assertion that if her position is allowed to stand (vis a vis 'free exercise' in relation to the fulfillment of the terms of her public office), it would present a violation of the 1st amendment 'establishment' clause. Effectively, 'establishing' the Christian religious doctrine as being the 'ruling' determination of government operations for the county clerk's office. Not to mention that if the entirety of that office operated as such (and there are 57 other county clerks offices in Kentucky that basically sided with her), it would mean that 58 county clerks offices in Kentucky would operate that way...and approx. 112 that would not. 


In my interactions with, and readings of, her supporters...it's pretty clear that they have a fundamentally different understanding of SCOTUS's function. They somehow believe that SCOTUS has ""made law"" here via their ruling. They also tend to deflect to a lot to other unrelated issues (Gavin Newsome's issuance of licenses to SSC prior to being told to cease and desist, the illegal immigration 'sactuary city' policy, Eric Holder's enforcement priorities vis a vis illegal immigration and other false equivalencies).


A considerable number of them have a paranoid, evangelical 'Christian caliphate' persecution complex and seem monumentally undereducated or informed as to how our constitutional form of government actually operates. They **burn** to have the US operate as a theocracy. I have had to point out to *many* that  Congress did, indeed, make a law regarding this matter. 


It was called ""DOMA"" (Defense Of Marriage Act). In fact, Congress passed the DOMA (Defense Of Marriage Act) law stating that marriage was to be defined as ""1 man, 1 woman"" (in section 3). Here's the info on that law and cases pertaining to its application and constitutionality:


> *""The Defense of Marriage Act (DOMA) (Pub.L. 104–199, 110 Stat. 2419, enacted September 21, 1996, 1 U.S.C. § 7 and 28 U.S.C. § 1738C) is a United States federal law that, prior to being ruled unconstitutional, defined marriage for federal purposes as the union of one man and one woman, and allowed states to refuse to recognize same-sex marriages granted under the laws of other states. Until Section 3 of the Act was struck down in 2013 (United States v. Windsor)""*

Section 3 of DOMA was what defined ""marriage"" as being between 1 man and 1 woman, which was challenged in SCOTUS:

> *""United States v. Windsor (2010–2013). Section 3 of the federal Defense of Marriage Act is found unconstitutional in U.S. district court. The Second Circuit Court of Appeals affirms that ruling, as does the U.S. Supreme Court. The U.S. government began implementing the decision the same week.[216]""* This is the case that ruled that portion of DOMA (as 1 man and 1 woman) being unconstitutional.


As to the most recent ruling in June:

> *""Obergefell v. Hodges (2013-2015) U.S. Supreme Court case finding state bans on same-sex marriage to be unconstitutional under the 14th Amendment. (Overturned Baker v. Nelson)""*


SCOTUS has ruled on matters of judicial challenge relating to marriage law 14 times over the past 200 or so years. It is pretty easy to look up and read the legal opinions from the courts as it relates to regulation of what we colloquially call ""marriage"".",3,0,1441808094,1444731384
cuw5l7d,1,t3_3k6avz,Lalagah,"> The Supreme Court are themselves the final arbiters of constitutionality.

We can all pretty much agree that what Kim Davis is doing is wrong, but I humbly submit that you are mistaken about the Supreme Court.  When something is not as it should be it is the duty of the people to resist.  Blind obedience to 9 appointed judges is idiotic at best.

We stopped 'playing by the rules' a long time ago.  If you think Kim Davis is the big problem I think your fear is misplaced.",3,0,1441839816,1444731384
cuw6e4r,0,t1_cuw5l7d,tenthreeleader,"> We can all pretty much agree that what Kim Davis is doing is wrong

Tell me what law she is breaking.  

She is enforcing the law of the State of Kentucky, which until January 1, 2016 defines marriage as between one man and one woman.  She is being ordered to break existing law.  ",1,0,1441841211,1444731384
cuw81sq,0,t1_cuw6e4r,Trotskyist,"She's breaking the 'supreme law of the land,' the US Constitution (specifically, the equal protection clause of the 14th amendment), as determined by the Supreme Court of the United States, the ultimate judicial authority in this country. 

Supreme Court rulings supercede state [and federal] laws, and there's more than 200 years of judicial precedent to back this up.",1,0,1441844208,1444731384
cuvjl1t,1,t3_3k6avz,Tesseractyl,"Crying foul about people disrespecting the Constitution and the Supreme Court is a little hypocritical if you can conceive of a scenario in which you would conscientiously disobey the law. If slavery were made legal again, I'm certain there would be a huge number of people resisting and deliberately violating that law, and none of us would say that's a constitutional crisis threatening to bring down American society; we would say that's ""real America"" reacting to the insensitivity of our government and re-asserting our own values. Whether or not it's acceptable for people to refuse to respect and obey the government's laws seems to be a settled issue for most folks: it's acceptable as long as you have a good moral or ethical justification. The proper angle of attack with Davis is to point out that her justification is terrible. Construed properly, she is a pivotal figure in a system constructed in part to deny homosexuals their full rights, and to participate in that oppression while citing conscientious objection is doubly abhorrent in precisely the same fashion as racist segregationists quoting bible verses and waving American flags in the name of saving America from the darkies. Conscientious objection is a well-established form of political protest and most people don't challenge that notion. What remains is to point out that her objection is itself the injustice.",5,0,1441804907,1444731384
cuvp6we,0,t1_cuvjl1t,Kinkonthebrain,"> The proper angle of attack with Davis is to point out that her justification is terrible

Indeed it is terrible. If a case is brought asserting that she has 'free exercise' of the type she is asserting, it effectively violates the 1st amendment 'establishment' clause. By 'establishing' Christian doctrine as the governing authority of the county clerk's office...instead of the Constitution being the governing authority. Upholding her asserting as legally valid opens the door to many hypotheticals or legal realities that lead down paths I'm sure that *no one* (other than perhaps the evangelical Christian 'caliphate') want us to go down.",1,0,1441814397,1444731388
cuvk95y,0,t1_cuvjl1t,Trotskyist,"There is a considerable difference between a private citizen disobeying the law and a public official disobeying the law.  Even more so: someone who is running to be the head of the executive branch supporting such an action. 

Additionally, one of the central tenants of civil disobedience is accepting the legal consequences for one's actions. When MLK disobeyed the laws of the Jim Crow era south, he knew full well that he would be jailed for doing so. He openly admitted that he was breaking the law. His point was that the laws needed to be changed.",4,0,1441806265,1444731388
cuv5c8e,1,t3_3k6avz,houinator,"Or they could just nominate enough SCOTUS justices to flip the court the other way.  The next President will likely get at least two nominations, and unlike Obama where both replacements came from the liberal wing, this will probably be both Kennedy and Ginsberg, flipping the court from the Roberts/Kennedy balance of moderate/libertarian jurisprudence to either solidly progressive or solidly conservative.

I suspect if we get a conservative President (however unlikely that may be) and they create a conservative SCOTUS that starts ruling the opposite direction, we will stop seeing many statements like ""It is in the very nature of the Supreme Court that it’s decisions cannot be wrong"" coming from the left (See the reaction to the Citizen's United ruling for a small preview).",7,0,1441764323,1444731388
cuv9a5s,0,t1_cuv5c8e,looklistencreate,"That doesn't happen nearly as often as you think. If that were the case the Supreme Court would be reversing decisions left and right every time a President switched the balance. If the court actually did that it would be a partisan joke, confirming all suspicions of activism and making a mockery of the concept of an impartial body. The reality is that Presidents don't tamper with the court to make everyone rule their way on everything and recent rulings are usually left alone. The next President most likely will not appoint people with the express purpose of achieving a desired ruling. Obama promised he wouldn't use litmus tests; I have hope the next President will do the same.",2,0,1441771451,1444731388
cuvhlvo,0,t1_cuv9a5s,omfgwallhax,">When the Supreme Court issued its latest campaign finance decision last month, the justices lined up in a familiar way. The five appointed by Republican presidents voted for the Republican National Committee, which was a plaintiff. The four appointed by Democrats dissented.  
That is why Republican presidents routinely appointed justices who were or would turn out to be liberals. Among them were Chief Justice Earl Warren and Justices William J. Brennan Jr. and Harry A. Blackmun.  
But it has been almost 25 years since the last such appointment, of Justice David H. Souter in 1990. And it has been more than 50 years since a Democratic president last appointed a justice who often voted with the court’s conservatives: Justice Byron R. White, who was nominated by President John F. Kennedy in 1962.  
Now, just as there is no Democratic senator who is more conservative than the most liberal Republican, there is no Democratic appointee on the Supreme Court who is more conservative than any Republican appointee. “It’s not coincidence,” said Lawrence Baum, a political scientist at Ohio State, “that the court is now divided along partisan lines in a way that hasn’t been true.”


http://www.nytimes.com/2014/05/11/upshot/the-polarized-court.html?_r=0

>“We are getting a composition of the clerk work force that is getting to be like the House of Representatives,” Professor Garrow said. “Each side is putting forward only ideological purists.”  
Supreme Court law clerks share the justices’ chambers, do much of their work and influence their thinking. They make recommendations about which cases the court should hear, help prepare the justices for oral arguments, discuss the cases with them and draft major portions of the opinions and dissents.

http://www.nytimes.com/2010/09/07/us/politics/07clerks.html?pagewanted=1&hpw

>The President of the United States appoints justices ""by and with the advice and consent of the Senate.""[69] Most presidents nominate candidates who broadly share their ideological views, although a justice's decisions may end up being contrary to a president's expectations.

[Source](https://en.wikipedia.org/wiki/Supreme_Court_of_the_United_States#Appointment_and_confirmation)

> recent rulings are usually left alone.

While probably true, let's not forget that it takes a while for any case to bubble up to the Supreme Court.",1,0,1441799968,1444731388
cuvdpz9,0,t1_cuv9a5s,righthandoftyr,"It helps that whoever the president nominates has to be acceptable to congress as well.  Even if someone like Sanders wound up in the white house come 2016, it's highly unlikely that congress is going to shift to the left enough to let him just pad the SC with whoever he wants.",2,0,1441784047,1444731388
cuv5wc9,0,t1_cuv5c8e,CompactedConscience,"Do you see anyone on the left not complying with the Citizen's United ruling? What about not complying and then claiming that they are being oppressed when they face legal sanctions for it? 

The supreme court leans conservative right now. There have been dozens of decisions that outraged liberals in both the Roberts and Rehnquist courts. I can't think of a single time that liberals did anything like this, but I could very well be missing something. ",14,0,1441765256,1444731388
cuv5xi5,0,t1_cuv5wc9,houinator,"> Do you see anyone on the left not complying with the Citizen's United ruling? What about not complying and then claiming that they are being oppressed when they face legal sanctions for it?

Lois Lerner comes to mind.",-8,0,1441765309,1444731388
cuv5yu5,0,t1_cuv5xi5,CompactedConscience,"Just googled it, and can not figure out what you are talking about. 

Edit: After 5 minutes of additional googling, I still can't find anything remotely analogous about anything Lois Lerner ever did. ",12,0,1441765370,1444731388
cuv6hqk,0,t1_cuv5yu5,TheNaBr,"Lois Lerner ran the IRS program that targeted conservative Political Action Non-profits for additional scrutiny, audits, intrusive questionnaires, and delayed approval.  Basically locked them out of an election cycle of advocacy.",-12,0,1441766224,1444731388
cuvd8bq,0,t1_cuv6hqk,question_all_things,"Oh my god.  This was such a non event.  I have no tears for these motherfuckers.  At the same time you had republican groups pulling all kinds of bullshit.  They deserved what they got because their team was playing bad.

If you told republicans they could have 1,000 slaves they'd ask if there was retroactive immunity.

Consistently year after year they have pulled the dirtiest shit and gotten away with it in the courts and media.  It's really disgusting.  Then they put on a nice tie and tell us all how much they love america and jesus.  Truly makes me sick that people like this exist.",-2,0,1441782166,1444731388
cuvgx5g,0,t1_cuvd8bq,secondsbest,"Let me preface by saying I'm a liberal myself, but the IRS targeting anyone using anything but accounting forensics was more than a non event. ",5,0,1441797748,1444731388
cuvh30p,0,t1_cuvgx5g,WhiteyDude,"If I started a tax exempt organization titled something like Taxed Enough Already, I'd expect extra scrutiny from tax collection agency. ",-2,0,1441798299,1444731388
cuvhcvz,0,t1_cuvh30p,secondsbest,"A bit more due diligence by an investigator because of a heuristic decision is one thing, but management made policy for the targeting of innocent until proven guilty groups is not acceptable practice of a government organization. ",2,0,1441799211,1444731388
cuvhiuz,0,t1_cuvhcvz,WhiteyDude,They scrutinized the organization's applications a little closer. Nobody was denied due process of law.,0,0,1441799713,1444731388
cuviw7r,0,t1_cuvhiuz,,[removed],-1,0,1441803364,1444731388
cuv6oio,0,t1_cuv6hqk,CompactedConscience,"Yeah, I know about the Lois Lerner scandal. I am having trouble figuring out how she is at all relevant. My point was that liberals tend to disagree with a lot of SCOTUS rulings, but then they comply with them. Lois Lerner seems to be nonsequiter. Her actions clearly weren't grounded in a disagreement with Citizens United. She didn't allegedly target donations from large corporations. The allegations were that she targeted certain political groups. If all claims made about her are true, then she was motivated by partisanship. 

I would argue with your claims about what she actually did, but I really don't want to derail this thread. ",9,0,1441766545,1444731388
cuv7gd9,0,t1_cuv6oio,TheNaBr,">My point was that liberals tend to disagree with a lot of SCOTUS rulings, but then they comply with them.

Everyone *tends* to disagree but complies.  Kim Davis is a Democrat herself.  

>Her actions clearly weren't grounded in a disagreement with Citizens United.

Sure seems like they were considering the PACs were the ones that specifically gained the right to organize by Citizens United.

>I would argue with your claims about what she actually did, but I really don't want to derail this thread.

Okay.  I was just letting you know the reference to Lois Lerner.",-14,0,1441767914,1444731388
cuv7ofy,0,t1_cuv7gd9,CompactedConscience,">Everyone tends to disagree but complies. Kim Davis is a Democrat herself.

She is clearly not a liberal, though. I was making an idealogical distinction and not a partisan one. She is clearly not complying with a decision and republicans are supporting her in that. Nothing like that happened on the left. 

Was Lois Lerner targeting all pacs? Or just certain ones? Again, if she was legitimately was acting out of disagreement with Citizens, why stop at conservative pacs? It is pretty obvious that wasn't the issue at play here. ",12,0,1441768329,1444731388
cuv8m5i,0,t1_cuv7ofy,TheNaBr,">Nothing like that happened on the left.

Well sure, when you get to define what the left means to you at any turn.  I'm guessing you're saying that she's not a liberal because she's religious.  I'd say that that is more the issue at stake with this story than marriage licenses.  The reason Republicans supported her is because Christians are no longer welcome to the Left/Liberals/Progressives.  

>Was Lois Lerner targeting all pacs? Or just certain ones? Again, if she was legitimately was acting out of disagreement with Citizens, why stop at conservative pacs?

Funny enough, Lois Lerner's defense was that she was targeting non-conservative PACs.  It was just disproportionately targeting Conservative Tea Party PACs.

",-12,0,1441770110,1444731388
