id,is_root,parent_id,author,body,score,score_hidden,created_utc,collected_utc
cv230qq,1,t3_3l0as3,kingvitaman,"One thing to remember that most of the refugees are middle and upper class. Those are the only who can afford to escape the country. There are also stark differences between the US and Europe in terms of middle eastern immigration and how they are processed. In France they are likely to live in a ghetto, in the US, they're likely to be your doctor. Now I know these are refugees, but I think those with the resources to get to the US will be at the top of the heap. Germany is taking 800,000 , if you want a case study of pros and cons I think that would be a better example. ",10,0,1442297017,1444728720
cv23nwx,0,t1_cv230qq,creativeusername55,"So the US is only taking those that can afford to escape? Is there a source showing this? And yes Germany has said they will take 500,000 a year for every year that it is needed; however, even though a case study would prove very interesting and Germany would be a great focus for one, I am more concerned with current pro and con arguments as case studies require time to understand long term effects ",4,0,1442299103,1444728720
cv2tekc,0,t1_cv23nwx,feyrband,"> So the US is only taking those that can afford to escape? Is there a source showing this?

i haven't researched this at all, but it appears quite sound, logically. getting half way across the world isn't cheap.",1,0,1442353077,1444728724
cv22rst,1,t3_3l0as3,SapCPark,"The Con argument is that we are taking on 10,000 poor people who we will need to provide for years if not decades till they are back on their feet via taxes.  They will be a drain on societies resources and may not end up benefiting our country in the long term.  There is also the fear that these refugees may harbor Islamic extremists in their ranks by chance and once in the US they can organize and commit terrorist attacks.  

The Pro is they need our help and we have been a country that has in the past welcomed those in need with open arms.  On the Statue of Liberty it says ""Give me your tired, hungry, and poor"" and its a motto that our country has lived up over and over in the past.  10,000 Syrians will cost at most 500 million dollars per year to help (If you assume the total aid is 50,000 per person which is likely an overestimate after a year).  In a budget of over 3 trillion dollars, that is peanuts.  Also their is the empathy side.  If we had a major disaster that forced millions of us to leave, we would want a country like Canada to help and protect us.  These refugees are in dire need of help, and as a rich nation, its the least we can do to take them in.  ",17,0,1442296262,1444728724
cv2bdce,0,t1_cv22rst,BrawnyJava,"The other con is that they will not integrate.  Some of their children will grow up hating the united states and will want to kill us.  I don't think the benefits come anywhere near matching the drawbacks.  We should not accept these people.",-1,0,1442325268,1444728724
cv2d05q,0,t1_cv2bdce,SapCPark,Integration has never been an issue w/ any minority group in the US.  Why should it be now.  ,2,0,1442328186,1444728724
cv2cyt4,0,t1_cv2bdce,uncannylizard,Have you ever been to the USA? Muslims are incredibly well integrated in the USA. ,10,0,1442328122,1444728724
cv2duye,0,t1_cv2cyt4,BrawnyJava,"I live in Denver.  I can think of three would be jihadists who were children of immigrants who were radicalized at Denver area mosques.  The guy who drove a truck from Denver to NYC to bomb times square was sentenced last year.  That's not ""incredibly well integrated"".  ",-1,0,1442329569,1444728724
cv2e62l,0,t1_cv2duye,uncannylizard,"They are. You are listing a trivial list of events. Virtually every other immigrant community causes way more damage to american society than that. Thousands of people are gunned down by hispanics every year, for example. By contrast the amount of deranged or violent muslims in the USA is miniscule. They are one of the most successful groups in the USA and widely regarded as one of the best integrated. ",6,0,1442330071,1444728724
cv2eiug,0,t1_cv2e62l,BrawnyJava,It's only trivial to you because your legs weren't the ones blown off.,-4,0,1442330657,1444728724
cv376cn,0,t1_cv2eiug,slam7211,Go visit Deereborne Michigan,1,0,1442379863,1444728724
cv38zqk,0,t1_cv376cn,BrawnyJava,"I really have no desire to visit there, at all.  ",1,0,1442385294,1444728724
cv2f6tt,0,t1_cv2eiug,uncannylizard,"This is the type of appeal to emotion that I am used to getting from you people. No evidence, no actual argument. Yes it sucks to die from terrorism. It also sucks to be raped. It sucks to have your child be raped and killed. It sucks to be torn in half by a drunk driver. It sucks to be robbed at gunpoint. A lot of things suck. You can't point to one single example of something happening and then think you have an argument. You don't. If we could just cite one example of an Irish person doing something bad and then exile them all back to Ireland, then we would have kicked them out centuries ago. Same with africans, hispanics, italians, chinese, japanese, etc. 

If you think that muslims are causing some unprecedented amount of harm then make that argument. Referencing one single crime does absolutely nothing for your argument. Show us a few thousands terrorism related murders by muslim immigrants in america and then demonstrate how thats vastly worse than the crimes (statistics) done by other immigrant groups. Then you will have an argument. I somehow strongly doubt that you will be able to do this because no such evidence exists. Muslims are much more peaceful in the USA than virtually any other group. ",7,0,1442331734,1444728724
cv2gv5y,0,t1_cv2f6tt,BrawnyJava,"You are making a subjective determination that it doesn't matter.  It matters to lots of people.  You don't get to decide for everyone else.Terrorism isn't like street crime.  I don't want to live in a police state, but a police state is what we have built in response to homegrown jihadis.  Stop letting in people who want to kill us, and we can get rid of the surveillance state.",0,0,1442334381,1444728724
cv2h23c,0,t1_cv2gv5y,uncannylizard,"> You are making a subjective determination that it doesn't matter. It matters to lots of people. You don't get to decide for everyone else.

Of course not. We live in a liberal democracy. I'm making an argument against you and saying that your argument is incoherent. I'm not forcing you to do or believe anything. 

> Terrorism isn't like street crime. 

Explain why. Why are 10,000 murders a year acceptable (UK has 50 btw), but 2 people dying from terrorism a year is the end of the world? This makes zero sense. Its hysteria and illogical thinking.

> I don't want to live in a police state, but a police state is what we have built in response to homegrown jihadis. Stop letting in people who want to kill us, and we can get rid of the surveillance state.

The police state is entirely optional. its not a rational response to the problem of terrorism. The special measures taken by the TSA/NSA have stopped a whopping 0-10 terrorist attacks or something like that. If you don't like the police state then vote against it. Banning all muslim immigrants is a completely illogical response to the problem. There is nothing more harmful about muslim immigrants than other types of immigrants. In fact muslim immigrants are distinctly less harmful. ",3,0,1442334674,1444728724
cv2jg1r,0,t1_cv2h23c,BrawnyJava,"Ten thousand murders a year isn't acceptable.  But its also irrelevant.  We have to fix that because its already a problem.  We can prevent the terrorism problem by not letting in the people who will become terrorists.  Yes we can treat lung cancer, but its better to not smoke.

And its not 2 or 3 a year.  Terrorists have killed thousands of americans in the last 15 years.  And more to the point, its not the body count.  Its the response to terrorism vs street crime.  I can no longer bring a backpack to 5k race, because of terrorism.  I can no longer bring golf clubs or water on a plane.  I can't chekc out a book from the library without ending up on a list.  And on and on.  I haven't lost too many freedoms from street crime, but I have lost a lot to terrorism.  

Then there's the money issue.  The US has spent hundreds of billions domestically on surveilance, and trillions on wars in response to terrorism.  Shutting down cities like Boston or NY for days after a terrorist attack causes billions in lost business and taxes.  That's absurd.  If we spent that money on education or social programs, we could put a dent in the 10k street murders.  We don't shut down a city when there's a drive by that kills 4 people.  We don't even notice.

Terrorism is nothing like street crime.  Congress doesn't lose their shit and start making secret FISA courts when a drive by happens.  They do when terrorism happens.  Don't compare terrorism to street crime because they are not comparable in how the rest of society and government reacts to them.  

The hard solution to this problem is to let these people in, then build a police state to watch them and us.  The easy solution is to turn them away. ",0,0,1442338330,1444728724
cv2kfcy,0,t1_cv2jg1r,uncannylizard,"> Ten thousand murders a year isn't acceptable. But its also irrelevant. We have to fix that because its already a problem. We can prevent the terrorism problem by not letting in the people who will become terrorists. Yes we can treat lung cancer, but its better to not smoke.

So explain to me why we don't ban all immigration. Do you think that there are a group of immigrants somewhere in the world who commit to murders or crimes in the USA? Why don't we just ban all immigrants? Don't treat lung cancer, just don't smoke right? 


> And its not 2 or 3 a year. Terrorists have killed thousands of americans in the last 15 years.

Wow this is incredibly low and you know it. You are trying to tie terrorism in general to these immigrants and you have absolutely no justification for doing so. You know full well that the vast majority of terrorism is not from muslim immigrants. 9/11 was committed by foreigners, not immigrants. The Oklahoma city bombing was committed by a non-immigrant. No crime ever committed by a muslim immigrant approaches those two crimes. Its honestly despicable for you to slander these people in such a dishonest way. 


And more to the point, its not the body count. Its the response to terrorism vs street crime. I can no longer bring a backpack to 5k race, because of terrorism. I can no longer bring golf clubs or water on a plane. I can't chekc out a book from the library without ending up on a list. And on and on. I haven't lost too many freedoms from street crime, but I have lost a lot to terrorism.


And as I have explained that response is ridiculous and disproportionate. Street crime is many times larger of a threat than terrorism. Even if we had 1 9/11 every year street crime would still be a much greater threat. The measures that you don't like such as not taking golf clubs on planes is a choice that some hysterical people made, it has nothing to do with what is necessary to combat terrorism. The hysteria about terrorism is hysteria, its not logical in any sense. You advocating the banning of muslim immigrants is hysteria. Also you are again trying to conflate all terrorism with muslim immigrants, people who haven't committed any major acts of terrorism in the USA. 


The rest of your comment basically repeats your previous points. You continually A) act like the correct response to hysteria is to ban all of these immigrants rather than reduce the hysteria, and B) you somehow think that muslim immigrants are the cause of terrorism. They are not. All major acts of terrorism here homegrown (not immigrants) or were done by foreigners.",1,0,1442339814,1444728724
cv2oc58,0,t1_cv2kfcy,BrawnyJava,">So explain to me why we don't ban all immigration. 

Because only a small, easily identifiable portion of the immigrants to our country blow things up.  

>You are trying to tie terrorism in general to these immigrants and you have absolutely no justification for doing so. 

Were the Tsarnaev brothers immigrants?  Yes.  Was Nidal Hassan an immigrant, or the child of one?  Yes.  Did Germany catch an ISIS operative sneaking in as an immigrant?  YES.  There's the justification.  And I'm sure there are more.  

>9/11 was committed by foreigners, not immigrants. 

There's no meaningful difference betweeen those two words.  If you walk across the border, you're an undocumented immigrant.  If you overstay your visa, undocumented immigrant.  I supposed if you intend to go home, you're a foreigner.  

>Its honestly despicable for you to slander these people in such a dishonest way.

The best defense to accusations of slander is the truth.  

> Street crime is many times larger of a threat than terrorism.

In your opinion, but not mine.  

>Even if we had 1 9/11 every year street crime would still be a much greater threat. 

Bullshit.  If we had that, Congress would throw people into camps like they did in the 40's.  Nobody would work in an office building over 3 stories.  Our economy would grind to a halt.  

>is a choice that some hysterical people made, it has nothing to do with what is necessary to combat terrorism. 

Yes, I agree.  But neither you nor I can do a damn thing about Congress setting up FISA courts, wiretaps, lists, and spending billions on stupid shit.  What we can control is letting these people it.  

>rather than reduce the hysteria

What's your plan, and how will it prevent us from losing more freedoms.  It has to be a damn good plan that deals with the reality of Congress and how they react to terrorism.  Change my mind.

>you somehow think that muslim immigrants are the cause of terrorism

What do Nidal Hassan, Mohammed Atta, the Tsarnaevs, the times square bomber (and on and on) have in common besides their religion?",1,0,1442345643,1444728724
cv2xs7a,0,t1_cv2oc58,uncannylizard,"> Because only a small, easily identifiable portion of the immigrants to our country blow things up. 

And other immigrant groups do far worse things. You have yet to explain why this one group is different. They objectively do less bad things than other groups. 

> Were the Tsarnaev brothers immigrants? Yes. Was Nidal Hassan an immigrant, or the child of one? Yes. Did Germany catch an ISIS operative sneaking in as an immigrant? YES. There's the justification. And I'm sure there are more. 

Jesus christ man. You named three incidents. We are talking about a region of around a billion people (western world) and you are listing off 3 incidents that killed a COMBINED 3 people. Its sheer insanity. The problem is so incredibly tiny that it should not even be uttered in the list of major problems facing our societies. And you are using this to justify banning ALL people from a religion from coming here. I am speechless. 


> There's no meaningful difference betweeen those two words. If you walk across the border, you're an undocumented immigrant. If you overstay your visa, undocumented immigrant. I supposed if you intend to go home, you're a foreigner. 

We are are talking about legal vetted immigrants who went through normal security procedures. We arent talking about illegal immigrants or foreigners. 


> In your opinion, but not mine. 

I am just not able to respond to this. Its unfathomable to me that you think that the deaths of 3 or so people is comparable to the deaths of 10,000 every year. 


> Yes, I agree. But neither you nor I can do a damn thing about Congress setting up FISA courts, wiretaps, lists, and spending billions on stupid shit. What we can control is letting these people it... What's your plan, and how will it prevent us from losing more freedoms. It has to be a damn good plan that deals with the reality of Congress and how they react to terrorism. Change my mind.

We can do it. We live in a democracy. If you elect someone to stop these activities they will do it. Its not complicated. Its no different than getting the government to stop all muslim immigration. One requires the government to be rational about security. The other requires the government to abandon liberal values. I dont see why you think the former is more realistic than the latter.

> What do Nidal Hassan, Mohammed Atta, the Tsarnaevs, the times square bomber (and on and on) have in common besides their religion?

Nice, you select 4 people with similar traits and then you ask what they have in common. How clever. How about you explain why you arent including Dylann Roof, Timothy McVeigh,  Adam Lanza, Seung-Hui Cho, or the thousands of gang/crime related murders that take place every year by non-immigrants and non-muslim immigrants? ",1,0,1442360610,1444728724
cv34mdv,0,t1_cv2xs7a,BrawnyJava,"> You have yet to explain why this one group is different. They objectively do less bad things than other groups. 

You're missing the point, probably deliberately.  I'm not measuring the danger these people pose by *body count*.  I'm measuring it by *freedom lost* and *wasted money*.

Some group of Mexican gangbangers killing other gangbangers doesn't change our society.  Planes crashing into buildings does change our society permanently, and causes us to spend money on stupid shit like invasions and TSA.  

>And you are using this to justify banning ALL people from a religion from coming here

I didn't say that.  I just don't want to take a bunch of people claiming to be refugees from a part of the world infested with islamist jihadists.  

>Its unfathomable to me that you think that the deaths of 3 or so people is comparable to the deaths of 10,000 every year. 

If you look beyond the body count, at the ways our society is permanently harmed, they aren't comparable.  

>We can do it. We live in a democracy. If you elect someone to stop these activities they will do it. Its not complicated. 

I have seen zero evidence that the electorate is capable of electing leaders who are rational about these things.  Following any kind of attack, either mass shooting by schizo guy or muslim guy, elected officials feel tremendous pressure to DO SOMETHING.  Never let a tragedy go to waste.  That's the nature of elected office, and its not going to change.  The only practical way to lessen the risk to our liberty is to less the risk of terrorists reaching our soil.  And better mental health care, but that's besides my point.  

>How about you explain why you arent including Dylann Roof, Timothy McVeigh, Adam Lanza, Seung-Hui Cho,

Because nobody is talking about letting in large groups of foreign white supremacists and schizophrenics.  If such a group showed up at the border, of course I would want them sent home.  

We currently have no way of keeping radicals out, and no way of stopping hate filled jihadi preachers from radicalizing other peaceful muslims.  The children of these refugees will be ripe for radicalization, and we have no way of stopping it, or even knowing about it.  

Letting them in benefits the US in no way, and puts us at substantial risk of loss of freedom.  ",1,0,1442372840,1444728724
cv2br9z,0,t1_cv22rst,ZenerDiod,"> On the Statue of Liberty it says ""Give me your tired, hungry, and poor"" and its a motto that our country has lived up over and over in the past.

While I agree with taking in refugee, I find what's written on a statue a horrible argument for policy. That worked when we were in demand for low skill workers, we are not in excess of them.",1,0,1442325985,1444728724
cv2dfsy,0,t1_cv22rst,Lambchops_Legion,">They will be a drain on societies resources and may not end up benefiting our country in the long term.

Economic research shows that low income legal immigrants (which is what they'd be) [are a net positive to the economy in the long term](http://www.nber.org/papers/w19932), [put in more than they take get out](http://www.vox.com/2015/8/17/9164725/immigration-and-wages-impact), provide other benefits such as [stabilizing local labor demand shocks](http://www.nber.org/digest/nov13/w19272.html),  and how [immigrants are more likely to entrepreneurial](http://www.nber.org/chapters/c13502.pdf) so they are able to [raise labor demand](http://www.nber.org/papers/w21123).

From that last study in 2015:

>Each immigrant creates 1.2 local jobs for local workers, most of them going to native workers, and 62% of these jobs are in non-traded services. Immigrants appear to raise local non-tradables sector wages and to attract native-born workers from elsewhere in the country. Overall, it appears that local workers benefit from the arrival of more immigrants.

Look, I'm willing to accept that the ""drain on society"" will come from a non-economic perspective, but anytime anyone says that immigrants are a drain on economic resources, no one is able to provide me actual economic research that proves such. It seems like it's all coming from populist rhetoric, but I'll keep an open mind if you can show me data that proves otherwise.",4,0,1442328889,1444728724
cv2dl8m,0,t1_cv2dfsy,SapCPark,"I wasn't talking economic resources, I was talking about government resources initially.  I absolutely agree w/ you in the long term these refugees will help the economy.",1,0,1442329135,1444728724
cv2b1aq,0,t1_cv22rst,zigmeister22,"> will cost at most 500 million dollars per year to help (If you assume the total aid is 50,000 per person which is likely an overestimate after a year). In a budget of over 3 trillion dollars, that is peanuts.

How many schools could be built with $500 million?  Also, how will countries with ""bad"" governments (e.g. dictatorships) ever change if we keep acting as a pressure release valve for them?  Also, why are we accepting refugees from Syria, but not from some African countries where things are just as bad?

The truth is Assad is happy that these people are leaving Syria and finding homes elsewhere.  ",10,0,1442324637,1444728724
cv2c512,0,t1_cv2b1aq,iamelben,">How many schools could be built with $500 million? Also, how will countries with ""bad"" governments ever change if we keep acting as a pressure release valve for them? Also, why are we accepting refugees from Syria, but not from some African countries where things are just as bad?

What value added will 10,000 immigrants, many of whom are skilled laborers (doctors, lawyers, engineers, etc.), add to our economy?  If you're making an economic argument, most economists agree that immigration is almost ALWAYS a boon to the destination of that immigration.
",4,0,1442326673,1444728724
cv2dvgx,0,t1_cv2c512,epicwinguy101,"I doubt enough of them are doctors and lawyers and engineers to add back even $100,000,000 per year.  Controlled, steady-state immigration is definitely a different situation than a surge of low-skill refugees, especially if said refugees don't integrate.  ",2,0,1442329594,1444728724
cv2hmpq,0,t1_cv2dvgx,uncannylizard,"A) many of these immigrants are skilled workers. These are syrian refugees, not economic migrants.

B) muslim immigrants typically integrate exceedingly well in the USA

C) low skilled workers are not bad for the economy. ",4,0,1442335555,1444728724
cv28bm7,1,t3_3l0as3,pankpankpank,">It is understood that US accepts about 70,000 refugees a year; yet, the US has always kept a low cap on Syrian refugees. Why is this? And why are so many people concerned about admitting any amount of Syrian refugees altogether? Is it because there is a higher risk of bringing in Syrians due to the possibility of a homeland security threat as many articles have mentioned?

Every year, the President and Congress set a ""[cap](https://www.whitehouse.gov/the-press-office/2014/09/30/presidential-memorandum-fy-2015-refugee-admissions)"" on the amount of refugees they plan to allow into the country on a regional basis. FY 2015 was 70,000 as you know, and broken down like this:

*Africa................................17,000
*East Asia.............................13,000
*Europe and Central Asia................1,000
*Latin America and Caribbean............4,000
*Near East and South Asia..............33,000
*Unallocated Reserve....................2,000 

After their initial arrival, the vast majority of their resettlement is handed off to various NGO's *NOT* the government. They are not a burden on our system at all. 

Between immigration and refugees, we regularly take in an astronomically higher number of people than these mere 10,000 refugees. Think about it, its only 10,000 people. 10,000 people fit into a medium sized concert venue. That number is sadly miniscule. 

This poses absolutely no increase in the threat to our national security from foreign terrorists by bringing in these refugees. This is a backwards talking point that the GOP and those against allowing refugees into the country are using as a scare tactic. Every one of the 10,000 refugees is screened through the Department of State as the first step in the admissions process. Therefore, any terroristic threats are hyperbole 
",5,0,1442318210,1444728724
cv2xr78,0,t1_cv28bm7,Usaftergrad,Do you know any specific NGO's I can contribute to?,1,0,1442360560,1444728724
