id,is_root,parent_id,author,body,score,score_hidden,created_utc,collected_utc
cvahp7s,0,t1_cvahfsy,Sollexs,"so should we ban all luxury items with no real positives other than having more convenience for their owners? That is a huge flaw in your thought process.

Also like I showed in the last link, you can make these larger magazines. So you are not getting rid of them from people who wish to do harm, just people who obey the law. I am tired of idiots who just want to ban everything they don't like.

Opinion: people who want to ban things don't understand how the real world works, are naive and should open their eyes.",2,0,1442948570,1444725967
cvahswe,0,t1_cvahp7s,Kelsig,"If there is substantially more downsides and danger caused by an item than positives, yes, they shouldn't be easily accessible. 

",-1,0,1442948720,1444725967
cvahyfg,0,t1_cvahswe,Sollexs,"However there is none of that provable here, yet you still naively want to ban it?

What danger dose a 30 round magazine possess over 3 10 round mags welded together? How would you ban it? How would you enforce it? would it be worth the time and money it takes to round up hundreds of millions of magazines for no real benifit? Would you go about it like New York, where you could own a 10 round magazine but could only load it to 7 because they said so?

Your thought process is rubbish.",2,0,1442948951,1444725967
cvai43r,0,t1_cvahyfg,Kelsig,"bro criminals ain't gonna weld 3 mags together

>would it be worth the time and money it takes to round up hundreds of millions of magazines for no real benifit?

Just stop most production / sales of it ",-1,0,1442949180,1444725967
cvai57f,0,t1_cvai43r,Sollexs,"Yea they would if they saw a need to, they make their own guns for fucks sake.

http://www.thefirearmblog.com/blog/2014/06/16/australian-police-10-firearms-seized-homemade/",2,0,1442949221,1444725967
cvai7no,0,t1_cvai57f,Kelsig,"Then let them to that, *responsible gun owners* can as well!",-1,0,1442949320,1444725967
cvaiema,0,t1_cvai7no,Sollexs,"however since they are banned, if a responsible gun owner did that, they would be a criminal...

flawed logic is flawed, unless you are suggesting there are no such things as responsible gun owners, then I would have to point you to simple statistics proving there are.... You gun control people are all the same, no logic, all feelings.",2,0,1442949585,1444725967
cvajrqx,0,t1_cvaiema,Kelsig,"I think they should be illegal to sell, not to have. ",0,0,1442951527,1444725967
cvajt4q,0,t1_cvajrqx,Sollexs,"How would that be enforced? With the hundreds of millions currently in circulation, there is no way that there won' be some for sale.

And it would make a ban on them pointless.

 I don't follow this logic at all.",2,0,1442951583,1444725967
cvajw42,0,t1_cvajt4q,Kelsig,"Sure, there would be black market dealing. Never said otherwise.",0,0,1442951702,1444725967
cvak6nl,0,t1_cvajw42,Sollexs,then why bother banning in the first place? so you just want it to be illegal in name while everyone still owns / buys / sells them? makes the thought of banning pointless and just feel good bullshit.,2,0,1442952117,1444725967
cvak99w,0,t1_cvak6nl,Kelsig,"If that's what you got out of my comment, sure.",-1,0,1442952223,1444725967
cvakg4i,0,t1_cvak99w,Sollexs,"This is what I got out of it-

You want to ban the sale of these magazines.

You don't care that they will still be bought and sold.

You don't care that people will still own hundreds of millions of them.

You don't care that the supply would not decrease, they just could not be acquired from a store.

This solves what? This stops bad people from getting them how?

This makes sense how?

Much like your want to ban something for no real reason, other than you don't like it, you don't seem to apply much logic to this.",2,0,1442952508,1444725967
cv9cxsq,0,t1_cv9c9ic,ThrowinStacks,"""Balanced"" relative to the rest of the democratic party, not republicans. Still, I believe anti-gun is an overly broad term when you compare him to politicians that wish to ban civilian gun ownership entirely. I don't agree with his position on the AWS, but I'm not a single-issue voter.",9,0,1442864789,1444725967
cv9fmx4,0,t1_cv9cxsq,Ysance,">Still, I believe anti-gun is an overly broad term when you compare him to politicians that wish to ban civilian gun ownership entirely.

Which politician is advocating for this? Even martin o'malley isn't that crazy.",9,0,1442868860,1444725967
cv9gqn6,0,t1_cv9fmx4,ThrowinStacks,"It's usually in watered-down statements, like we need ""policies that will get guns off the streets.""
http://www.ontheissues.org/2016/Hillary_Clinton_Gun_Control.htm",4,0,1442870593,1444725967
cv9hyrb,0,t1_cv9gqn6,Sollexs,"or being spoken from dianne feinstein's lips.

She is still in office. She has said on record that she wants all guns banned.",6,0,1442872554,1444725967
cv9m7hw,0,t1_cv9gqn6,Ysance,"Yes, my point was just that no presidential candidate is stupid enough to come out and say directly that they want to ban all civilian gun ownership.

I think that in practice there is very little difference between hillary's stance on guns and bernie's stance. The rhetoric is slightly different but their goals are similar, ban all guns which are designed for killing people, and leave only weapons which are clearly designed for hunting. Bernie has come out and publicly said that is his goal.

To claim that bernie is substantially less anti gun than Hillary is to ignore his rhetoric and vote record.",8,0,1442879781,1444725967
cv9vkgf,0,t1_cv9m7hw,Quierochurros,Ignore his record? Until the assault weapons ban the NRA loved him.,0,0,1442896122,1444725967
cv9yfra,0,t1_cv9vkgf,Ysance,In one race they supported him over his opponent.  1994 changed all that when he voted for the assault weapon ban. 1994 was a long time ago.,2,0,1442904412,1444725967
cv9dccu,0,t1_cv9c9ic,syncopator,"I'm very pro-2nd Amendment and I will give him a pass on that one.  I get why he supports it, even if it is stupid.

He voted against the Brady Bill, voted against longer waiting periods, and voted to protect gun manufacturers from product liability lawsuits.

He very vocally supports mental health care availability and ending the war on drugs over gun control as a way to curb gun violence.",13,0,1442865394,1444725967
cv9hca6,0,t1_cv9dccu,Braver_Incident,He also vocally supported the banning of all guns including handguns unless they had the singular purpose to hunt,5,0,1442871546,1444725967
cv9htjf,0,t1_cv9hca6,Standupaddict,Can I get a source on this?,1,0,1442872320,1444725967
cv9hy2j,0,t1_cv9htjf,Braver_Incident,https://www.reddit.com/r/PoliticalDiscussion/comments/3f35em/yesterday_bernie_sanders_changed_his_stance_and/?,4,0,1442872524,1444725971
cv9hpe1,0,t1_cv9hca6,syncopator,"Citation please.

I have not heard that once from Sanders, and if it is in fact true I will stop supporting him.",3,0,1442872131,1444725971
cv9hs2x,0,t1_cv9hpe1,Braver_Incident,"https://www.reddit.com/r/PoliticalDiscussion/comments/3f35em/yesterday_bernie_sanders_changed_his_stance_and/?

",7,0,1442872253,1444725971
cv9icps,0,t1_cv9hs2x,syncopator,"His words: ""certain types of guns used to kill people, exclusively, not for hunting, they should not be sold in the United States of America"".

Your words: ""He also vocally supported the banning of all guns including handguns unless they had the singular purpose to hunt""
",0,0,1442873184,1444725971
cv9ir8s,0,t1_cv9icps,Braver_Incident,"Handguns are not exclusively used for hunting...

Have you even used a gun before?",8,0,1442873861,1444725971
cv9ljmr,0,t1_cv9ir8s,syncopator,"I don't think you know who you are talking to.

Odds are that I have fired more rounds than you.  I would venture I have fired more rounds through my 1911 than you have from anything.",-4,0,1442878614,1444725971
cv9pq4z,0,t1_cv9ljmr,Shotgun_Sentinel,Except you don't realize that Bernie would ban that very 1911 you have.,6,0,1442885633,1444725971
cv9q4o1,0,t1_cv9pq4z,syncopator,"Oh bullshit.  There is nothing in Bernie's statement on Meet the Press nor in anything he has ever said about guns that would indicate he wants to ban handguns.  I know you want to hear it in what he says, but it isn't there.

This is also the same Sanders who voted to allow firearms on Amtrak trains, voted to protect firearm manufacturers from product liability lawsuits, voted against the Brady Bill, and voted for instant background checks instead of waiting periods.",0,0,1442886275,1444725971
cv9rihk,0,t1_cv9q4o1,Shotgun_Sentinel,"> Oh bullshit. There is nothing in Bernie's statement on Meet the Press nor in anything he has ever said about guns that would indicate he wants to ban handguns.

Did you not read the quote? Ban all guns made specifically for killing. That means combat handguns, like glocks, HKs, and SIGs. There is no hunting purpose for pocket and sub compacts, but his statement means that he would be up to banning them. Also the last AWB included guns with rails on the spring housing.

Its is blatantly obvious that he and other democrats want to attack the right to self-defense. Maybe you are just too Fudd to see that though.

>This is also the same Sanders who voted to allow firearms on Amtrak trains, voted to protect firearm manufacturers from product liability lawsuits, voted against the Brady Bill, and voted for instant background checks instead of waiting periods.

First off the Brady bill was instant background checks. Lastly you sound exactly like all the Obama voters from last time around. ""He is basically pro-gun"". Give me a fucknig break. Lie to yourself but not to me.",5,0,1442888571,1444725971
cv9y9kv,0,t1_cv9rihk,syncopator,"I think you and I have gotten off on the wrong foot.  Probably my fault.  This is the very first time I have found myself anywhere near this side of the argument, and it ain't easy.  Feel free to browse my post history and you will find me supporting the 2A time and time again.

Let's suspend for a moment the details of what Sanders did and didn't say, and instead share some common ground.  We both agree that gun control won't work, right?  I'll bet we both agree that it won't work because criminals by definition don't give a fuck about the law.

There is a problem.  Denying that will in the long term ensure our rights are taken away.  Maybe it is time we become part of the solution.

I will again bet that we agree the vast majority of gun violence in the US is drug/gang related.  The school/mall/theatre shootings are a different (and much smaller statistically) category all together.  One is socio-economic and the other is a mental health issue.

First, the drug/gang crime problem.  The War on Drugs has failed, and so has locking up a higher percentage of our population than any developed country in the world.  Why?  Because if you are born into a situation where the only people who have any real ""quality of life"" are the ones who use guns to take it from others, that is what you learn to respect.  But, truth be told, while gun violence in this segment of society accounts for probably 75% of the total, nobody gives a fuck because it's in the ghetto.  The only time it counts is when it gets added in to the statistics.

The mental health shootings are the ones that make the headlines, and subsequently trumpet the calls for more laws to make it go away.  Of course in every case, no one can specify what new laws would have prevented anything but there must be something to make us feel better, right?

Our country is getting more urban every day.  That isn't going to change.  At the same time, the pressures of society are getting so weird we are starting to act like rats in overpopulated cages.  That isn't going to change either.  The idea that we can simply stand up and shout ""Second Amendment!"" towards anyone who says ""gun control"" is going to become antiquated by circumstances.  It will work until about two-thirds of the population wants to ban all the guns, and the Second Amendment will simply go away.

The reality is that we need to solve the problems.  You and I agree that the problems aren't guns, the problems are the people using them.

If we end the War on Drugs, we drain the profitability of using guns to defend drug territory.  A lot of people got shot over moonshine about a hundred years ago, but the idea seems ridiculous now.  

If we make mental health care easy to find for people who need it, we might actually stand a chance of stopping people from doing seriously crazy shit.  It's obvious that just making crazy shit (like shooting up movie theaters) illegal doesn't work.

Now back to the man in question.  Sanders is the only candidate who wants to do both these things.  He is the only one who wants to actually solve the problems that you and I agree are at the root causes of the issue.  Hillary sure as fuck doesn't want to.  Her donors won't stand for it.  Trump wants to solve a lot of things, but these two issues definitely aren't among them.  The rest of the field isn't really worth mentioning.

If we don't start coming up with solutions to the problem, we *will* eventually be subject to someone else's solution.  And have no doubt about it, the ""pry it from my cold dead hands"" approach is not going to work.

So, I will end this remarkably long diatribe with a simple question:

What if the most effective form of gun control isn't actually gun control at all?",-2,0,1442903802,1444725971
cv9ydz5,0,t1_cv9y9kv,Shotgun_Sentinel,"The solution to the problem has nothing to do with guns, which you have said, the problem is many people think it is. We combat this by educating people in every corner in America. My problem is that people are making the same mistake with Bernie that they did with Obama, except Bernie has actually support gun control. If he gets an easy win against a Republican, this could very well embolden the progressives like they were when Obama won the last election. 

I am not sure if you remember the attitude of all of the reporters after Obama won the second time. They acted like a new age was ushering in, and that there was no reason to care about real compromise. This of course came crashing down when Sandy Hook didn't go how they wanted. So they started their long game. They have been disparaging the NRA and the gun culture as lone extremists, and many people hold this attitude.",5,0,1442904230,1444725971
cv9yq00,0,t1_cv9ydz5,syncopator,"I wish education stood a chance of changing those attitudes.  I think it's time to realize it doesn't.  The urbanization of America will continue, and it becomes a numbers game.

We can't stop the next Sandy Hook by standing here with our rights in our hands.  How many more will it take for uninformed and irrational public sentiment to simply overwhelm the Second Amendment?

You are right that the media has started their long game.  We haven't.  If we don't, they will win.

So I ask you, what should our long game be?

(We should keep this going, I think it's good to get some ideas out there)",-1,0,1442905469,1444725971
cv9zbyo,0,t1_cv9yq00,Shotgun_Sentinel,"> I wish education stood a chance of changing those attitudes. I think it's time to realize it doesn't. The urbanization of America will continue, and it becomes a numbers game.

Which is why we need to educate urban people the usefulness of guns in the right hands.

>We can't stop the next Sandy Hook by standing here with our rights in our hands. How many more will it take for uninformed and irrational public sentiment to simply overwhelm the Second Amendment?

If people are educated then their emotions wont get the best of them.

>You are right that the media has started their long game. We haven't. If we don't, they will win.

Our long game is to educate and share our hobby. Part of the medias plan was to shame gun owners and force them into hiding. This worked in the 90s before the internet help social circles branch out. This is how my home state got hopelessly anti-gun. Believe it or not however more and more people are getting into shooting even in NJ, and it isn't as taboo to talk about guns now, which is helping to spread the hobby despite the gun laws.",4,0,1442907947,1444725971
cvab7jk,0,t1_cv9zbyo,syncopator,"Can we educate away the gang violence?  I don't see how.

The mental health issue is even tougher.  There is no ""teaching"" someone out of mental illness.  And unfortunately these types of shootings generate magnitudes more anti-gun sentiment than street violence, even though they are a very small percentage of the total.",1,0,1442938947,1444725971
cvap5my,0,t1_cvab7jk,Shotgun_Sentinel,"> Can we educate away the gang violence? I don't see how.

You fix gang violence with socio-economic fixes, not gun control. Also gun violence is dropping everywhere.

>The mental health issue is even tougher. There is no ""teaching"" someone out of mental illness.

I don't think you understand what I mean by educating. I mean we educate people to realize that gun violence is not tied to gun control, but instead other issues, so they use other methods to lower gun violence.

>And unfortunately these types of shootings generate magnitudes more anti-gun sentiment than street violence, even though they are a very small percentage of the total.

It only has this effect on the uneducated.",1,0,1442959714,1444725971
cvairnt,0,t1_cvab7jk,Sollexs,">Can we educate away the gang violence? I don't see how.

Maybe, I see ending the drug war more of a way to end gang violence, cut the flow of money and the gang will eventually disband.

>The mental health issue is even tougher. There is no ""teaching"" someone out of mental illness. And unfortunately these types of shootings generate magnitudes more anti-gun sentiment than street violence, even though they are a very small percentage of the total.

And that is why hospitals should be encuraged to share their info more with the NCIS background check system, granted most of the mental health shooters stole their weapons. Maybe we could educate the people taking care of mental cases a better way to keep firearms from them? It is indeed a much harder question.
",1,0,1442950090,1444725971
cv9iyk9,0,t1_cv9ir8s,Pseudonymical,"I think you need to re-read the sentence and take the commas into note. I'll try to restate it in a less confusing way. He said that if a gun's only purpose is to kill other people then it should be banned, but if a gun can be used for hunting, that's okay.
I don't blame you for misreading because this is the way he talks out loud, and when you put it to writing the places were pauses are supposed to be can get a little confusing if you aren't reading closely.",0,0,1442874203,1444725971
cv9j33j,0,t1_cv9iyk9,Braver_Incident,That still bans handguns and a selection of certain rifles,1,0,1442874414,1444725975
cv9q8fy,0,t1_cv9iyk9,Frostiken,"Tell me what's kind of guns you think he's talking about, then.",8,0,1442886448,1444725975
cvaw0z0,0,t1_cv9q8fy,Pseudonymical,"I'm just here to clarify the reading of a sentence, not get into a debate about what kind of gun Bernie Sanders thinks should or should not be banned.",1,0,1442971878,1444725975
cv9bejt,0,t1_cv99yvl,eliminate1337,"There are no nuclear reactors that don't produce waste. Even fusion reactors produce waste by irradiating themselves with neutrons. Luckily, nuclear waste isn't too difficult to deal with. In my opinion, dumping it in subduction zones in the ocean is ideal. The way we currently store waste (in pools of water at nuclear plants) works just fine. ",8,0,1442862509,1444725975
cv9c07q,0,t1_cv9bejt,ThrowinStacks,You are correct. I've corrected my original comment for better accuracy.,2,0,1442863403,1444725975
cv9d05d,1,t3_3lty3f,Blarglephish,"The non-GMO stance really bugs me. It's become really popular - especially in more liberal areas - to make GMO foods out to be scarier or worse than they really are by using dubious studies, weak correlations, and bad science to try and tie GMOs to things like cancer and autism - and then to call it 'science'. See [Mamavation](http://www.mamavation.com/) for an example of this. Without even attempting to cite refute every single example, there is no established or accredited study that shows that GMO foods are less healthy, or more harmful, than non-GMO foods. I'm not saying its not possible, either: its just that the proof hasn't come out yet. 

I also don't like Bernie's official stance (and a popular stance taken by advocates of non-GMO foods) that we should add non-GMO labeling to all packaged foods, because its in the best interest of consumers, and its something consumers should know. Why bother adding it, if not for an implicit accusation that there is something about GMO foods that would give you cause not to buy them? Everything that we require food producers include on their labeling is there because of a direct and specific health and safety consideration: things like nutritional value and ingredients have direct and specific health risks. Even in states like mine (WA), where we have added calories counts to restaurant menus, was made because of an established public health concern (battling obesity rates). GMO foods have no such safety or health concern  (none recognized by any federal, state, or local government entity), and until any such organization does publicly cite an official declaration of a health and safety concern about GMO foods, then there is no credible reason to require food producers to add such labeling. We do not ask unreasonable demands of businesses because of fear-mongering.

So yes - I am a Bernie fan, but I do find his stance on GMOs very frustrating.",10,0,1442864885,1444725975
cv9vb1g,0,t1_cv9d05d,norablindsided,"GMO use is great when it adds nutrients to foods. However, lately it has been used by seed manufactures as a way of hurting farmers. Monsanto specifically has a large legal division to simply make sure farmers aren't using their seeds. Its a big issue when a farmer is next to someone using round up ready seeds and the seeds blow into their field. They then get sued by Monsanto for having their seeds in their field.

GMO patents are the biggest problem, and while we do know that most GMO foods are perfectly safe for consumption what we don't really know are the long term environment impacts with certain GMO seeds.

While we would like to think that GMO is for more nutrition most of the time its for round up ready crops.",0,0,1442895514,1444725975
cvaae32,0,t1_cv9vb1g,Blarglephish,"Ehh, I don't think GMO foods are really for boosting nutrients. I realize that the majority of GMOs are for increasing yield, breeding disease resistant crops, or (in the case of Monsanto) making pesticide resistant crops. GMO patenting is a whole issue that I don't want to get into. How do you patent a living thing? I'll let the supreme court decide on that one. I'm also aware of Monsanto's tactics they use against farmers, which is ethically immoral at best, but most likely criminal to some degree; its unfortunate that most farmers just can't afford to put up the legal fees to mount a defense against a company the size of Monsanto.

However, all of this shouldn't affect the labeling of the food. The stuff on labels is for health and safety concerns. What it shouldn't be is a political symbol, which is what GMO labeling advocates really seem to want instead.

",1,0,1442937681,1444725979
cva1x7f,0,t1_cv9vb1g,dtiftw,"No farmer has ever been sued over accidental contamination. Ever. 

This is why I'm opposed to GMO labeling. The people in favour of it are uninformed and regularly spread misinformation.",4,0,1442919808,1444725979
cva27zn,0,t1_cva1x7f,norablindsided,https://www.rt.com/usa/monsanto-patents-sue-farmers-547/,-1,0,1442920928,1444725979
cva2d95,0,t1_cva27zn,dtiftw,"RT is propaganda and completely misrepresents the case. I know you just googled and copied the first link, so I'll explain. 

OSGATA is an organic trade group. They sued Monsanto over the issue of contamination. During the oral arguments, they admitted they couldn't find a single case where Monsanto sued a farmer over trace contamination. The ruling also didn't give Monsanto license to sue farmers. By saying they wouldn't take legal action in cases of trace contamination, it's a binding estoppel that the farmers can use as a defense. 

>JUDGE DYK: No, no, no. What is the answer to my question? Is there an example of a suit that they have brought based on contamination by trace amounts?

 

>MR. RAVICHER:  We’re not aware of them filing such a suit.

",3,0,1442921438,1444725979
cva3rou,0,t1_cva2d95,norablindsided,"Interesting I'll have to look into this more. I did see one case [Monsanto v Schmeiser](https://en.wikipedia.org/wiki/Monsanto_Canada_Inc_v_Schmeiser#Patent_rights_versus_property_rights).

But that case seems kinda iffy. Apparently over 95% of his crops were round-up ready crops, and that doesn't happen with just having seeds naturally into your field. Those had to have been planted.

I do think it is an issue that the possibility of a suit does exist. Could it be possible that a suit could be settled out of court?",1,0,1442925566,1444725979
cva3z0i,0,t1_cva3rou,dtiftw,"Anything is possible. But considering there's no evidence of it happening, but there is a huge incentive for anti-Monsanto activists to pretend there is, I'm extremely skeptical.

It's easy to paint Monsanto as some huge corporate behemoth that's untouchable. But Schmeiser was able to raise a sizeable legal fund and he actually stole the seeds. I can't imagine an actual innocent farmer hasn't come forward yet. They'd have all the resources they need.",2,0,1442926072,1444725979
