id,is_root,parent_id,author,body,score,score_hidden,created_utc,collected_utc
cv0jdbp,1,t3_3ku6i0,lollersauce914,So every time there's been nativist sentiment in US politics (which has gone on pretty regularly forever) it's been the harbinger of fascism?,12,0,1442184845,1444729314
cv0k2ef,0,t1_cv0jdbp,Memetic1,It is one of the warning signs yes. You have to look at the whole package to really get an understanding though.,-5,0,1442186079,1444729314
cv0kfs3,0,t1_cv0k2ef,lollersauce914,"Alright, in total i see a candidate taking advantage of voters who feel abandoned by their party, just one of many politicians who has done that kind of thing to position himself as an outsider untainted by ""corruption"" in dc. Was jackson a fascist? Zachary taylor? Eisenhower? 

Trump is a terrible candidate with terrible ideas, but he is not a fascist.",1,0,1442186748,1444729314
cv0u47c,0,t1_cv0k2ef,BoiseNTheHood,It's sad that the left has become so oikophobic that any candidate who even implies that they love this country is the next Hitler in waiting to you.,3,0,1442204727,1444729314
cv11ur9,0,t1_cv0u47c,Memetic1,The fact that he had leading Neo-nazis at his rally isn't a clue I suppose.,-2,0,1442232687,1444729314
cv1dum3,0,t1_cv11ur9,Tsuruta64,So did Ron Paul. Was Ron Paul a fascist?,2,0,1442254152,1444729314
cv1e11z,0,t1_cv1dum3,Memetic1,"He is drawing these people to him like flys to shit.
http://www.huffingtonpost.com/entry/donald-trump-white-supremacists_55dce43ee4b08cd3359dc41a",0,0,1442254427,1444729314
cv1faj6,0,t1_cv1e11z,Tsuruta64,And so did Ron Paul. Does this mean that Ron Paul was a fascist?,1,0,1442256369,1444729314
cv1fhqj,0,t1_cv1faj6,Memetic1,From what I am aware of he never made racist remarks or policy's.,1,0,1442256670,1444729314
cv1k64o,0,t1_cv1fhqj,Tsuruta64,........are you serious? Did you never hear about the controversy over his newsletters?,1,0,1442263749,1444729314
cv1krhl,0,t1_cv1k64o,Memetic1,Nope not a big of his. If he is making those sort of remarks then I have no interest in him as a politician. ,1,0,1442264667,1444729314
cv1g3yu,0,t1_cv0u47c,Captainobvvious,"OP seems to be a liberal nut but let's not assume the vast majority of liberals think loving your country is a bad thing. 

",1,0,1442257609,1444729314
cv199rl,0,t1_cv0u47c,zoidberg1339,">oikophobic

Thanks for teaching me a new word. That's a good one.",2,0,1442247088,1444729314
cv0kcxt,0,t1_cv0k2ef,joe_navark,Humor us and tell us why Trump is a real according-to-Hoyle fascist and not just another blowhard.  We're all about the nuance here. ,5,0,1442186601,1444729314
cv0jcmg,1,t3_3ku6i0,iflyboats,We've reached the stage of intellectuality in America where most people just reflexively label anything they don't like as fascist.,15,0,1442184812,1444729314
cv0k1j9,0,t1_cv0jcmg,Memetic1,"Fascism is something very specific actually. From google define
fas·cism
ˈfaSHˌizəm/Submit
noun
an authoritarian and nationalistic right-wing system of government and social organization.
synonyms:	authoritarianism, totalitarianism, dictatorship, despotism, autocracy; More
(in general use) extreme right-wing, authoritarian, or intolerant views or practice.",-7,0,1442186037,1444729314
cv0n8lk,0,t1_cv0k1j9,Braver_Incident,"Fascism isn't well defined, but that is not necessarily fascism.

Fascism functions on the belief of class collaboration, as opposed to class destruction from its socialist counterparts.  It also functions on the idea that the state must grow to survive, thus justifying the imperialism that these days we are reluctant to acknowledge but actively participate in. Fascism believes in creating and emphasizing societal roles. Fascism wants to create a powerful state that takes control of its economy, and uses ultranationalism and other forms of manipulation (racism, religion) to unite the people.  The most important thing in all of this is that this isn't a degeneration of any ideology, it is accepted, it IS the ideology.

The US is not fascist. It will not be fascist because we elect Trump.",2,0,1442192032,1444729314
cv11u9o,0,t1_cv0n8lk,Memetic1,Neither was Germany before Hitler was elected. Germany was a democracy. I can't believe I am having to tell you this.,-2,0,1442232647,1444729314
cv196e7,0,t1_cv0n8lk,arrowminded,"rounding up 12 million people,most who have built families and lives here, over 45 percent whom own homes,only to expel and to steal their home land and valuables is at the least facist. and to also expel those who were born here making them defacto citizens is maniacal.  but i guess its ok because mexicans are inferior. if it was 12 million blue eyed blonde haired norwegian women with big titties here illegally trump would be licking their feet. ",0,0,1442246942,1444729314
cv0pl4x,0,t1_cv0jcmg,cassander,we reached that stage in [1934](https://en.wikipedia.org/wiki/House_Un-American_Activities_Committee#Special_Committee_on_Un-American_Activities_.281934-1937.29),2,0,1442196114,1444729318
cv0kaq9,0,t1_cv0jcmg,joe_navark,That's just what a fascist would say,6,0,1442186494,1444729318
cv0jm9t,1,t3_3ku6i0,,[deleted],4,0,1442185289,1444729318
cv0k3c5,0,t1_cv0jm9t,Memetic1,Well I have an opinion here. I'm sorry if that isn't politically correct to you.,-10,0,1442186125,1444729318
cv19atq,1,t3_3ku6i0,zoidberg1339,"And of course the only solution is to FEEL THE BERN, right OP?",3,0,1442247136,1444729318
cv1am0i,0,t1_cv19atq,Memetic1,"Or have a serious discussion in your own political party. With the demographic shifts that are occurring currently. Namely most of your base starting to die out. The republicans really need to re-examine there core assumptions. It's actually kind of sad that the right doesn't have any candidates that have any chance at this point. Hell Romney had more broad base support, and that was still an embarrassment for you guys.",1,0,1442249174,1444729318
cv1btc0,0,t1_cv1am0i,BoiseNTheHood,"> Hell Romney had more broad base support

Millions of Republicans stayed home on election day because they were so opposed to Romney.  Mittens was a textbook example of the establishment forcing an unlikeable candidate down the throats of the base.",1,0,1442251045,1444729318
cv1c543,0,t1_cv1btc0,Memetic1,And what is going to happen if Trump doesn't get the nomination?,1,0,1442251544,1444729318
cv1c98d,0,t1_cv1c543,BoiseNTheHood,"If it's another establishment turd like Jeb, I fully expect him to get even less votes than Romney (assuming Jeb is facing Hillary or Biden in the general).",1,0,1442251718,1444729318
cv0mh4n,1,t3_3ku6i0,Precursor2552,"Ugh I wish that site would get taken down. IIRC the guy who made it as no intellectual credits, no publishing credentials, and isn't a professor. 

Anyone can write 14 shitty points that makeup 'Fascism.' Hell get Ask Historians or Ask Political Scientists to write up something endemic to Fascism and you'd probably get something better than that guy. 

Rechecked the website. It's actually worse than I recall. Astral Projection? Seriously? That should be a big clue it's absolute worthless garbage. ",2,0,1442190632,1444729318
cv11tk9,0,t1_cv0mh4n,Memetic1,"> Fascism
It is not just this guy. Here is a video from WW2 talking about despotism
https://www.youtube.com/watch?v=bY8GzJNuz7I",0,0,1442232590,1444729318
cv1w5k6,0,t1_cv11tk9,Precursor2552,"Despotism and Fascism are different things. And if you want to argue the US is creeping towards despotism you can go grab Lincoln and FDR to argue your point far better than crap like Trump. 

Further that video isn't from WWII. The whole thing of the company is throwback to yesteryear. The writing on the videos should be a hint 'emergency podcast system' being a rather blaring neon sign. 

Peer-Reviewed Journal Articles or a publication from a respected authority.",1,0,1442283466,1444729318
cv2ervp,0,t1_cv1w5k6,Memetic1,"Wait you do realize that the person who hosted that video added that in right?
You don't really think the government would bother to put up something from 60 years ago?

You seem really desperate to prove that Trump is not a potential threat to democracy. I mean come on he wants to strip American citizens of there citizenship. What exactly is the point of getting rid of Birthright citizenship? Why is it that if you try to put one gun law in place it's a threat to our freedom. This guy wants to get rid of a whole amendment, and it is just fine.
",1,0,1442331059,1444729318
cv30bl7,0,t1_cv2ervp,Precursor2552,"Actually I hate Trump, he's the 2nd worst candidate in the field (barely edging out Sanders) IMO. 

But what I hate even more than any candidate is people who use terms with no understanding of them. Fascism, Despotism, Totalitarianism, and Autocracy all have meanings. You cannot use them interchangeably. Nor can you google search the definitions and find them from some insane blog. 

If you think denying someone citizenship even though they are born in your country is Fascism then you've got some major issues with a lot of states, hell nearly all of them. But I mean I've lived in the UK for a few years so I guess Fascism isn't so bad, and I visited Ireland it didn't seem like a hellhole either, that was even back when they legalised all the drugs. 

It's identified as 'based on' so if your going to insist supply the guys credentials (I couldn't find them) and the original. or again better yet Peer-Reviewed article or a respected authority (Freedom House tending to be my preferred one). ",1,0,1442365027,1444729318
cv98a49,0,t1_cv30bl7,Memetic1,http://www.globalresearch.ca/donald-trump-and-the-ghosts-of-totalitarianism/5477104,1,0,1442857750,1444729318
cv13emp,1,t3_3ku6i0,HeloRising,"Trump doesn't really have an ideology.

He's ranted off some half-baked solutions (I use the word loosely) to undocumented immigration but beyond that I really haven't seen him come out with very much. Wisecracks are not political positions.",1,0,1442236659,1444729318
cv13o21,0,t1_cv13emp,Memetic1,I think we have to take his position on ISIS/ Iraq bloody seriously. If this nitwit becomes commander in chief he could end up sending many soldiers to there deaths. His idea about stealing Iraqs oil is horrendous.,1,0,1442237251,1444729318
cv1c75w,0,t1_cv13o21,BoiseNTheHood,"His idea of taking the oil sounds a lot like the [letters of marque and reprisal](http://legal-dictionary.thefreedictionary.com/Letter+of+marque+and+reprisal) that Congress is allowed by the Constitution to issue during times of war.

""A commission granted by the government to a private individual, to take the property of a foreign state"" - in other words, send in a bunch of PMCs to take the oil.",1,0,1442251631,1444729318
cv1cio7,0,t1_cv1c75w,Memetic1,So a bunch of PMCs versus the whole country of Iraq. The logistics on that alone would be hell. Not to mention the fact that it would rightfully cause an international uproar.,1,0,1442252120,1444729318
cv141dk,0,t1_cv13o21,HeloRising,"It's the same stock position that most of the Republican candidates have. There really isn't anything unique about it.

And don't sweat, he won't make it. If he lasts as a viable candidate through January I'd be amazed.",1,0,1442238035,1444729318
cv1e528,1,t3_3ku6i0,Mentioned_Videos,"Videos in this thread: [Watch Playlist &#9654;](http://sbtl.tv/_r3ku6i0?feature=playlist)

	VIDEO|COMMENT
	-|-
[Bernie Sanders' Character and view on Rights exposed](https://youtube.com/watch?v=tBIKP4W50-I)|[3](https://reddit.com/r/PoliticalDiscussion/comments/3ku6i0/_/cv0qt8h) - You could literally do this for every candidate.  Here&#39;s Bernie:  Sexism: &quot;A woman enjoys intercourse with her man — as she fantasizes being raped by three men simultaneously.&quot;  More sexism: &quot;Sexual adjustment...
[White Power at a Donald Trump Rally](https://youtube.com/watch?v=c4_UiUrRcbg)|[1](https://reddit.com/r/PoliticalDiscussion/comments/3ku6i0/_/cv1e3n1) - As for the source here is a video of one of the incidents.  
[Fun with Fascism](https://youtube.com/watch?v=bY8GzJNuz7I)|[1](https://reddit.com/r/PoliticalDiscussion/comments/3ku6i0/_/cv11tk9) -  Fascism It is not just this guy. Here is a video from WW2 talking about despotism   
I'm a bot working hard to help Redditors find related videos to watch.
***
[Info](https://np.reddit.com/r/SubtleTV/wiki/mentioned_videos) | [Chrome Extension](https://chrome.google.com/webstore/detail/mentioned-videos-for-redd/fiimkmdalmgffhibfdjnhljpnigcmohf)",1,0,1442254601,1444729318
cv0n8vo,1,t3_3ku6i0,adimwit,"This isn't fascism. There are relatively few people who could be defined as such because fascism is also an economic system rather than just nationalist rhetoric.

Fascism was a system where labor unions and managerial associations (the capitalists) had power to manage major industries with state oversight. Literally no one advocates this in the U.S.",1,0,1442192046,1444729322
cv11o3q,0,t1_cv0n8vo,Memetic1,"Excuse me Hitler hated labor unions, and communism. Go read your fake history books somewhere else.",1,0,1442232135,1444729326
cv13f75,0,t1_cv11o3q,adimwit,"Hitler hated unions, but he didn't create the corporatist system in Germany. The Social-Democrats did. When he came to power he drastically altered the system, smashing communist unions but building state unions reserved for Aryans.

Mussolini was different. He was a former Marxist, and the Fascist movement were largely working class military veterans who were sympathetic to socialism. This was because during WWI, the military drafted a ton of urban workers to fight. After the war, when the socialist movement split, tons more workers flocked to fascism. The notorious beatings and union smashing we see from Italian fascism was due largely to the agrarian Fascists who were simply hired thugs for the landowners. The urban Fascists were workers who were largely sympathetic to socialism. When the Fascists took power in Italy, they had union leaders, socialists and even Marxists working in the government.",1,0,1442236697,1444729326
cv1bw87,0,t1_cv11o3q,BoiseNTheHood,"Hitler hated unions so much that he made them [an official arm of his government.](https://en.wikipedia.org/wiki/German_Labour_Front)

He did hate communism, that much is true, but he was also an outspoken opponent of capitalism.",3,0,1442251167,1444729326
cv1cm28,0,t1_cv1bw87,Memetic1,A mandatory union that was basically another aspect of the Nazi party is not an actual workers labor union. This thing that you brought up was a union in name only.,1,0,1442252264,1444729326
cv1cz4t,0,t1_cv1cm28,BoiseNTheHood,"You could say the same thing for ""private corporations"" under Hitler and Mussolini.  The means of production were privately owned on paper only.  The government held all the substantive powers of ownership over the major industries and called all the shots.

Hopefully you're starting to see why labeling politicians you don't like as ""fascist"" is just ignorant.  Fascism is a specific system of government and economics that bears no resemblance at all to our system.  

If you're looking for a modern-day fascist, Kim Jong-un comes to mind.  You can dislike Trump all you want, but if you really think he's at all comparable to Kim Jong-un, you're crazy.",2,0,1442252810,1444729326
cv1defd,0,t1_cv1cz4t,Memetic1,"Not currently he is not comparable, however you give a megalomaniac the power of the US and it could get real ugly real fast. What happens when he tries to fire congress because they hurt his feelings. By the way I use the exact definition of fascism as it stands. It's not my fault that the right has ignored what the word actually means. Also Trump keeps a copy of Hitlers works in his place. His supporters include Neo-Nazis and people who joke about wanting to take a vacation where they hunt undocumented people. The man is a blatant racist/  sexist. 

fas·cism
ˈfaSHˌizəm/Submit
noun
an authoritarian and nationalistic right-wing system of government and social organization.
synonyms:	authoritarianism, totalitarianism, dictatorship, despotism, autocracy; More
(in general use) extreme right-wing, authoritarian, or intolerant views or practice.

Oh and here is a Wikipedia article on this. https://en.wikipedia.org/wiki/Fascism",1,0,1442253464,1444729326
cv1dlhh,0,t1_cv1defd,BoiseNTheHood,"> Not currently he is not comparable, however you give a megalomaniac the power of the US and it could get real ugly real fast.

We just gave a megalomaniac the power of the US in the last two elections.  Things could be better, but we're still not fascist.

> What happens when he tries to fire congress because they hurt his feelings.

What happens when he doesn't?

> By the way I use the exact definition of fascism as it stands.

The exact definition of fascism is not ""an opposing party's candidate who I don't like.""

> Also Trump keeps a copy of Hitlers works in his place.

The Art of War is one of the most popular books of all time among businessmen - does that mean they all aspire to be ancient Chinese warlords fighting literal wars?

> His supporters include Neo-Nazis

Source? Also, Neo-Nazis probably buy toilet paper, does that mean Quilted Northern is fascist?

> The man is a blatant racist/sexist. 

He isn't.  He just hurts your feelings, apparently.",2,0,1442253764,1444729326
cv1dpok,0,t1_cv1dlhh,Memetic1,"fas·cism
ˈfaSHˌizəm/Submit
noun
an authoritarian and nationalistic right-wing system of government and social organization.
synonyms:	authoritarianism, totalitarianism, dictatorship, despotism, autocracy; More
(in general use) extreme right-wing, authoritarian, or intolerant views or practice.",1,0,1442253943,1444729326
cv1dswj,0,t1_cv1dpok,BoiseNTheHood,"If Trump was a totalitarian dictator, he wouldn't waste time running for president.",1,0,1442254082,1444729326
cv1dzu6,0,t1_cv1dswj,Memetic1,Hitler was elected by a democratic vote.,0,0,1442254377,1444729326
cv1e843,0,t1_cv1dzu6,BoiseNTheHood,"Actually, he lost the election to Hindenburg.  He wormed his way into the government through backroom deals.  His party couldn't get anything more than a weak plurality of the vote until the Reichstag Fire gave them an opening to start rigging elections and banning opposing parties.",2,0,1442254729,1444729326
cv1ehsu,0,t1_cv1e843,Memetic1,"Wow it's almost like what is going on now with gerrymandering, election fraud, and the plutocracy buying our political leaders.",0,0,1442255140,1444729326
cv1eoeo,0,t1_cv1ehsu,BoiseNTheHood,Don't break your arms reaching that much.,1,0,1442255428,1444729326
cv1wazo,0,t1_cv1dswj,dickwhitman69,Does that same logic apply to Barry O?,1,0,1442283689,1444729326
cv98doq,0,t1_cv1dlhh,Memetic1,http://www.globalresearch.ca/donald-trump-and-the-ghosts-of-totalitarianism/5477104,1,0,1442857898,1444729326
cv1e3n1,0,t1_cv1dlhh,Memetic1,"As for the source here is a video of one of the incidents.
https://youtu.be/c4_UiUrRcbg",1,0,1442254538,1444729326
cv0o02h,0,t1_cv0n8vo,circlebrock,"> Fascism was a system where labor unions and managerial associations (the capitalists) had power to manage major industries with state oversight. Literally no one advocates this in the U.S.

That's corporatism (which has nothing to do with modern corporations).

",2,0,1442193345,1444729326
cv0o6z6,0,t1_cv0o02h,adimwit,Exactly. Mussolini said over and over that you can't have Fascism without corporatism. Which makes that whole 14 points list totally irrelevant.,2,0,1442193682,1444729326
cv0l8k6,1,t3_3ku6i0,KabIoski,"It's a bit early to be worried about fascism, he's just a blowhard.  

That said, the fact that he's a really thin skinned guy who considers people who criticise him to be enemies, surrounds himself with lackeys who tend to cross lines to defend him, and has built his political image around demonizing a minority group as the cause of our problems is pretty scary. That's EXACTLY the kind of guy you don't want having a ton of power.  The idea of Donald Trump having the secret service, drones, wiretapping abilities and the US armed forces at his disposal is a dangerous prospect. I doubt he'd hesitate to use any or all of those for political gain or petty revenge if given the opportunity. ",0,0,1442188253,1444729326
cv0lg1t,1,t3_3ku6i0,TheDildoWarrior,"Does Trump want to synthesize all the components of society with the state?

I mean, is there any indication that he is a totalitarianist?",0,0,1442188650,1444729326
cv0m1uv,0,t1_cv0lg1t,,[deleted],2,0,1442189825,1444729326
cv0m7ti,0,t1_cv0m1uv,TheDildoWarrior,\^ right-wing hysterics above,-1,0,1442190139,1444729326
cv0m578,1,t3_3ku6i0,Memetic1,"Here it is point by point all in Donalds own words

#5 sexism “You know, it really doesn’t matter what the media write as long as you’ve got a young and beautiful piece of ass.”

#9 corporate power is protected “The concept of global warming was created by and for the Chinese in order to make U.S. manufacturing non-competitive.”

#1 Powerful and continuing nationalism When was the last time anybody saw us beating, let's say, China in a trade deal? They kill us. I beat China all the time. All the time.”

#3 Identification of enemies/ scapegoats The U.S. will invite El Chapo, the Mexican drug lord who just escaped prison, to become a U.S. citizen because our ""leaders"" can't say no!

#7 Obsession with national security ""When Mexico sends its people, they're not sending the best. They're not sending you, they're sending people that have lots of problems and they're bringing those problems with us. They’re bringing drugs. They’re bringing crime. They’re rapists. ... And some, I assume, are good people.""

#12 Obsession with Crime and Punishment Our great African American President hasn't exactly had a positive impact on the thugs who are so happily and openly destroying Baltimore!

#2 Disdain for the Recognition of Human Rights  “The only kind of people I want counting my money are little short guys that wear 
yamakas every day.”

#5 again Rampant Sexism ""If I were running 'The View,' I'd fire Rosie [O'Donnell]. I mean, I'd look her right in that fat, ugly face of hers, I'd say, 'Rosie, you're fired.'""

#9 Corporate power is protected “If you can’t get rich dealing with politicians, there’s something wrong with you.”

#4 Supremacy of the Military “We build a school, we build a road, they blow up the school, we build another school, we build another road they blow them up, we build again, in the meantime we can't get a f------ school in Brooklyn.”

#3 Identification of Enemies/Scapegoats as a Unifying Cause “I saw a report yesterday. There’s so much oil, all over the world, they don’t know where to dump it. And Saudi Arabia says, ‘Oh, there’s too much oil.’ Do you think they’re our friends? They’re not our friends.”

#5 Again with the sexism and narcissism as well All the women on The Apprentice flirted with me — consciously or unconsciously. That’s to be expected.”

The list goes on and on. I suppose if you really have an invested interest in seeing Trump as the second coming of Christ it's not going to matter. So I am going to stop there.",-3,0,1442190005,1444729326
cv0o7m7,0,t1_cv0m578,Snedeker,That's quite a bold statement you're making.,1,0,1442193714,1444729326
cv0qt8h,0,t1_cv0m578,BoiseNTheHood,"You could literally do this for every candidate.  Here's Bernie:

Sexism: [""A woman enjoys intercourse with her man — as she fantasizes being raped by three men simultaneously.""](http://www.npr.org/sections/itsallpolitics/2015/05/29/410606045/the-bernie-sanders-rape-fantasy-essay-explained)

More sexism: [""Sexual adjustment seemed to be very poor in those with cancer of the cervix.""](http://www.mediaite.com/online/bernie-sanders-once-blamed-cervical-cancer-on-a-lack-of-orgasms/)

Corporate power is protected: [Bernie's firmly in bed with the sugar industry's lobbyists.](http://www.forbes.com/sites/jaredmeyer/2015/08/25/sanders-rubio-support-costly-sugar-subsidies/)

Nationalism: [Bernie bellows that he remembers a time when you could walk into a department store and ""buy things made in the U.S.A.""](http://www.nationalreview.com/article/421369/bernie-sanders-national-socialism)

Scapegoating: This is just too easy.  He can't go two sentences without blaming something on the rich, the 1%, or the oligarchy.

Militarism/National Security: [He (Bernie) sends out mailings to veterans that supports the US having ""the strongest military in the world,"" while praising our sacrifices as veterans ""for the freedom of Americans.""](http://www.libertyunionparty.org/?page_id=363)

Disdain for Human Rights: [Bernie thinks you can delegate rights you don't have.](http://www.youtube.com/watch?v=tBIKP4W50-I)

OMG guys, 90% of Redditors are literally Hitler!",3,0,1442198353,1444729326
