id,is_root,parent_id,author,body,score,score_hidden,created_utc,collected_utc
cux7k9x,1,t3_3kgjql,FlareCorran,"Yes.

The pro-life movement sponsors over 2,500 crisis pregnancy centers in the US (significantly more than the number of abortion clinics.) Those centers provide a large number of services, including resources for adoption, financial and material support and counseling.

That's not including the enormous number of church programs across the country that are geared toward helping new mothers, even those who don't attend the church.",44,0,1441920652,1444730370
cux7lwg,0,t1_cux7k9x,shutupshuttinup,"Can you provide me with names of any of the organizations, links, etc.?

I found [this](https://en.m.wikipedia.org/wiki/Crisis_pregnancy_center) on Wikipedia; some pretty disturbing practices, it seems.",-1,0,1441920725,1444730370
cuxxsph,0,t1_cux7lwg,xJoe3x,Those types of centers are pretty well known for being very dishonest to patients.  Going so far as trying to trick people into believing it is a location to get an abortion and then lying to them to get them not to go through with it.,0,0,1441982287,1444730370
cux887t,0,t1_cux7lwg,FlareCorran,"I missed your edit.

Like I mentioned, a lot of them are independent, which means trying to describe them all isn't going to be successful. What's more, they intentionally take an adversarial role against Planned Parenthood, an organization that's much better funded than they are (since it's national v. local.) What that comes down to is a lot of advertising and press releases are made about deceptive advertising and other things that rarely have much evidence to back them up. Even when there is, you're talking about a single entity, rather than describing all of them.

The Crisis Pregnancy Center counter would be that Planned Parenthood is acting deceptively by its very nature and point to things like resisting ultrasounds being shown to the patients. As many as 50% of women choose not to have an abortion after seeing an ultrasound, which is arguably why Planned Parenthood doesn't want to show them, even though they are almost always used during surgical abortions.",4,0,1441921747,1444730374
cux8jit,0,t1_cux887t,shutupshuttinup,"Are you talking about the transvaginal ultrasound that Virginia tried to mandate a few years back? Have you heard any of the allegations against crisis centers, connecting breast cancer and abortion, and so on?",1,0,1441922266,1444730374
cuxctc0,0,t1_cux8jit,FlareCorran,"They tried to mandate ultrasounds. That was morphed into a claim that they were mandating transvaginal ones, which aren't terribly common, but when that's the only option, they're typically done already. They're just not shown to the patient. Planned Parenthood is not a reliable source of information. After all, they're the source of the incredibly misleading 3% statistic.",3,0,1441930015,1444730374
cuxdkzd,0,t1_cuxctc0,shutupshuttinup,[About as incredibly misleading as SBA List.](http://www.washingtonpost.com/blogs/fact-checker/wp/2015/08/12/for-planned-parenthood-abortion-stats-3-percent-and-94-percent-are-both-misleading/) And speaking of [incredibly misleading statistics...](http://www.politifact.com/wisconsin/statements/2013/jul/12/rachel-campos-duffy/more-90-women-change-their-minds-about-having-abor/),3,0,1441931401,1444730374
cuxd6zn,0,t1_cux887t,FlyingFistsOfFury,"Could you show me some data backing up your statements about ultrasounds.  Because I have never heard of a Planned Parenthood that ""resisted"" showing ultrasounds to pregnant women.  Resisting laws to require medically unnecessary ultrasounds, sure, but that's far different.",4,0,1441930702,1444730374
cux7pvx,0,t1_cux7lwg,FlareCorran,"A lot of them are independent. [Here's one that my parents give money to.](http://www.hcpcc.typepad.com/) 

Googling ""crisis pregnancy center [town]"" is almost guaranteed to turn up one near you.",14,0,1441920910,1444730374
cux7wj1,0,t1_cux7pvx,shutupshuttinup,I guess I'm wondering about support *after* the birth. A lot of these places seem focused almost exclusively on preventing abortion.,3,0,1441921210,1444730374
cuxtd7x,0,t1_cux7wj1,Battlesnake5,"That is their goal, is it not? This idea that someone cannot oppose what they see as murder without signing on to some welfare agenda is not as contradictory as you guys think it is. ",9,0,1441973003,1444730374
cuxtvau,0,t1_cuxtd7x,shutupshuttinup,"Wouldn't that be the, I dunno, ""Christ-like"" thing to focus on, then? Caring for a life that's already here? It's much less messy to defend a potential life than it is one who needs help at 70, is that it? Cuddle a puppy than care for a mangy, old dog? Every time I think about What Jesus Would Do, it's doing the harder thing, not the easier thing. And if it's ""murder"" you're trying to prevent, why all the opposition to sex education and birth control? It makes no (warning, I'm about to break a Comnandment here) Goddamn sense.",-8,0,1441974371,1444730374
cuxvezy,0,t1_cuxtvau,getfuckingreal,"Where do you draw the line? So I pay my taxes which support welfare programs and donate a hundred dollars to charity every month. I could do more, I could do less. I oppose genocide, does that mean I'm obligated to care for the groups that would be killed? On one end of the spectrum is taking in the child into your home and raising it as your own, the other end is killing the child. One does not need to choose a polar position at one end or the other, most are on the continuum.",5,0,1441977944,1444730374
cuxvo24,0,t1_cuxvezy,shutupshuttinup,"False analogy. No one is pro-proverty or pro-genocide, this side of South Korea or Syria. Here, if you defend a political position, you take responsibility for it.",-6,0,1441978450,1444730374
cuxw1no,0,t1_cuxvo24,getfuckingreal,"Nobody is pro-abortion either. One side is absolutely anti-abortion and the other is ""ok with it if the mother is"". I give money to the poor, and I obligated to give all my money to the poor. A baby without a donation from me is still better off than a dead baby.",3,0,1441979184,1444730374
cuxwbaf,0,t1_cuxw1no,shutupshuttinup,"OK, but as you said, ""where do you draw the line""? If abortion is banned tomorrow, you're gonna rationalize millions more babies without donations, force rape and incest victims to carry to term, and doom mothers to die who can't carry a fetus to term? Interesting morality you got there.",-4,0,1441979682,1444730374
cuycn63,0,t1_cuxwbaf,ThisisClambake,Do you have any idea how small the number of pregnancies that are a result of incest and rape are? It's basically negligible in this discussion.,2,0,1442005613,1444730374
cuxwxk0,0,t1_cuxwbaf,getfuckingreal,"The only relevant concern is mothers who would die if they didn't abort, a decision would have to be made somehow to save one of the two lives since they both cannot be saved. Babies without donations are still better than dead babies. Just because someone was raped to cause the pregnancy does not change the conditions for the unborn child. Also who is a ""victim"" in incest? If there is statutory rape then, it's rape. Brothers/sister/cousin whatever fucking is a victim less crime. There are valid arguments for and against abortion. Now that you mention it tell me about some charities that are pro-choice that help poor mothers raise their children, since after all they are pro-choice not pro-abortion.",2,0,1441980816,1444730374
cuxx8zs,0,t1_cuxwxk0,shutupshuttinup,"Like I said, interesting morality you got there. A father having sex with his daughter is incest; still think it's victimless? A child born by incestuous ""parents"" has serious risks of physical and mental deformity. A rapist can actually sue for custody of the child they forced into their victim in 31 states; are you cool with that, too?",0,0,1441981361,1444730374
cuxxq4t,0,t1_cuxx8zs,getfuckingreal,"Anybody can sue for anything, do you need to explicit prohibit something. There has never been a case of a rapist getting custody, so what's the problem. If the daughter is an adult who cares? If she is a kid then yea, statutory rape/molestation whatever. The age is the concern not the familial relationship. 

You use hyperbole and change the subject because your actual argument doesn't hold water. 

We were talking about how you think that in order to oppose abortion you must also be willing to provide for the child else you are a hypocrite.",2,0,1441982169,1444730374
cuxygz4,0,t1_cuxxq4t,shutupshuttinup,In a land without abortion that you personally advocated for? You bet your ass you're responsible.,-1,0,1441983382,1444730374
cuxyyh8,0,t1_cuxygz4,getfuckingreal,"You have a pretty low view of women if you think their only options when pregnant should be abort or collect charity. Some women (and men) take care of their children themselves, god forbid they do that.",2,0,1441984154,1444730374
cuy1ht3,0,t1_cuxyyh8,shutupshuttinup,"Geez, that's the straw-iest straw man anyone's ever tried to attribute to me. Congrats!",-1,0,1441988032,1444730374
cuy1mi1,0,t1_cuy1ht3,getfuckingreal,You're the one that said women need welfare if they can't have abortions.,2,0,1441988231,1444730374
cuy1y7o,0,t1_cuy1mi1,shutupshuttinup,"*sigh*

No, I'm addressing the fallout from your abortion-less utopia. Raising children costs money and costs tax money, regardless of the mother's financial situation.",0,0,1441988716,1444730374
cuxznfa,0,t1_cuxw1no,gprime,"I'm actually pro-abortion. From an absolute efficiency point of view, I'd rather people use proper birth control and turn to abortion when that fails. But beyond that, when there is a pregnancy, I think most people in most cases should abort. That is more than just being pro-choice.",-1,0,1441985212,1444730374
cuy0l3v,0,t1_cuxznfa,getfuckingreal,"I know you're not alone. I was trying to be politically correct. I think nobody should get an abortion, but that they government shouldn't make laws preventing it, I feel the same way about crack cocaine.",2,0,1441986647,1444730374
cuxu3xf,0,t1_cuxtvau,Battlesnake5,"Nothing you are saying is relevant. It's just the same ol' gotchas the pro-choice side has repeated for decades now. 

The fact is, if you consider something to be murder, you are going to do what you can to prevent it by force. Not having welfare is a far better situation than not having your life. You are just assuming that these people must have a utilitarian materialist view of humanity: that it would be better to just preemptively shut down an ""unborn child"" than to allow it to grow up being miserable. Well, they don't think that way.

Birth control is also pointless to talk about. Nobody is opposing birth control, they just don't want their money being used to subsidize other people's ""sin."" And again we come back to your utilitarian paradigm: they are not going to accept something they see as evil just because it might be the lesser of two evils. ",7,0,1441974983,1444730374
cuxuntc,0,t1_cuxu3xf,shutupshuttinup,"Why are questions ""gotcha questions"" when posed to a conservative? You're basically saying ""yes, I'm a hypocrite, deal with it"". And choosing ""the lesser of two evils"" is something we do every hour of every day. You're really going to tell me that there are conservatives out there that find subsidizing a pill (and fuck yes, there are people opposing birth control and sex for anything other than procreation) more morally repugnant than stopping a ""murder""?

And incidentally, abortion is NOT about saving children from a miserable life, it's about personal autonomy - being able to do with your body and your future as you choose, a concept you'd think conservatives world be on board with. Or is that too ""gotcha"" for ya?",-6,0,1441976304,1444730374
cuxvksv,0,t1_cuxuntc,getfuckingreal,"Your phrased your original posting neutrally, but you clearly have strong views on the subject. There are others that feel differently and  neither side has a monopoly on morality or what is right. 

Tell me why it is hypocritical to oppose abortion if you aren't also willing to provide for the child to some arbitrary standard as well?

Would you say abortion supporters would be hypocritical if they also didn't support the legalization of prostitution, drug use, sports based on death, and the selling of body parts in the interest of body autonomy?",6,0,1441978269,1444730374
cuxvywm,0,t1_cuxvksv,shutupshuttinup,">Tell me why it is hypocritical to oppose abortion if you aren't also willing to provide for the child to some arbitrary standard as well?

So, to borrow from George Carlin, ""if you're pre-born, you're fine, but if you're pre-school, you're fucked""?

>Would you say abortion supporters would be hypocritical if they also didn't support the legalization of prostitution, drug use, sports based on death, and the selling of body parts in the interest of body autonomy?

I'm not trying to stop prostitution, drug use, and if someone wants to lop off their dick and donate it to science, feel free. WTF are ""sports based on death""?",-3,0,1441979036,1444730374
cuxw5gs,0,t1_cuxvywm,getfuckingreal,Like a death match or human hunting with all participants volunteers.,3,0,1441979385,1444730374
cuxwd3n,0,t1_cuxw5gs,shutupshuttinup,"Uh, who exactly is advocating for that? Is Ted Nugent running for Congress?",-1,0,1441979774,1444730374
cuxwr0q,0,t1_cuxwd3n,getfuckingreal,"It's not as popular as the others, what about selling a kidney, you ok with that?",3,0,1441980482,1444730374
cuxwy6c,0,t1_cuxwr0q,shutupshuttinup,"Considering hospitals only use kidneys that are donated, your question is moot.",-1,0,1441980844,1444730374
cuxx4f1,0,t1_cuxwy6c,getfuckingreal,"Because it's illegal to buy or sell kidneys, would you oppose allowing the people that want that to do so? There would certainly be a market for it if it were legal.",6,0,1441981139,1444730374
cuxxe5p,0,t1_cuxx4f1,shutupshuttinup,"Exactly how many examples of things that don't exist are you going to give me to try to salvage your point? There are plenty of reasons not to put kidneys on sale, the least of which being that the donor has to be typed and matched first, so the recipient's body doesn't reject it.",-1,0,1441981608,1444730374
cuxxlxk,0,t1_cuxxe5p,getfuckingreal,"They don't exist **BECAUSE IT'S ILLEGAL**. It is illegal because people don't think your right to your body trumps the societal cost. Do you really think if those laws were abolished that nobody would sell a kidney? You would still need to match up, but a rich guy could get one more easily and that's something people don't like about it. If you believe in body autonomy you should feel more strongly about this even than abortion since in abortion there is another life involved, here it is just you, a kidney is not a separate person. I think you like keeping organ selling illegal because you're a hypocrite, tell me I'm wrong.",4,0,1441981977,1444730374
cuxxwl2,0,t1_cuxxlxk,shutupshuttinup,"What is the societal cost to abortion, other than Christians whinging about a mother and baby they'll never meet? In fact, fetal tissue research actually *saves* lives, not only for babies and adults that are already here, but for fetuses still in the womb that the mother intends to carry to term. Even conservatives back in the Roe v. Wade days didn't want to see fetal tissue go to waste; now pro-life activists lose their goddamned mind if you discuss it over salad.",-2,0,1441982466,1444730374
cuxyj4x,0,t1_cuxxwl2,getfuckingreal,"I don't oppose embryonic stem cell research, but it hasn't saved any lives. No research from embryonic stem cells has led even to a human trial in the 50+ years we've been studying it. If you are going to keep changing the subject I'm getting back to work.",3,0,1441983478,1444730374
cuy1bxr,0,t1_cuxyj4x,shutupshuttinup,"I didn't say stem cell research, I said fetal tissue research, which yes, [has saved and continues to save millions every year.](http://www.cnn.com/2015/07/17/health/fetal-tissue-explainer/)",0,0,1441987778,1444730374
cuy1l2r,0,t1_cuy1bxr,getfuckingreal,Hmm..pretty cool. Can you also get fetal tissue from the umbilical cord?,1,0,1441988170,1444730374
cuy1rxg,0,t1_cuy1l2r,shutupshuttinup,No idea. But I imagine use of the umbilical cord would only benefit umbilical-cord-related issues and/or the blood involved.,0,0,1441988458,1444730374
cuxvfim,0,t1_cuxuntc,Battlesnake5,"Stop being indignant. If you can't deal with disagreement without seeing an enemy (and I'm not even a conservative, you just assumed I was for no reason), you need to sit quietly while the adults talk.

They're gotcha questions because you think you are attacking the consistency of an idea that's only hypocritical when you try to place it in your own value system. Guess what? Pro-life conservatives don't think like you and don't have values like yours.

> And choosing ""the lesser of two evils"" is something we do every hour of every day.

With environmental issues or the minimum wage, maybe. Not with murder. Will you support my plan to have state-run battledomes because they'd be safer for the community than gang warfare on the streets? No, of course you won't. Because in that case the moral dimension is obvious. You just cannot or will not recognize that people see abortion the same way.

>You're really going to tell me that there are conservatives out there that find subsidizing a pill

This is incredibly disingenuous. Moral issues don't work that way. You don't come up to me and say ""Buy me a pill so I can fuck without consequence or I'll just kill my kid"" and then act like it's my responsibility to appease you into not killing the kid. It's your responsibility to handle your own body and not murder humans that are inconvenient.

Remember, these people don't see abortion as a social ill that we can try to minimize like poverty - they see it as a grave offense that must be stopped. Stop infantilizing people: People have every right to demand moral responsibility from adults. 

>and fuck yes, there are people opposing birth control and sex for anything other than procreation

They are negligible and you damn well know it. You just need an enemy.

>being able to do with your body and your future as you choose

Oh that's rich coming from the left. Tell me, which other parts of my autonomy will you defend?",8,0,1441977973,1444730374
cuxvsob,0,t1_cuxvfim,shutupshuttinup,"> and I'm not even a conservative, you just assumed I was for no reason

> Oh that's rich coming from the left.

*drops the mike, walks offstage*",-9,0,1441978700,1444730374
cuxvuau,0,t1_cuxvsob,Battlesnake5,Do you do anything other than repeat cliches from a decade ago?,5,0,1441978790,1444730374
cuxw0i2,0,t1_cuxvuau,shutupshuttinup,"You're just pissed because I ""gotcha"". Take this defeat and troll better next time.",-5,0,1441979123,1444730374
cuxwcl9,0,t1_cuxw0i2,Battlesnake5,"You really think that, huh?

Truth is, I'm something closer to a Marxist, I do not have a home on either side of American politics. I feel free to criticize both sides.",3,0,1441979748,1444730374
cuxwi63,0,t1_cuxwcl9,shutupshuttinup,You're right - I totally misrepresented what you said by quoting you exactly and in context. My heartfelt apologies.,-2,0,1441980033,1444730374
cuxxk0p,0,t1_cuxwcl9,shutupshuttinup,"I didn't catch your edit, but someone who demonizes ""the left"" probably doesn't vote for them, so you have a ""side"", despite the joy you take in criticizing people in hindsight.",-2,0,1441981885,1444730374
cuxxom5,0,t1_cuxxk0p,Battlesnake5,"I didn't demonize, though. I am just pointing out that the left is very comfortable requiring people to sacrifice some amount of autonomy for the collective good. That's the basis for most progressive economic policies. To then act like autonomy is some central virtue, when I don't see it in any issue that isn't abortion, is a bit dishonest. Am I wrong about that?

I do actually vote for Democrats most of the time, except in some local elections. ",2,0,1441982101,1444730374
cuxy3fk,0,t1_cuxxom5,shutupshuttinup,"You're comparing what you should be able to do with your own body to what, your tax burden? Try to find a better analogy, friend.",-4,0,1441982772,1444730374
cuy020h,0,t1_cuxy3fk,Battlesnake5,"All laws regulate ""what you can do with your own body."" Your livelihood and property are just extensions of your own personhood. If I can regulate all the other markets, I can sure regulate what's available on the healthcare market. Don't tell people it's okay to intervene on lightbulbs but not on a matter of life and death. Even if it is a qualitatively worse intrusion, if the ""pro-life"" people are correct, it would be justified by the seriousness of the issue at hand.*

Either way, it still goes to consistency. No, social progressives do not support a general right to autonomy, and I cannot think of one issue that doesn't involve sex where anyone on the left even thinks in those terms. Feel free to enlighten me, though.

The better distinction is between most laws which are negative, restricting what you can do with your body, and a prohibition on abortion being a positive requirement to submit your body to something outside your control.

But all of that is irrelevant if there is a second person who has rights that must be weighed against the woman's. Which is what the ""pro-life"" people claim and which none of the pro-choice arguments actually address.

*Just in general, these types of arguments are so fluid that they really can't lead anywhere. ",4,0,1441985835,1444730374
cuy1la1,0,t1_cuy020h,shutupshuttinup,"Oh, God - you're not one of those AnCaps who think taxes are rape or whatever, are you? Because I'm pulling the ripcord right now, if so.",-4,0,1441988178,1444730374
cuy6e83,0,t1_cuy1la1,Battlesnake5,I am not. ,2,0,1441995514,1444730374
cux7y2j,0,t1_cux7wj1,FlareCorran,"They provide diapers and formula, for the most part. They also provide other forms of assistance, depending on the situation.",15,0,1441921280,1444730374
cux8497,0,t1_cux7y2j,shutupshuttinup,"OK, that's something. Do they have any sort of stance on government programs like TANF or SNAP, etc. - or do they not go there?",-5,0,1441921563,1444730374
cuxsyar,0,t1_cux8497,houinator,"Yes.  The pro-life movement has long supported making unborn children eligible for SNAP benefits, something the pro-choice movement has been successful in blocking so far.  Under certain conditions unborn children are already eligible for TANF.",5,0,1441971779,1444730374
cuxta7u,0,t1_cuxsyar,shutupshuttinup,Not exactly what I meant. How many conservative pro-lifers favor paying taxes to cover programs like TANF and SNAP? Food banks cannot/do not cover everything. How many of them favor paying taxes to government health programs for children? Building public parks for them to play in?,-3,0,1441972763,1444730374
cux8b58,0,t1_cux8497,FlareCorran,"They'll typically refer people to whatever support is available, but they normally don't take political stances (other than the obvious one.)",16,0,1441921881,1444730374
cuxc1qf,0,t1_cux7k9x,houinator,"Seconding this.  My Mom went to one when she was a single mother pregnant with me, and out of her eventual five kids, she still maintains it was the best pre-natal care she ever got.

",16,0,1441928589,1444730374
cuxwahg,0,t1_cuxc1qf,beetbear,Oh yea CPC's. [Just cuddly little organizations that are only there to help. By lying and shaming woman.](http://msmagazine.com/blog/2015/05/21/we-heart-the-truth-about-crisis-pregnancy-centers/) Awesome.,-11,0,1441979642,1444730374
cuxwmz3,0,t1_cuxwahg,houinator,"While there are certainly some bad actors, it's a little unreasonable to judge all CPC's for the actions of a handful.  However, if you want to play that game, we can easily do the same for the [other side](http://www.phila.gov/districtattorney/PDFs/GrandJuryWomensMedical.pdf).

",9,0,1441980275,1444730374
cuy4y5v,0,t1_cuxwmz3,beetbear,"Actually NARAL has done extensive undercover work at CPC's as well as the conferences of those that fund and operate the major CPC networks. Lies and Shame are tactics [#1](http://thinkprogress.org/health/2015/03/13/3633349/crisis-pregnancy-california-report/) and [#2](https://www.youtube.com/watch?v=wFB1wRSeJLY&feature=youtu.be). They're goal isn't to help mothers, but rather to end abortion. A package of diapers and a binky does not make up for a lack of social safety net for families in this country.

As for your link to Hermit Gosnell  - Gosnell came about because it doesn't matter how many clinics conservatives close down there's going to be abortion. By pushing it into the back-alleys and with bad doctors you make it less safe. Abortion should be available in every hospital or ob-gyn in this country. It's a safe and simple procedure which normally only requires taking a pill.",-6,0,1441993284,1444730374
cuy632k,0,t1_cuy4y5v,houinator,"Gosnell didn't run a back alley clinic, he ran one that was legally certified by the state and subject to regular inspections.  However, when the inspections came back telling them there was something fishy going on at the clinic, they ignored the reports because they didn't fit their political ideology.",7,0,1441995047,1444730374
