id,is_root,parent_id,author,body,score,score_hidden,created_utc,collected_utc
cuxt5tj,1,t3_3kiyui,houinator,"There was a whitewash, and from what we know, it mostly relates to Saudi involvement, since those are the parts of the 9/11 commission report that still remain classified.",18,0,1441972410,1444730134
cuyyv67,0,t1_cuxt5tj,molotoviphone,"People always try to convince me that despite the fact that 15 of the terrorists were from Saudi Arabia, the real activity went down in Iran/Afghanistan/Iraq and that's where we needed to be. I have a hard time believing that. ",1,0,1442066463,1444730134
cuxvxz8,0,t1_cuxt5tj,BeefSupreme24,"Absolutely, same reason the JFK Assassination files are locked for 75 years or whatever.  Have to protect wealthy and / or powerful individuals who may have been somehow involved.  That and hiding any kind of government sanctioned illegal activity the led to the attacks.

Too many people are drunk on Nationalism that they just can't believe our government would be that corrupt.",7,0,1441978989,1444730134
cuxw97d,0,t1_cuxt5tj,Swolemageddonfour,"It's not exactly difficult to read between the lines, some rich Saudis funded and continue to fund terrorism.  The Saudi leadership know the US/UK/everyone knows but for the continued buying of arms from the west and the selling of oil we pretend that they're not.  

Not great but in the end not that interesting or even important.  Until they run out of oil/we get serious on electric cars and renewables/nuclear the Saudis are untouchable. ",6,0,1441979578,1444730134
cuy2hag,0,t1_cuxw97d,BrawnyJava,It's even easier than that to read between the lines.  Prince Bandar funds a lot of terrorism.  I'm betting this was paid for in part by him.,1,0,1441989518,1444730134
cuxs7qu,1,t3_3kiyui,ClockOfTheLongNow,"> a country which had absolutely nothing to do with 911 even though the Bush admin claimed they were linked.

This never happened.

Bush and his administration rightly claimed links between Iraq and Al Qaeda, and those nonoperational links were confirmed by intelligence and the 9/11 Commission, but the Bush administration learned very early on in the investigations that Iraq had nothing to do with the attacks and went to great lengths to note exactly that.

To answer your broader question, there doesn't appear to be actual fault in how the investigation went down, nor is the official story unbelievable in any way.  There may be classified details we're currently not privy to, but in terms of the basics (an attack by 18 Al Qaeda hijackers organized by the top officers of the organization, including Osama bin Laden), it looks pretty cut and dry.

EDIT: spelling",8,0,1441969359,1444730134
cuxwkk1,0,t1_cuxs7qu,goethean,"My god, how does the kool-aid taste?",-5,0,1441980154,1444730134
cuxwveg,0,t1_cuxwkk1,kingvitaman,Care to elaborate? Do you disagree that these statements were made?,1,0,1441980707,1444730134
cuxyzcg,0,t1_cuxwveg,goethean,"The Bush Administration and their operatives made many allegations that Saddam Hussein was involved in 911. This was of course, lies and deception. They were determined to invade Iraq because they thought that it would lead to domestic electoral victories. Due to credulous tools like the user above, they succeeded for a while.",-1,0,1441984190,1444730134
cuxxneh,0,t1_cuxwkk1,ClockOfTheLongNow,"Do you have an issue with the facts, or is this just cognitive dissonance?",4,0,1441982046,1444730134
cuxy6x7,0,t1_cuxxneh,goethean,"[Saddam Hussein and al-Qaeda link allegations](https://en.wikipedia.org/wiki/Saddam_Hussein_and_al-Qaeda_link_allegations)






",1,0,1441982930,1444730134
cuxyfr8,0,t1_cuxy6x7,ClockOfTheLongNow,"Wikipedia is a terrible source, and you know that.

I've detailed the facts above.  Do you have an issue with the conclusions of those on the Commission?  If so, why?",-3,0,1441983326,1444730134
cuxyups,0,t1_cuxyfr8,goethean,"[The effort to tie 9/11 to Saddam Hussein began as early as six hours after the first plane strike, with an aide to Donald Rumsfeld noting his boss’s orders as: “Best info fast, judge whether good enough hit S.H. [Saddam Hussein] at same time. Not only U.B.L. [Osama bin Laden].” From that point until the invasion of Iraq began, on March 19, 2003, the Bush ­administration would pursue several theories—all ultimately debunked—as it sought to build its case for war.](http://nymag.com/news/9-11/10th-anniversary/iraq-war/)

I can ***remember*** seeing James Woolsey talking on the TV after 911 about Saddam Hussein's involvement in the attack. 

[more](https://books.google.com/books?id=vyZ9AgAAQBAJ&pg=PT132&lpg=PT132&dq=woolsey+saddam+911&source=bl&ots=JnyRREfm0C&sig=zy-5qQWnw5yhy3fxa7BgAPCQduo&hl=en&sa=X&ved=0CDwQ6AEwBGoVChMI84mOqqDvxwIVQxk-Ch2RYAXz#v=onepage&q=woolsey%20saddam%20911&f=false)",0,0,1441983991,1444730134
cuy4c6u,0,t1_cuxyups,ClockOfTheLongNow,"Yes, it was logical to wonder if Iraq had any connection to the attacks initially.  That's completely sensible.

That this was not a route that was pursued is also true.",0,0,1441992350,1444730134
cuy4ii6,0,t1_cuy4c6u,goethean,"Just remember, true believers: We don't want the smoking gun to be a mushroom cloud!",1,0,1441992615,1444730134
cuxsc4g,0,t1_cuxs7qu,kingvitaman,">the Bush administration learned very early on in the investigations that Iraq had nothing to do with the attacks and went too great lengths to note exactly that.

2004 

[ President Bush yesterday defended his assertions that there was a relationship between Saddam Hussein's Iraq and Osama bin Laden's al Qaeda, putting him at odds with this week's finding of the bipartisan Sept. 11 commission. ""The reason I keep insisting that there was a relationship between Iraq and Saddam and al Qaeda: because there was a relationship between Iraq and al Qaeda,"" Bush said after a Cabinet meeting. As evidence, he cited Iraqi intelligence officers' meeting with bin Laden in Sudan. ""There's numerous contacts between the two,"" Bush said. ](http://www.washingtonpost.com/wp-dyn/articles/A50679-2004Jun17.html)

2006

Bush reaffirmed the White House position in even stronger terms in a press conference on 21 August 2006. When asked what the connection was between Iraq and the September 11th attacks, Bush replied, ""Nothing.... Nobody has ever suggested that the attacks of September the 11th were ordered by Iraq.",4,0,1441969782,1444730134
cuxyz7w,0,t1_cuxsc4g,evanb_,Are there still people who don't understand that Iraq and alQaeda can be linked without the Iraqi government being involved in 9/11? I really thought people had gone over this.,2,0,1441984185,1444730134
cuy06bc,0,t1_cuxyz7w,kingvitaman,"“report that’s been pretty well confirmed, that [9/11 hijacker Mohammed Atta] did go to Prague and he did meet with a senior official of the Iraqi intelligence service in Czech Republic last April, several months before the attack.”

Dick Cheney 2002",1,0,1441986018,1444730134
cuxt8e2,0,t1_cuxsc4g,ClockOfTheLongNow,"The 9/11 Commission very clearly noted that there were was a relationship between Iraq and Al Qaeda.  They detail these links on pages 66 and 128 of the report, in particular.

To quote Lee Hamilton, a Democrat on the Commission:

> I must say I have trouble understanding the flack over this. The Vice President is saying, I think, that there were connections between al Qaeda and Saddam Hussein’s government. We don’t disagree with that. What we have said is we don’t have any evidence of a cooperative, or a corroborative relationship between Saddam Hussein’s government and these al Qaeda operatives with regard to the attacks on the United States. So it seems to me the sharp differences that the press has drawn, the media has drawn, are not that apparent to me.

He also said something similar on *Hardball*:

> There are all kinds of ties. There are all kinds of connections. And it may very well have been that Osama bin Laden or some of his lieutenants met at some time with Saddam Hussein lieutenants.  They had contacts, but what we did not find was any operational tie with respect to attacks on the United States.

Another Commission member, John Lehman, had this to say on *Meet the Press*:

> The Clinton administration portrayed the relationship between al- Qaeda and Saddam’s intelligence services as one of cooperating in weapons development. There’s really very little difference between what our staff found, what the administration is saying today and what the Clinton administration said. The Clinton administration portrayed the relationship between al- Qaeda and Saddam’s intelligence services as one of cooperating in weapons development. There’s abundant evidence of that. In fact, as you’ll soon hear from Joe Klein, President Clinton justified his strike on the Sudan “pharmaceutical” site because it was thought to be manufacturing VX gas with the help of the Iraqi intelligence service.  Since then, that’s been validated. There has been traces of Empta that comes straight from Iraq, and this confounds the Republicans, who accused Clinton of doing it for political purposes. But it confirms the cooperative relationship, which were the words of the Clinton administration, between al-Qaeda and Iraqi intelligence... The Bush administration has never said that they participated in the 9/11 attack. They’ve said, and our staff has confirmed, there have been numerous contacts between Iraqi intelligence and al-Qaeda over a period of 10 years, at least. And now there’s new intelligence, and this has come since our staff report has been written because, as you know, new intelligence is coming in steadily from the interrogations in Guantanamo and in Iraq and from captured documents. And some of these documents indicate that there is at least one officer of Saddam’s Fedayeen, a lieutenant colonel, who was a very prominent member of al-Qaeda. That still has to be confirmed. But the vice president was right when he said that he may have things that we don’t yet have. 

The facts are in on this one.  We can either go by what the report and Commission says, or how the media erroneously portrays it.  I'll go with the facts.",5,0,1441972617,1444730134
cuxwzda,0,t1_cuxt8e2,kingvitaman,"> the Bush administration learned very early on in the investigations that Iraq had nothing to do with the attacks and went to great lengths to note exactly that.

...

>The 9/11 Commission very clearly noted that there were was a relationship between Iraq and Al Qaeda.

",-5,0,1441980900,1444730134
cuxxmv5,0,t1_cuxwzda,ClockOfTheLongNow,One can have a link with Al Qaeda and not be involved with the attacks.,5,0,1441982021,1444730134
cuy14lg,0,t1_cuxxmv5,lannister80,"> One can have a link with Al Qaeda and not be involved with the attacks.

OK, so why the fuck did we invade their country, then?",0,0,1441987468,1444730134
cuy4a0g,0,t1_cuy14lg,ClockOfTheLongNow,"Fear of WMD spread, support of international terror, and so on.",0,0,1441992262,1444730134
cuy4min,0,t1_cuy4a0g,lannister80,"Funny, we haven't invaded KSA...  or Israel...",0,0,1441992788,1444730134
cuy52od,0,t1_cuy4min,ClockOfTheLongNow,Why would we?,4,0,1441993479,1444730134
cuy5839,0,t1_cuy52od,lannister80,"Both export terrorism, but I thought KSA had nukes.  It apparently doesn't.  Israel obviously does.",-3,0,1441993711,1444730134
cuy5efl,0,t1_cuy5839,ClockOfTheLongNow,"Saudi Arabia does not appear to export terrorism as government policy.  Saudi Arabia's problem is adhering to an ideology that tends to breed a disproportionate number of Islamic terrorists, but the nation has a pretty successful counterterrorism program.

Israel absolutely doesn't export terrorism.",3,0,1441993986,1444730134
cuygqz5,0,t1_cuy14lg,Gnome_Sane,"Same exact reason Clinton bombed them Christmas of 98.

http://www.cnn.com/ALLPOLITICS/stories/1998/12/16/transcripts/clinton.html

>Transcript: President Clinton explains Iraq strike

>CLINTON: Good evening.

>Earlier today, I ordered America's armed forces to strike military and security targets in Iraq. They are joined by British forces. Their mission is to attack Iraq's nuclear, chemical and biological weapons programs and its military capacity to threaten its neighbors.

>Their purpose is to protect the national interest of the United States, and indeed the interests of people throughout the Middle East and around the world.

>Saddam Hussein must not be allowed to threaten his neighbors or the world with nuclear arms, poison gas or biological weapons.

>I want to explain why I have decided, with the unanimous recommendation of my national security team, to use force in Iraq; why we have acted now; and what we aim to accomplish.

>Six weeks ago, Saddam Hussein announced that he would no longer cooperate with the United Nations weapons inspectors called UNSCOM. They are highly professional experts from dozens of countries. Their job is to oversee the elimination of Iraq's capability to retain, create and use weapons of mass destruction, and to verify that Iraq does not attempt to rebuild that capability.

I know you were probably raised on the MEME that Bush loves killing brown people either in Iraq or Louisiana, and just wants to go to war for shits and giggles and his daddy and all...

But it really is just a childish meme.",1,0,1442013022,1444730134
cuyi3o5,0,t1_cuygqz5,lannister80,"Then Clinton was wrong as well.  Of course, a bombing campaign and a full-scale invasion / nation-rebuilding are entirely different in scope.

Bush II wasn't even elected until I was a junior in college.",1,0,1442015665,1444730134
cuyejai,0,t1_cuy14lg,Scottmk4,They flagrantly violated the cease fire agreement that ended desert storm.,2,0,1442008869,1444730134
cuyi5eq,0,t1_cuyejai,lannister80,And?  Nations violate agreements all the damn time.  We don't usually invade them.,-1,0,1442015763,1444730134
cuyxxol,0,t1_cuyi5eq,Scottmk4,"When you violate a cease fire agreement, the war is back on.

It's a bit different than violating a trade agreement.",2,0,1442064084,1444730134
cuy0hv5,0,t1_cuxxmv5,kingvitaman,Cheney claimed that Mohammad Atta met with a senior Iraqi official in Prague a month before the attack. ,0,0,1441986507,1444730134
cuxx6y3,0,t1_cuxwzda,secondsbest,The relationship between the two factions was undeniable. The relationship did not involve 9/11 though. What's hard to parse there?,6,0,1441981259,1444730134
cuxxa8n,0,t1_cuxx6y3,kingvitaman,"[Cheney said on June 17, 2004 that the evidence was ""overwhelming"" that al Qaeda had a relationship with Hussein's regime in Iraq, and said media reports suggesting that the 9/11 commission has reached a contradictory conclusion were ""irresponsible.""](http://edition.cnn.com/2009/POLITICS/06/01/cheney.speech/)

Here's the audio of him talking about the connection on Meet the Press. https://www.youtube.com/watch?v=IJiNtpIpD6k",-2,0,1441981424,1444730134
cuxxo2z,0,t1_cuxxa8n,ClockOfTheLongNow,"Right.  Why was Cheney wrong about that?  He was 100% correct, as I demonstrated.",4,0,1441982077,1444730134
cuy1ut5,0,t1_cuxxo2z,kingvitaman,Cheney was wrong about Muhammad Atta meeting with senior Iraqi intelligence officers. He was 100% wrong. ,-4,0,1441988577,1444730134
cuy49do,0,t1_cuy1ut5,ClockOfTheLongNow,Then perhaps you should have excerpted that portion as opposed to what you did.,5,0,1441992236,1444730134
cuygokl,0,t1_cuxxo2z,Gnome_Sane,"> Why was Cheney wrong about that?

Because he is Darth Cheney! That is the MEME! 

HOW DAARE YOU QUESTION THE MEME!!!!1111",3,0,1442012887,1444730134
cuy13sj,0,t1_cuxt8e2,lannister80,"> And it may very well have been that Osama bin Laden or some of his lieutenants met at some time with Saddam Hussein lieutenants. 

Woah, rock-soild evidence there.  lol

>They had contacts, but what we did not find was any operational tie with respect to attacks on the United States.

Definitely worth going into a 10-year war over....",0,0,1441987435,1444730134
cuxx1rm,0,t1_cuxsc4g,Snedeker,"I'm not sure what you think that reply proves. Bush said that there was contact between Iraq and al Qaeda, and there was. Irag was in contact with, and provided support to many terrorist organizations.

Bush then further said that Iraq did not order the 9/11 attacks, and that is also true. He never claimed that they were responsible for the attacks. 
",7,0,1441981014,1444730134
cuxx37p,0,t1_cuxx1rm,kingvitaman,Bush also stated he never said that there were any connections between Iraq and Al Qaeda. DO I need to link to the video?,1,0,1441981079,1444730134
cuxxdr9,0,t1_cuxx37p,Snedeker,"Might as well, if you can. I'd like to see what you are talking about. 

The 9/11 attacks were never a main justification for the Iraq invasion, but for the little that it was used I remember the opposite of what you are saying. 

Like I said above, what I remember is that he said that the two organizations were in contact with each other, but he never said that Iraq was responsible for the attacks.  ",6,0,1441981589,1444730134
cuy0rsj,0,t1_cuxxdr9,kingvitaman,"Bush stated that Iraq was the ""center of the war on terror"" . Considering we just had a terrorist attack, I'd conclude ( and remember ) many people conflating the two. 

Cheney also stated that Muhammad Atta had met with senoir Iraqi officials in Prague a month before the attack. I don't think it's hard to see what he was insinuating with this ( even though it turned out to be false)",-1,0,1441986931,1444730134
cuy1cer,0,t1_cuy0rsj,Snedeker,"Isn't this how it always goes, though. It starts out ""BUSH SAID IRAQ DID 9/11!!!!""

Then when challenged it always ends up, ""Well, Bush never said that Iraq was responsible for 9/11..... but if you squint really hard and take statements out of context, then some of the things that people in his administration said might lead people to believe that Iraq had *something* to do with 9/11.""

",8,0,1441987798,1444730134
cuy1m6c,0,t1_cuy1cer,kingvitaman,"I think if you say that senior Iraqi officials are meeting with the head of the terrorists who attacked the US, at the Iraqi consulate, a few months before the attacks it doesn't take much squinting to connect the two.  

What would you take from that? Or the statement that Iraq was the ""center of the war on terror"". I think after a terrorist attack it doesn't exactly take a leap to put 2 and2 together. One reason why 70% of Americans polled thought there was a direct connection between Saddam and 911. [link](http://usatoday30.usatoday.com/news/washington/2003-09-06-poll-iraq_x.htm)",-1,0,1441988217,1444730134
cuy2ls2,0,t1_cuy1m6c,Snedeker,"What would I take from the fact the Czech intelligence agencies reported with a very high confidence that Muhammad Atta met with a member of Iraqi intelligence? 

I would take from that, that there was a pretty good chance that Muhammad Atta met with a member of Iraqi intelligence. I would further take from that, that Iraq was in contact with terrorist organizations all around the world. Which they were. 

It's not that difficult to take a decade worth of out of context statements by hundreds administration officials, and ""recollections"" from thousands of lower level aides, and come up with a half dozen statements that you can use to support your theory.

It just didn't happen that way.",2,0,1441989706,1444730134
cuy2sqn,0,t1_cuy2ls2,kingvitaman,So you believe that Muhammad Atta met with senior officials in Prague. But you don't believe there was any connection between 911 and Iraq? ,-1,0,1441989994,1444730134
cuy2vyw,0,t1_cuy2sqn,Snedeker,The allegation was that he was there to discuss blowing up a building in Czechoslovakia. ,2,0,1441990127,1444730134
cuy2zzx,0,t1_cuy2vyw,kingvitaman,"I've never heard this before. Any link to verify this? Cheney certainly didn't ever mention it. He talked about the meeting while speaking about the reasons why the US needed to go into Iraq. 

Also. Czechoslovakia hasn't been a country for around two decades. ",1,0,1441990296,1444730134
cuy3ake,0,t1_cuy2zzx,Snedeker,"I remember it from the time, but I just found this on a Czech website where they talk about it: http://www.respekt.cz/respekt-in-english/atta-s-trip-to-prague


>BIS has two pieces of information about Atta's alleged stay in Prague in April of last year, both of which were obtained by a one secret service agent. An informant from the Prague Arab community allegedly saw Atta and al-Ani meet twice: once near the Radio Free Europe building at the top of Wenceslaus Square, and the second time at dinner in a hotel not far from Prague. ""Neither of these pieces of information are one-hundred percent sure. They cannot be verified,"" says the man from the intelligence unit.

>The meeting in front of the Radio Free Europe building should have been captured by the closed-circuit camera monitoring the vicinity of the building. Al-Ani can be clearly seen in the shot, but the picture is not well enough focused to absolutely confirm that the second man is Atta. Al-Ani knew people at Radio Free Europe. He often moved around the building and even photographed it. Identifying him was easy. In fact it was al-Ani's constant photographing of Radio Free Europe that proved fateful to him. On April 22, 2001, fourteen days after his alleged meeting with Atta, he was expelled from the country and the information about his photographing the building evidently became the foundation of Zeman's alarming reports last year that Atta was preparing an attack on Prague's Radio Free Europe building.",1,0,1441990748,1444730134
cuy3ww4,0,t1_cuy3ake,kingvitaman,Wow. That's a great source I hadn't seen before. Thanks. I still think that when Cheney was talking about the meeting he was alluding to a connection between Atta and Iraqi officials to help bolster the case for the invasion of Iraq. ,0,0,1441991708,1444730134
cuy4hka,0,t1_cuy3ww4,Snedeker,"Well, you're welcome!

Having this discussion, I'm wondering how old you are. There are a lot of people who are young enough that they don't remember the events themselves and get most of their information from internet sources. I'm not saying that there is anything wrong with that, but a lot of the *flavor* of the facts gets lost when you are reading someone else's interpretation.

If you were really into politics and world events at the time, a lot of the stuff in that article was discussed quite a bit. People spent loads of time analyzing Atta's movements and known locations to see if it was possible that he actually went to Prague when it was alleged to have happened. ",2,0,1441992576,1444730134
cuy2kya,0,t1_cuy1cer,BrawnyJava,"I know.  If you repeat a lie often enough and loudly enough, it becomes true.  It's so easy to just spew this shit out there, and pretty time consuming to rebut.  And then next week, the same guy is saying the same shit.",5,0,1441989671,1444730134
cuy2xog,0,t1_cuy2kya,kingvitaman,I'm not sure I understand. What's the lie? ,-1,0,1441990200,1444730134
cuy370v,0,t1_cuy2xog,BrawnyJava,"The us invaded Iraq because of 9-11, but we knew they had nothing to do with it.  Frequently this is bundled with empty headed assertions it was all a scheme to make Cheney rich, because he used to work for Halliburton.  It's tiring to see the same stuff repeated over and over.I remember watching Colin Powell give his presentation to the un security council listing the reasons why force against Iraq was necessary.  ",2,0,1441990598,1444730134
cuy393m,0,t1_cuy370v,kingvitaman,So why do you think there were assertions made by the Bush admin connecting 911 and Iraq?,0,0,1441990687,1444730134
cuy6nxp,0,t1_cuy393m,BrawnyJava,"Why would you ask me, when you can just look up what Colin Powell said?  He had twenty or so reasons why Iraq was in violation of the 1991 treaty.  Only one of those was support for terrorism and only one was WMD.  The rest are completely airtight.But nothing I say will change your mind, since you made up your mind based on falsehoods.  So I'll just play to your ignorant biases and say the us invaded Iraq so Cheney could get rich.  Gwb was a hapless stooge who could barely tie his shoes, and Cheney was the evil mastermind behind it all.  Thank god the president pulled us out of there and triggered a humanitarian crisis.  Otherwise, Cheney would have stolen their oil.  No bombing brown people for oil!",2,0,1441995917,1444730134
cuy6sq1,0,t1_cuy6nxp,kingvitaman,"Wow. This is pretty much the definition of a strawman if I ever saw one. 

What falsehood do you believe I'm perpetuating? Cheney himself said that Atta had met with senior Iraqi officials months before the attack. What do you think he was insinuating? We'll leave Bush's statements that Iraq was ""central to the war on terror"" for later. ",1,0,1441996113,1444730134
cuy8o7b,0,t1_cuy6sq1,BrawnyJava,"It sort of is a straw man, because I don't know exactly what your beliefs are.  However, I don't care either.  I've had many conversations with your ilk, and none of you give two shits about the facts.  Discussing anything with a truther is fucking pointless.  Which is why I didn't reply to you, I replied to someone who gave a shit about what was actually factual information.",3,0,1441999109,1444730134
