id,is_root,parent_id,author,body,score,score_hidden,created_utc,collected_utc
cusio4u,1,t3_3juvm8,ThatGuyFromOhio,"Brent Scowcroft, GW Bush's national security adviser, has also endorsed the deal.",28,0,1441553373,1444732192
cusgtdz,1,t3_3juvm8,pjabrony,"Powell was always a moderate Republican. Even during the Iraq war, he was one of those asking to give the inspections more time. Of course, as Secretary of State it was his job to advocate for diplomatic solutions.",37,0,1441549068,1444732192
cuszftn,0,t1_cusgtdz,Zeakk1,"So, I don't think you should justify this as being a moderate stance. It's really the only stance that doesn't involve letting Iran do what it wants or requires American military action.

It's the best policy option available. There isn't another policy option. So, I ask you moderare compared to what?

What's the Right Wing plan?",1,0,1441586406,1444732192
cusgxqn,0,t1_cusgtdz,glberns,"No ~~other~~ elected Republican has endorsed the deal, moderate or otherwise.

I like your secretary of state explanation though. 

Edit: other implies Powell is an elected official.",11,0,1441549377,1444732196
cusjign,0,t1_cusgxqn,krabbby,"Because most of those elected officials have to pander to their base, oftentimes by running to the right. You don't want to be seen as the Republican who went against his party and supported Obama.",26,0,1441555144,1444732196
cusxyxp,0,t1_cusjign,iki_balam,what about Chris Christie?,3,0,1441583215,1444732196
cusyqru,0,t1_cusxyxp,krabbby,"There's a difference between accepting help from a natural disaster, and switching sides on a policy issue. Christie get's flak for what he did, but enough reasonable people don't fault him for it.",8,0,1441584902,1444732200
cut1p9g,0,t1_cusyqru,Occamslaser,"> reasonable people

They didn't vote for him",-1,0,1441591255,1444732200
cusi0i2,1,t3_3juvm8,ReasonableUser,"No, Colin is rational and straightforward. He doesn't have to toss red meat for the sake of it.",58,0,1441551934,1444732200
cusoxwm,0,t1_cusi0i2,MAGwastheSHIT,It helps that he's not running for any office and doesn't have to pander to the chickenhawk crowd whose foreign policy ideas are mostly based on Tom Clancy movies and Biblical prophecy.,28,0,1441565475,1444732200
cutou9w,0,t1_cusoxwm,Reptilian_Overlords,"Those are the best policies, Michael Bay says so!",5,0,1441652626,1444732200
cussee7,0,t1_cusi0i2,Gonzzzo,"I also think his name/word still carries a lot of weight with moderates across the aisle, but particularly with right-leaning moderates. I think he was probably he only one who emerged from the Bush administration still looking like one of the good guys in a lot of people's minds",13,0,1441571988,1444732200
cusyhba,0,t1_cussee7,Anirak,"If you're interested in another of the moderates that was pulled into the cabinet and went against them, there's a good book about [Paul O'Neill](http://www.amazon.com/Price-Loyalty-George-Education-ONeill/dp/0743255461/ref=sr_1_8?ie=UTF8&qid=1441584205&sr=8-8&keywords=paul+o%27neil&pebp=1441584211893&perid=1YDC2XEMYCHJVTS6C29G) that goes into it.",6,0,1441584328,1444732200
cusp7er,1,t3_3juvm8,xiipaoc,"> Given that he is a Republican and worked for GWB, is this surprising or somewhat expected?

Completely expected.  Powell's been out of politics for the whole let's-all-hate-Obama thing.  He's a diplomat, and he actually knows what he's talking about.

""Republican"" hasn't always been defined as ""anti-Democrat"".  These days, if a Republican agrees with the Democrats on any issue, that's a huge political problem.  I'm surprised they can even name post offices together.  But Colin Powell thought about the deal and came to the conclusion that it's acceptable enough.  Remember, the Republicans were dead set against the deal before they even read it.  Powell, I would assume, actually read and understood the thing.

Also note that the other countries that negotiated the deal along with the US also support it.  The only people who don't are the Republicans, who can't support anything Obama likes on principle, and the Israelis, who have their ultra-right-wing views on Iran for whatever reason (note that Israel has made peace with *less* moderate regimes than Iran's in the last few decades; Netanyahu is just a far-right populist preying on the Israelis' legitimate fears and anger).  Everyone else is cool with the deal.  This means that the US will isolate *itself* by putting sanctions on Iran without international support.  Colin Powell is not an idiot.  He understands all of this.  And he doesn't automatically mistrust Obama either, which seems to be a modern litmus test for the Republican party these days.

Ultimately, if the deal were a bad one, we wouldn't have made it, and our allies wouldn't have been on it.  The Republicans just need to grow a pair.",21,0,1441565951,1444732200
cusvvgp,1,t3_3juvm8,gafftapes10,"This is the man who endorsed obama for president both times.  He has always been a moderate, and if you look at his actual political positions, espeically foreign policy, he has always supported a diplomatic solution.",7,0,1441578842,1444732200
cushptp,1,t3_3juvm8,kcash935,"Sadly, you would say surprising. We should be saying expected though. If it's a good deal, regardless of party, acknowledge it's a good deal. 

The whole ""we don't wanna give the other party a W, even if it's a good proposal"" is getting extremely old. ",20,0,1441551260,1444732200
cusmv5n,0,t1_cushptp,Snedeker,"The issue here is that it is widely considered to be a horrible deal. Having the D's fall in line for it just because Obama supports it is just as bad. 

To their credit, there are some prominent Democrat politicians who in fact did come out against it. ",-17,0,1441561602,1444732200
cusvrq4,0,t1_cusmv5n,Happy_Plot_Twists,"The *ONLY* parties who are calling this a ""bad deal"" are those who are hostile toward Iran/US as a matter of principle and thus categorically against any thaw between the two powers, that means Israel, Saudi Arabia, the GOP, and Iranian hardliners. For said parties ""any deal would be a bad deal."" Both Kerry and Hammond (UK FM) made that statement. Other than that all atomic scientists in America and abroad, the IAEA, our European allies, Turkey, Saudi Arabia (probably just trying to avoid drawing Iran's wrath even further), a few Reps who are not running in elections, a remarkable number of Jewish Dems and *EVEN* current and former Israeli security officials endorse this deal. ",6,0,1441578626,1444732200
cuso2t9,0,t1_cusmv5n,kcash935,"Except it's not considered a bad deal to anyone that's not a Republican, basically. 

Just about the only thing they didn't get is the US citizens that Iran is holding, but you're not going to get everything you want in negotiations, that's why you negotiate. The US will aim for those later. 

They got international inspections, they reduced the centrifuges and their ability to  enrich uranium to military grade levels, and they have the ability to snap sanctions back into effect. 

Flat out, this was a good deal.

 Edit: fixed wording",13,0,1441563846,1444732204
cuso7ef,0,t1_cuso2t9,Snedeker,"Well, except for Chuck Schumer I guess. But you're right, almost all of the support for the plan is from partisan Democrats. ",-5,0,1441564094,1444732204
cuso8z1,0,t1_cuso7ef,kcash935,I'm saying outside of Congress as well. Not just Dems v. Repubs.,4,0,1441564198,1444732204
cusnjgb,0,t1_cusmv5n,shot_glass,">The issue here is that it is widely considered to be a horrible deal. 



No it isn't, it's argued about. Certain factions are arguing it's bad, but it isn't widely considered a horrible deal. ",18,0,1441562855,1444732204
cusqm6p,0,t1_cusnjgb,TheInternetHivemind,"As far as I understand the deal, either party can withdraw from it at any time. That makes it a bad deal for the party with more power (the US).

While US sanctions would re-engage upon Iran's withdrawal, international sanctions would not. 

That's my understanding, but I would be more than happy to be wrong. ",-3,0,1441568624,1444732204
cussta4,0,t1_cusqm6p,shot_glass,"No either parties can't withdraw at anytime, and the international sanctions are the default, they can't be vetoed if things fall apart, and they kick right back in on volition. ",9,0,1441572778,1444732204
cusuiex,0,t1_cussta4,TheInternetHivemind,">No either parties can't withdraw at anytime

I thought that was part of sovereignty. 

As far as I've gleaned (from NPR) the US sanctions go back into effect, but international ones don't.

I would be happy to be proven wrong though, as it would make me more confident in the deal.",0,0,1441576105,1444732204
cusvmad,0,t1_cusuiex,DragonflyRider,Your ignorance is very indicative of the snowjob the GOP has done with this deal. ,4,0,1441578337,1444732204
cusurb5,0,t1_cusuiex,shot_glass,"[If Iran violates the agreement, any of the P5+1 can invoke a ""snap back"" provision, under which the sanctions ""snap back"" into place](https://en.wikipedia.org/wiki/Comprehensive_agreement_on_the_Iranian_nuclear_program#Sanctions)

Basically the way it's set up is that if anyone on on the security council, including the US,  feel like Iran is not holding up it's end, the sanctions go back up, no veto, no pushing, no talking, back up. Then the process starts up to pull them back which can be vetoed. It's one of the things i like about it as Russia/China can't stop them from going back up, they can only push to pull them back which can be vetoed. The Security council veto is a major stopping point in most UN deals as the US or Russia/China usually is a sugar daddy to one of the countries doing something wrong. 

The snapback does not require the Iranians to stay in the deal, they leave and can still be sanctioned. ",9,0,1441576603,1444732204
cusp29c,0,t1_cusmv5n,theholyroller,"Except it's not considered a bad deal by a wide swath of the international atomic community, current and former Israeli officials, and much of the international diplomatic community. But yeah I guess other than those people. ",21,0,1441565691,1444732204
cusrd7l,1,t3_3juvm8,GideonWells,"Expected, he was critical of Cheney and his focus on controlling Iran. ",5,0,1441570068,1444732204
cusn3gg,1,t3_3juvm8,Riekopo,"Yes, he's a Republican, but he's not a neoconservative like Bush and his gang. ",7,0,1441562030,1444732208
cusvv1q,0,t1_cusn3gg,Happy_Plot_Twists,...which is not stopping any other non-neocon Rep. from blindly shooting down the deal.,4,0,1441578817,1444732208
cusw4nv,0,t1_cusvv1q,Riekopo,Blindly?,2,0,1441579369,1444732208
cut7f5y,0,t1_cusw4nv,Happy_Plot_Twists,Yes. Almost all of them said they were opposed before even reading the text.,1,0,1441604540,1444732208
cuszshk,0,t1_cusw4nv,DaSuHouse,Not the worst adjective given the immediate response of most high profile Republicans before they even had a chance to review the deal.,2,0,1441587161,1444732208
cusnxux,1,t3_3juvm8,uncannylizard,http://www.nbcnews.com/storyline/iran-nuclear-talks/colin-powell-iran-deal-pretty-good-deal-n422551,3,0,1441563592,1444732212
cusssgx,1,t3_3juvm8,rctm_dmn_nr_kld_hm,Is his opinion on anything relevant after he lied to the international community with trumped up information re: WMD in Iraq?,5,0,1441572737,1444732212
cusztne,0,t1_cusssgx,DaSuHouse,Did he though? My impression was that he was the sole voice of reason in a cabinet of neocons focused on Iraq.,2,0,1441587228,1444732212
cut0ka1,0,t1_cusztne,rctm_dmn_nr_kld_hm,">Most observers praised Powell's oratorical skills. However, Britain's Channel 4 News reported soon afterwards that a UK intelligence dossier that Powell had referred to as a ""fine paper"" during his presentation had been based on old material and plagiarized an essay by American graduate student Ibrahim al-Marashi.[46][47] A 2004 report by the Iraq Survey Group concluded that the evidence that Powell offered to support the allegation that the Iraqi government possessed weapons of mass destruction (WMDs) was inaccurate.

> In an interview with Charlie Rose, Powell contended that prior to his UN presentation, he had merely four days to review the data concerning WMD in Iraq.[48]

> A Senate report on intelligence failures would later detail the intense debate that went on behind the scenes on what to include in Powell's speech. State Department analysts had found dozens of factual problems in drafts of the speech. Some of the claims were taken out, but others were left in, such as claims based on the yellowcake forgery.[49] The administration came under fire for having acted on faulty intelligence, particularly what was single-sourced to the informant known as Curveball. Powell later recounted how Vice President Dick Cheney had joked with him before he gave the speech, telling him, ""You've got high poll ratings; you can afford to lose a few points."" Powell's longtime aide-de-camp and Chief of Staff from 1989–2003, Colonel Lawrence Wilkerson, later characterized Cheney's view of Powell's mission as to ""go up there and sell it, and we'll have moved forward a peg or two. Fall on your damn sword and kill yourself, and I'll be happy, too.""[50]

That's from Wikipedia.  Not the best source, blah blah blah, but still sourceable to other sources.

At best, he was an ignorant pawn in their scheme.  At worst, he was a willing participant.  Neither scenario paints the picture of someone whose opinion matters much to me.  A ""voice of reason"" would not have proceeded with faulty information and/or unprepared.  

Revisionist rose colored glasses still can't wash the stink off this fraud.",4,0,1441588802,1444732212
cusygth,0,t1_cusssgx,velmarg,"I mean, in a sense, would anyone in the Bush administration's opinion be relevant, based on that?",3,0,1441584298,1444732212
cusjf25,1,t3_3juvm8,rdinsb,He has always been reasonable - so this seems in character.,3,0,1441554946,1444732212
cut1yxp,1,t3_3juvm8,thatnameagain,"Given that he is a Republican who got booted from the GWB administration for not being gung-ho about permanent war in the middle east, this is not surprising at all. ",2,0,1441591828,1444732212
cut13mi,1,t3_3juvm8,DwarvenPirate,Like I'm going to believe anything that jackass has to say.,-2,0,1441589948,1444732212
cush61l,1,t3_3juvm8,ClockOfTheLongNow,Expected.  He's one of the ones who learned the wrong lessons from Iraq.,-18,0,1441549950,1444732212
cuslxp9,0,t1_cush61l,CrapNeck5000,"Well now you got me curious about the right lessons.  I realize its off topic, but care to elaborate?  ",3,0,1441559871,1444732212
cusn8dy,0,t1_cuslxp9,ClockOfTheLongNow,"Short answer to keep it as on topic as possible, as I feel this issue has been beaten to death here lately, is that the risk of belligerent, terror-supporting nations having access to these sorts of weapons is too great to rely on the sort of half-baked investigatory activities that have little historical record of working.  But then people look at Iraq now and say ""see?!"" without realizing that our hasty exit, rather than our measured (and perhaps delayed) entrance, is the cause of the current effect.",-5,0,1441562290,1444732212
cusq82b,0,t1_cusn8dy,glberns,"> our hasty exit, rather than our measured (and perhaps delayed) entrance

Sometimes, Clock, I just think you're a troll.",4,0,1441567840,1444732212
cuswfd9,0,t1_cusq82b,AdmiralChamrajnagar,"What do you mean, sometimes?",2,0,1441579965,1444732212
cusnvzj,0,t1_cusn8dy,uncannylizard,If you dont trust investigatory activities then whats the solution? Preemptive war against every country with a nuclear energy program? ,4,0,1441563494,1444732216
cusnyab,0,t1_cusnvzj,ClockOfTheLongNow,"How about we just keep it confined to countries that aren't pretty obviously in violation of international treaties while acting as a significant threat to our allies?

That seems like a pretty okay line to draw in the sand to me.",-4,0,1441563615,1444732216
cuso4ad,0,t1_cusnyab,uncannylizard,"Okay so every single nation on earth other than Israel that has an opinion on the deal has supported it. 

And your plan is to pre-emptively go to war AFTER that deal is signed and BEFORE they violate it. Do you really think that this is a smart idea from the POV of American standing in the world? ",3,0,1441563922,1444732216
cusob64,0,t1_cuso4ad,ClockOfTheLongNow,I don't think we should be going along with the deal at all. ,-1,0,1441564320,1444732216
cusoczt,0,t1_cusob64,uncannylizard,"Yes, but the rest of the world has said that it will go ahead with the deal. So we will be powerless unless we wage preemptive war",5,0,1441564415,1444732216
cusotbe,0,t1_cusoczt,ClockOfTheLongNow,"Well, it might not really be preemptive given the threat to our allies, but if that's what has to happen...",-2,0,1441565246,1444732216
cusowj2,0,t1_cusotbe,uncannylizard,It is pre-emptive if we go to war to stop Iran from violating the terms of a deal that they havent violated yet. ,2,0,1441565405,1444732216
cusozb8,0,t1_cusowj2,ClockOfTheLongNow,But it's not preemptive to head off the threat to our allies or to combat their terror-supporting activities.,0,0,1441565543,1444732216
cusp56v,0,t1_cusozb8,uncannylizard,so basically you want to go to war because of their support for hezbollah,3,0,1441565835,1444732216
cuspyg6,0,t1_cusp56v,ClockOfTheLongNow,Among other reasons.,0,0,1441567345,1444732216
cusr31g,0,t1_cuspyg6,uncannylizard,"good luck getting anyone to support you. nobody is going to support an invasion of iran because of hezbollah. An invasion of Iran would be many many times more difficult than the Iraq and Afghanistan wars combined. Tens of thousands of american lives. hundreds of israelis would likely be killed too. And for what? To stop Iran from supporting Hezbollah, which hasnt even attacked Israel in a decade? Which has only been attacking ISIS and al Qaeda in recent years?
",2,0,1441569530,1444732216
cusp73h,0,t1_cusozb8,MAGwastheSHIT,Waging war to head off a threat is the definition of preemptive.,4,0,1441565935,1444732216
cuspybq,0,t1_cusp73h,ClockOfTheLongNow,"Preventative, maybe.",-1,0,1441567338,1444732216
cusquh4,0,t1_cuspybq,MAGwastheSHIT,"That's a bit pedantic, don't you think? At the risk of invoking Godwin's Law, here's a quote from a great Republican president who knew a thing or two about war:

""Preventive war was an invention of Hitler. Frankly, I would not even listen to anyone seriously that came and talked about such a thing.""
-Dwight D. Eisenhower",3,0,1441569087,1444732216
cusr3pq,0,t1_cusquh4,ClockOfTheLongNow,"From the same quote, and the context necessary: ""I would say a preventive war, if the words mean anything, is to wage some sort of quick police action in order that you might avoid a terrific cataclysm of destruction later.""  He believed it to be impossible in his time, but we know now that he was wrong about that impossibility.",1,0,1441569565,1444732216
cuszy1m,0,t1_cusr3pq,DaSuHouse,"> we know now that he was wrong about that impossibility

You're gonna need to explain that one.",2,0,1441587483,1444732216
cutcu1o,0,t1_cuszy1m,ClockOfTheLongNow,"Clearly, preventive war is possible.  It's been done successfully, perhaps most notably in Israel's Six Day War.",2,0,1441625649,1444732216
cusofcm,0,t1_cuso4ad,Trorbes,"They seem to believe that a persistent and indefinite occupation will lead to *less* resentment among the occupied country over time, and that our good intentions and military supremacy can justify any action the US takes.",2,0,1441564534,1444732216
cushdfe,0,t1_cush61l,glberns,What lesson is that? ,5,0,1441550445,1444732216
cuskgff,0,t1_cushdfe,ClockOfTheLongNow,The one where many are skittish about even glancing at the military option in Iran because they think Iraq was a mistake.,-10,0,1441557004,1444732216
cusl0tm,0,t1_cuskgff,glberns,That's an interesting view. Most people would say that we should explore diplomacy before going to war.,2,0,1441558116,1444732216
cusn9c2,0,t1_cusl0tm,ClockOfTheLongNow,I don't disagree.  I also don't think the last 30+ years are somehow a representation of a lack of diplomatic attempts.,1,0,1441562339,1444732216
cuu5nhk,0,t1_cusl0tm,ultimis,"We used diplomacy with Iraq. Both the Clinton Administration and the Bush Administration. The point from the OP is that you do not remove the military option off the table even though the after math of the war was a mess. It's leverage in the negotiations. Iran can bluster all they want, but a war with the United States is not something they would eagerly jump into. But if Iran thinks the United States has no interest to go to war with them, suddenly the only leverage the United States has is international sanctions which the Iranians already know the international partners don't care care to continue indefinitely.

You want the strongest position in a negotiation to get the best deal. And *sometimes* war is the best diplomatic option. Diplomacy is a tool, it is not the end result.",1,0,1441689398,1444732216
cusowd3,0,t1_cuskgff,xiipaoc,For whom exactly did the Iraq affair work out?,3,0,1441565397,1444732216
cusozmj,0,t1_cusowd3,ClockOfTheLongNow,Before or after we gave it all away to ISIS?,1,0,1441565558,1444732216
cusp9q9,0,t1_cusozmj,xiipaoc,"Either.  ISIS is a fairly new phenomenon in Iraq.  For whom was it working out before ISIS swooped in?  The millions of Iraqis killed or made homeless during a decade of war?  I don't know, who was it that benefited?",4,0,1441566068,1444732216
cuspy3z,0,t1_cusp9q9,ClockOfTheLongNow,"> For whom was it working out before ISIS swooped in? The millions of Iraqis killed or made homeless during a decade of war? I don't know, who was it that benefited?

The Iraqi people benefited, as did our allies in the region and the greater world.",-1,0,1441567328,1444732216
cutlft3,0,t1_cuspy3z,rdinsb,"http://thinkprogress.org/security/2011/12/20/393290/poll-iraq-war-iran/   

The Iraqi's don't feel they are better off.",0,0,1441646359,1444732216
cutln1y,0,t1_cutlft3,ClockOfTheLongNow,Does that mean they aren't better off?,1,0,1441646727,1444732216
cutlod2,0,t1_cutln1y,rdinsb,"They had stability, power 24/7, education, health services, working roads and trade..... then we invaded and they lost all that.  So yea, they were better off.",2,0,1441646792,1444732216
cutluor,0,t1_cutlod2,ClockOfTheLongNow,"But could be raped and executed at any time, constantly living in fear.  Good tradeoff for you?",1,0,1441647108,1444732216
cutlwwm,0,t1_cutluor,rdinsb,You think ISIS isn't raping or executing people at whim?  You think there was any time since the invasion when women felt safe?  You are deluded if you think so.  Things went from bad to far worse thanks to us.,1,0,1441647215,1444732216
cutm48z,0,t1_cutlwwm,ClockOfTheLongNow,I think ISIS was avoidable in Iraq.,1,0,1441647580,1444732216
cutm9aw,0,t1_cutm48z,rdinsb,True as that may be it in no way changes the facts on the ground - Iraqi's were safer and healthier and happier before we invaded with Saddam Hussein in power.,2,0,1441647831,1444732216
cutmjiz,0,t1_cutm9aw,ClockOfTheLongNow,I don't consider that factual.,1,0,1441648438,1444732216
cutmlct,0,t1_cutmjiz,rdinsb,"What exactly is not factual about it?   
Edit: I get it that it feels good to think we did something positive for them but feelings are feelings and facts are facts - and when we used depleted uranium shells in Iraq we increased the native populations cancer rates skyrocketed and continue to raise (as they will for lifetimes) - we need to simply face facts.",2,0,1441648529,1444732216
cusw08l,0,t1_cuspy3z,xiipaoc,"I take it you're not Iraqi, are you?",2,0,1441579118,1444732216
cusvdk5,0,t1_cuspy3z,Bassoon_Commie,"Yes, creating greater regional instability is totally beneficial for us and our allies.",2,0,1441577848,1444732216
cuskzih,0,t1_cuskgff,Feezec,"I agree that it is theoretically possible to become overly gun shy after looking at how the Iraq invasion turned out. I'm actually kinda inclined to believe the American response to Syria/Isis is overly tepid, likely because of bad memories from Iraq. But the results of Iraq seem very applicable to Iran. What I'm getting at is that military action against Iran is a really really bad idea",2,0,1441558047,1444732216
cusn9w9,0,t1_cuskzih,ClockOfTheLongNow,">  But the results of Iraq seem very applicable to Iran. 

Only if we choose to leave too soon again.",-5,0,1441562368,1444732220
cusnn90,0,t1_cusn9w9,RationalRattachist,I'm sure if we stayed in Iraq for a couple more years we would have found WMDs. Dammit Obama.,7,0,1441563048,1444732220
cusnq89,0,t1_cusnn90,ClockOfTheLongNow,"[Ahem] (http://www.nytimes.com/interactive/2014/10/14/world/middleeast/us-casualties-of-iraq-chemical-weapons.html?_r=1).

The ""too soon"" refers to ISIS, in any regard.",-8,0,1441563199,1444732220
cusw76a,0,t1_cusnq89,SapCPark,Abandoned chemical weapons. Not usable. George Bush even admitted there were no active weapons of mass destruction.  ,1,0,1441579504,1444732220
cusnyqt,0,t1_cusnq89,RationalRattachist,"Saddam Hussein did not have WMDs, something admitted by Bush himself. That was the main reason behind the war (alongside fictional links to Al Qaeda) and the failure to find the WMDs is why the war was and still is, a total failure.",6,0,1441563639,1444732220
cusoc2u,0,t1_cusnyqt,ClockOfTheLongNow,"Read the 9/11 Commission Report sometime to see how the Al Qaeda links were detailed.  

The war was a massive success.  Our failure was in the post-war activity.",-9,0,1441564368,1444732220
cusoxim,0,t1_cusoc2u,RationalRattachist,"""We could never verify that there was any Iraqi authority, direction and control, complicity with al-Qaeda for 9/11 or any operational act against America, period."" -George Tenet former director of the CIA.

To go to war you have to have a reason to do so. The reasons were that Saddam has WMDs and was involved with 911. Neither of them were true. So the war was pointless.",5,0,1441565454,1444732220
