id,is_root,parent_id,author,body,score,score_hidden,created_utc,collected_utc
cvhhrom,1,t3_3mqguc,mathurin1911,"As a small town Kansan, we suffer mostly from the dual decline of farming and manufacturing/industry, compounded by a fairly dispersed population and somewhat high levels of corruption (business leaders = politicians = the local rich class) not to mention brain drain, the flight of educated young people.",12,0,1443484123,1444722674
cvhs7ze,0,t1_cvhhrom,Brownbacked,"tl;dr People leave Kansas, or refuse to move here, knowing they will disadvantage their children in the global marketplace. Where talent goes, employers go.

Brain drain. I picture a snake biting its tail. The Kansas economy needs employers to move deeper west into the state and create non-seasonal, equitable wage jobs with career potential for advancement, family-building and settlement. Employers wonder how they will attract and cultivate strong talent to an isolated location with some of the nation's lowest paid teachers, highest consumption taxes, and [2015 personal income tax rates higher than California wage earners with similar income levels and filing status](http://taxfoundation.org/article/state-individual-income-tax-rates-and-brackets-2015) in exchange for negligible-to-negative cultural ROI. Will the talented, educated parents agree to settle long-term where really only one parent can expect to be a wage earner; where they will fear that their children will be allowed only a sub-par education; (No, calculus. Yes, boy's football.); when reports that Kansas schools, while they may be equitably funded, annually cut the number of academic school days thereby increasing the probability that this generation's milieu will consist of unenlightened people who may or may not realize they are functional illiterates with few to no 21st century practical skills?

Edit: No insults intended. Kansas has more than 34,000, unfilled, mostly low-paying jobs, and whether you make $15k annually or $150,000k annually you'll pay just 4.6% income tax. So, if you're a doctor who makes $250,000 annually from your LLC you pay zero taxes. So? Shame on us. Our taxes on food are just plain shameful. I'd pay 50% income taxes if it would afford our kids great educations, advanced training and employment near their families that offers them a full 40-hours per week and the hope they might just have a chance here and not have to become a truck driver or go work for the marijuana industry in Colorado.  I cannot begin to count the number of KS-college graduates I interview who cannot spell, write a grammatically correct sentence, read (let alone understand) a technical manual, or even speak grammatically correct sentences in their only language, English. (""I seen him yesterday."" grrrr...) If the internet connection speeds are faster in Central America than in Paola, what are we doing?!
",5,0,1443502207,1444722674
cvhblun,1,t3_3mqguc,ABSOLUTELY__BASED,"Kansan here, I'll do my best to give a tl;dr of the past couple of years.

Governor Brownback's and many Republicans in the state legislature's ultimate goal here is to make Kansas a zero-income tax state like Texas, Nevada, Florida, and I think one of the Dakotas. Because it's highly unreasonable to make that sort of change a flip of a switch type of deal, there's been a push lately to lower income taxes across the board. IIRC, the income tax cuts first took into effect 1.5 or 2 years ago.

Now here's where things get a bit partisan and fuzzy.

Kansas Democrats didn't much like the income tax cuts, in part because tax receipts for the state came in something like 1-3% below predicted values. On paper that worked out to around to a few hundred million. On top of that, a (in my estimation) activist judge ruled that the state's new funding formula for schools put many rural schools at a funding disadvantage, and by court order decreed that school spending had to go up in those areas, costing the state another $300 million or so, based off of a number produced by some state bureau that deals with this sort of thing. I mentioned earlier that it gets partisan here, because just a few months before the funding formula was changed, this same bureau came out with a number of required funds; and had they stuck with that same number everything would have been alright. But almost immediately after publishing the initial figure, they bumped up that price of required dollars that these schools needed, essentially throwing a bomb on the budgetary process at the very last possible moment.

Overall, the state faced a $600 million deficit. Queue back and forth bickering in the legislature and media about Brownback wanting schools shut down, and how the state's economy is a mess because of the deficit and yadda yadda.

In the end, the legislature passed an increase to the state sales tax of (I think) somewhere less than 1% and also bumped up the tax on smokes, and now everyone is upset. Democrats because the income tax rates were lowered, Republicans because other taxes were raised.

To sum up, the state economy is doing fine. We've maintained really good unemployment figures throughout the recession, and that's one of the reasons why certain media sources throw out the claim that 'oh well Kansas isn't recovering as fast as our neighboring states!' and they point to the delta in unemployment. Well the problem with that is when you're relatively close to full employment, OF COURSE you're not gonna have huge dips in the unemployment rate.

I think this upcoming year's economic output and tax receipts are going to do rather well. We're heavy on aviation and agriculture in the state, and both of those industries have had pretty good years in late 2014-2015.

That's all I can remember off the top of my head now. Let me know if you'd like me to get into any more specifics or anything.",44,0,1443473855,1444722677
cvhuba7,0,t1_cvhblun,bergamaut,">Governor Brownback's and many Republicans in the state legislature's ultimate goal here is to make Kansas a zero-income tax state

FYI this is a horrible, terrible idea: http://www.motherjones.com/kevin-drum/2012/02/soaking-poor-state-state

And it appears he's already getting his wish: http://www.usnews.com/dbimages/master/43009/GR_130613_garofalo.jpg",1,0,1443508074,1444722677
cvhz1a3,0,t1_cvhuba7,ABSOLUTELY__BASED,">motherjones

""Liberal media outlet says Republicans have bad policies!""

fucking yawn.",-1,0,1443527688,1444722677
cviik6a,0,t1_cvhz1a3,JordanLeDoux,"lol, you tried so hard in your first post to hide your bias, and then in the replies you're going full-on ""fuck the facts"" Republican.",1,0,1443559238,1444722677
cvimlvv,0,t1_cviik6a,ABSOLUTELY__BASED,k,1,0,1443565327,1444722681
cvi46b5,0,t1_cvhz1a3,bergamaut,There is no bias to the table ranking regressive state taxes. No income tax is simply a bad idea for anyone who isn't wealthy. ,2,0,1443538436,1444722681
cvhgrie,0,t1_cvhblun,slyweazal,"This is a suspiciously rosy interpretation that is revealingly devoid of facts or sources. 

This [article](http://mic.com/articles/112350/2-years-since-cutting-taxes-on-the-rich-kansas-economy-has-become-an-actual-hellscape) is an easy read with lots of citations that despite /u/ABSOLUTELY__BASED attempt to discredit it, does have more accurate, objectively verifiable facts than his narrative.",8,0,1443482376,1444722681
cvhhrxf,0,t1_cvhgrie,ABSOLUTELY__BASED,You mean this hit piece which ignores the changes to the tax law to middle and low earners?,2,0,1443484135,1444722685
cvhll02,0,t1_cvhgrie,Kronos9898,"The title calls Kansas a ""hellscape"", I'm sorry, but I am doubting it is anything but objective.",7,0,1443490343,1444722685
cvhr8ec,0,t1_cvhll02,slyweazal,"***Title:*** ""*2 Years Since Cutting Taxes on the Rich, Here's What Happened to the Economy in Kansas*""

The article has plenty of sources and offers a straightforward rundown of the cause-and-effect of what happened with links to exact quotes and news articles.",5,0,1443499974,1444722685
cvhdpqe,0,t1_cvhblun,zigmeister22,"Thanks for the great write up here- very interesting.  As a Kansasan, are you worried at all about the future (e.g. debt caused by tax situation, resulting jobs situation, etc.)?",5,0,1443477145,1444722685
cvhf7bd,0,t1_cvhdpqe,ABSOLUTELY__BASED,"As for debt caused by the tax base change, I'm not at all worried. Kansas like most other states is a zero deficit state, so legally we wouldn't be allowed to carry over debt. What I am worried about is the constant and consistent push to throw more money at the schools, regardless of need or results.

Do a quick google for 'brownback school cuts' and you'll get [162,000](https://www.google.com/webhp?sourceid=chrome-instant&rlz=1C1CHVN_enUS584US584&ion=1&espv=2&ie=UTF-8#q=brownback+school+cuts) results. Little known fact thanks to a partisan media is that school funding has [never actually gone down during Brownback's tenure](http://www.kansasopengov.org/SchoolDistricts/SpendingPerPupil/tabid/1271/Default.aspx), or the fact that Kansas ranks rather well in terms of [per pupil spending](http://www.usnews.com/news/blogs/data-mine/2015/01/29/how-states-are-spending-money-in-education) compared to other states, even though our population is ~3 million and GDP is well [below average](https://en.wikipedia.org/wiki/List_of_U.S._states_by_GDP) due to 80% of the state being very rural.

>resulting jobs situation

I've yet to understand this cry that the job situation is bad in Kansas... We're [.5% better than the national average](https://en.wikipedia.org/wiki/List_of_U.S._states_by_unemployment_rate) in terms of the unemployment rate and our only neighboring state with a better unemployment rate is Nebraska at an astonishing 2.3%!",3,0,1443479617,1444722685
cvhlyfq,0,t1_cvhf7bd,way2lazy2care,"Oh shit, Nebraska out of left field...",1,0,1443490927,1444722685
cvhl10f,0,t1_cvhf7bd,YaDunGoofed,">or the fact that Kansas ranks rather well in terms of per pupil spending[3] compared to other states

I think that might be BECAUSE of:

>80% of the state being very rural

Consider the [map of the page you cited](http://www.usnews.com/news/blogs/data-mine/2015/01/29/how-states-are-spending-money-in-education) as a comparison to other rarely populated states vs denser ones (except new york, holy shit) for proof",5,0,1443489467,1444722685
cvhlmjw,0,t1_cvhl10f,ABSOLUTELY__BASED,"You mean like the entire SE corner, Utah, Idaho, Arizona, Oklahoma, Texas, Iowa, Washington, Oregon, California, Nevada, South Dakota, Missouri, Arkansas, and Kentucky?",1,0,1443490412,1444722689
cvhmx9p,0,t1_cvhlmjw,YaDunGoofed,Yes,1,0,1443492446,1444722689
cvhei4i,0,t1_cvhblun,iliveintexas,"> zero-income tax state like Texas, Nevada, Florida, and I think one of the Dakotas

Washington state too.

Source: I used to live in Washington.",4,0,1443478451,1444722689
cvhj3tp,0,t1_cvhblun,SapCPark,"According to the BLS, Kansas has lost 27,000 jobs since March and unemployment has gone up .4%.  To say the economic picture in Kansas is fine is misleading.  It's concerning at the least that Kansas is losing jobs at the same time the countries economy is growing.  ",24,0,1443486392,1444722689
cvhlpxl,0,t1_cvhj3tp,ABSOLUTELY__BASED,">gone up .4%

Yes, [half of which](http://www.bls.gov/eag/eag.ks.htm) coming from the 'loss' of government jobs.",7,0,1443490552,1444722689
cvhu2eb,0,t1_cvhlpxl,bergamaut,"Where do you get the idea that it's not a real loss of employment?

Government jobs often put upward pressure on wages and benefits, all without money being transferred to the wealthy via profit.",6,0,1443507285,1444722689
cvhz1l5,0,t1_cvhu2eb,ABSOLUTELY__BASED,"> Where do you get the idea that it's not a real loss of employment?

Because the net effect is generally a positive to the state budget.

>all without money being transferred to the wealthy via profit.

Funny you say that, considering the richest counties in the United States [mostly surround the DC area](https://www.google.com/webhp?sourceid=chrome-instant&rlz=1C1CHVN_enUS584US584&ion=1&espv=2&ie=UTF-8#q=richest%20county%20in%20usa).",-7,0,1443527713,1444722689
cvi4hb2,0,t1_cvhz1l5,bergamaut,">Because the net effect is generally a positive to the state budget.

This doesn't address my question. The jobs are still very real and they were lost. Not ""lost"", but actually lost.

>Funny you say that, considering the richest counties in the United States mostly surround the DC area.

LOL, you think the people making all of that money are in the public sector and not the private sector? I'm not talking about contractors and lobbyists, I'm talking about state employees.",6,0,1443538921,1444722689
cvhrpy5,0,t1_cvhlpxl,SapCPark,So that still means private jobs are leaving as well/not filling in close to enough to make up for it,10,0,1443501035,1444722689
cvhkmm5,0,t1_cvhblun,JordanLeDoux,"Hmmm. The fact that you said the Democrats are upset because income taxes went down makes me think you don't understand their side, which makes me think your post is a little more biased than you let on.

Democrats are almost surely more upset about the increase in sales tax, since sales taxes are one of the worst kinds of taxes for the poor.

I guarantee whatever gains the poor got from income tax cuts were eaten up by the sales tax increase, but I doubt the rich make most of their purchases in Kansas.",31,0,1443488846,1444722689
cvhgojf,0,t1_cvhblun,punk___as,">Democrats because the income tax rates were lowered

I'm not convinced that it's the lowering of income taxes that bothers Democrats. It's the decision of who to lower them for, and the question of how to balance the reduction in revenue. ",21,0,1443482228,1444722689
cvhhsot,0,t1_cvhgojf,ABSOLUTELY__BASED,"Right, so lowering of tax rates upset Democrats.

This was an across the board tax reduction.",-6,0,1443484172,1444722689
cvhihc2,0,t1_cvhhsot,schoocher,"Or, it's because an increase in sales tax is by it's nature a regressive tax.",20,0,1443485356,1444722689
cvhk312,0,t1_cvhihc2,Unshkblefaith,Most state income taxes are regressive anyway. If they aren't a flat tax then the difference between top and bottom rates is less than 3%. California and New Jersey are the only stays in the US with significant differences in income tax rates.,4,0,1443487985,1444722689
cvhr31t,0,t1_cvhk312,mclumber1,"This.  As an Oregon resident, it's painful to see poor people here pay nearly the same rate at high earners. ",0,0,1443499660,1444722689
cvhlyxw,0,t1_cvhhsot,punk___as,">This was an across the board tax reduction.

They removed the top tier of taxation and combined that with the next tier (of 3), and they increased the standard deduction. (Those tiers were too close together anyway.) But this obviously provides greater benefit to higher income Americans than working ones.

What upset Democrats is that those tax cuts for high earners were paid for by increasing sales tax, so effectively the tax burden is just been shifted to working Americans. 

But hey, I'm sure that's totally going to trickle down any day now. 
",27,0,1443490949,1444722689
cvhjgvv,0,t1_cvhgojf,r_a_g_s,"Lowering income tax has a disproportionate effect; with few exceptions, how much of a benefit you get is directly proportional to your income, meaning it helps high-income people a lot, but doesn't do a damn thing for low-income people.

Meanwhile, increasing sales taxes almost always affects low-income people more (in terms of percentage of income) than high-income people.

So lowering income taxes and raising sales taxes at the same time effectively amounts to a transfer of income/wealth from the poor to the rich.",21,0,1443486993,1444722689
cvh8s9g,1,t3_3mqguc,rdinsb,"Well, the whole cut taxes and the economy will boom was tried and tested in Kansas and the results are in- they are not raising sufficient money to run their State, the economy is not booming and is in fact trailing from similar States that are near that did not cut taxes.
",27,0,1443469843,1444722689
cvhbwm4,0,t1_cvh8s9g,MeowTheMixer,"The time frame for the changes to take affect are not short term, and hard to really show in two years. Short term, deficits are expected when you cut taxes due to the cut. It should be a few years before new revenue is realized. 

Companies do not just ""up and move"" to new areas the second a law is changed. Business plans are drafted easily 3-5 year segments. 

For now yes, Kansas is not looking good. But many other states, are also in big defects such as California/Illinois ",-3,0,1443474305,1444722689
cvhcoh4,0,t1_cvhbwm4,rdinsb,"California under Gerry Brown and a strong Democratic majority has managed to wipe out the deficit in California and now has around an 8Billion dollar surplus: http://www.governing.com/topics/finance/tns-california-surplus.html   

California did the opposite of Kansas - and it paid off in the short and long term.",12,0,1443475511,1444722689
cvhereq,0,t1_cvhcoh4,MeowTheMixer,"Fair article,  but it was published before a revised budget was released by Governor Brown.  So I think over all this surplus would be closer to $6billion, if the assembly speakers comments were accurate (very easy to spin these numbers, I live in Wisconsin and see it all the time) 

>Atkins' comments come a week before Gov. Jerry Brown is expected to release a revised draft of his $113 billion general fund spending plan for the fiscal year that begins in July

The actual general budget that was passed was slightly larger. [Soruce](http://www.latimes.com/local/political/la-me-pc-jerry-brown-signs-california-budget-20150624-story.html)

>The new spending plan includes a $115.4-billion general fund and takes effect July 1.

It also looks like there are some major budget issues that still need to be addressed according to that article. So I'm not exactly sold on the long term success of this plan. 

>Brown has more work to do on long-term financial issues, such as figuring out how to pay for healthcare for retired state workers. The cost is estimated at $71.8 billion more than officials have set aside, making it one of the biggest drags on California finances.

But there is some money also not accounted for in this plan form carbon tax credits. Estimated in the hundreds of millions. I'm guessing this is because they are unsure of how sustainable this revenue stream is (100% conjecture).    

>The budget does not include a plan for using hundreds of millions of dollars generated by California's cap-and-trade program
",0,0,1443478878,1444722689
cvhdgri,0,t1_cvhcoh4,xole,"Yep, I used to live in CA and you'd be amazed at how many people think jerry brown ran it into the ground, when it was his predecessor who did and he turned it around. ",7,0,1443476750,1444722689
cvhbff2,0,t1_cvh8s9g,BagOnuts,"That's because KS cut taxes but not spending. Cutting taxes has [paid off considerably](http://www.wsj.com/articles/the-tax-cut-payoff-in-carolina-1433373095) in NC, but we also cut spending. 

EDIT- Just realized this article is behind a paywall. Here is the text, if anyone is wondering:

>Four years ago North Carolina’s unemployment rate was above 10% and the state still bore the effects of its battering in the recession. Many rural towns faced jobless rates of more than 20%. But in 2013 a combination of the biggest tax-rate reductions in the state’s history and a gutsy but controversial unemployment-insurance reform supercharged the state’s economy and has even helped finance budget surpluses.

>As Wells Fargo’s Economics Group recently put it: “North Carolina’s economy has shifted into high gear. Hiring has picked up across nearly every industry.”

>The tax cut slashed the state’s top personal income-tax rate to 5.75%, near the regional average, from 7.75%, which had been the highest in the South. The corporate tax rate was cut to 5% from 6.9%. The estate tax was eliminated.

>Next came the novel tough-love unemployment-insurance reforms. The state became the first in the nation to reject “free” federal payments for extended unemployment benefits and reduce the weeks of benefits to 20 from 26. The maximum weekly dollar amount of payments, $535, which had been among the highest in the nation, was trimmed to a maximum of $350 a week. As a result, tens of thousands of Carolinians left the unemployment rolls.

>Committee to Unleash Prosperity Co-founder Steve Moore on the return of the Republican Party's 'Pat Buchanan' wing. Photo credit: Getty Images.
In an interview at the governor’s mansion, Gov. Pat McCrory tells me that when he took office in January 2013 he looked at the data and knew “we couldn’t stay on the course we were on. We had the highest unemployment benefits and yet at the same time businesses were routinely complaining they couldn’t find workers until benefits ran out. We heard a lot of stories of workers waiting until benefits ran out before going back to work.” In sum, the state was paying people not to work.

>While these measures were passing the legislature, the state capital boiled over with rancorous political rallies, called Moral Mondays, designed to block the “cruel” GOP agenda. Rev. William Barber II, one of the protest organizers, lambasted Republicans for making the Tar Heel State a “crucible of extremism and injustice.” The national media piled on with claims that the Republican agenda cut taxes for the rich while slashing benefits for the poor.

>Then a funny thing happened. After a few months, the unemployment rate started to decline rapidly and job growth climbed. Not just a little. Nearly 200,000 jobs have been added since 2013 and the unemployment rate has fallen to 5.5% from 7.9%. There is a debate about how many of North Carolina’s unemployed got jobs and how many dropped out of the workforce or moved to another state. But the job market is vastly improved and people didn’t go hungry in the streets. On the Tax Foundation index of business conditions, North Carolina has been catapulted to 16th from a dismal 44th since 2013.

>The most recent news will make many other governors jealous. The state didn’t take the extra federal benefits—which require repayments later to the feds—and it cut the weekly benefits. So the state government has been able to pay back $2.8 billion in unemployment-insurance money owed to the feds, and it now has a trust-fund surplus. This means it will be able to provide employers with at least $500 million in cuts from the state and federal unemployment tax on payroll over 18 months.

>This comes at a time when other states are having to raise payroll taxes to pay off the loans for the rich benefits they doled out in the recession and its aftermath. The lesson: Handouts from the feds are never free.

>An even bigger surprise—even to supporters—is the tax cut’s impact on revenue. Even with lower rates, tax revenues are up about 6% this year according to the state budget office. On May 6, Gov. McCrory announced that the state has a budget surplus of $400 million while many other states are scrambling to fill gaps.

>This is the opposite of what has happened in Kansas, where jobs have been created but revenues have fallen since the top personal income-tax rate was cut from 6.45% in 2012 to 4.6% today and the income tax for small business owners who file as individuals has been eliminated. North Carolina’s former budget director, Art Pope, says one difference between the two states is that “we cut spending too. Kansas didn’t.”

>The story gets better. Because North Carolina built in a trigger mechanism that applies excess revenues to corporate-rate cuts, the business tax has fallen to 5% from 6.9%, and next year it drops to 4%.

>You won’t hear much about this in national news media, where the preferred story line is that tax cuts don’t work because they were followed by budget deficits in Kansas. In North Carolina, policies to reduce taxes and stop paying people for not working have created jobs and surpluses. Mr. Pope says: “I wish people criticizing Kansas would look at what’s happened here.”",15,0,1443473594,1444722693
cvhmf1q,0,t1_cvhbff2,dbcfd,"Unlike Kansas, who cut income taxes for businesses and the wealthy (e.g. LLCs to shelter income), North Carolina cut taxes for the poor and middle class.

```This change was part of the changes made to individual income tax to reform and simplify the State’s tax law. Previously, there were three individual income tax rates of 6%, 7%, and 7.75%, based on filing status and income levels.```

http://www.dor.state.nc.us/taxes/individual/taxrate15.html",0,0,1443491650,1444722693
cvhckud,0,t1_cvhbff2,virnovus,"North Carolina had been having strong growth for at least the past decade prior to that.  Tax cuts likely had little to no effect on that growth, although their supporters are certainly going to give them full credit for it.",10,0,1443475356,1444722697
cvhcy1v,0,t1_cvhckud,BagOnuts,"You have anything to base that off of? Before the Republicans took the majority in the GA and started implementing these plans, we were over 10% unemployment (higher than the national average), $2.8 *billion* in federal unemployment-insurance debt with no plan to pay it off, and at the bottom of the list of indexes for business conditions. 

Yes, NC has been growing for a while now, but you can't just ignore the correlation of the explosion of growth and a very health economic environment after these policies went into effect. I'm not going out of my way to give them credit. There are a lot of things the Republican GA has done that I completely disagree with, but their economic plans have had tangible positive impacts on our economy. Denying that seems incredibly partisan, to me. ",5,0,1443475926,1444722697
