id,is_root,parent_id,author,body,score,score_hidden,created_utc,collected_utc
cv4zvyx,1,t3_3lc48c,FlyingFistsOfFury,"I'm not impressed with her as a person, but I thought she managed one of the somewhat better performances of the night.",5,0,1442516586,1444727353
cv50ka3,0,t1_cv4zvyx,rkrish7,"This is how I feel as well. I know for a fact that she talks a lot of bs, but she is very articulate, and if I can see why some people support her. ",2,0,1442517588,1444727353
cv52048,0,t1_cv50ka3,,"And the debate was just a series of 10-second clip farming.  Many candidates could straight up avoid ever talking about anything beyond a shallow reasoning because there are still too many on the podium.
",2,0,1442519704,1444727353
cv50wc7,1,t3_3lc48c,maddata,"Oh I thought you were being sarcastic, I do sort of agree though that she came of as meh.  Perhaps just the best meh of the night?

I'll just offer some rebuttal?

> She wants to increase an already bloated military budget and is very hawkish

It's difficult to just call our military budget bloated.  Sure you can compare it to everyone else, but that's totally apples to oranges.  Fact is, we do need to maintain global hegemony, and we do need to confront Russia to return to a peaceful status quo.  Does that mean carpet bombing Syria?  Probably not, but remember that all of the candidates on stage are pandering to likely republican voters.  Fiorina displayed good fluency with foreign policy issues, second to Rand Paul and Rubio (iirc, Paul was the most pragmatic - said what should and would be done, Rubio was the first to highlight the realities of the situation, and Fiorina was the best at describing a desirable sounding policy in detail whether or not she would actually go through with it).

> She made up stuff about planned parenthood videos, and can put a good emotional response of indignation when she needs to.

Yeah this shit irritates me too.  The PP videos are deliberately misleading, no need to lie about them even more.  Still, pandering to the audience is more important than honesty in politics.


> She can actually land a punch on Trump due to the social protection of being a women, notice how the audience clapped along when Trump made fun of Rand's looks 10 minutes earlier but thought her response was brilliant.

Entertainment?  And trump said some pretty nasty shit about her, the response was very good [I think we all heard trump clearly] because on the surface it is very civil but it highlights how disrespectful trump was to her.  Trump was making rude comments to everyone, it's part of his brand to be a brash loudmouth.

> Completely forgettable on taxes and immigration.

Yeah fair.

> Has a very low likability in terms of mannerisms and demeanor, I can actually see what Trump mean't.

I think she's alright, I mean she comes off as a little stern but seems well informed.

> Pandering response about the currency question, because women aren't a special interest group, they can't be on the bill?

Who cares bout the bill?

> Lied blatantly about her business record.

Who cares about her business record?  What did she lie about?  I'm sure there's multiple interpretations to the story.

Annnnyways, I took biggest umbrage at her parading her Alcoholic Pill-addicted daughters death as an anti-Marijuana anecdote, pretty disgusting (just like  the way PP is discussed).  Any reasonable person looking at plain facts would agree that marijuana is less dangerous than alcohol and has less social impact than alcohol, but the GOP still parades this nonsense about gateway drugs around.  I would probably vote GOP if not for that issue...

I'm a little skewed because I really strongly believe that the entire drug scheduling act should disappear.  State regulations and some federal legislation against some of the more deadly drugs (heroin) should take it's place. Legitimate addiction should be treated (just like it is for alcohol, gambling, tobacco and whatever else), but throwing people in jail for taking drugs is dumb, and used in practice as the primary mechanism to perpetuate racial injustice.",2,0,1442518083,1444727353
cv51e27,0,t1_cv50wc7,ZenerDiod,">Fiorina displayed good fluency with foreign policy issues, second to Rand Paul and Rubio (iirc, Paul was the most pragmatic - said what should and would be done, Rubio was the first to highlight the realities of the situation, and Fiorina was the best at describing a desirable sounding policy in detail whether or not she would actually go through with it).

Come on, it's not apples to apples but do you think we need MORE spending? Don't we already spend more then the next 10 combined? If we get in a large scale war with any superpower it'll be nuclear winter anyways, wars between countries are fought with economics nowadays not bullets.

>Entertainment? And trump said some pretty nasty shit about her, the response was very good [I think we all heard trump clearly] because on the surface it is very civil but it highlights how disrespectful trump was to her. Trump was making rude comments to everyone, it's part of his brand to be a brash loudmouth.

Yeah, I liked seeing Trump shut down, I just hate that the only reason she was able to do it because people feel sorry for women that called ugly and not men. She had made fun of Trump's appearance first, and everyone feels sorry for her when he hits back. Trump insulted Rand for no reason and everyone's clapping along.

>Who cares about her business record?

It's the only qualification she to run as president and its a complete failure 

http://www.washingtonpost.com/blogs/fact-checker/wp/2015/05/08/carly-fiorinas-misleading-claims-about-her-business-record/
http://www.businessinsider.com/fiorina-widely-considered-the-worst-ceo",1,0,1442518805,1444727353
cv664q9,0,t1_cv51e27,rabidstoat,"I think she came across as solid in foreign policy issues, as far as the base knowledge goes. She demonstrated that she knew who the players were, and she demonstrated that she knows their history and its implication.

She also had a very clear agenda laid out in terms of foreign policy, nothing wishy washy. Now granted, it scared the shit out of me and makes me think she wants to start World War 3, but she did have a definite platform.",1,0,1442603103,1444727353
cv6abxu,0,t1_cv664q9,ZenerDiod,"Yeah I guess, I'm honestly never really that impressed by anyone foreign policy experience considering the amount of resources they have at their disposal, they know no more then I have gotten from casually following international politics.",0,0,1442609758,1444727353
cv50940,1,t3_3lc48c,BoiseNTheHood,"Her debate performance was completely overrated because she lobbed one decent zinger at Trump.  Conveniently, the media has ignored one of Trump's stronger moments of the debate, which was when he explained in great detail just how badly Carly failed as CEO of HP.

I know most GOP candidates these days tend to be hawkish, but Carly's thirst for immediate war is downright disturbing.  Does she realize that average Americans' children, siblings, relatives and friends go off to die in these wars, or is she too detached and aloof to care? She's getting a huge free pass on this for some unknown reason.

Additionally, I would say that her attitude and demeanor are very similar to Rand Paul's.  They're both shrill, condescending, with an unearned superiority complex.  She *is* unlikeable.",4,0,1442517128,1444727353
cv5lasc,0,t1_cv50940,rikross22,"I disagree, she commanded a lot of speaking time and managed to get a few very important things; the zinger on trump, the red meat moment on abortion that will play great to pro life groups, and a human moment speaking about drug use. Now I don't agree with her on the latter two issues stated but I think she positioned herself great in this debate, she looked like she belonged up there and wasn't intimidated by the lime light. If she keeps putting in performances like this she will at least be a top choice for VP if not in the mix for nomination. ",1,0,1442554797,1444727353
cv50zvk,0,t1_cv50940,xertzed,"Yeah... Paul came off looking like the most reasonable member of the group, in my opinion, but he can definitely get a little pretentious, which isn't playing well at all with Republican primary voters.

Also, his hair looks like microwave ramen.",3,0,1442518226,1444727353
cv5043z,1,t3_3lc48c,IUhoosier_KCCO,"> She's clearly pretty smart, and a decent speaker.

i agree with this. however, most of the negatives you list are petty, but it's hard to really disagree with them. plus, some of the negatives you listed are positives for republicans (hawkish, her demeanor, being a businesswoman, etc.).

on the other hand, i do agree that i'm not really impressed by carli fiorina. i don't mind candidates who aren't politicians. but there are some immediate disadvantages when you have 0 legislative experience (e.g. actually understanding how to get bills passed, bipartisanship, lack of knowledge in vital presidential roles like foreign policy, etc.) and she hasn't done anything to really make up for it.",1,0,1442516922,1444727356
cv5uo4n,1,t3_3lc48c,yabbadabbadoo1,"She just seemed too angry, could she smile once? And her forign policy makes Trump seem tame. Wants war with Russia from the sounds of things. Also looking at her previous companies and its not good.

https://en.m.wikipedia.org/wiki/Lucent",1,0,1442585296,1444727356
cv500r5,1,t3_3lc48c,DevonWeeks,"The claim she ""made up stuff about Planned Parenthood"" was an incorrect fact check by the Washington Post.  Fiorina was referring to the 10 unedited videos in which what she described took place (in the 7th video).  It does, in fact, exist.  Expect a correction on that probably in the morning. 

And I can't recall any lies about her business record.  I do recall Trump's, though. ",1,0,1442516785,1444727356
cv50m3d,0,t1_cv500r5,ZenerDiod,"Can you link to the correction and the video that she was referring too?

Her entire business record thing was bullshit and you know it, she was rated one of the worst CEOs by multiple people, and has been referred to as the anti-Steve Jobs. If she's so smart why isn't she running a tech company anymore?",0,0,1442517663,1444727356
cv50ysy,0,t1_cv50m3d,DevonWeeks,"Sigh.  Okay.  Thought we were having a serious discussion.  The only ""worst CEO"" claims that come up in a search are far left websites like DK or HuffPo.  You're deliberately overplaying partisan opinion pieces to push a narrative which would indicate you aren't really interested in having a real discussion.  

Next time, try approaching the issue with at least somewhat of an open mind, and try not to tell other people what they ""know is bullshit.""",1,0,1442518181,1444727356
cv513m2,0,t1_cv50ysy,ZenerDiod,"Look through my comments and you'll know I lean right, so I don't know what partisan bullshit you're talking about.

http://www.washingtonpost.com/blogs/fact-checker/wp/2015/05/08/carly-fiorinas-misleading-claims-about-her-business-record/

http://www.businessinsider.com/fiorina-widely-considered-the-worst-ceo

Yeah BI and WP are soooo far left. ",-2,0,1442518378,1444727356
cv51d9c,0,t1_cv513m2,DevonWeeks,"Until you can calm down and be civil, we're not discussing it anymore.  I'm not in the mood for childish Internet ranting right now.  I have real life going on, happy memories to be made, and I frankly won't let your piss poor attitude into my day.  So, good day. ",-4,0,1442518772,1444727356
cv51iro,0,t1_cv51d9c,Fuckn_hipsters,"Ok I'll ask, can you please provide a source for the video you were referring to. ",0,0,1442518997,1444727356
cv52o36,0,t1_cv51iro,LeftysRule22,[Around the 6 minute mark](https://www.youtube.com/watch?v=FzMAycMMXp8),1,0,1442520708,1444727356
cv532yb,0,t1_cv52o36,Fuckn_hipsters,"First thank you for providing me with some reference to what he was talking about.

However, this tells me nothing about if these procedures actually take place, how often, and what were the reasons for the late term abortion. This lady could be making her entire story up, the guys on Ancient Aliens do the same things with a straight face all of the time. 

I am pro-choice but I'm against late term abortions when the fetus and mother are healthy. If the mothers life is at risk I would support the abortion. How do I know that the fetus from this video is not from one of these situations? Also, when these situations are necessary I have no problem with organs or tissues being usd for research. To me this is not any different than me being an organ donor.",2,0,1442521331,1444727356
cv53i42,0,t1_cv532yb,LeftysRule22,I agree that the videos have zero credibility and I think it is very unethical and unpresidential to use them for political gain.,-2,0,1442521967,1444727356
cv55rog,0,t1_cv532yb,littlebitsoffluff,"

How about this one? I think this is the actual 7th video. Correct me if I'm wrong. 

https://www.youtube.com/watch?v=GWQuZMvcFA8",1,0,1442525540,1444727356
cv51ghk,0,t1_cv51d9c,ZenerDiod,"I response with sources, and you have no rebuttal, I'll consider that a concession.",3,0,1442518903,1444727356
cv51r1y,0,t1_cv51ghk,DevonWeeks,I consider your unwillingness to have a civilized conversation your own admission that you don't really have any basis or understanding for anything you claimed. To each his own. ,-7,0,1442519334,1444727356
cv51wg2,0,t1_cv51r1y,ZenerDiod,"> that you don't really Hanne any basis 

English please?

And I don't know what was so uncivilized about my response, can you not handle the word bullshit without clutching your pearls? What about the response to my sources?

Ad hominems are the last refuge of the out argued. ",0,0,1442519556,1444727356
cv522fx,0,t1_cv51wg2,DevonWeeks,"Fixed the autocorrect.  Your hostility is quite clear, and I don't care if you curse.  You attacking my integrity is what's so hostile.  Saying ""and you know it"" implies I am lying about my statement.  You leave no room for alternate sources or interpretation of data.  Instead, you essentially say I just made something up.  That's what makes you hostile and childish.  ",-3,0,1442519800,1444727356
cv529r7,0,t1_cv522fx,ZenerDiod,So...no sources to back up your claim? Got it!,-3,0,1442520098,1444727356
cv53f1w,0,t1_cv529r7,DevonWeeks,"I do have them, and they come up really in Google.  I just care nothing for having any kind of an exchange with you because you obviously aren't open to any information that doesn't fit what you intend to believe. ",0,0,1442521840,1444727356
cv524tn,0,t1_cv522fx,Fuckn_hipsters,"When you make claims without sources even when people ask you for them they are inclined to think you made things up. So again, how about that source?",1,0,1442519899,1444727356
cv52bae,0,t1_cv524tn,DevonWeeks,"Funny how you didn't demand any sources for anything OP claimed.  Don't go screaming ""source"" just because you disagree with something.  Either you respect sources on their academic merit, or you don't.  You clearly don't, so it would be a waste to give your any.  ""Source"" has become the most partisan and opportunistic word used on Reddit.",-2,0,1442520162,1444727356
cv52hvb,0,t1_cv52bae,Fuckn_hipsters,"He provided sources on Carly's business record, but you have seemed to ignore those. As for the PP comment, I currently work for a non-profit and understand how billing works for that type of organization. You can raise money anyway you want as long as it isn't counted as profits. So it is completely legal to do what PP did as long as it is used to cover their operating expenses. I wanted to see the video and attempt to see if there is anything nefarious going on like you claim. 

>""Source"" has become the most partisan and opportunistic word used on Reddit.

Nope, it is to check and make sure people like you aren't just making things up. You have still not provided a source after multiple requests so I am lead to believe that you have no idea what you are talking about and there is no source. ",-2,0,1442520441,1444727356
cv53dhw,0,t1_cv52hvb,DevonWeeks,"https://m.youtube.com/watch?v=FzMAycMMXp8

Start at the 5:40 mark and watch for roughly two minutes.  It's amazing how you people will never admit to only caring about sources when it suits your purposes.  This source shows the video Fiorina mentioned, but you don't care.  This is the point where you try to find some way to quibble on the details to keep promoting whatever narrative you intended to in the first place.  ",1,0,1442521774,1444727356
cv57e0w,0,t1_cv53dhw,ZenerDiod,"And...bullshit

http://blogs.wsj.com/washwire/2015/09/17/at-debate-carly-fiorina-described-scenes-not-in-abortion-videos/",0,0,1442528273,1444727356
cv5h10u,0,t1_cv57e0w,DevonWeeks,"And, as I said, you weren't ever intending on actually paying attention to any sources or watching them for yourself.  You have nothing of value to add and no interest in discussion.  If you did, you'd have at least just watched the clip yourself and seen that it does, in fact, exist.  You'd also be paying attention to the fact that CNN admitted it existed but just quibbled over its authenticity.  You're cherry picking information, and now you're resorting not to a WSJ blog post and your fingers in your ears.  Troll someone else, please.",1,0,1442545337,1444727356
cv5hrij,0,t1_cv5h10u,ZenerDiod,"I watched them, and then rebutted them. You just can't admit you mad a mistake. It's alright, I understand it's probably hard.",-1,0,1442546672,1444727356
cv5hui4,0,t1_cv5hrij,DevonWeeks,"You rebutted nothing.  Now you're just flat out lying.  Simply saying ""bullshit"" and posting a blog isn't ""rebutting.""  You could try admitting you didn't intend to be open to anything you didn't want to hear, but that would require a shred of honesty.  ",1,0,1442546828,1444727356
cv5hvzc,0,t1_cv5hui4,ZenerDiod,"Why don't you address then blog directly instead of whining, your video shows nothing except a aborted fetus moving, a far cry from what was talked about during the debate.",-1,0,1442546908,1444727356
cv5inpt,0,t1_cv5hvzc,DevonWeeks,"Why don't you stop acting like a worthless child?  Really.  ""Whining?""  It's pathetic. Go back to /r/politics or learn how to have an adult conversation. 

As for your little blog there's nothing to address.  It quotes Fiorina from the debate and **includes the link to the video she references.**  The only thing in question is whether or not the video is authentic or whether or not it is dishonestly edited, a point I'm not debating one way or the other.

Here's what tells me you didn't watch the video.

>your video shows nothing except a aborted fetus moving

Obviously, you haven't watched it.  Why?  Because the video is over 10 minutes long and obviously shows more than ""nothing except"" an aborted fetus moving.  It also includes the commentary Fiorina gave, and what she described shows up exactly.  

Like I said, you can debate the authenticity of the video.  I'm not an abortion or anti-abortion activist and have no interest in whether or not the video is authentic or everything it claims to be.  I only pointed out that the fact check was **flat wrong**.  The video does, in fact, exist and matches clearly the description given by Fiorina at the debate.  Instead of fact checking that, websites have concerned themselves with whether or not the video is authentic.  But, here's the thing.  It doesn't matter.  A fact check is a fact check.  Fiorina said this video exists and described it.  It does.  If the video isn't authentic, that's on the makers of the video, not Fiorina, yet, you and others seem intent on assigning blame to her for merely making mention of it rather than the filmmakers for not making it honestly.  That's your problem, not mine.  The bottom line, she described a scene from a video, and that video is right there for anyone to watch.  Anything beyond that doesn't belong in a ""fact check.""",1,0,1442548331,1444727356
cv5izeu,0,t1_cv5inpt,ZenerDiod,"> Why don't stop acting like a worthless child? Really. ""Whining?"" It's pathetic. Go back to /r/politics or learn how to have an adult conversation.

Who's name calling now :)

Speaking of children, you have the emotional stability of one.",0,0,1442548964,1444727356
cv5j2av,0,t1_cv5izeu,DevonWeeks,"And, again, you show your inability and unwillingness to have a serious conversation.  You just reveal yourself as a troll.  It was readily apparent you had no intention of having a serious discussion from your first response, and you've done nothing but substantiate that.",1,0,1442549126,1444727356
cv5j2pf,0,t1_cv5j2av,ZenerDiod,lol,0,0,1442549148,1444727356
cv54avu,0,t1_cv53dhw,Fuckn_hipsters,">It's amazing how you people will never admit to only caring about sources when it suits your purposes.

Actually I try to provide sources without complaint when I make any claim. This is the internet and I do not know your qualifications just as you do not know mine. Providing sources is how you make sure the other person is being honest. This shouldn't be problem unless you are lying. Are you?

>This source shows the video Fiorina mentioned, but you don't care. 

I do care and actually appreciate you finally providing something.

>This is the point where you try to find some way to quibble on the details to keep promoting whatever narrative you intended to in the first place.

You got me here, I do have problems with the video. The Center for Medical Progress is an anti-abortion organization with an obvious bias. How do I know that this woman didn't just make things up?

While I am pro-choice I do oppose late-term and partial birth abortions, which, I assume is where the fetus in question comes from. That said if the mothers life is in danger I would support this type of procedure. This video gives zero reference on what the circumstances around this abortion were. If the mother's life was in danger I have no problem with tissue being used for research. I am an organ donor and if my organs are not usable when I die I would want my body to be used for whatever research they could do with it.

Now before you roll your eyes and say Fuckn_hipsters is an asshole like I thought he was lets think about what your reaction would be if I sourced something from the Center for American Progress. I would hope that you doubted their claims also. Do you have a source that is not created by an organization that has an obvious agenda?

",2,0,1442523198,1444727356
cv54pxn,0,t1_cv54avu,DevonWeeks,"First of all, I don't care anything about defunding PP or really even about abortions in the first place.  I actually laid out my position (or lack of one) in another thread just this morning.  I am wholly uninvolved and uninterested in the abortion debate.  I welcome your sources biases and all.  My only purpose was to point out that the video Fiorina referenced did in fact exist, clearly.  Whether or not the video is using legally obtained footage or is edited or anything else is irrelevant to my point.  People who care about the substance of the video and its implications for PP can debate that.  But, the video exists exactly as Fiorina described it, and I recognized it immediately having already seen the video.  Washington Post was just flat wrong in the fact check, and so was CNN who admitted it did exist but said it was misleading.  My only purpose was pointing out that what was said was true, nothing else.",1,0,1442523854,1444727356
cv53qwh,0,t1_cv522fx,xertzed,"Dude, if that's the case, then provide alternate sources and interpretation of data. It's not other people's responsibility to ""leave room"" for you - if you've got a point, make it.

Pouting just makes you look childish and unreliable. That doesn't mean you're wrong, but it does become more difficult to take you seriously.",3,0,1442522345,1444727356
cv53x8g,0,t1_cv53qwh,DevonWeeks,"Do you not see the really terrible precedent you and others are setting?  This sub is becoming an environment where we can make all the outlandish, unsourced claims we want... **as long as it is in our new threads and not in our comments**.  It's on the commenters to source their rebuttals!  This is what's irritating me.  No one questions an original post no matter what it is says.  It could say ""elves live in boxes.""  A commenter could respond ""Nuh uh.""  And we'll all dogpile on the commenter and demand he prove the negative.  It's a very unintelligent standard we have of late. ",0,0,1442522614,1444727356
cv54lic,0,t1_cv53x8g,,[deleted],1,0,1442523656,1444727356
cv54z7x,0,t1_cv54lic,DevonWeeks,"First, he didn't call me wrong.  He called me dishonest.  Second, you're avoiding my point entirely.  There is no reason whatsoever to impose a higher degree of scrutiny to comments than you do to the original post.  That's precisely what we do, and I've pointed it out in numerous threads.  Thirdly, I've already sourced my statement to another user, just not the op because he clearly isn't interested in having an honest discussion. ",0,0,1442524267,1444727356
cv55mic,0,t1_cv54z7x,,[deleted],0,0,1442525304,1444727356
