id,is_root,parent_id,author,body,score,score_hidden,created_utc,collected_utc
cv9jtdw,0,t1_cv9geib,I-HATE-REDDITORS,"> Only law abiding people in these other countries don't have guns, criminals have no problems getting them.

This is one of the most common arguments against gun laws and also the dumbest.  The majority of shootings are not commited by career criminals trading arms on the black market.  Most start off with a ""good guy with a gun"" having a bad day and misusing a gun that he legally bought ""for protection"" or other legal purposes.  Or a family member ""borrowing"" a legal gun.

So maybe gun control won't stop the fucking Yakuza from buying rifles in a warehouse but that's not really the problem.",2,0,1442875652,1444725995
cv9lw16,0,t1_cv9jtdw,troygates,"Never heard this one, source please? ",4,0,1442879217,1444725995
cv9mdlx,0,t1_cv9lw16,I-HATE-REDDITORS,"I hate the Huffington Post, but [this article sources its data pretty well on gang violence vs. gang-unrelated gun homicides](http://www.huffingtonpost.com/evan-defilippis/do-we-have-a-gang-problem_b_5071639.html).",0,0,1442880079,1444725995
cv9qsop,0,t1_cv9fvn3,Shotgun_Sentinel,"http://www.ncpa.org/sub/dpd/index.php?Article_ID=17847

http://www.captainsjournal.com/2012/07/23/do-gun-bans-reduce-violent-crime-ask-the-aussies-and-brits/

Those are two sources that quote the AIC, an Australian criminologist org., that says that the gun control in Australia made no difference in their total homicide or violence rates.

 The same thing is true in Europe since they never had much crime to begin with.",4,0,1442887359,1444725995
cv9fgje,0,t1_cv9evx8,Ysance,"Except that we have a constitutionally protected right to own guns and use them for self defense. We have a right to carry them for that purpose as well, the right isn't just confined to the home.

So you can try to amend the constitution, but you won't succeed. Guns save lives, they prevent rapes and kidnappings. Guns for self defense is a popular concept.",5,0,1442868590,1444725995
cv9fuqa,0,t1_cv9fgje,rstcp,"I never said it was easy to amend the constitution (or to get a SCOTUS that would re-interpret the constitution to allow for the banning of guns for personal use/ownership), but I'm in favour of it. I don't understand the constitution-worship. If it's broke, fix it. I don't care if it's popular or not, that's not a good argument for or against. 

>Guns save lives, they prevent rapes and kidnappings

lol",-10,0,1442869197,1444725995
cv9lqdf,0,t1_cv9fuqa,Ysance,"It isn't broken, it is working as intended.

You laugh at the people you want to doom to helplessness, and ignore the fact that innocent people will be raped, kidnapped, and murdered as a result of the policies you advocate. That is pretty darn cold...

I think you should meet one of these people in person, someone who used a gun to protect themselves from rape, kidnapping, or murder. It might give you some more perspective on the issue.",3,0,1442878941,1444725995
cv9qfyn,0,t1_cv9fuqa,Shotgun_Sentinel,"> favour of it.

Well judging by your spelling, its not really up to you, nor is it your place to tell us how to protect ourselves.",2,0,1442886787,1444725995
cv9yz5v,0,t1_cv9qfyn,rstcp,You sure got me,0,0,1442906472,1444725995
cv9ufq2,0,t1_cv9evx8,I_Love_Liberty,You would prefer that the estimated hundreds of thousand of people who use guns to defend themselves and their families from violent crime each year become victims?,3,0,1442893678,1444725995
cv9wni6,0,t1_cv9ufq2,rstcp,Yes. That's what I want,0,0,1442898857,1444725995
cv9d5ye,0,t1_cv9ctm8,OpticalDelusion,"I guess it would depend on the exact legislation then, since the word isn't well defined, but banning automatic weapons amd semi-automatic weapons with large clip sizes and strong penetration power seems pretty in line with what pro-gun control people want.

So the AR-15 is something you can have now that would be an assault weapon, right? Do people want AR-15s for self-defense? Doesn't seem like something I'd shoot inside my house at an intruder.",2,0,1442865127,1444725995
cv9krk0,0,t1_cv9d5ye,insanemindofmine,Why would magazine (not clip) size matter? I've never understood this talking point.,3,0,1442877274,1444725995
cv9lf2k,0,t1_cv9krk0,OpticalDelusion,"Not that this is necessarily my personal opinion, but I imagine it's because what do you need a 30 round clip/mag for besides shooting a lot of people quickly?",-1,0,1442878398,1444725999
cv9lvyk,0,t1_cv9lf2k,littlebitsoffluff,Shooting a lot of targets quickly.,0,0,1442879214,1444725999
cv9n66q,0,t1_cv9lvyk,OpticalDelusion,"I went trap shooting and you could only have 2 shells loaded at a time, regardless of the capacity on your shotgun. Reloading isn't a problem when you are shooting recreationally.",1,0,1442881435,1444725999
cva1phj,0,t1_cv9n66q,littlebitsoffluff,For you. Other people like to shoot large magazines.  Not sure why you get to tell them what they can own and can't own. ,2,0,1442918952,1444725999
cva3ql9,0,t1_cva1phj,OpticalDelusion,"There's a difference between understanding a viewpoint and agreeing with it.

I think the viewpoint that the second amendment gives you complete and uninhibited access to every firearm and associated product ever invented for all time is wrong, but I understand it.",1,0,1442925485,1444725999
cva4s4d,0,t1_cva3ql9,littlebitsoffluff,Did you ever consider that your stance against high-capacity magazines might be based on erroneous assumptions? ,0,0,1442927959,1444725999
cv9pp4z,0,t1_cv9n66q,insanemindofmine,Ever done 2gun? Reloading takes time and hurts your score. Also we dont ban based on need.,3,0,1442885587,1444725999
cv9rq7b,0,t1_cv9pp4z,OpticalDelusion,"Well we ban based on whatever metric society wants to, more or less.

But no I've never done 2gun, or even heard of it. I'm just trying to explain the perspective of people who do want restrictions on the number of rounds. If your child was killed in a shooting, of course you would prioritize a restriction like that over a particular recreational hobby.

Personally, I'm not really for a blanket ban on any gun or ammunition or clip/magazine. I'd much prefer a system like drug scheduling, where we categorize weapons, and place various restrictions based on level. That way we can discuss each particular firearm or ammunition or what-have-you on an individual basis, and make a research-based decision on each.",1,0,1442888922,1444725999
cvbtm47,0,t1_cv9rq7b,insanemindofmine,"While true in prqctice its not ideal and i think we should be revisiting the decisions of that practice not continuing it.

Emotional people aren't exactly reowned for logic though. 

You mean the scheduling system that ranks weed as a schedule 1? Though curious what criteria you would use.",1,0,1443042523,1444725999
cvab3cs,0,t1_cv9lf2k,BeartrapSandwich,"That's the wrong question.

What overwhelming need do you have for mandating a maximum size of someone's box with a spring inside it? ",1,0,1442938771,1444725999
cv9qeet,0,t1_cv9lf2k,Shotgun_Sentinel,The worst mass shooting in this country's history was done with a pistol that had 10 round magazines. He shot his gun 190 times and he passed a background check. Many mass shootings are done with guns that are reloaded often and done by people aren't even in the system to be popped on the background check.,5,0,1442886716,1444725999
cv9qc1q,0,t1_cv9lf2k,Frostiken,Do cops need big magazines for killing as many people as possible?,5,0,1442886612,1444725999
cv9rf8a,0,t1_cv9qc1q,OpticalDelusion,"America's police problem is another problem that needs attention, I agree.",2,0,1442888420,1444725999
cv9fd3e,0,t1_cv9d5ye,Huey_McDuck,">So the AR-15 is something you can have now that would be an assault weapon, right? 

Assault weapon is a made up term, so I don't understand the question.  What definition are you using?  The one that Sen. Fernstein gave, which is the gun looks scary?

>Do people want AR-15s for self-defense? Doesn't seem like something I'd shoot inside my house at an intruder.

Well, then you have a right to not purchase one.   But like with abortion, your unreasonable fear shouldn't limit my rights. ",8,0,1442868447,1444725999
cv9floq,0,t1_cv9fd3e,OpticalDelusion,"How about the definition in the link posted in the comment I replied to?

I'm not pro-gun or anti-gun, I mostly don't care. I was legitimately asking what the use case for an AR-15 is. In most gun control arguments, the points of contention are hunting and self-defense, so I was curious which bucket the AR-15 fell in, if any.

This is /r/PoliticalDiscussion, you don't have to get all emotional and combative because I asked a question. If you want to convince someone, you need to provide them with information rather than looking down on them with trivial statements like, ""which is the gun looks scary [sic]"" and ""your unreasonable fear shouldn't limit my rights.""",-2,0,1442868810,1444725999
cv9hrz4,0,t1_cv9floq,Sollexs,"ARs are good for self defense, small game hunting (think coyotes and smaller) and target shooting.

well, really since an AR15 is a 'lego gun', you could build one to do just about anything. Need to hunt deer? Slap on a bigger upper and now you have a more powerful rifle. Hell, I saw a upper that turned a [AR15 into a bolt action .50BMG](http://www.amodmp-int.com/Blank%20Page%2020_files/image004.jpg) long range competition rifle.

The AR15 is a general porous rifle and a easy / cheap design to work with. You could have a 16in upper with a red dot for home defense, swap that upper (by pulling 2 pins out of the side) for a 20in free float barrel with a 10 power scope for long range target shooting, then swap it out again for a larger round and use it to hunt deer. Swap a 3rd time for a 20in barrel and scope setup to hunt groundhogs or coyotes. It can be practically any gun you want, all for the cost of one 'gun' in legal speak (The lower receiver, or that part the stock and pistol grip are attached to, is the only part that is a 'gun' legally speaking) with many different barrels to choose from. Not many other designs can do something like that.",7,0,1442872248,1444725999
cv9dfdw,0,t1_cv9d5ye,Sollexs,">I guess it would depend on the exact legislation then, since the word isn't well defined, but banning automatic weapons amd semi-automatic weapons with large clip sizes and strong penetration power seems pretty in line with what pro-gun control people want.

Yes, anti-gun people do want to ban all guns. A vast majority of firearms are semi-automatic and automatics are already very heavily restricted (look up the NFA). Besides, they are not going after full autos at all, just semi autos that look like full autos.

>So the AR-15 is something you can have now that would be an assault weapon, right? Do people want AR-15s for self-defense? Doesn't seem like something I'd shoot inside my house at an intruder.

Its actually a perfectly acceptable firearm for home defense, It fires a very small bullet for a rifle (Same size as a .22 LR bullet, just a lot more powder behind it). Its the type of round that when using hollow points, has a good chance to get stuck in a wall and not go through it. People often look at it and think the AR15 is a powerful gun, but its not, in fact the reason its illegal to hunt game like deer in most states is because the 5.56x45 round is too weak to reliably kill a deer without perfect aim. TOO WEAK, granted you can get them chambered in other rounds like .308/7.62x51 which is a full rifle round and perfectly fine to hunt deer with along with just about every bullet that exists on earth as AR15s are lego guns that can take many different uppers, the standard configuration is 5.56x45, and that is a weak bullet for a rifle.

Again, the term 'assault weapon' means nothing, its made up bullshit. https://ourrvadventures.files.wordpress.com/2013/01/difference-between-weapons.jpg


On top of all this, there are about 48 uses a year of so called 'assault weapons' in crime, 48. More people are murdered by hammers than 'assault weapons'. More people are murdered by hammers than all rifles combined. There is literally no reason to ban them other than illogical 'feelings' with no factual basis, that they are dangerous to society.",13,0,1442865520,1444725999
cv9fq7x,0,t1_cv9dfdw,burritoace,"> Yes, anti-gun people do want to ban all guns.

Some do, but to lump all those pushing for more stringent gun control into this category is really disingenuous and a poor rhetorical tactic. Furthermore, there are reasonable arguments to be made for banning military-style weapons - while some features are cosmetic, many do affect the functionality of the firearm and can increase the efficiency with which one can harm people.",1,0,1442868998,1444725999
cv9hhd8,0,t1_cv9fq7x,Sollexs,">there are reasonable arguments to be made for banning military-style weapons - while some features are cosmetic, many do affect the functionality of the firearm and can increase the efficiency with which one can harm people.

Do tell, I don't hear of many drive by baynoettings.

Funconality, there is nothing on a 'military style' weapon that improves its lethality. Leathality of a firearm comes down to the round it fires and the workings of its action.

One could argue a bolt action rifle chambered in .338 Lapua is much more lethal than a AR15, even if the AR15's magazine is 6 times the size, because of how powerful .338 Lapua is.

Please tell me of these cosmetics that make a gun more deadly, I will continue to lump people like you into the 'ban all guns' group so long as you adhere to poor rhetoric and misinformation.",6,0,1442871770,1444725999
cv9hztc,0,t1_cv9hhd8,burritoace,">'ban all guns'

And you will continue to misrepresent what people on my side of the argument want, further stymying reasonable compromise.

To turn the tables a bit, can you explain why the AR15 is so popular? Is it not because, as a 'military-style' weapon, it is relatively light and easy to shoot?

Pro-2nd Amendment folks like to point out that, all things being equal, one gun is more deadly than another (such as a larger caliber hunting rifle vs. a smaller caliber AR15). But it should be clear that there are many factors at play in determining the lethality of a weapon, as evidenced by the fact that handguns kill more people than any other type. Is the difference between a handgun and a hunting rifle purely 'cosmetic?'",1,0,1442872602,1444725999
cv9ig2x,0,t1_cv9hztc,Sollexs,">reasonable compromise.

That is a laugh. There is never compromise on your side, only taking.

http://www.everydaynodaysoff.com/wp-content/uploads/2013/11/Illustrated-Guide-To-Gun-Control.png

>To turn the tables a bit, can you explain why the AR15 is so popular? Is it not because, as a 'military-style' weapon, it is relatively light and easy to shoot?

sure, the AR15 is a cheap, light weight rifle that shoots a small bullet and has a recoil system that takes most of the 'bite' off the recoil, all while being a lego gun that can literally be made into anything you want, even a .50bmg bolt action rifle. Its not because the fact that the M16 is its sister weapon, its just a (arguably) great rifle design over all (I say arguably, as people will tell us its jamtastic and that AK pattern rifles are better, both I don't necessarily agree with).

>Pro-2nd Amendment folks like to point out that, all things being equal, one gun is more deadly than another (such as a larger caliber hunting rifle vs. a smaller caliber AR15). But it should be clear that there are many factors at play in determining the lethality of a weapon, as evidenced by the fact that handguns kill more people than any other type. Is the difference between a handgun and a hunting rifle purely 'cosmetic?'

No, the difference between a handgun and a rifle being more popular for crime is due to size. You can't easily stuff a AR15 down your pants like you can with a pistol. Concealability trumps accuracy and ammo count for criminal use. Rifles are definitely more deadly as it comes to actual use, they are more accurate and rifle rounds, even the small .223, have more power behind them than a 9mm luger round. It really does just come down to the fact that a 9mm glock can be stuffed in your pants while a AR15 would be hard to do while not sticking out like a sour thumb.


So, what do your people want? If you keep going after 'assault weapons' I will keep calling you fools. If you go after pistols, I won't  call you a fool as that is what criminals use, but I won't go with you eaither because I believe we have the right to defend ourselves, and carrying a pistol goes along with that. If your side keeps advocating for shitty laws that don't even try to stop criminals yet try to stop law abiding people from owning firearms and make it more of a hassle for us (Like the last try to pass universal background checks, the way that law was written would not have effected criminals at all while forcing law abiding people to go to an FFL and pay a $50 background check 'tax' in order to do anything, even just passing a firearm to a friend or family temporarily).


If you are truly willing to compromise, such as getting rid of the NFA, then we can talk. until you actually will compromise, you will get nothing from 'my' side.",2,0,1442873335,1444725999
cv9q0r8,0,t1_cv9fq7x,Shotgun_Sentinel,">  many do affect the functionality of the firearm and can increase the efficiency with which one can harm people.

Not in any meaningful way that makes them better for killing unarmed people/children.",2,0,1442886099,1444725999
cv9dr8y,0,t1_cv9dfdw,OpticalDelusion,"Hm very interesting. I'm surprised Sanders is anti assault weapon then, since Vermont is relatively rural and conservative.",8,0,1442866021,1444725999
cv9w0oj,0,t1_cv9dr8y,Quierochurros,"Vermont's not that conservative, and Sanders has a pretty solidly permissive attitude toward guns over the course of his career. ",1,0,1442897218,1444725999
cv9dxfq,0,t1_cv9dr8y,Sollexs,"I think a large part of the problem is that the anti-gun groups were successfully able to get people to believe that 'assault weapons' = assault rifles. Assault rifles are machine guns and they have been heavily regulated since 1934 (NFA act) and then even more so in 1986 (Banning of new, post may 1986 machine guns to be added to the NFA registry).

They were able to use the media to get people to believe that they were banning machine guns, and since most people are fairly gun illiterate while guns not being a big deal to most people who live in the cities, they did not get a strong push back until the mid 2000s.

Vermont is relatively rural and conservative, but I am guessing a large part of them are ok with anything black and partly plastic being banned as long as their wooden, bolt action hunting rifles are ok. We in the gun community refer to people like this as FUDDs, like elmer fudd.",8,0,1442866283,1444725999
cv9fteu,0,t1_cv9dxfq,OpticalDelusion,"To bring our conversation back to the original question, then, I would say it still doesn't bother me that Sanders is purportedly for the AWB.

Firstly, it doesn't rank highly on his priority list. Even if this was a legitimate opinion of his, I don't think it would result in any actual legislation because Bernie has *wayyy* bigger fish to fry.

Second, I think Sanders is seriously the most reasonable candidate. I have not seen any candidate in several election cycles as open to discussion and compromise. The fact that you convinced me in two posts that the AWB is silly suggests to me that Sanders hasn't really considered it and it's more of a result of staying more-or-less in line with the Democratic platform at large.",6,0,1442869138,1444725999
cv9ghc1,0,t1_cv9fteu,Sollexs,"Fair enough.

To be honest, I don't like sanders. I think his policies would sink the economy and would be very toxic to the US. I do not believe he has even a slight chance of getting elected so I am really not worried though...

That said, I don't like any of the other candidates... I don't have a clue as who I may vote for at this point, or even if I will bother to vote (I live in Illinois, its going to go dem no matter in what way I vote).",3,0,1442870182,1444725999
cvaa7ub,0,t1_cv9fteu,BeartrapSandwich,">Firstly, it doesn't rank highly on his priority list. Even if this was a legitimate opinion of his, I don't think it would result in any actual legislation because Bernie has wayyy bigger fish to fry.

Even still, as a leftist gun nut I'm not willing to risk it. Marx had a very strong opinion about the disarmament of the workers and once they're gone you're not likely to get your gun rights back...",2,0,1442937413,1444725999
cv9q9rx,0,t1_cv9fteu,Frostiken,"Except there's still congress to worry about. It means if CONGRESS thinks an AWB is a priority, Bernie would sign it.",6,0,1442886508,1444725999
cv9rh05,0,t1_cv9q9rx,OpticalDelusion,"Yes, and Bernie has a record of voting for the AWB. Usually it gets packaged up with things like a mandatory background check.

Personally, however, I don't think the possibility that Sanders might not veto something is really very high on my list of voting priorities.",3,0,1442888502,1444725999
cv9rn0a,0,t1_cv9rh05,Frostiken,"To me democrats have talked far too much about gun control since 2013 for them to just let it go. They are completely on the wrong side of the issue and I don't trust them if they get a majority. Gun control *is* one of the more important issues, more important than abortions by far. 

Even if I truly believed that democrats wouldn't push the issue, my intent is to punish them for talking about it, passing state level gun control, and Obama's executive orders. I don't believe they deserve the presidency at all.",3,0,1442888780,1444725999
cv9rzrl,0,t1_cv9rn0a,OpticalDelusion,"If gun control is the most important issue for you, then by all means vote Republican.

But if your worry about guns is about the ability to rebel against the government, I'd think that the actions of the NSA would be far more concerning - considering the actual likelihood that anyone will use guns for an anti-government purpose in our lifetime.


Finally, I sincerely believe that most Americans don't give a shit about their second amendment rights. And for the ones that do, I really don't think it's very high up on their priority list compared to the giant list of crises that face America today. It's just become an antiquated concept for many citizens (especially urban ones). So for the Democrats, an anti-gun stance just makes sense.",1,0,1442889350,1444725999
cv9w3oo,0,t1_cv9rzrl,Quierochurros,"> Finally, I sincerely believe that most Americans don't give a shit about their second amendment rights. 

I agree.

>And for the ones that do, I really don't think it's very high up on their priority list compared to the giant list of crises that face America today.

I disagree. For the ones that do, it seems to be the thing about which they are most vocal.",2,0,1442897428,1444725999
cv9gmvn,0,t1_cv9d5ye,efk,"> So the AR-15 is something you can have now that would be an assault weapon, right? Do people want AR-15s for self-defense? 

My friend hunts with an AR. They're not without a practical use.

There is a lot of miscommunication between both sides of the debate. The pro-control people misunderstand guns and therefore can't properly articulate their position. The media further exaggerates and distorts the issue.

The AR-15's you can buy at the store are semi-automatic. You pull the trigger, one bullet comes out. You pull it again, you get another bullet. You can't hold down the trigger and spray bullets everywhere. That's what an automatic weapon does. Full-auto weapons are highly regulated already. The semi-automatic AR-15's are no different than just about any other gun you can buy, so you are essentially banning a gun because it looks like a fully automatic weapon you see in war documentaries. 

If anyone was serious about gun control, they would be talking about handguns anyway.

I'm pro gun, but I also think we could do a better job of regulating them. Neither side of the debate seems to have the right idea in my book.",7,0,1442870426,1444725999
cv9h65p,0,t1_cv9gmvn,OpticalDelusion,"I think I agree with you. I'm more of the opinion that the problem lies in the process of obtaining a gun, rather than which guns and ammunition are available. I'd even go so far as to say I might be for allowing automatic rifles, as long as sufficient restrictions were in place to prevent them from getting in the wrong hands. Most of the school shootings were done by kids with documented psychological problems (if I remember correctly).",-2,0,1442871275,1444726004
