id,is_root,parent_id,author,body,score,score_hidden,created_utc,collected_utc
cuv0n5q,0,t1_cuuchrs,ultimis,"> Your logic seems kinda circular. 

The logic is pretty clear. Do not remove options off the table before negotiation, especially if it provides you leverage in the negotiation. Unless your intention is to give your side a shit deal.

> I expect it was used when negotiating the Iran treaty

Not when the president's party is saying ""we can't go to war with Iran it's too costly!"" Iran isn't going to take any threats seriously when Obama couldn't even keep his party in line on the issue.

>Yes, sometimes war is preferable to diplomacy.

Diplomacy is a tool, not an outcome. People perceive diplomacy as this magic hand waving that makes things alright. War is sometimes the best diplomatic solution for a given situation. You will obviously try the more peaceful solutions first, but if they will not give they need to know that war is something you will not fear using.

>That's not bluffing, that's diplomacy, and opposing diplomacy solutions because they are not military solutions snd therefore weaken diplomatic solutions is borderline sophistry

War is a diplomatic solution.

Diplomacy: ""the profession, activity, or skill of managing international relations, typically by a country's representatives abroad.""

There is no either or when it comes to diplomacy and war. Sometimes the outcome is paying out money. Sometimes the outcome is a country giving up claim to some land. Sometimes the outcome is support in the United Nations or other sensitive issue that the country cares about. Diplomacy is a tool used to resolve differences between the countries. Those differences can at times only be solved by war if one country is unwilling to give up what the other country perceives as highly dangerous to them.",1,0,1441756358,1444732220
cusm3kb,0,t1_cuskgff,LiberalTerryN,Are you contending that going to war in Iraq *wasn't* a mistake? ,11,0,1441560183,1444732220
cusn637,0,t1_cusm3kb,ClockOfTheLongNow,Absolutely.,-11,0,1441562169,1444732220
