id,is_root,parent_id,author,body,score,score_hidden,created_utc,collected_utc
cvgtf6h,1,t3_3moxvb,knowses,"Well, the government runs the military, and that certainly doesn't stifle military weapons innovation. ",37,0,1443444955,1444722965
cvgv94y,0,t1_cvgtf6h,repmack,"Yeah, but then we'd be paying twice as much for the innovation. Horrible example.",1,0,1443449087,1444722965
cvgvbhc,0,t1_cvgv94y,knowses,"Oh I agree, government run programs are not cost effective. ",0,0,1443449218,1444722965
cvhlsrv,0,t1_cvgtf6h,Risk_Neutral,The government wastes a lot of money on the military. ,1,0,1443490674,1444722965
cvh0cqb,0,t1_cvgtf6h,BeatArmy99,"Very different.  Government says ""We need a plane that goes this far, this fast, and carries this much payload.""  They get some proposals then those proposals are funded.

Government cannot say that we need a ""drug that cures this disease, with this level of efficacy,"" then expect private industry to go out and do it.",2,0,1443457546,1444722965
cvhe55a,0,t1_cvh0cqb,kyew,"> Government cannot say that we need a ""drug that cures this disease, with this level of efficacy,"" then expect private industry to go out and do it.

They already [do that](http://grants.nih.gov/searchGuide/Search_Guide_Results.cfm?PAsToo=0)",1,0,1443477848,1444722965
cvh0ewa,0,t1_cvh0cqb,knowses,Private researchers look for treatments of specific diseases all the time.,2,0,1443457639,1444722969
cvh2h7b,0,t1_cvh0ewa,8llllllllllllD----,"and they charge a butt load for it.

If the government took it over, they'd say go figure this out, but we won't pay you for it. 

You won't get the same levels of research. 
",0,0,1443460714,1444722969
cvh4nsl,0,t1_cvh2h7b,Jenocular,"THIS IS A FALSE DILEMMA FALLACY

And is such bullshit.  Our culture loves to just make up fake dilemmas.  ""You're either with us or against us.""  Clearly the choice isn't that they get paid or don't get paid.",1,0,1443463980,1444722969
cvh5b2r,0,t1_cvh4nsl,Cockdieselallthetime,"The relationship between market and research is not a false dilemma dumbass.

",6,0,1443464923,1444722969
cvh6n5e,0,t1_cvh5b2r,Jenocular,"You don't understand.  People get paid for research.  The guy I responded to said that the choice is either we pay people a ""butt load"" or the government takes it over and doesn't pay anyone.  That's a false dilemma.

My argument is really simple.  Control spiraling out of control costs.  This ridiculous idea that people won't work in the pharmaceutical and medical business unless they can make billions of dollars is absurd.",2,0,1443466885,1444722969
cvh7p4y,0,t1_cvh6n5e,Cockdieselallthetime,"You're comment shows how ignorant you are of the costs and liability associated with drug and medical development. 

",2,0,1443468365,1444722969
cvhr2d6,0,t1_cvh7p4y,Jenocular,"Pfizer.  Just one example.   They make $40,000,000,000 a year.  $40 billion.  I'm pretty sure someone else can innovate just as well making only $500 million a year in gross profits.

Liability?  Fine we need tort reform too.  I'll grant you that.",2,0,1443499621,1444722969
cvh5glh,0,t1_cvh4nsl,ZenerDiod,"You know it cost at least 1 billion to bring a drug to market, how are you going to get drug companies to do that if you don't pay them enough to make it worth their while? Point a gun to the CEO's head?",2,0,1443465148,1444722969
cvh6yh9,0,t1_cvh5glh,Jenocular,"Drug companies spend incredible amount of money on drugs that don't make it to the market.  They factor in these losses into their profit margins.  They need to be more efficient and I'm sure we need to have a better system in place for getting drugs to market.  These companies also currently have profit margins that are through the roof.  I don't subscribe to the notion that the only way we get innovation is with billion dollar profits.

The whole system from what I can tell just takes advantage of Americans.  I've lived all over the world and my healthcare costs have been incredibly low everywhere but the USA.  What costs $10 in one country costs $100 in the US.  That's a problem.  The system needs to be readjusted to stop praying on our shitty healthcare system where they can charge these insane amounts because we spend so much on healthcare.",1,0,1443467331,1444722969
cvh8hdg,0,t1_cvh6yh9,ZenerDiod,">The whole system from what I can tell just takes advantage of Americans.

Yep, Americans subsidize the rest of the worlds R&D. If we stopped doing that, the rate of innovation would go down, or the rest of the world would have to pay more.",2,0,1443469429,1444722969
cvhcjyp,0,t1_cvh8hdg,Trot1217,We subsidize a lot of things the rest of the world benifits from.  Doesn't stop them bitching about dumb Americans.,3,0,1443475316,1444722969
cvhcquy,0,t1_cvhcjyp,ZenerDiod,"Anyone who wants to complain about Americans being dumb is especially silly, majority of technological innovations that have raised standards of living across the world come from America, for example we perform practically all public vaccine research.",1,0,1443475614,1444722969
cvh0me5,0,t1_cvh0ewa,BeatArmy99,"Yes, and?",2,0,1443457952,1444722969
cvh0dpq,0,t1_cvgtf6h,cassander,"The military is often described as ""two centuries of tradition unblemished by progress.""  It's a joke obviously, but militaries are most definitely not innovative.  They are conformist, extremely resistant to change, and massively inefficient, as anyone who's spent more that an hour interacting with them will tell you.",4,0,1443457587,1444722969
cvh3duf,0,t1_cvh0dpq,zoidberg1339,Anyone who has studied military history could tell you the same thing.,4,0,1443462072,1444722969
cvgu1sv,0,t1_cvgtf6h,BUbears17,"I think they're separate beasts though. If we had a massive push for affordable military equipment the argument could be make that the industrial complex wouldn't be left with enough profits to innovate new aircrafts, weapons, etc. 

I'm not saying I agree with either side, but I just don't think comparing a national health system to a national security system is fallacious. ",9,0,1443446511,1444722969
cvgu9s6,0,t1_cvgu1sv,knowses,"Sure, fair enough point. My issues with single payer are more about the political implications. Do we as a nation really want the government to have control over our health decisions? ",1,0,1443447019,1444722969
cvh18tk,0,t1_cvgu9s6,Dugen,"> Do we as a nation really want the government to have control over our health decisions?

Hell yes.  

Who would you rather have control.. the guy who's job it is to keep the public happy or the guy who gets to keep the money when he denies you care?   Healthcare paid for by the public, under democratic control is the right way to do it.",-2,0,1443458878,1444722969
cvhc631,0,t1_cvgu9s6,TheNerdyNegro,You would pay one entity less than you are paying to private insurance. There would still be private insurance with single payer. So it's your choice.,1,0,1443474712,1444722973
cvhd52u,0,t1_cvhc631,knowses,"Actually, I think the government wants to become the insurance company. It's quite a profitable racket being the middleman, and they won't have to produce anything. They are good at that.",2,0,1443476232,1444722973
cvguoza,0,t1_cvgu9s6,BUbears17,"Would single payer change anything about government control over our healthcare? From what I understand id still be able to get covered for whatever I want through additional private insurance. 

What kind of extra control do you fear the government will gain?",7,0,1443447925,1444722973
cvgv2ee,0,t1_cvguoza,knowses,"Think of this, if the government is paying for everyone's healthcare with tax money, then they have a legitimate right to pass laws that dictate what is healthy or unhealthy for society. They can justify this In the name of protecting public funds. So, they may outlaw all public ownership of guns, or classify certain political views as a mental illness/dangerous, or dictate what foods people can eat, etc. I don't believe any of this is completely out of the realm of possibility. ",1,0,1443448704,1444722973
cvgv7be,0,t1_cvgv2ee,MisterMiddleFinger,"It is also in the realm of possibility that a bunch of xenophobes will dress up in white robes and kill people that don't look like them.  And unlike your crazy hypothetical, that shit actually happened.  

",-2,0,1443448984,1444722973
cvgv9x0,0,t1_cvgv7be,knowses,I don't see the relevance to government run healthcare.,4,0,1443449131,1444722973
cvgy0n2,0,t1_cvgv2ee,IUhoosier_KCCO,"> Think of this, if the government is paying for everyone's healthcare with tax money, then they have a legitimate right to pass laws that dictate what is healthy or unhealthy for society. 

i fully support some of the EU bans that they place on specific food. a healthier populace benefits everyone. i don't see a problem with the government having a vested interest in making sure its citizens are healthy. 

> So, they may outlaw all public ownership of guns, or classify certain political views as a mental illness/dangerous, or dictate what foods people can eat, etc.

what is the basis for these assertions? can you show me a centrally-planned healthcare system that has banned guns or classify political views as a mental illness in the name of said healthcare system? do you not think the 2nd amendment will protect your guns? 

you making a good point until you made these assertions? again, what sort of factual basis do you have for them?",-2,0,1443453935,1444722973
cvgyfs7,0,t1_cvgy0n2,knowses,"I think my overall point is that governments tend to want power and control over their populace. And they may find creative ways to accomplish this goal. There are plenty of examples of overbearing governments in the world, plenty of examples of corruption, and political persecution. ",2,0,1443454598,1444722973
cvgyo2n,0,t1_cvgyfs7,IUhoosier_KCCO,"i could take that vague, blanket statement and use it to counter any sort of policy proposal. 

also, replace ""government"" with ""corporation"" and the vague, blanket statement loses no meaning or value.",-4,0,1443454960,1444722973
cvgywph,0,t1_cvgyo2n,knowses,"The recent IRS targeting of conservative groups is a good example of what the goverment can do with a supposedly non-partisan agency. You know information about certain people can and would be leaked, possibly for political ends.",5,0,1443455326,1444722973
cvgz5r9,0,t1_cvgywph,IUhoosier_KCCO,"> The recent IRS targeting of conservative groups is a good example of what the goverment can do with a supposedly non-partisan agency.

i don't see how the IRS ""targeting"" is at all related to the US banning guns or foods in the name of healthcare. being partisan doesn't overrule the constitution. ",-4,0,1443455710,1444722973
cvgzcut,0,t1_cvgz5r9,knowses,"https://www.psychologytoday.com/blog/evolutionary-entertainment/201206/conservatism-mental-illness

The US can deny rights to those deemed mentally ill.


",1,0,1443456012,1444722973
cvgzfbx,0,t1_cvgzcut,IUhoosier_KCCO,i understand that. but to say that single-payer healthcare will lead to certain political views being deemed as a mental illness is... quite the logic leap. i can't even see the other side.,0,0,1443456119,1444722973
cvgzi9j,0,t1_cvgzfbx,knowses,Did you click on the link?,3,0,1443456246,1444722973
cvgzpib,0,t1_cvgzi9j,IUhoosier_KCCO,yes,0,0,1443456555,1444722973
cvh478i,0,t1_cvgv2ee,ScannerBrightly,"> I don't believe any of this is completely out of the realm of possibility. 

Okay, let's take a look at these possible government actions.

> they may outlaw all public ownership of guns

Never gonna happen.  2nd Amendment, much? Also, the political climate doesn't even offer the ability to _talk_ about gun control, let alone beat a veto.

> classify certain political views as a mental illness/dangerous

Views?  I doubt it.  First Amendment much?  Actions are another ball of wax, but thought crime would be hard to do anything about.

> or dictate what foods people can eat

Also, doesn't happen and can't happen.  Sure, they can dictate what you can sell in stores, but not what you can eat.",3,0,1443463289,1444722973
cvh6lfn,0,t1_cvh478i,knowses,"If the government classifies guns as a health risk or certain behaviors such as Tea Party participation as a form of mental illness, then maybe they would repeal the 2nd amendment or limit access for some. If you can't buy certain foods, it may be hard to eat them.",0,0,1443466815,1444722973
cvh6od2,0,t1_cvh6lfn,ScannerBrightly,"> then maybe they would repeal the 2nd amendment.

Again, never gonna happen.  You'd have to pass another amendment and get 3/4ths of the states to sign on.  Tell me, which states would that be.  NEVER GONNA HAPPEN.",1,0,1443466935,1444722973
cvh85p7,0,t1_cvh6lfn,mjhmjh,This is the most ridiculous argument against UHC I have ever heard. Is this really the best you have?,1,0,1443468992,1444722973
cvh98bu,0,t1_cvh85p7,knowses,https://www.psychologytoday.com/blog/evolutionary-entertainment/201206/conservatism-mental-illness,-1,0,1443470468,1444722973
cvhw92k,0,t1_cvh98bu,shot_glass,"The reason people are being hard on you is, if the government could list people with opposing views as a group to be locked up, and take away guns(2 things that would require 2 more constitutional amendments) things would be so bad that a universal health care would be the least of your worries. It would require a fundamental and drastic change not only in what government would try, but in what the public would allow them to do. You can't just backdoor or sneak and change the constitution. ",1,0,1443515887,1444722973
cvidw40,0,t1_cvhw92k,Fuckdabullshit,">if the government could list people with opposing views as a group to be locked up

....

>It would require a fundamental and drastic change not only in what government would try, but in what the public would allow them to do. You can't just backdoor or sneak and change the constitution.

Am I the only person aware that we indiscriminately locked up Japanese people during WWII? It wasn't for opposing views, but close enough. ",1,0,1443552768,1444722977
cvi5njz,0,t1_cvhw92k,knowses,"Sure, like unlawful search and siezure. For Instance, there is no way the government could simply spy on innocent Americans using US telecommunication corporations. It is against the Constitution. ",1,0,1443540764,1444722977
cvgvcqg,0,t1_cvgv2ee,BUbears17,"Both guns and political views are protected completely by the 1st and 2nd amendments though, so I doubt single payer would lead to anything different than what we already see today. As far as anything else goes (like food) the government already has the power to ban or control whatever they want due to the commerce clause and how loosely it's been interpreted. So I just don't see any kind of new levels of control happening from single payer that isn't already possible. ",10,0,1443449290,1444722977
cvgvfpo,0,t1_cvgvcqg,knowses,"Well, the government already runs healthcare for veterans. How is that working out?",3,0,1443449452,1444722977
cvgybb5,0,t1_cvgvfpo,metachronos,Single-payer would be less like the VA and more like an expansion of medicare. ,4,0,1443454400,1444722977
cvgwikc,0,t1_cvgvfpo,Freckled_daywalker,"The VA system is a terrible example of what a government run single payer would look like. It isn't ""health insurance"", where facilites get reimbursed for care provided, rather they get a set amount of funds and try to treat as many people as possible. Tricare Prime is a much better example of a single payer, with both government run hospitals and reimbursement for private care. It's not perfect but most people who use it are quite satisfied with it. ",5,0,1443451423,1444722977
cvha9y7,0,t1_cvgvfpo,Waylander0719,"About on par with private healthcare....

http://www.washingtonpost.com/blogs/federal-eye/wp/2014/04/17/va-hospitals-on-par-with-private-sector-for-patient-satisfaction/

http://www.military.com/daily-news/2014/04/17/va-hospitals-earn-high-patient-satisfaction-scores.html",2,0,1443471952,1444722977
cvgw5jv,0,t1_cvgvfpo,MisterMiddleFinger,"Veterans can still get private care.  The fact that they choose the VA means that's better for them than what they could get elsewhere.

So I'd say it is working out ""shittily, but less shittily than if it would without them.""",11,0,1443450783,1444722977
cvh9h1d,0,t1_cvgw5jv,boxerman81,"Or it's they can't afford to go anywhere else, because the VA is the healthcare plan their employer provides.  Unless your spouse also works, you're not going to be able to afford any private healthcare without making serious cuts.  Paying for private healthcare as a soldier is essentially paying for two sets of healthcare plans, because the VA is part of your reimbursement. 

 This argument always falls completely flat for me in terms of single payer.  It forces those who want what's currently already available to pay twice.  ",2,0,1443470809,1444722977
cvhw7ca,0,t1_cvh9h1d,shot_glass,"Most vets like or love the VA, that doesn't mean it doesn't have a ton of problems. All my family that was eligable used it even tho they had perfectly good options from there spouse. The recent issue with the VA isn't that vets didn't like it, it's that it wasn't ready to deal with expansion of eligibility, Iraq vets and changing over from paper to computer records all at the same time. ",1,0,1443515665,1444722977
cvh4mtq,0,t1_cvgtf6h,liquidfan,"Yes but the way the military industrial complex works is completely different from how a single payer healthcare system would. Weapons innovation comes from the government talking to private companies and throwing hundreds of billions of dollars at them with the expressed purpose of weapons development, and it often turns out to be a total bust all the same (take for example the f35). So unless you'd propose throwing similar amounts of money at pharma companies (ya know, those guys that intentionally kill people by price gouging aids meds) and hoping they don't just walk off with it laughing their asses off all the way to the bank the analogy kinda falls apart.",8,0,1443463939,1444722977
cvhgrn6,0,t1_cvgtf6h,bfhurricane,"US Army here, innovation within the military is abysmal. High risk aversion + politics results in poor doctrine and very slow change to strategy (see: War on Terror). Weapons innovation is largely due to earmarked payouts to private corporations where our tax money is held above the heads of private citizens grappling to outcompete the next. I wouldn't compare the military to the government whole, unless it's to describe the similarities between poor oversight on entitlements.",3,0,1443482382,1444722981
cvguitn,1,t3_3moxvb,brinz1,"Just a word, currently in america 55% of what you pay to healthcare insurance does not go to healthcare professionals. Instead it goes to costs such as underwriting, legal costs, regulation wrangling, profits and a variety of other things that do not benefit the healthcare world in any way. 

[cost of healthcare in america compared to single payer countries](http://www.trbimg.com/img-53863db9/turbine/la-fi-mh-overuse-healthcare-20140528-001/900/900x506)

",13,0,1443447563,1444722981
cvh79rd,0,t1_cvguitn,zeperf,"Who is included in your category of ""healthcare professionals""?  Are the suppliers of equipment and pharmaceuticals included?  Those are the people that the original question addresses and I'm worried you may have lumped them into ""profits and other things"" in your 55%.",1,0,1443467766,1444722981
cvh2gdn,0,t1_cvguitn,Weenercopter,"> profits 

I'm on board with you about everything else, but I disagree bigtime with this one.  

Profit motive is the reason someone will invest 10 years of their life, and $300,000 in debt to become a doctor.  Profit motive is the reason someone will take the risk to personally guarantee $70,000 in loans to build-out a custom space to grow a practice.  Profit motive is the reason someone will pay $40,000+ a year in malpractice insurance premiums.  Profit motive is the reason why you pay $90,000 annually to have outstanding nurse practitioner on staff, and $60,000 annually to have outstanding registered nurses on staff.  (By the way, I'm exactly describing a friend's experience.)  I could go on.  

Yes, doctors genuinely love medicine as well, otherwise they wouldn't get involved, but profit motive is what makes the world turn.  It is a necessary evil in order to even produce medical services in the first place.  Even in a government single-payer system, doctors still have to make enormous up-front sacrifices that they otherwise wouldn't take were it not for profit motive.  

Call it dismal, but profit motive is a necessary evil, even among the altruistic--because you gotta cover overhead, dammit.  ",6,0,1443460681,1444722981
cvh4b23,0,t1_cvh2gdn,brinz1,"Yes, there is nothing wrong with the profit motive


however, in this case,  the profit motive incentives the insurance company to pay for as little medical services as it is legally required to, to the point where they will spend money on legal services and underwriters just so they spend even less money on claims",3,0,1443463446,1444722981
cvh4jsb,0,t1_cvh4b23,Weenercopter,"I don't follow. 

Spending money on legal services and underwriters (or other non-claims expenses) still eats into profits.  

",2,0,1443463812,1444722981
cvh4kj3,0,t1_cvh4jsb,brinz1,by spending $1 they save $3,4,0,1443463844,1444722981
cvgun1r,0,t1_cvguitn,BUbears17,"So understandably single payer would cut out a lot of the government-insurance agency back and forth, but would it do anything to stop the rest of the gunk you just named off?",4,0,1443447812,1444722981
cvgurnl,0,t1_cvgun1r,brinz1,"Because A private business' main priority  is to maximize its own profits. That is why so much money is spent consolidating the money they make by paying out as little as possible.

In a public business, which does not have a profit margin demanded by investors, its main priority is treating as many people as possible.

I wont deny there will be still a percentage spent on bureaucracy, but to put it in perspective, they spend about as much in singapore or britain in public healthcare in total as americans spend on their private system bureaucracy alone.


The current system does as much to encourage Innovation in the form of cost cutting for insurance companies and pricing systems for medical companies as it does medical innovation",3,0,1443448080,1444722981
cvguy40,0,t1_cvgurnl,BUbears17,Ah I see your point. I'll have to look into that more as that's not something I've seriously considered as a major argument for single payer!,2,0,1443448458,1444722981
cvgyojj,0,t1_cvguy40,zeperf,"Removing all the lawyers is the best argument for public heathcare.  Its like if we have a system of privatized roads and you need a different pass and vehicle inspection for each road.  There'd be many lawsuits about prices and contracts.  There'd also be advertising.  But since we've made it a priority to give it to everyone regardless of whether you can pay or not, you might as well remove all the privatization machinery I mentioned and let the government control it.

I do suspect that all the expensive fighting of lawyers and insurance companies, as well as ""multiple-buyers"", must contribute somewhat to a more optimized product though.  I don't know enough to be able to weigh one argument against the other.",3,0,1443454979,1444722981
cvh2z4y,0,t1_cvgyojj,Weenercopter,"> Removing all the lawyers is the best argument for public heathcare.

I do not mean this rudely, although it will sound blunt.  You're dead wrong. 

Check out [this documentary](https://www.amazon.com/gp/video/detail/B008CUL504/179-1653318-3261538?ie=UTF8&*Version*=1&*entries*=0) called ""Hot Coffee.""  

It is about tort reform, and about how corporations and insurance companies manipulated the public into believing that doctors and businesses were getting screwed by lawyers, and how lawyers were drastically increasing the prices of everything.  

At the end of the day, corporations and insurance companies have made a killing off tort reform, and malpractice premiums have barely dropped at all.  

As a result, the [average harmed consumer or patient has gotten royally screwed](http://www.huffingtonpost.com/larry-bodine/lie-of-tort-reform_b_1976213.html).  Many tort lawyers won't even take blatantly legitimate malpractice cases anymore.  

Please don't buy into the rhetoric and the messaging, over which corporations and insurance companies have a monopoly.  It's exactly what they want.  

The courtroom used to be where the average American could confront a mighty corporation, but that has eroded. 

Please watch that documentary.  You can watch it digitally from Amazon for like $2.99.  



",4,0,1443461456,1444722981
cvh3dds,0,t1_cvh2z4y,zeperf,"I'm not trying to say lawyers are getting rich.  I'm saying nobody is getting rich but there's just a lot of extra machinery that goes into having private, competing suppliers.  A private system of roads and highways would involve more lawsuits, paperwork, advertising, contracts, storefronts, etc.  With public roads, you just build them and they may suck a little, but its not complicated.

If you are saying I'm dead wrong, then where is all the extra money the US pays on healthcare going?  I do suspect a certain percentage is going towards higher quality products, but some is the ""waste"" of private competition for a product that hospitals are mandated to provide anyway.",3,0,1443462052,1444722981
