id,is_root,parent_id,author,body,score,score_hidden,created_utc,collected_utc
cuv8uat,0,t1_cuv8m5i,CompactedConscience,"What? Do you honestly think I am using an unfair definition of the left? The person refusing to comply with this decision is pretty clearly not a member of the left. The fact that virtually no democrats support her and many republicans do is indicative of that. It is hard to believe you are arguing in good faith if you think she is at all a part of the left just because of her party affiliation. 

On Lerner: That clearly wouldn't defend her against wrongdoing. Targeting both groups but targeting conservatives more is wrong. However, it definitely makes her irrelevant to this case. If we assume all allegations are true then she was definitely targeting conservative groups more than she was scrutinizing liberal ones. You are being disingenuous if you think that was motivated by anything other than pure partisan politics. ",10,0,1441770570,1444731388
cuv9boo,0,t1_cuv8uat,TheNaBr,">What? Do you honestly think I am using an unfair definition of the left?

Yes.  

>The person refusing to comply with this decision is pretty clearly not a member of the left.

Why is she not a member of the left?

>The fact that virtually no **democrats** support her and many **republicans** do is indicative of that.

So, you're using party affiliation to define your left vs right, but then denying that angle for Kim Davis.  All I ask is, what do you consider to be a person on the left?  Is it the *lack* of religion?

> {Lois Lerner} You are being disingenuous if you think that was motivated by anything other than pure partisan politics.

Citizens United is opposed purely based on pure partisan politics, just as the Fairness Doctrine is supported based on pure partisan politics.  *Your request* for an example was based on pure partisan politics (you needed to know someone on the left what would do something like that).  ",-3,0,1441771536,1444731388
cuv9mdu,0,t1_cuv9boo,CompactedConscience,"Let me make this simple because you aren't getting it. 

Most democrats are liberal. Not all democrats are liberal. Most republicans are conservative. Not all republicans are conservative. A fundamental liberal position is that people have a right to marry consenting adults that they love. If someone is a democrat who does not believe in that position, then they aren't a liberal. Most republicans support Davis. Recall, most republicans are conservative. 

Can we conclude that it is likely that most republicans and most conservatives support defying the constitution and a court order when it is convenient? What about that it is unlikely that most democrats support that? If you think Kim Davis is a liberal then you are delusional. It isn't even worth engaging on. ",6,0,1441772161,1444731388
cuv9x0d,0,t1_cuv9mdu,TheNaBr,">A fundamental liberal position is that people have a right to marry consenting adults that they love.

Where did you come up with that as a fundamental liberal position?  I think you made it up right here and now.  

You could have also just apologized for your improper characterization of left/right Democrat/Republican.  

>Can we conclude that it is likely that most republicans and most conservatives support defying the constitution and a court order when it is convenient?

No, not at all.

> What about that it is unlikely that most democrats support that?

I'd say that position is completely grounded in creating your self-serving argument in this case.  

>If you think Kim Davis is a liberal then you are delusional.

She's a Democrat.  I'm guessing you think it's delusional because she's religious.  ",-6,0,1441772782,1444731388
cuva37z,0,t1_cuv9x0d,CompactedConscience,"I didn't improperly characterize anything and I didn't make anything up. There are pretty clear partisan and ideological divides on the all the policy and cultural issues Davis claims to champion. This all skirts the real issues. It is clear that more conservatives and more republicans support her unlawful behavior than democrats and liberals. 

>No, not at all

""Yes, unquestionably"" was the correct answer. 

If you honestly think that most democrats support her in this, or that more democrats support her than republicans then I don't know what to say to you. 

>think it's delusional because

 I think its delusional because she is doing something antithetical to the values of liberalism. ",5,0,1441773143,1444731388
cuv9hgw,0,t1_cuv5xi5,WhiteyDude,And the Supreme Court said what about Lois Lerner?,8,0,1441771873,1444731388
cuvljo0,0,t1_cuv5wc9,ISBUchild,">Do you see anyone on the left not complying with the Citizen's United ruling?

What would civil disobedience to that ruling even look like?",2,0,1441808652,1444731388
cuvlrbg,0,t1_cuvljo0,CompactedConscience,"Because we are talking about public officials, it would look like someone in office either directly not processing funds or maybe freezing them or seizing them for anyone who is trying to donate funds. Analogy gets a bit strained because no office that I know of is directly in charge of that.",-1,0,1441809016,1444731388
cuv5lb8,0,t1_cuv5c8e,Trotskyist,"Of course the leanings of the court can be swayed by future nominations. That's how their power is checked. I am a progressive and this is the number one issue that's going to be pulling me to the ballot box this year, because it's that important.

Private citizens disagreeing with a law is different from government officials actively undermining it. I disagree with the Citizens United ruling, but it is unquestionably the law of the land. The same is true if Roe v. Wade were to be struck down. I'd be horrified and appalled, but there is *no* legal basis to disagree with a Supreme Court ruling. That's why they're the *supreme* court. To argue otherwise only displays a fundamental ignorance of how the US Constitution is written.",4,0,1441764739,1444731388
cuv5sxq,0,t1_cuv5lb8,houinator,"I certainly don't disagree with that sentiment.  Kim Davis is obviously in the wrong, I just don't think the next President will bother getting into a direct fight with the Supreme Court when they have so much power to make it their own.",0,0,1441765101,1444731388
cuwdj6g,0,t1_cuv5sxq,call_it_art,If Ginsburg dies she'll need to be replaced.,1,0,1441854011,1444731388
cuwdl49,0,t1_cuwdj6g,houinator,Ginsberg and Kennedy are the two I am thinking are most likely to die/retire in the next term.,1,0,1441854115,1444731392
cuvlifs,0,t1_cuv5lb8,Kinkonthebrain,"> Private citizens disagreeing with a law is different from government officials actively undermining it.

This. ",3,0,1441808595,1444731392
cuvs4kz,1,t3_3k6avz,molotoviphone,"Carly Fiorina couldn't secure carlyfiorina.org, let alone a few more points in the Republican Polls. 

The only thing Christie could possibly beat Hillary Clinton in is number of accused scandals. 

Neither of them matter. ",2,0,1441818874,1444731392
cuvevl5,1,t3_3k6avz,pjabrony,"The Supreme Court is not the ultimate arbiters of legality. If they chose to say ""We interpret that the first amendment really means that our particular sect should be the state religion,"" they would be wrong. If Congress and the states passed an amendment to specifically counter a Supreme Court ruling, and the court later ruled that that amendment was null and void, they would be wrong.",3,0,1441789041,1444731392
cuvgw61,0,t1_cuvevl5,yankeesyes,"Right, hence we have checks and balances.  There is very little likelihood that a single Supreme Court justice would be appointed that believes that a single sect should be the state religion, never mind five.  That's the executive's check on the Supreme Court.  The executive can also refuse to enforce that ruling, in practice the executive has considerable latitude on enforcement actions.",1,0,1441797654,1444731392
cuvnrr4,0,t1_cuvevl5,Dennis_Langley,"> and the court later ruled that that amendment was null and void

They cannot do this, by definition.

> If they chose to say ""We interpret that the first amendment really means that our particular sect should be the state religion,"" they would be wrong.

Normatively, not legally. ",3,0,1441812250,1444731392
cuvbz11,1,t3_3k6avz,Corranus,"First, the Constitution does not give the power of Judicial Review to the Supreme Court. The Court decided that it had that power and no one argued with them too much. Personally, I think judicial review is a stupid way to decide the Constitutionality of laws. It's made the process of selecting justices far too political and completely overhauled the system of checks and balances, leaving impeachment as the only check on the Court and no power outside the reach of the Court.

What's more, the 14th Amendment says that Congress is the one who has the power to enforce it, by legislation. The Supreme Court is acting unconstitutionally by enforcing the amendment in a way not authorized by Congress. Indeed, they're enforcing it in a way that Congress forbade.

If that's not enough, Kennedy's interpretation was a flagrant violation of the rule of law, saying:

>""The nature of injustice is that we may not always see it in our own times. The generations that wrote and ratified the Bill of Rights and the Fourteenth Amendment did not presume to know the extent of freedom in all of its dimensions, and so they entrusted to future generations a character protecting the right of all persons to enjoy liberty as we learn its meaning.""

In effect ""the authors of the amendment left a bunch of room for interpretation so that we could make up additional rules."" Had the 14th amendment said in a parenthetical ""this includes same-sex marriage"" there is no way on earth it would have passed, even just 10 years ago. The Constitution does not change quickly for a reason. Even Roberts, who plainly wanted same-sex marriage to be legalized, argued that Kennedy was betraying his own principles along with the Constitution, quoting Kennedy himself:

>“One can conclude that certain essential, or fundamental, rights should exist in any just society. It does not follow that each of those essential rights is one that we as judges can enforce under the written Constitution. The Due Process Clause is not a guarantee of every right that should inhere in an ideal system.”

TL;DR: You are placing the Supreme Court on a pedestal that the Constitution does not give it, the Founding Fathers did not want for it and its actions prove it has not earned.",4,0,1441778022,1444731392
cuvcs1z,0,t1_cuvbz11,question_all_things,"> While the U.S. Constitution does not explicitly define a power of judicial review, the authority for judicial review in the United States has been inferred from the structure, provisions, and history of the Constitution.

...

>Chief Justice John Marshall maintained that the Supreme Court's responsibility to overturn unconstitutional legislation was a necessary consequence of their sworn oath of office to uphold the Constitution as instructed in Article Six of the Constitution.

https://en.wikipedia.org/wiki/Judicial_review_in_the_United_States

Further...

>But judicial review is not just made up.  In recent years, scholars have argued persuasively that the Framers expected judicial review of the Constitution.  But, even more importantly, judicial review has a strong basis in the constitutional text.  While I cannot go review all of the arguments, I will try to hit the high points.

>First, the Supremacy Clause expressly states that a form of judicial review exists:

- *This Constitution, and the laws of the United States which shall be made in pursuance thereof; and all treaties made, or which shall be made, under the authority of the United States, shall be the supreme law of the land; and the judges in every state shall be bound thereby, anything in the Constitution or laws of any State to the contrary notwithstanding.*

>Clearly, this is stating that state court judges must apply the Constitution rather than state statutes.  Thus, Graglia’s apparent claim that judicial review is not expressly in the Constitution is mistaken as to judicial review of state laws, and Graglia’s essay clearly indicates that he has such judicial review of state laws in mind.

http://www.libertylawsite.org/2013/01/24/the-constitutional-basis-for-judicial-review/",3,0,1441780567,1444731396
cuvcy4b,0,t1_cuvcs1z,Corranus,"The Supremacy clause binds them to federal laws and the federal Constitution when they contradict state laws and state constitutions. It says nothing about striking those laws down (except as applied in a given case) or about altering federal laws. (Marshall's opinion appears to be built from the same line, so the points are actually the same.)",3,0,1441781142,1444731396
cuvd3fa,0,t1_cuvcy4b,question_all_things,"  There are highly qualified people who have been looking at this, and the matter seems to be plainly settled.  As an amateur it'd be an insult to all for me to pretend to have something to add beyond my references.",1,0,1441781664,1444731396
cuv61ke,1,t3_3k6avz,TheNaBr,">refusal to comply with a court order to issue marriage certificates to gay and lesbian couples

Didn't she refuse to issue any marriage certificates?

>Essentially, they are arguing to the public that the decisions of the judicial system are not absolute

It's not absolute, Judges can err just like other people.  See the Dred Scott case.  She refused to comply knowing full well that there would likely be consequences.  

>The Supreme Court are themselves the final arbiters of constitutionality.

Not really.  The three branches are co-equal.  A President can have their own interpretation, Congress can have its own interpretation, and the Scotus can have their own interpretation.

>It is in the very nature of the Supreme Court that it’s decisions cannot be wrong

I don't think many people see it that way.  On both sides of the aisle.  

>Supporters of Ms. Davis argue that she did not break any law

Maybe some are, some recognize the law was broken, but they see that a Christian gets jailed for it...if other Federal laws are broken, such as with Sanctuary cities, those laws are allowed to be broken without jailing.  I think a lot of people see this event as a sign that the US Government has become incompatible and hostile to Christians.   

>She broke the “supreme law of the land,” the US Constitution

The Constitution doesn't say anything about issuing marriage licenses.  The SCOTUS ruling struck down a definition of what marriage is in Kentucky law.

>There is no room for debate here.

Sure there's room for debate.

>Yet, here were are today, where every major GOP candidate has come out in defense of Ms. Davis' actions.

And Mrs. Davis is a Democrat.  Finally, some bipartisanship!

>Consider for a moment the implications of a sitting President holding the position that each of these candidates do.

Co-equal branches of government.

>This is the sort of action that causes constitutional crises and governments to fail.

I'm in total agreement we're having a Constitutional Crisis, but it isn't over a gay marriage license issuance in Kentucky.

>If we choose to stop ‘playing by the rules’, which is to say following the constitution

The rules haven't been followed for a long time now.

>We are nothing without the absolute rule of law

I too advocate for the rule of law...but there will always be an element of morality that can overrule the law.  

And no, I'm not a Christian myself.",5,0,1441765489,1444731396
cuvfphp,0,t1_cuv61ke,yankeesyes,">Maybe some are, some recognize the law was broken, but they see that a Christian gets jailed for it...if other Federal laws are broken, such as with Sanctuary cities, those laws are allowed to be broken without jailing.

What law is there against ""sanctuary cities?""  What court order prevents ""sanctuary cities?""",0,0,1441792951,1444731396
cuvczqg,0,t1_cuv61ke,question_all_things,"> Maybe some are, some recognize the law was broken, but they see that a Christian gets jailed for it...if other Federal laws are broken, such as with Sanctuary cities, those laws are allowed to be broken without jailing. I think a lot of people see this event as a sign that the US Government has become incompatible and hostile to Christians.

There is a large difference here I'd like to mention.  Sanctuary Cities are keeping migrants alive, some of which have kids or are expecting.  People who risked their lives maybe more than once to get here at all.  And these same people get abused often because they are illegal and don't want to go to the cops.  They are some of the most vurnable people in our society.

Some self righteous middle class white person screaming about govt oppression this and that is the height of..what's the word...delusion.  Anytime middle class white christians dont get their exact way its a god damn assault on jesus, sign of the end times, and who knows what else.

Christians are forcing what they've always wanted , a show down with the govt , to be oppressed by the govt.  They get off on this shit.  They've been dreaming of it for decades.  I know, I was raised Christian Conservative.  I listened to the talk radio, watched the videos in church, heard all about how liberals were basically working for satan.  Killing babies for fun, and so on.  To be oppressed for your beliefs is one of the highest honors for religious fanatics.  You can see it on that ladys face every time she smirks. 

There is no oppression of white christians in this country.  Thats why they get off so hard anytime they get some scraps like this.  She was put in jail because she was basically asking for it.",1,0,1441781299,1444731396
cuvo1yr,0,t1_cuvczqg,Kinkonthebrain,"> Christians are forcing what they've always wanted , a show down with the govt , to be oppressed by the govt. They get off on this shit. They've been dreaming of it for decades.

Women allowed to vote, interracial marriage, abortion rights, same-sex marriage, the end of slavery, etc. - it **all** relates (on some level) to historical background and precedent relating to religious systems of belief. The faith-based 'authority' structure and hierarchy see their 'control systems' being whittled away more and more and more. Now, I will be the first to admit that not *every* congregation thinks this way. There are some who do not. As a matter of statistical reality, most homosexuals actually identify with the Christian faith (or...their understanding and interpretation of it).


For many that waive around the Bible as justification for some things (anti-homosexuality for example), they conveniently *don't* like accepting that the same Old Testament that wording comes from also advocates for wives basically to be slaves. And advocates for the beating and rape of their 'owned' female(s) and other things that we (today) would view as abhorrent and morally repugnant.


And it's true - they are so ""oppressed"" and persecuted that they enjoy tax-free status (a 'special privilege') and have had basically *every* President in the history of this nation in their 'camp'. They **burn** for this country to be a theocracy. And very often are maniacally enthusiastic for the 'end of the world'. Gee...isn't that nice? They are **yearning** for a *huge* number of deaths as part of their highly-anticipated Armaggedon. Very loving, indeed.",1,0,1441812678,1444731396
cuv8pbj,0,t1_cuv61ke,Reptilian_Overlords,"> A President can have their own interpretation, Congress can have its own interpretation, and the Scotus can have their own interpretation.

Unless Congress gets an Amendment passed, this is *the* final interpretation and understanding with regards to the law.

Also, 

> I think a lot of people see this event as a sign that the US Government has become incompatible and hostile to Christians. 

If you seriously believe this I feel really *really* bad for you.
",1,0,1441770291,1444731396
cuv9i1t,0,t1_cuv8pbj,TheNaBr,">If you seriously believe this I feel really really bad for you.

Why do you feel really really bad for me?",1,0,1441771907,1444731396
cuvfw9h,0,t1_cuv9i1t,yankeesyes,Because you've deluded yourself into thinking that the elected government is actively hostile to 80% of the voter base that identifies as Christian.,-2,0,1441793785,1444731396
cuvoyqf,0,t1_cuvfw9h,TheNaBr,"Just practicing Christians.  And in that case, yes, the government will shut down your business or throw you in jail if you don't toe the government line.  ",2,0,1441814051,1444731396
cuvpd5e,0,t1_cuvoyqf,yankeesyes,"Who gets to decide who is practicing?  You?  What denomination or cult should we judge ""practicing"" on?  ",1,0,1441814665,1444731396
cuw2900,0,t1_cuvpd5e,TheNaBr,"Oh, *that's a great point!*  That's entirely the case with this particular incident.  No one knew prior to Kim Davis that Christians disapproved of homosexual relationships.  

It was just totally made up.  You cracked the case!",0,0,1441834294,1444731396
cuv6zi1,0,t1_cuv61ke,CompactedConscience,">Not really. The three branches are co-equal. A President can have their own interpretation, Congress can have its own interpretation, and the Scotus can have their own interpretation.

The branches are co-equal, but they are given different responsibilities. Interpreting the constitution is not a responsibility of the executive or legislature. 

>Federal laws are broken, such as with Sanctuary cities, those laws are allowed to be broken without jailing. I think a lot of people see this event as a sign that the US Government has become incompatible and hostile to Christians. 

Sanctuary cities don't break a single federal law, to my knowledge. They just involve a mayor directing his law enforcement personal to prioritize other tasks to the exclusion of enforcing immigration laws. There is nothing illegal about this in the way that what Davis did was illegal. 

>The Constitution doesn't say anything about issuing marriage licenses. The SCOTUS ruling struck down a definition of what marriage is in Kentucky law.

Not in those words. However, the constitution does recognize that you can not be deprived of liberty without due process of the law. Now define liberty. Being able to marry someone you love has long been recognized by the courts as essential to liberty and this was the majorities justification. So, in essence, as long as being able to marry who you want is important to liberty and the due process clause exists then the constitution does protect same sex marriage. ",4,0,1441767072,1444731396
cuv7z9d,0,t1_cuv6zi1,TheNaBr,">Interpreting the constitution is not a responsibility of the executive or legislature.

It absolutely is their responsibility.  Congress has a responsibility to craft laws that are Constitutional and the President has the responsibility to veto unconstitutional laws and to enforce the laws in a Constitutional manner.

All that requires interpreting the Constitution.

>Sanctuary cities don't break a single federal law

They refuse to enforce Federal laws on immigration. How is that not breaking the law?  That is illegal.

>Being able to marry someone you love has long been recognized by the courts as essential to liberty and this was the majorities justification.

I wouldn't define liberty that way.  Love has got little to do with it too.  Couples are free to love one another regardless of marriage status.  

>So, in essence, as long as being able to marry who you want is important to liberty and the due process clause exists then the constitution does protect same sex marriage.

So then a refusal to issue multiple marriage licenses will be next on the docket I'm guessing.  If marriage can't be defined as between 1 man and 1 woman, how is the definition that it has to be between 2 people going to hold up?

Personally, I don't care if homosexuals marry and I'm happy for them to do just that.  But I think the SCOTUS ruling is SO abysmal that it's pitching us directly into this legal mess.",-2,0,1441768884,1444731396
cuvftal,0,t1_cuv7z9d,yankeesyes,"> Sanctuary cities don't break a single federal law
> They refuse to enforce Federal laws on immigration. How is that not breaking the law? That is illegal.

You tell me.  How is a locality not enforcing federal law breaking the law?  Be specific, with cites to laws and court cases.",1,0,1441793426,1444731396
cuv84yz,0,t1_cuv7z9d,slam7211,"> They refuse to enforce Federal laws on immigration. How is that not breaking the law? That is illegal.

This is not illegal at all. The president stopped defending DOMA and he was perfectly in the clear. No law says municipal governments NEED to spend resources enforcing all laws. In fact there is a SCOTUS ruling that says you are not entitled to police protection.",1,0,1441769182,1444731396
