id,is_root,parent_id,author,body,score,score_hidden,created_utc,collected_utc
cusoyv2,0,t1_cusoxim,ClockOfTheLongNow,"> ""We could never verify that there was any Iraqi authority, direction and control, complicity with al-Qaeda for 9/11 or any operational act against America, period."" -George Tenet former director of the CIA.

And that wasn't the claim made in any regard.

> To go to war you have to have a reason to do so. The reasons were that Saddam has WMDs and was involved with 911. 

The WMDs were understood to exist by the intelligence and the international community.  This was not a serious debate by anyone involved.

There was never a reason given that Saddam was involved with 9/11.",-1,0,1441565521,1444732220
cuss3cz,0,t1_cusoyv2,rdinsb,"Really? https://en.wikipedia.org/wiki/Saddam_Hussein_and_al-Qaeda_link_allegations

>Vice President Dick Cheney had told Meet the Press on December 9, 2001, that Iraq was harboring Abdul Rahman Yasin, a suspect in the 1993 World Trade Center bombing, and repeated the statement in another appearance on September 14, 2003, saying ""We learned more and more that there was a relationship between Iraq and al-Qaida that stretched back through most of the decade of the '90s, that it involved training, for example, on BW and CW, that al-Qaida sent personnel to Baghdad to get trained on the systems that are involved. The Iraqis providing bomb-making expertise and advice to the al-Qaida organization. We know, for example, in connection with the original World Trade Center bombing in '93 that one of the bombers was Iraqi, returned to Iraq after the attack of '93. And we’ve learned subsequent to that, since we went into Baghdad and got into the intelligence files, that this individual probably also received financing from the Iraqi government as well as safe haven."" and once again in an interview with National Public Radio in January, 2004, stating that there was ""overwhelming evidence"" of a relationship between Saddam and al-Qaeda based on evidence including Iraq's purported harboring of Yasin.
In the same Meet the Press interviews, Cheney implied a connection between Iraq and Mohamed Atta; ""The Czech interior minister said today that an Iraqi intelligence officer met with Mohammed Atta, one of the ringleaders of the September 11 terrorists attacks on the United States, just five months before the synchronized hijackings and mass killings were carried out."" and ""With respect to 9/11, of course, we’ve had the story that’s been public out there. The Czechs alleged that Mohamed Atta, the lead attacker, met in Prague with a senior Iraqi intelligence official five months before the attack, but we’ve never been able to develop any more of that yet either in terms of confirming it or discrediting it. We just don’t know."" Czech officials have since backed off of this claim, and even Cheney has since acknowledged that the notion ""that the meeting ever took place"" has been ""pretty well knocked down now.""

And The intelligence community:
>In the initial stages of the war on terror, the Central Intelligence Agency, under George Tenet, was rising to prominence as the lead agency in the Afghanistan war. But when Tenet insisted in his personal meetings with President Bush that there was no connection between Al Qaeda and Iraq, V.P. Dick Cheney and Secretary of Defense Donald Rumsfeld initiated a secret program to re-examine the evidence and marginalize the CIA and Tenet. The questionable intelligence acquired by this secret program was ""stovepiped"" to the vice president and presented to the public. In some cases, Cheney’s office would leak the intelligence to reporters, where it would be reported by outlets such as The New York Times. Cheney would subsequently appear on the Sunday political television talk shows to discuss the intelligence, referencing The New York Times as the source to give it credence.   

And finally:   
>Opponents of his Iraq policy charged that his statement was inconsistent with his letter to Congress of March 21, 2003 [35] and a minority (Democrat) staff report by the U.S. House of Representatives Committee on Government Reform claimed that ""in 125 separate appearances, they [Bush, Cheney, Powell, Rumsfeld and Rice] made ... 61 misleading statements about Iraq's relationship with al-Qaeda.""",1,0,1441571418,1444732220
custjgq,0,t1_cuss3cz,ClockOfTheLongNow,This is why we don't use Wikipedia.  ,0,0,1441574185,1444732220
cusxyj2,0,t1_custjgq,rdinsb,That is an ad hominem poisoning the well fallacy.,0,0,1441583191,1444732220
cusyjxu,0,t1_cusxyj2,ClockOfTheLongNow,Okay.,1,0,1441584486,1444732220
cuswa8v,0,t1_custjgq,SapCPark,Wiki was found to be as accurate as encyclopedia Britannica,1,0,1441579676,1444732220
cuswbld,0,t1_cuswa8v,ClockOfTheLongNow,"Wasn't that, like, 10 years ago?",2,0,1441579750,1444732220
cusr0cx,0,t1_cusoxim,DeShawnThordason,"It's generally accepted that [Iraq had WMDs](http://www.nytimes.com/interactive/2014/10/14/world/middleeast/us-casualties-of-iraq-chemical-weapons.html), even though he didn't have capability to produce more.  The 9/11 link was very tenuous (it's probably easier to link Saudi Arabia to al Qaeda), and possession of chemical weapons stockpiles [isn't a great reason to invade a country on its own](https://en.wikipedia.org/wiki/Chemical_weapon_proliferation)",2,0,1441569394,1444732220
cusoyd2,0,t1_cusoc2u,definitelyjoking,"The beating of the massively inferior army went well? Color me surprised. If it wasn't for the entirely predictable insurgent response there would have been no issues. If you've got actual proof (you don't) then show it. Don't say ""you should read a large document and then you'll agree with me."" Saddam was absolutely no friend to  Al Qaeda, and there was increased presence after his removal even before we withdrew. ",6,0,1441565497,1444732220
cuspzjm,0,t1_cusoyd2,ClockOfTheLongNow,"> If you've got actual proof (you don't) then show it. Don't say ""you should read a large document and then you'll agree with me.""

Lee Hamilton, 9/11 Commission: ""I must say I have trouble understanding the flack over this. The Vice President is saying, I think, that there were connections between al Qaeda and Saddam Hussein’s government. We don’t disagree with that. What we have said is [that] we don’t have any evidence of a cooperative, or a corroborative relationship between Saddam Hussein’s government and these al Qaeda operatives with regard to the attacks on the United States. So it seems to me the sharp differences that the press has drawn, the media has drawn, are not that apparent to me.""",-5,0,1441567401,1444732220
cutbb3d,0,t1_cuspzjm,,[removed],0,0,1441618551,1444732220
cutctgt,0,t1_cutbb3d,ClockOfTheLongNow,">  I actually read the document you are referencing. There was no evidence that Saddam was involved in 9/11

And no one claimed as such.  What's with this continued strawman?

",0,0,1441625583,1444732220
cutd4p8,0,t1_cutctgt,rlobster,"I probably shouldn't reply to you, but here goes: You said ""Read the 9/11 Commission Report sometime to see how the Al Qaeda links were detailed.""

The report however states that there is no indication of such a link. This is what I put in my reply. I don't know what you are trying to achieve, but everything you wrote on this topic in this thread is wrong.",0,0,1441626862,1444732220
cutd84h,0,t1_cutd4p8,ClockOfTheLongNow,"[The report says the opposite, however] (http://nsarchive.gwu.edu/pdbnews/blanton21.pdf).  Everything I've written is 100% correct, unlike this continued claim of people thinking Iraq was involved with 9/11. ",-1,0,1441627238,1444732220
cutdm9z,0,t1_cutd84h,rlobster,"Your reading skills seem to be impaired. The part you linked talks about an indictment (!) from 1998 that alleges an understanding between al Qaeda and the government of Iraq. A passage which was removed in a later indictment. No evidence whatsoever.

And not only that, the report on multiple occasions mentions that Bin Laden was working against Saddam / supporting his opposition.",0,0,1441628693,1444732220
cutdv1r,0,t1_cutdm9z,ClockOfTheLongNow,"> The part you linked talks about an indictment (!) from 1998 that alleges an understanding between al Qaeda and the government of Iraq. A passage which was removed in a later indictment. No evidence whatsoever.

Except for Clarke agreeing with it, right?

There's also page 66, but I'm sure you'll find some way to handwave those links away, too, right?",1,0,1441629536,1444732220
cuu5axu,0,t1_cutbb3d,ultimis,"If you read the Iraqi Senate Report from 2006 they explain the intelligence failure on this. Essentially there were hundreds of Al Qaeda that setup operations in Iraq after 9/11. The intelligence of the time suspected that Saddam and these groups were actually working together or at the very least that Saddam was turning a blind eye to them since they were effective as hurting the United States (enemy of my enemy is?).

In reality (20/20 hindsight knowledge) Saddam was actively hunting these new terrorist cells (so they existed, the intelligence just didn't realize Saddam was antagonistic to their existence). It was one of the many intelligence failures of Iraq. The blame lies with Clinton in the 90's who had done two things to the intelligence sector: 1.) Severe budget cuts 2.) Prohibited financial distribution to individuals who were known to have been involved in immoral activities. The number 2 essentially killed sources of intelligence in many if not all areas in Iraq and around it. Leading up to the Iraq war they had to build new intelligence infrastructure which resulted in only a few sources. One of those sources ended up being incredibly unreliable (the man hated Saddam with a passion and really wanted the U.S. to take him out).

I don't think there was any evidence that Saddam was involved in 9/11. But there was evidence (bad evidence) he was working with Al Qaeda. And the risk of Saddam passing off a newly constructed nuclear weapon (again bad intelligence, please read that report) was enough to warrant action from the United States. Bill Clinton and his administration also postured in a hostile manner towards Iraq (with several air strikes in the late 90's and a lot of drum beating after the weapons inspectors were kicked out). It also doesn't help that Saddam had repeated lied about having WMD's as bluster to his neighbors (because he hated Iran and wanted them scared).

I personally was of the opinion with the lead up of the Iraq war that Saddam was a general threat to the United States and the stability of the world. I felt it was unfinished business and that HW Bush should have finished the job.",1,0,1441688371,1444732220
cusq54v,0,t1_cuspzjm,definitelyjoking,"He's saying they have no proof of connections to the attacks on the US. That makes the question of Iraqi connections to Al Qaeda utterly irrelevant to a commission on 9/11, so they're not talking about the subject. It's also not proof of connections. Try again. ",3,0,1441567690,1444732220
cusqnwy,0,t1_cusq54v,ClockOfTheLongNow,"> That makes the question of Iraqi connections to Al Qaeda utterly irrelevant to a commission on 9/11, so they're not talking about the subject. 

Which is why they dedicated a few pages to these connections in the reports, right?",-5,0,1441568741,1444732220
cusrji1,0,t1_cusqnwy,definitelyjoking,"So, you're just again going to refer to something which you won't cite? Your quote didn't offer proof. Talking about the lack of proof that Iraq was even slightly involved in 9/11 does actually seem relevant to a 9/11 commission though. ",3,0,1441570386,1444732220
custk1l,0,t1_cusrji1,ClockOfTheLongNow,"> So, you're just again going to refer to something which you won't cite?

I did cite the report as well as a statement about one of the people who made it.

> Talking about the lack of proof that Iraq was even slightly involved in 9/11 does actually seem relevant to a 9/11 commission though.

Good thing no one claimed this!
",-1,0,1441574218,1444732220
custra2,0,t1_custk1l,definitelyjoking,"You referenced (citation requires something much more specific) a huge document and made a handwaving generalization about what was in it. Your personally selected statement offered no actual proof whatsoever.

Actually, YOUR quote specifically mentions the lack of proof that Iraq was involved in the attacks on America. 

I'm done engaging with you. You have nothing substantive to offer here. ",1,0,1441574604,1444732220
custwrr,0,t1_custra2,ClockOfTheLongNow,"> Actually, YOUR quote specifically mentions the lack of proof that Iraq was involved in the attacks on America.

And as no one claimed they were involved, it's a moot point!

> I'm done engaging with you. You have nothing substantive to offer here.

And strawmen are substantive?
",-2,0,1441574900,1444732220
cusno4u,0,t1_cusn9w9,Feezec,">Only if we choose to leave too soon again.

So you're saying that the lesson of Iraq is that if we want a good return on investment on invading Iran we need to make an long term military and political commitment which by some reasonable standards would be considered prohibitively expensive, particularly when there is the possibility of achieving an imperfect but satisfactory diplomatic solution?",4,0,1441563093,1444732220
cusnrgx,0,t1_cusno4u,ClockOfTheLongNow,The lesson is simpler than that: don't kneecap the inevitable military option just because the choices made in concluding Iraq turned out poorly.  Just don't make the bad choices again.,-2,0,1441563265,1444732220
cuso8pz,0,t1_cusnrgx,Trorbes,"> Just don't make the bad choices again.

You mean like using the military option? I agree, they shouldn't do that again.

Seriously though, what leads you to think the government won't fuck up again and create yet more radical anti-Western groups in the region? ",2,0,1441564184,1444732220
cusodvk,0,t1_cuso8pz,ClockOfTheLongNow,"> You mean like using the military option? I agree, they shouldn't do that again.

No, the bad choices were the hasty, political exit.  Not the use of the military to successfully remove a terror-supporting dictator from power.

> Seriously though, what leads you to think the government won't fuck up again and create yet more radical anti-Western groups in the region?

If we were looking at the military option, it would demonstrate some sort of actual learning from the last 15 years, so my hope would be that the application of such information would be beneficial.",1,0,1441564460,1444732220
cusp3uc,0,t1_cusodvk,Trorbes,"> No, the bad choices were the hasty, political exit. Not the use of the military to successfully remove a terror-supporting dictator from power.

Interventionism is a nice, liberalist ideology I sympathize with, but it really does deserve criticism. Not least because we have no problem allying with terrorist-supporting dictators when it's convenient.

And really, how can you say the invasion was not a bad choice, but the withdrawal was? Was it a good choice when the state we built couldn't stop sectarian conflict? Was it a good choice when we gave al-Qaeda more justification in their anti-Western opposition? Was it a good choice when the IS gained a foothold in the resulting turmoil?

> If we were looking at the military option, it would demonstrate some sort of actual learning from the last 15 years

I'm still waiting for our government to learn from its belligerence over the last *60* years. ",1,0,1441565770,1444732220
cusq0hm,0,t1_cusp3uc,ClockOfTheLongNow,"> And really, how can you say the invasion was not a bad choice, but the withdrawal was? Was it a good choice when the state we built couldn't stop sectarian conflict? 

It was, because they weren't ready for us to leave yet.

> Was it a good choice when we gave al-Qaeda more justification in their anti-Western opposition? 

Our mere existence does this.

> Was it a good choice when the IS gained a foothold in the resulting turmoil?

No.  That's the lesson we should have learned.


",-1,0,1441567450,1444732220
cusy1eo,0,t1_cusq0hm,Trorbes,"> It was, because they weren't ready for us to leave yet.

The pullout was agreed upon by the Iraqi regime, was it not?

> Our mere existence does this.

I'm sure they wouldn't give a fuck about the US were it not for our government's imperialism and interference in the ME. 

> No. That's the lesson we should have learned.

Yes. The lesson our government should have learned is that we breed hostility and resentment among radical Sunni Muslims every time we stomp around the Middle East. 

The solution is obvious: Stop fucking meddling in the Middle East.",1,0,1441583361,1444732220
cusyler,0,t1_cusy1eo,ClockOfTheLongNow,"> The pullout was agreed upon by the Iraqi regime, was it not?

Sort of.  The idea was that we would set a timetable and revisit it, but then we decided to elect someone who made a hasty withdrawal a campaign plank, so a lot of negotiation and leverage was lost.

> I'm sure they wouldn't give a fuck about the US were it not for our government's imperialism and interference in the ME.

Read Osama's open letter from the Guardian back about a decade ago.  One of the main complaints was cultural imperialism.  The fact that we exist, export our culture, and influence people in those nations as a result is a big problem for those extremists.

",1,0,1441584578,1444732220
cusz39v,0,t1_cusyler,Trorbes,"> The idea was that we would set a timetable and revisit it, but then we decided to elect someone who made a hasty withdrawal a campaign plank, so a lot of negotiation and leverage was lost.

So what part of this means the Iraq government didn't agree to the withdrawal date? 

> One of the main complaints was cultural imperialism.

Emphasis on the 'imperialism,' of course. ",1,0,1441585658,1444732220
cutcufp,0,t1_cusz39v,ClockOfTheLongNow,"> So what part of this means the Iraq government didn't agree to the withdrawal date?

The part where the withdrawal date would have been up for negotiation with a better diplomat.

> Emphasis on the 'imperialism,' of course.

You understand what ""cultural imperialism"" means, right?",2,0,1441625692,1444732220
cutgv74,0,t1_cutcufp,Trorbes,"> The part where the withdrawal date would have been up for negotiation with a better diplomat.

It was up for negotiation; a date was set, and was followed through. Shouldn't the blame be placed on the diplomats who set this date; or the governments who accepted this date in the first place?

> You understand what ""cultural imperialism"" means, right?

The saturation of a domestic society with foreign culture, basically. What is your point?",1,0,1441637522,1444732220
cuthqtv,0,t1_cutgv74,ClockOfTheLongNow,"> It was up for negotiation; a date was set, and was followed through. Shouldn't the blame be placed on the diplomats who set this date; or the governments who accepted this date in the first place?

The latter.  Poor diplomacy and negotiation skills from this administration failed Iraq and our interests in particular.  Running on a ""we're leaving no matter what"" platform is incredibly dumb.

> The saturation of a domestic society with foreign culture, basically. What is your point?

The focus on the imperialism aspect implied that you didn't under stand it.",2,0,1441639399,1444732220
cutmy1t,0,t1_cuthqtv,Trorbes,"> Poor diplomacy and negotiation skills from this administration

But this admin wasn't the one to put the date on the calendar: the last one did. Does the Bush admin not share the blame?

> Running on a ""we're leaving no matter what"" platform is incredibly dumb.

The alternative would be to continue our illegitimate occupation of Iraq, which was not just incredibly dumb, but also difficult to justify in the midst of a major recession.",1,0,1441649168,1444732220
cuto9hp,0,t1_cutmy1t,ClockOfTheLongNow,"> But this admin wasn't the one to put the date on the calendar: the last one did. Does the Bush admin not share the blame?

To a point.  The Bush adminsitration probably didn't anticipate the sort of politicized withdrawal in the face of needing to stay, but that wouldn't have been the first time they failed to anticipate events in Iraq.

> The alternative would be to continue our illegitimate occupation of Iraq, which was not just incredibly dumb, but also difficult to justify in the midst of a major recession.

The occupation was legitimate, and, while I agree that war spending isn't stimulative (because government spending isn't stimulative), ""we're in a recession"" is a terrible reason to abandon a country.
",2,0,1441651537,1444732220
cuso77j,0,t1_cusnrgx,Feezec,">don't kneecap the inevitable military option

resorting to a diplomatic solution before a military one is not necessarily kneecapping...

> just because the choices made in concluding Iraq turned out poorly

""Let's not invade Iran because Iraq turned out poorly"" is not the same thing as ""Let's not invade Iran because numerous observable circumstances in the present day suggest doing so could turn out poorly.""

>Just don't make the bad choices again.

uhhh....okay?

>inevitable military option

inevitable? Did you misspell ever-present or did you just finish reading the first chapter of Starship Troopers?",4,0,1441564083,1444732220
cuso9nw,0,t1_cuso77j,ClockOfTheLongNow,"> resorting to a diplomatic solution before a military one is not necessarily kneecapping...

This should probably be disseminated to everyone in favor of the deal, then, as that seems to be why this is so celebrated.

> ""Let's not invade Iran because Iraq turned out poorly"" is not the same thing as ""Let's not invade Iran because numerous observable circumstances in the present day suggest doing so could turn out poorly.""

This is not the observation, however.  It doesn't even have to be a full-scale invasion, after all.

> inevitable? Did you misspell ever-present or did you just finish reading the first chapter of Starship Troopers?

No, I said inevitable.  I do not see the end result in Iran being anything less than some sort of military action.
",0,0,1441564238,1444732220
cusool8,0,t1_cuso9nw,Feezec,">No, I said inevitable. I do not see the end result in Iran being anything less than some sort of military action.

I guess we'll have to agree to disagree then",2,0,1441565003,1444732220
cuu5hr8,0,t1_cuso77j,ultimis,">resorting to a diplomatic solution before a military one is not necessarily kneecapping...

Diplomacy requires you to have options to negotiate. Removing the military option or the opposition thinking you would never use the military option is a big problem. As long as they think it's a possibility it gives an edge to the negotiations.

And yes sometimes the best diplomatic answer is war.

>""Let's not invade Iran because numerous observable circumstances in the present day suggest doing so could turn out poorly.""

It doesn't have to be an invasion. But again a posturing stance of ""There is no way we will use military force because it might be tough"" is not the best stance for a negotiator. Bluffing is often a crucial tactic.",1,0,1441688959,1444732220
cuuchrs,0,t1_cuu5hr8,Feezec,"In not sure what you're trying to say. It sounds you think that by negotiating, we are not threatening to attack, and by not threatening to attack we are weakening our negotiating position, despite the fact that actually attacking would obviate any present need/opportunity for negotiation.  Your logic seems kinda circular. I under stand that the military option is a useful bargaining chip in negotiation, and I expect it was used when negotiating the Iran treaty. So I don't really see where you are disagreeing with me here, unless you are opposed to any American ever expressing a negative opinion about the use of military force because doing so spoils the American governments bluff.

Yes, sometimes war is preferable to diplomacy. Sometimes. Not this particular time, unless you have a compelling argument to the contrary. Arguing that we can use military force that falls short of an invasion is kind of beside the point. Again, advocating for the use of diplomacy is not the same advocating pacifism. It is perfectly plausible and useful for to negotiators to open the discussion with ""we could blow each other to hell, but we don't want to, so let's reach terms under which we avoid blowing each other to hell, but remain aware that blowing each other to hell is still on the table, even if we don't want to use it, we still totally might use it so keep that in mind."" That's not bluffing, that's diplomacy, and opposing diplomacy solutions because they are not military solutions snd therefore weaken diplomatic solutions is borderline sophistry ",1,0,1441715260,1444732220
