id,is_root,parent_id,author,body,score,score_hidden,created_utc,collected_utc
cv98v4j,1,t3_3lty3f,,"If he's anti nuke and anti GMO, then yes that would bug me. The other positions not so much.  All I've seen on the nuke side is that he favors weighting funding to renewables, which is not in itself anti-nuke.  Can you source those specific positions you object to?",67,0,1442858634,1444725890
cv9tb1q,0,t1_cv98v4j,SirGallantLionheart,He's not anti GMO. He eats them he just wants them labelled as a matter of being honest to the consumer as some people are irrationally afraid of them.,0,0,1442891581,1444725890
cv9tqzm,0,t1_cv9tb1q,BevansDesign,I'm irrationally afraid of farmers named Mike. How do I know if my food wasn't grown by a farmer named Mike without labels alerting me to the fact? It's a matter of being honest with the consumer. ,2,0,1442892367,1444725890
cv9ttfh,0,t1_cv9tqzm,SirGallantLionheart,Youre being facetious but if you're a significant part of the population and it isn't considered discriminatory against any protected class or anything like that then yes you could probably get a Mike label added.,1,0,1442892492,1444725893
cva0fhi,0,t1_cv9ttfh,wherearemyfeet,"Forcing speech without a compelling reason breaches the 1st amendment. There's even legal precedent for that too. 

It's why we couldn't have a *mandatory* label saying whether the farmer voted Democrat or Republican: they can say if they want to, but you can't force them via a mandatory label as it isn't essential health or nutrition information. ",5,0,1442913058,1444725893
cva4j43,0,t1_cv9tb1q,Mason11987,"I also want labels on my fruit picked on Sundays, picked by immigrants, owned by democrats, or picked by women on their period.  I need this policed and I want taxpayers to fund the administrative cost of enforcing this forced labeling policy.",2,0,1442927403,1444725897
cv9a1z7,0,t1_cv98v4j,hlpe,"Im on mobile, so someone else might be able to find better links, but here are a couple.

http://m.huffpost.com/us/entry/1609814


https://en.m.wikipedia.org/wiki/Political_positions_of_Bernie_Sanders (there's a nuclear section under environment)",20,0,1442860451,1444725897
cv9l9qs,0,t1_cv9a1z7,SmashBoomStomp,Since when has advocating for labels been akin to being anti GMO?,3,0,1442878147,1444725897
cva4ikh,0,t1_cv9l9qs,Mason11987,"I see it as anti-GMO.

You might as well demand labeling for ""This tomato was picked on a Sunday"", or ""Picked by immigrants"", or ""Picked by women on their period"".  All are equally irrelevant to safety but SOMEONE would say they want that information.",3,0,1442927369,1444725901
cva0b3c,0,t1_cv9l9qs,wherearemyfeet,"Because the organisations behind the push for labelling are very open that they are doing so specifically to push GM out of the marketplace, as they intend to use mandatory labels as a way of demonising GM (as in ""watch out for the GMO warning label""). Again, this isn't wild conjecture, they are very open about this being the reason. It's specifically an anti-GMO move. 

It's like saying the ""evolution is just a theory"" stickers on biology books in Texas weren't anti-evolution stickers, they were there for public information because more information is better. It was very obvious that the motivation behind them was anti-evolution. ",7,0,1442912459,1444725901
cv9b07e,0,t1_cv9a1z7,,"Good links, thanks.  The nuclear position is pretty much what I expected- don't fund publicly but no active opposition to private expansion. I'm not too happy with the GMO labeling that he's in favor of, but it's not a deal-breaker for me in terms of voting for him. ",26,0,1442861901,1444725901
cv9hnxy,0,t1_cv9b07e,cantletthatstand,">...don't fund publicly but no active opposition to private expansion.

So he's in favor of abolishing the NRC?

",1,0,1442872065,1444725901
cv9dfn2,0,t1_cv9b07e,hdaviirus,"I am a Bernie supporter and a far left progressive and I agree with him on GMOs. I believe there is absolutely no problem with them, but it should be on the labeling no differently than calories, fat, and other ingredients are on the labeling. Why do you disagree?",4,0,1442865531,1444725901
cv9h8v7,0,t1_cv9dfn2,Braver_Incident,Far left progressive...?,0,0,1442871393,1444725905
cv9jmh1,0,t1_cv9dfn2,Sleekery,"There is no scientific, medical, or environmental reason to do so.",-1,0,1442875326,1444725905
cv9n23h,0,t1_cv9dfn2,Meph616,"There already are labels!

See the ones that say GMO-free? Yeah, if they do not contain GMO crops they are absolutely labeling it that. No label means it has GMO.

It's a non-issue.",2,0,1442881244,1444725910
cv9f8ao,0,t1_cv9dfn2,Huey_McDuck,"> I believe there is absolutely no problem with them, but it should be on the labeling no differently than calories, fat, and other ingredients are on the labeling. Why do you disagree?

Because there is no reason to do so.  It creates a feedback loop, where individuals then believe that there is a reason for labeling.  

With no reason, there should be no labeling.  ",2,0,1442868248,1444725910
cv9dvpy,0,t1_cv9dfn2,DeletedLastAccount,It's more that GMO's penetrate the food chain to a degree that labelling ultimately serves little to no purpose. It's almost like California's cancer causing materials labelling law. The labels are so ubiquitous as to be meaningless.,9,0,1442866210,1444725910
cv9e4ge,0,t1_cv9dvpy,hdaviirus,"I understand but I believe that the consumer should be able to make that choice. Pseudo science believing morons should be able to buy non-GMO food, that is their choice to make. And even if it would be annoying to label foods with GMOs, I think it should be done for the aforementioned reason.",-3,0,1442866581,1444725914
cva2s0o,0,t1_cv9e4ge,psychicsword,"Do you believe that consumers should be able to make a choice on vaccines as well? To me labeling GMOs as a general label is like labeling vaccines with a label saying ""non-scientists believe this may cause autism"" just so that those people can make a choice. That is exactly how a GMO label would be used. ",1,0,1442922780,1444725914
cv9jg9r,0,t1_cv9e4ge,kerouacrimbaud,"Here's the thing, if food from GMOs made up a minority of our food markets, I'd be fine with labeling them.  But that's not the case.  An overwhelming majority of the food eaten in the developed world comes from GMOs.  It makes more sense to label foods, if any exist outside of the wild, that *aren't* GMOs.  ",2,0,1442875033,1444725917
cv9ebth,0,t1_cv9e4ge,DeletedLastAccount,"I'm not arguing against that motivation, I'm just saying that it's almost useless. 

When almost everything one will eat is a result of GMO's then isn't education as to why that's the case more useful to the body politic than some onerous feel good labelling law? 

It would be a far better practice for the free market to take on the labelling, as in marketing non GMO foods as such, and letting the consumer think of all non such labelled foods as likely containing spooky veggies. It works for Halal, Kosher, and Gluten free, why not anti-GMO?",6,0,1442866886,1444725917
cv9eir7,0,t1_cv9e4ge,throwawayingtonville,">Pseudo science believing morons should be able to buy non-GMO food

They can. There are [over 35,000 products labeled as non-GMO](https://www.facebook.com/nongmoproject). They can also go GMO-free by supporting any of the roughly [7,800 certified organic farmers, which represents a $9.3 billion industry](http://www.wholefoodsmarket.com/about-our-products/organic-food/organic-food-faqs#howlargeindustry). There are also transitional organic farms, farmer's markets, CSA boxes etc. 

If these consumers are 'pseudo science believing morons,' they should have to pay a premium for GMO-free food--not pass on the burden of labeling costs and regulatory hurdles to those who support the science.",13,0,1442867177,1444725917
cv9jf7w,0,t1_cv9e4ge,Vayate,"Why not just let companies label their products GMO-free, as many already do voluntarily?",5,0,1442874984,1444725922
cv9e8xr,0,t1_cv9dfn2,wherearemyfeet,"Calories, fats and ingredients are considered essential information for consumers to make choices about their health and nutrition. GMO is not even close to this criteria. It's as essential to the consumers health or nutrition as knowing whether the farmer that grew the crop voted Democrat or Republican. Therefore it's not important enough to warrant a mandatory label and to force speech. 

If people want to avoid GM, which they're quite welcome to do, then they can look for the ""Organic"" or Verified non-GMO"" label. Both are guaranteed to be non-GM. It's not like there's absolutely no way to know if something is GM or not. ",16,0,1442866769,1444725922
cv9tm9r,0,t1_cv9e8xr,BevansDesign,"I love those labels. I treat them as ""don't buy this"" labels. 

Can't stand fearmongering. ",2,0,1442892128,1444725922
cv9cpzz,0,t1_cv9b07e,benjamoo,"On GMOs he has said that he supports labeling it to give consumers more information, but doesn't necessarily think they're dangerous. It sounded a little bit like backtracking to be, and as a big fan of his I still don't love his position, but it's not a deal breaker for me either.",41,0,1442864467,1444725922
cv9cxdl,0,t1_cv9cpzz,,"The only reason to label something is if it's a danger.  But this is silly:  ""Warning- this food contains food"".  ",20,0,1442864773,1444725925
cv9doqj,0,t1_cv9cxdl,,The consensus on GMOs isn't quite as universal as things like climate change. Why is it so hard to label?,-2,0,1442865915,1444725925
cv9e5qa,0,t1_cv9doqj,,"How about we label air conditioned air? Why is that so hard?  The point is not the difficulty, the problem is the message. A label implies danger, something you'd want to avoid.  ",7,0,1442866632,1444725925
cv9ep8y,0,t1_cv9e5qa,984519685419685321,But fan death...,5,0,1442867449,1444725925
cv9dygg,0,t1_cv9doqj,dtiftw,"The consensus [is stronger than that on climate change](http://www.pewinternet.org/2015/01/29/public-and-scientists-views-on-science-and-society/). 

Labeling will cost consumers money and is being pushed by the organic industry. It's about one industry trying to use the government to hinder another industry. ",19,0,1442866329,1444725929
cv9i9ys,0,t1_cv9dygg,,[removed],-7,0,1442873058,1444725933
cv9iyg4,0,t1_cv9i9ys,dtiftw,"Joseph Mercola believes that vaccines cause autism. And he makes money convincing people of that.

If you honestly believe he's a valid source, that says a lot about your position.
",11,0,1442874198,1444725933
cv9jhfc,0,t1_cv9iyg4,,[removed],-7,0,1442875089,1444725933
cv9jlpt,0,t1_cv9jhfc,Sleekery,Proven wrong?  Say it was all part of your plan and then insult the other person with a personal attack.,2,0,1442875291,1444725933
cv9myts,0,t1_cv9dygg,Meph616,The American way.,1,0,1442881092,1444725933
cv9f77s,0,t1_cv9cxdl,benjamoo,"Yeah I agree, and I'm not in favor of it necessarily, but if people have more information available when they're buying their food it's not hurting anyone.",2,0,1442868202,1444725933
cv9m2sn,0,t1_cv9cxdl,TheLadderCoins,"So the nutritional information means the product is dangerious?

I agree labeling GMO is unnessisary, but labels give information. 

I'm personally of the belief that if we label the fact that most products are labeled will become clear very quickly and it will cease to be an issue, but that's just me with my sliver of hope for humanity.",3,0,1442879550,1444725933
cv9p34v,0,t1_cv9m2sn,ribbitcoin,"> So the nutritional information means the product is dangerious?

Nutritional info is to convey important nutritional information. Genetic engineering is a breeding technique. Its label doesn't convey anything related to food safety or nutrition.",2,0,1442884592,1444725937
cv9s5cf,0,t1_cv9p34v,PKMKII,Neither does country of origin but we include that.,2,0,1442889602,1444725942
cv9eyes,0,t1_cv9cxdl,ragnaROCKER,"i am totally pro gmo, but if a bunch of people want it to be labeled there is no good reason not too.",16,0,1442867832,1444725942
cv9hd8f,0,t1_cv9eyes,flal4,"On mobile so no links but iirc Europe (or a few countries in Europe) require labeling and because of this gmo food sales are minimal (people think they are dangerous so good markets don't typically sell them). This is a big deal becuase it is the first world nations that make investing in GMOs worthwhile, but it is the poorer nations that need them the most...",4,0,1442871586,1444725946
cv9j7kx,0,t1_cv9hd8f,kerouacrimbaud,"The whole GMO thing is so silly. Chipotle says it's GMO free, but its sodas aren't, its corn isn't (I mean, seriously, that's one helluva claim for a company to make).  Besides, essentially all domesticated food products are genetically modified.  Artificial selection is genetic modification.  I suppose the concern is for *laboratory* GMOs. But what's the difference?",6,0,1442874623,1444725946
cv9pwgd,0,t1_cv9j7kx,szczypka,"Replace ""modified"" with ""engineered"" and that's where the difference lies.

EDIT: And since I'm here, reasonably strong arguments around genetic diversity can be made against the potential monocultures, so that aspect of it, at least, isn't so silly.",2,0,1442885912,1444725946
cv9tntn,0,t1_cv9pwgd,TheRestaurateur,"> reasonably strong arguments around genetic diversity can be made against the potential monocultures

Did you miss the one example someone gave of Pioneer brand corn seed? There's many varieties sold, and they're constantly coming up with new ones. 

From where did you get the idea that the big seed companies only sell one variety? ",0,0,1442892207,1444725950
cv9v178,0,t1_cv9tntn,szczypka,From where did you get the idea that I was suggesting that big seed companies only sell one variety?,0,0,1442894907,1444725951
cv9vkfh,0,t1_cv9v178,TheRestaurateur,"""monocultures"", which is meaningless in agriculture. I already copied and pasted.....

Mix it up, you think pests won't find their target species? 

Is any farm a nature preserve, deer, rodents, birds, insects, weeds, trees, native plants, it's all allowed within a farmers fields? 

I'll also add that one of the things a farmer agrees to with transgenic crops, is planting a refuge - the same species without the insecticidal trait. The farmers sign a two part agreement, one is a promise not to sell the crop as seed or clean it and replant it, and the other is a stewardship agreement. An agreement to plant a certain percentage of refuge, it's a method to discourage or slow  pests from developing resistance. https://www.bayercropscience.us/products/traits/twinlink/resistance-management

If you want to discuss year after year same crop, there's a lot of hypocrisy, myth, and exaggeration with regards to that. ",2,0,1442896121,1444725951
cv9fjyh,0,t1_cv9eyes,dtiftw,"It's expensive. That's a big reason. 

Anyone who wants to avoid GMOs can buy certified non-GMO products. ",12,0,1442868736,1444725951
cv9ipfn,0,t1_cv9fjyh,pikk,"> It's expensive

adding a few lines of verbiage to a piece of packaging? Companies change their packaging all the time. There's nothing about this that would make it substantively more expensive. ",9,0,1442873773,1444725951
cv9pa1y,0,t1_cv9ipfn,TheRestaurateur,"> adding a few lines of verbiage to a piece of packaging?

Label laws vary by state.

 Merely by requiring a product to be labeled GMO suggests there's a good reason to, a suggestion that it may cause harm, for which there's 0 proof that it does. 

We don't need irrational fear of a fantastic technology, one that can save lives, improve lives, help the environment, etc. 

People with peanut allergies would love an allergy free peanut, but they can't have it right now due to irrational fears. 

People with celiac disease could have a gluten free wheat, but they can't due to irrational fears. 

Hundreds of thousands of people suffering diseases due to malnourishment could have a solution right now, and again, irrational fears prevent it from coming to fruition. 

We've even de-nutrified cereals, because some vitamins are made with GMO microorganisms, and people are demanding GMO free cereal due to irrational fears. 

At every step, those irrational fears can be traced to the marketing of some product or service. Marketing of organic foods, marketing of supplements, marketing of shit health and diet related books, marketing of charlatans selling their appearances and their own lines of health and diet products. Marketing of shit diet and health related documentaries. 

",2,0,1442884913,1444725951
cva4yj6,0,t1_cv9pa1y,pikk,"Forget about making changes to the supply chain. If people want non-GMO foods, they can pay the exorbitant prices that accompany all the supply chain changes. Requiring labeling will do nothing other than cause new labels to be on 90% of our food. 

> irrational fears prevent it from coming to fruition.

Hundreds of thousands of acres of coastline are going to be underwater in 40 years, except irrational fears about damage to the economy are preventing anyone from doing anything about it. 

Look, I don't give a shit about GMOs, but if people are asking for them to be labelled, then label them. ",-1,0,1442928334,1444725951
cva534l,0,t1_cva4yj6,dtiftw,And anyone who wants non-GMO food *already has an option to do so*. ,3,0,1442928601,1444725951
cv9oz7s,0,t1_cv9ipfn,ribbitcoin,"Supply chain, labeling is more than just the ink.",4,0,1442884408,1444725951
cva51pq,0,t1_cv9oz7s,pikk,"Everyone keeps saying they'll need to change the supply chain, and that doesn't make any sense to me. 

Why would they need to change the supply chain, and why would normal people be the ones stuck with the cost. 

If people want GMO labeling, just slap labels on all the GMO foods. If people want to avoid eating GMO products, then they'll have to pay the costs associated with supply chain changes and etc. Normal people who are comfortable eating GMO stuff shouldn't see any price increases. Those price changes would be born by the people requesting more non-GMO products. ",0,0,1442928527,1444725951
cva95rm,0,t1_cva51pq,ribbitcoin,"Currently GMO and non-GMO crop are commingled starting from the grain silo (because they are the same crop with just a different breeding technique). Labeling would require GMOs to be kept separate from non-GMOs, from the trucks to the silos to the food manufacturers.",1,0,1442935770,1444725951
cvag5qw,0,t1_cva95rm,pikk,"why? Just say ""This product processed in a facility that also processes GMO foods, and may contain GMO ingredients."" ",1,0,1442946331,1444725951
cv9ja4r,0,t1_cv9ipfn,dtiftw,"It's not the packaging. It's the massive supply chain changes. And monitoring. And auditing. 

http://thefoodiefarmer.blogspot.com/2014/04/the-costs-of-gmo-labeling.html",9,0,1442874743,1444725951
cva4mxs,0,t1_cv9ja4r,pikk,"Man, you should really read your sources. 

>Segregation is costly. We know because **we do it every year, year in and year out, and have for years.**

Wow, farmers and suppliers are already having to segregate their GMO stuff, because the seed suppliers who make the GMOs pay them too. 

>We do it because we get paid a premium for ensuring that the specialty grains and seeds we grow are ""identity preserved"", very much like the certified organic process, involving higher management, higher tracking, and systems in place to ensure that the grains and seeds are genetically consistent and true to their traits, of highest quality meaning they are uniform in size, shape, color, free of weed seed and contamination. We will have 900 acres of grains and seeds this year that will require some protocol for identity preservation. They will be tested for the presence of GMO and tested to ensure that they are genetically consistent to parent seeds. This requires us to use some of our grain tanks for segregation. It requires us to do more ""housekeeping"", cleaning equipment, trucks, trailers, planters, harvesters, grain bins, etc... all along the food supply chain to ensure that we have preserved the identity of that crop. It is an inherently more costly system.",-1,0,1442927642,1444725951
cva4tkj,0,t1_cva4mxs,dtiftw,"That's one farmer, and they only segregate because they get paid significantly more to do so. Not all farmers have the setup to do the same.

You think that this farmer, who is trying to explain why labeling means significant infrastructure costs, doesn't know what they're saying?

Or is it more likely that you're misinterpreting what they're saying? ",3,0,1442928046,1444725951
cva5624,0,t1_cva4tkj,pikk,"Listen, if people really care about eating non-GMO stuff, then they'll be willing to pay the additional costs associated with setting up a separate supply chain for that stuff. 

Putting a label on the products we already make isn't going to cost anything extra. ",-1,0,1442928774,1444725951
cva5hw8,0,t1_cva5624,dtiftw,"People who want that already have it. It's Certified Organic or Certified Non-GMO. Those labels and supply chains already exist. 

And how can you still claim that it's only the packaging cost? I gave you a great resource as to why there's more involved. After you misunderstood it, are you just going to ignore it?",3,0,1442929451,1444725951
cva5prx,0,t1_cva5hw8,pikk,"> you just going to ignore it?

Yes. Because there's NO NEED to change anything about the supply chain. If all people are asking for is the shit to be labelled, just add the fucking label to everything you make, and move on. The only way it's going to be more expensive is if companies try to cater to these nut jobs and start trying harder to keep their non-gmo foods separate. 

Alternatively, they could change NOTHING AT ALL ABOUT THEIR SUPPLY CHAIN, and just ADD THE LABEL TO ALL THEIR PRODUCTS, and everyone would be happy. ",-1,0,1442929891,1444725951
cva5v9z,0,t1_cva5prx,dtiftw,"You don't need to get upset. 

The reality is that companies can't just put the label on everything. You have to have accurate labels. So you have to track whether or not there's GMO products. 

The only alternative (which hasn't been proposed anywhere) is a ""May Contain GMO"" label. And that's pointless because it provides no information.",3,0,1442930194,1444725951
cva6is1,0,t1_cva5v9z,pikk,">a ""May Contain GMO"" label

O, I thought that's what was being proposed. 

> And that's pointless because it provides no information.

Well yeah. Complaining about GMO foods in the first place is pointless. 

",0,0,1442931408,1444725951
cv9j0c9,0,t1_cv9ipfn,JF_Queeny,"Who is going to certify the supply chain.   What are the penalties for mislabeled items in the wrong state?   Does the manufacturer, distributor or retailer pay the fine?   What does the label say?

Why should this burden of threats of litigation be open to those who won't benefit from it?

Existing labels cater to Luddites and Yoga experts; USDA Certified Organic and the Non GMO Project label.",26,0,1442874287,1444725951
cv9ut1s,0,t1_cv9j0c9,old_mold,"Arent those just the administrative and implementation costs of literally any new policy ever made? They are things to consider before passing something but they aren't necessarily a good reason not to do it.  People who want to avoid GMOs are going to avoid GMOs whether or not you label them.  I think the more information you can give them before they decide, the better

Also many people avoid GMO's because of their effect on the agriculture industry and it's impact on the environment.  No GMO has ever been proven to have negative health effects on humans, but some of them have certainly enabled the increased use of pesticides, and in the case of monsanto, the profits from GMOs have gone towards some questionable practices.  There are valid reasons to avoid GMOs that have nothing to do with human health 
",5,0,1442894427,1444725955
cv9v76q,0,t1_cv9ut1s,Quierochurros,"> some of them have certainly enabled the increased use of pesticides, and in the case of monsanto, the profits from GMOs have gone towards some questionable practices. There are valid reasons to avoid GMOs that have nothing to do with human health

These are my concerns with them. I don't usually actively avoid them, though.",1,0,1442895281,1444725959
cva9f5y,0,t1_cv9ut1s,ribbitcoin,"> I think the more information you can give them before they decide, the better

I want a mandatory label showing the relative maturity of the crop.

I want a mandatory label showing if the farming equipment was powered by fossil for bio diesel.

I want a mandatory label showing the tillage practice used on the crop.

I want a mandatory label showing the day of the week the crop was harvested.

I don't care how much it costs or who pays for it because more information is better.",3,0,1442936177,1444725959
cvafzt9,0,t1_cva9f5y,JF_Queeny,I would support you if you banned green paint,2,0,1442946081,1444725959
cv9yyku,0,t1_cv9ut1s,JF_Queeny,"> valid reasons to avoid GMOs that have nothing to do with human health

Great!   Now you realize that the only reason you dislike GMO's is because of your *opinion*, not the facts.

This is why the FDA should handle labeling, not the states.   The FDA deals in facts, not feelings or opinions.   Your claim about 'questionable business practices' would cause a label to appear on Rainbow Papaya, Squash from Syngenta, and non-browning Apples.   You literally assigned labels to those products for no reason other than the fact you dislike a breeding method and an unrelated company.

Sorry, put on your big girl pants and sit this one out.    Every state that has put labeling up to a vote in the general public has failed.   



",3,0,1442906409,1444725959
